livre.chapitre.verset,Bafia,Dii,Ejagham,Ghomala,Vute,Limbum,MKPAMAN_AMVOE_Ewondo,Mofa,Mofu_Gudur,Ngiemboon,Doyayo,Guidar,Peere_Nt&Psalms,Samba_Leko,Du_na_sdik_na_wiini_Alaw,Francais,Anglais,BIBALDA_TA_PELDETTA,Bulu,Guiziga,Fulfulde_Adamaoua,Fulfulde_DC,KALATA_KO_SC_Gbaya,KALATA_KO_DC_Gbaya,Kapsiki_DC,Tupurri
1JN.2.13,"Ɓɛ̀seŋi ɓɛ̀m, ǹkàni mìni ɓisuulɛ ɓì yii roànɛ à ɓaghà à tumɛ̀n a rìtumɛ̀n; ǹkàn mìni ɓɛ̀dɛlì, ɓisuulɛ ɓì mɛ yag ghèghey à mum. Ǹkàni mìni ɓɔɔɓɔɓti ɓisuulɛ ɓì mɛ yi roànɛ à rì Seŋi. ","Mí bíńda víw moo yɛ nɔ, ba'á vu̵, moo ví gaa ı̵́ ka mbaa diga ya dəné woolı̵́ máa ó̧. Mí bíńda víw moo yɛ nɔ, náásaa vu̵, moo ví mba gbaŋ hȩn ɓı̵́d sú̵'ú̵.","Ane-akúí ane, n kí seŋ mbâ eyəné, ka ó riŋi ên yê nnyo a ri ta ka eróghá-ndə́p í ngun. Abhóné, n kí seŋ mbâ eyəné, ka ó nok ên enok na ntûfâm obhí ó ko ên érûm.","Gɑ bvə bi po, wɔ mta, nə kə lə a bɑ po zhyə mo yə e lə pɑ tə tyɛ' a. Gɑ bvə bi po, wɔ ŋkhɛ mo nə pa' a bɑ po lo' tə shyə. Mo cwəpuŋ.","Tá bɨ, mɨ tɨnna nyí àm nyí ɗəŋhȩ nɨ́ nò ya ducɨ nɨ́ du̧ú̧, nɨ́ɨ́b lâs ma nyààŋyèwáá á. Wàánjííb, mɨ tɨnna nyí àm nyí ɓei Sátàìn su rè á.",M ce sañ neè weâe btaèr njobeè' weèe rïìñ ñwáè ce e m ba efa rkáè'. M ce sañ neè weâe mnsuènsuè njobeè' ce weèe aè so Sataèn. ,"A bëtara, matil mina mbol mingayëm e nyò anë atarigi a mëtari. A binanga, matil mina mbol mingatègè Mbe. ","Babhai, i windè kinè, te man kinsun nenga'aman azne te nhinkaƋ na. Golahai, i windè kinè, te man kin ga'a a ngul nenga'a man ambaɓai. ",I windadəkuraɓa baba hay: «Ka səradama ha Ndaw ana zla da mezley ana.» I windadəkuraɓa gawla hay: «Kuray na ka fənamar 'ar ba a Ndaw hayakakay ana.» ,"Matseiljeiya ñꞌoomwaa cwentaaꞌ ꞌo ta na ncjoꞌtquieꞌyoꞌ ncꞌe jnda̱ macwilaꞌjomndyoꞌ ñequio Cristo na mꞌaaⁿ xjeⁿ na jnaⁿjndyeecheⁿ chaꞌtso. ꞌO na titquiendyoꞌ matseiljeiya ñꞌoomwaa ncꞌe jnda̱ macwinaⁿndyoꞌ nacjooꞌ tsaⁿjndii. ꞌO ntseindaaya, matseiljeiya ñꞌoomwaa ncꞌe macwitaꞌjnaⁿꞌyoꞌ nqueⁿ na cwiluiiñê Tsotya̱a̱ya. ","Baa mi wɛ, mi gisin hin wɛrɛ bi̧i̧k anyɔ nɛ mɛɛ Bɛt yɔ gi nɛ doosɛ, yɛɛl a biitirnaandu. Walɛsɛrɛ dɛ, mi gisin bi̧i̧k hin wɛrɛ, anyɔ nɛ ɗɛɛ Saydanu yɔ gi doo bɔbtini. ","Intatə ver sukum munokum effiŋgitti, vi kəsənənək ɗəffan dəsan daga wətəŋ nani. Intatə ver sukum munokum gewleɗi, vi kədayaŋgək ki mbrayen.","Bàavɛ, və́ gàalè yír ya kə̧ bìi laa dùg ní, ŋdì̧i̧nà pə́və́ ɛn yò zɛ. Yírbògənvagtò, və́ nɛ̧̀no Dumpántóo , ŋdì̧i̧nà pə́və́ ɛn yò zɛ. ","Báá bərá, íí gàb nɛ́ŋə̀ aa éèn kùm sɛŋ aa yɛ́b sɔ̀d dú rə yàá, kə̀ taàbìá, mə́ bári taà núúboòraa yóo. Íí yɛb gbàád bərá, íí kàn Nɛ́ŋə̀ Vaksə́ì kə̀ kpɛŋsɛ́lá, kə̀ taàbìá, mə́ bári taà núúboòraa yóo.","Tiki tamai, mu ɗo siki na ɗa, buri ɓa ki siɗi ni n’a na, haa war pi zi tiki par; tiki gawlakai, mu ɗo siki na ɗa buri ɓa ki rɗi amai midini na meefeŋ. ","Je vous écris, pères, parce que vous avez connu celui qui est dès le commencement. Je vous écris, jeunes gens, parce que vous avez vaincu le malin.","I write unto you, fathers, because ye have known him that is from the beginning. I write unto you, young men, because ye have overcome the wicked one. I write unto you, little children, because ye have known the Father.","Nan ɗoowa tigiya nigi sumayna, kay nam ma ay hay cawa'ta tunit pana nigi wumu. Nan ɗoowa tigiya nigi joriyona, kay mige nigi kolawa kay ma joona.","Ma tili mia de a beésa amu mia yem nyô a too aso atataʼa. Ma tili mia de a bisoé bi bôt, amu mi dañeya mbia môt ate. ","Kum cine ngi ziri, i tuhukum ɓi ani: «Mbur misi zle angi ɗuva virzi naŋ na, ki sinaka le.» Kum gawla ati diilihey, i tuhukum ɓi ani: «Ki paka hirnga le da ɓi malambaˀa.»","Mi ɗon winndana on, onon baabiraaɓe, ngam on anndi mo ɗon diga fuɗɗam. Mi ɗon winndana on, onon derke'en, ngam on njaalake Kalluɗo .","Mi ɗon winndana on, onon baabiraaɓe, ngam on anndi mo ɗon diga fuɗɗam. Mi ɗon winndana on, onon derke'en, ngam on njaalake Kalluɗo .","O dáà kɔ‘m, mi yɔr mɔ'ɔ h’ɛ́nɛ́, wen ɛ́nɛ́ iŋa wi nɛ̀ duka so nɛ̀ ku̧u̧naŋ-a mɛ̀ tɛnɛ. O ŋgaiwi, mi yɔr kalata’ɛ h’ɛ́nɛ́, wen ɛ́nɛ́ gana Wan-ɗaŋmɔ kaɗi.","O dáà kɔ‘m, mi yɔr mɔ'ɔ h’ɛ́nɛ́, wen ɛ́nɛ́ iŋa wi nɛ̀ duka so nɛ̀ ku̧u̧naŋ-a mɛ̀ tɛnɛ. O ŋgaiwi, mi yɔr kalata’ɛ h’ɛ́nɛ́, wen ɛ́nɛ́ gana Wan-ɗaŋmɔ kaɗi.","Ka yitehɛ, karafe ŋayɛ ghena 'ya, va nya ɗepe wəndə nya kenza shɛ se vəashinyɛ yɛ. Ka mempɛhwetɛti, karafe ŋayɛ ghena 'ya, va nya hərəte Nde ndiremia mehele yɛ.","Nday paçaçreben wo no, ndi yer wo wee wer maga nday de ko je maga hay le tañgu äaa mono. Nday weere joçoçren wo, ndi yer wo wee wer maga nday go de ma joñ blum Je ma de älaggen mono."
1JN.2.14,"Ǹkàni mìni ɓɛ̀seŋi, ɓisuulɛ ɓì yii roànɛ à ɓaghà à tumɛ̀n a rìtumɛ̀n; ǹkàn mìni ɓɛ̀dɛlì ɓisuulɛ ɓì tèèsɛɛ, jɛ̀ɛ̀ ì Bɛ̀ll ì ɓa mìni ɓi mɛ̀rem, rì tì lɛ ɓì mɛ yag ghèghey à mum.","Mí bíńda víw moo yɛ nɔ, náásá̧ŋ́ waa vu̵, moo ví gaa Ba'á Tayɨɨ ú̵. Mí bíńda víw moo yɛ nɔ, ba'á vu̵, moo ví gaa ı̵́ ka mbaa diga ya dəné woolı̵́ máa ó̧. Mí bíńda víw, náásaa vu̵, moo ví néé víí sú̵'ú̵; moo Tayɨɨ woo mbaa dɨ víílí, ma ví mba gbaŋ hȩn ɓı̵́d sú̵'ú̵.","Abhon í ḿbə́ŋé, n kí seŋ nná ń káre ên, ka ó məŋe ên Obhasi Ńsé. Ane-akúí ane, n kí seŋ ń káre ên, ka ó məŋe ên yê nnyo a ri ta ka eróghá-ndə́p í ngun. Abhóné, n kí seŋ ń káre ên, ka o gyím ên son-son na Obhasi. Eyum í nchot ejê é gye ên ka echî ta fə́ne ó ko ên érûm ka enok ejə́né na ntûfâm obhí.","Gɑ bvə ya bi po, wɔ po mkəcɔk po pɑ̌: Pǒ bɑ po zhyə Ta. Bvə bi wɔ mta: Po bɑ po zhyə mo yə e lə la' bɑ tə fɑ nə to' a. Bvə bi wɔ ŋkhɛ mo: Po bɑ po tʉɔ, ghɔm Si bɑ nə po. Po lo' tə shyə Cwəpuŋ.","Munɨ́b moò, mɨ tɨnna nyí àm nyí ɗəŋhȩ nɨ́ Táà á. Tá bɨ, mɨ tɨnna nyí àm nyí ɗəŋhȩ nɨ́ nò ya ducɨ nɨ́ du̧ú̧, nɨ́ɨ́b lâs ma nyààŋyèwáá á. Mɨ tɨnna nyí á, wàánjííb, ɓetí nyí á ɓe kɨ̀ɓá̧á̧. Nyí gə́tɨréé Kìn Mèèín nyínè sumí, nyí ɓeiceé Sátàìn su.","M ce sañ neè weèe boo waê, njobeè' weèe rïìñ Taèr. M ce sañ neè weâe btaèr njobeè' weèe rïìñ ñwáè ce e m ba efa rkáè'. M ce sañ neè weâe mnsuènsuè njobeè' weèe yu btatap, nlaèa Nyúè yi niñ weèe njep bláá, weèe aè so Sataèn. ","Maatil mina, a bòngò, mbol mingayëm esya. Maatil mina a bëtara, mbol mingayëm e nyò anë atarigi a mëtari. Maatil mina, a binanga, mbol minë ngul, ndò ebug Zamba enë abë mina, ndò mingatègè Mbe. ","Wudahai, i windè kinè te man kin sun Bab Zhiklè. Babhai, i windè kinè, te man kin sun nenga'a man a zhè te nhinkaƋ na. Golahai, i windè kinè, te man wuƋi kinè a zhè, ma Zhiklè a nzi te ndav kinè, a kin ga a ngul nenga'a man ambaɓai.","I ka windadəkuraɓa ba tok dem a ɗaw hay: «Ka səradama ha Baba na seŋgey.» I ka windadəkuraɓa ba baba hay: «Ka səradama ha Ndaw ana zla da mezley ana.» I ka windadəkuraɓa ba gawla hay: «Kuray na gədaŋ ahiya, arka na guma ma Bay ma Bəla ma ndza ha da vaw kwar, arka na, kuray ka fənamar 'ar ba a Ndaw haya kakay ana.» ",Matseiljeiya ñꞌoomwaa cwentaꞌ ꞌo ta na ncjoꞌtquieꞌyoꞌ ncꞌe jnda̱ macwitaꞌjnaⁿꞌyoꞌ nqueⁿ na mamꞌaaⁿ xjeⁿ na jnaⁿjndyeecheⁿnaꞌ chaꞌtso. Mati matseiljeiya ñꞌoom cwentaꞌ ꞌo na titquiendyoꞌ ncꞌe laxmaⁿꞌyoꞌ na jnda̱ꞌyoꞌ ndoꞌ jnda̱ mamꞌaaⁿ ñꞌoomꞌ Tyꞌo̱o̱tsꞌom quiiꞌ nꞌomꞌyoꞌ ndoꞌ jnda̱ macwinaⁿndyoꞌ nacjooꞌ tsaⁿjndii.,"Ya̧a̧mwaat wɛ, mi bi̧i̧sin hin wɛrɛ anyɔ nɛ mɛɛ Baa wɛ Bɛto. Baa mi wɛ, mi bi̧i̧sin hin wɛrɛ anyɔ nɛ mɛɛ Za̧a̧nyɔ gi nɛ doosɛ, yɛɛl a biitir-naandu. Walɛsɛrɛ dɛ, mi bi̧i̧sin hin wɛrɛ anyɔ nɛ gi tɛŋk-yaadɛ, Bɛt dɔglɔ gi waak a nɛ kpoos du, nɛ wɛɛ nɛ ɗɛɛ Saydanu yɔ gi doo bɔbtini.","Intatə ver sukum munokum kirini, vi kəsənənək Affəni. Intatə ver sukum, munokum effiti, vi kəsənənək ɗəffan dəsan daga wətəŋ nani. Intatə ver sukum munokum gewleɗi, vi də sembe kənanaŋ, kəpprəmənək əpel na Maŋgəlva, taya makrokum, yaŋ kədayaŋgək ki mbrayen.","Varə́mtò, və́ gàalè Bàa Vannábò, ŋdì̧i̧nà pə́və́ ɛn yò zɛ. Bàavɛ, və́ gàalè yír ya kə̧ bìi laa dùg ní, ŋdì̧i̧nà pə́və́ ɛn yò zɛ. Yírbògənvagtò, və́ và̧lérì, Vannáb muur kə̧ŋ kəvə́ símá̧a̧r di, və́ nɛ̧̀no ɛn dumpánɛ̀, ŋdì̧i̧nà pə́və́ ɛn yò zɛ.","Yɛb í'sɛ̀lbə̀ mə́ bərá, íí gàb Báá yàá, mə́ bári taà núúboòraa yóo. Báá bərá, íí gàb nɛ́ŋə̀ aa éèn kùm sɛŋ aa yɛ́b sɔ̀d bərə yàá, kə̀ taàbìá, mə́ bári taà núúboòraa yóo. Yɛb gbàád mə́ bərá, íí tə́ kə̀ kpɛŋsɛ́l naú, kə̀ taàbìá, mə́ bári taà núúboòraa yóo, Íí kò' Vɛnɛ́b nwɔŋì aí tɛ́mú, bít íí kàn Nɛ́ŋə̀ Vaksə́ì kə̀ kpɛŋsɛ́lá.","Aliya mu ɗo siki na ɗa, buri ɓa tiki ki siɗi Api ya. Tiki tamai, mu ɗo siki na ɗa, buri tiki ki siɗi ni n’a na war pi zi tiki par. Tiki gawlakai mu ɗo siki na ɗa, buri ɓa ki ɗa gdaŋai, buri ɓa seŋni Alaw a sumna warki, buri ɓa ki rɗi amai midini na meefeŋ ya lai.","Je vous ai écrit, petits enfants, parce que vous avez connu le Père. Je vous ai écrit, pères, parce que vous avez connu celui qui est dès le commencement. Je vous ai écrit, jeunes gens, parce que vous êtes forts et que la parole de Dieu demeure en vous, et que vous avez vaincu le malin.","I have written unto you, fathers, because ye have known him that is from the beginning. I have written unto you, young men, because ye are strong, and the word of God abideth in you, and ye have overcome the wicked one.","Nan ɗoowa tigiya gurona vanu, kay mige nigi wi bumnawa. Nan ɗoowa tigiya nigi sumayna, kay nigi wi nam ma ay hay cawa'ta tunit pa. Nan ɗoowa tigiya nigi joriyona, kay donota vigi ka'a, yoboyna vi Lawna mus haygiya kaw, kay nigi kolawa kay ma joona.","Ma tili mia a ayôme bone dam amu mia yem Esaa. Ma tili mia a be ésaa amu mia yem nyô a too aso atataʼa. Ma tili mia de a bisoé bi bôt, amu mi ne ngu, a Ajô Zambe e too e be mia, a mi ne bedañe mbia môt. ","Ziri ɗuwoy, i ra tuhukum ɓi ani ma: «Ki sinaka Cine ndra le.» Kum cine ngi ziri, i ra tuhukum ɓi ani ma: «Ki sinaka mbur misi zle angi zli virzi naŋ na le.» Kum gawla ati diilihey, i ra tuhukum ɓi ani ma: «Kum gidaŋ, yo mingiɓi ngi Buymisemuŋ naŋ da a hur kumo.»","Mi winndani on, onon ɓikkoy, ngam on anndi Baabiraawo. Mi winndani on, onon baabiraaɓe, ngam on anndi mo ɗon diga fuɗɗam. Mi winndani on, onon derke'en, ngam on semmbiɗɓe, wolde Allah ɗon tabiti nder mooɗon, on njaalake Kalluɗo.","Mi winndani on, onon ɓikkoy, ngam on anndi Baabiraawo. Mi winndani on, onon baabiraaɓe, ngam on anndi mo ɗon diga fuɗɗam. Mi winndani on, onon derke'en, ngam on semmbiɗɓe, wolde Allah ɗon tabiti nder mooɗon, on njaalake Kalluɗo.","O bem kɔ‘m, mi yɔra mɔ'ɔ h’ɛ́nɛ́, wen n’ɛ̀nɛ̀ iŋa Dáà. O dáà kɔ‘m, mi yɔra mɔ'ɔ h’ɛ́nɛ́, wen n’ɛ̀nɛ̀ iŋa wi nɛ̀ duka so nɛ̀ ku̧u̧naŋ-a mɛ̀ tɛnɛ. O ŋgaiwi, mi yɔra mɔ'ɔ h’ɛ́nɛ́, wen ɛ́nɛ́ ɔ ŋgaya; wen ko Sɔ̧ dúk tɛ‘nɛ́, ɓɛɛ ɛ́nɛ́ gana Wan-ɗaŋ.","O bem kɔ‘m, mi yɔra mɔ'ɔ h’ɛ́nɛ́, wen n’ɛ̀nɛ̀ iŋa Dáà. O dáà kɔ‘m, mi yɔra mɔ'ɔ h’ɛ́nɛ́, wen n’ɛ̀nɛ̀ iŋa wi nɛ̀ duka so nɛ̀ ku̧u̧naŋ-a mɛ̀ tɛnɛ. O ŋgaiwi, mi yɔra mɔ'ɔ h’ɛ́nɛ́, wen ɛ́nɛ́ ɔ ŋgaya; wen ko Sɔ̧ dúk tɛ‘nɛ́, ɓɛɛ ɛ́nɛ́ gana Wan-ɗaŋ.","Ŋwalea ɗa, karafe ŋayɛ ghena 'ya, va nya ɗepe Yita yɛ. Ka yitehɛ, karafe ŋayɛ ghena 'ya, va nya ɗepe wəndə nya kenza shɛ se vəashinyɛ yɛ. Ka mempɛhwetɛti, karafe ŋayɛ ghena 'ya, va nya nza yɛ bereteke: Kanza ghena ta Shala mbe gheyɛ ba'a nahe yɛ kehərəte Nde ndiremia mehele.","Ndi yer wo wee weere äi no, wer maga nday de ko Paçaçben no. Ndi yer wee paçaçreben wo, wer maga nday de ko je maga hay le tañgu äaa mono. Ndi yer wo wee weere joçoçre no, wer maga nday de eegre, waçaçre Baa de hayle äil äay, nday joñ blum Je ma de älaggen we go."
1JN.2.15,"Kɛ̀ ɓi keesi ziinɛ, nsoò com kidɛŋ ki miì; i mum à keesii ziinɛ, di ǹkɔ̀nɛ̀n à Tààta à yin nyi ɓi nɗem; ","I soo hȩn hágá yɛ vu̵ sá, kóó hȩn nánán ku̵u̵ hí̧í̧ wu̵lı̵́ máa á̧ḿ. Tow nán tóó a hí̧í̧ hȩn hágá yɛ vu̵ tée, duu hí̧i̧n sı̵́ Ba'á Tayɨɨ né. ","Deê nne a kâ kə̂n echî a kí ka achot obhí ngun nnyí. Nne nnyo se achot obhí ngun nâ á rî ejûm, deê a məŋé se á ka fon okot na Obhasi Ńsé. ","Po kə kuŋ dzʉ pu a tsə́ dzʉ. Mo yə e ŋkhuŋ dzʉ a, kuŋnyə Ta tə bɑ nə e pɑ.","Nyí nɨ nɨ́ɨ́b ɓáŋhɨ́b ɗɔ̀bɨ́nné ɗúu, dùgɨ̀ nɨ́ɨ́b ók ɓe nɨ́ɨ́b ɓáŋhɨ́b kíì. Nò kù ɨ́ ɗû nɨ́ɨ́b ɓáŋhɨ́b ɗɔ̀bɨ́nné, ɗûnɨ́m Táà nɨ nò kíì sumí ɗàà. ","Weèe fa koèñ ñgoèñ ka'. Weèe fa koèñ buu enjep ñgoèñ ka'. Ñwáè ka' koñ ñgoèñ aètaè ñgaèñ koñ Taèr ka', ","Te miadiṅ si-ndon tò e byem binë a si-ndon. Ngë mod adiṅ si-ndon, ediṅ tara yasëki abë nyè. ","Kin woy herkeda a skwi nte pa ɓai! Aman ndo man a woy herkeda, te nenga'a mwoy-ndo Bab Zhiklè azɓai. ","Ka da wuɗama bəla zlay, kwa tek na ŋga ka bəla na zlay. Kendzey ndaw ana a wuɗey bəla na, ma wuɗa vaw ma Baba ka ŋga dakay. ","Tilacandyaꞌ nꞌomꞌyoꞌ na matseixmaⁿ tsjoomnancue meiⁿ tsꞌiaaⁿ na matseixmaⁿnaꞌ. Cwii tsꞌaⁿ na candyaꞌ ntyjii na matseixmaⁿ tsjoomnancue, titseixmaaⁿ juu na candyaꞌ tsꞌom Tyꞌo̱o̱tsꞌom nnꞌaⁿ. ","Bɔnɛ gbaa kpoos nɛ a waal du, bɔgi ha̧a̧nɛ hinwɔ hi gi a waal du. Za̧a̧nyɔ ha̧a̧g waalɛ, hā̧a̧g Baa wɛ Bɛt gɛ. ","Kədaŋgluwən duniya ɓa, walla zəga na duniya ɓa. An ɗəf aŋgluwək duniya, nan wəŋgla Affən taya zan ɓa. ","Və́ yá̧a̧ kúsà̧a̧r pai, və́ yá̧a̧ ɛn ya kúsà̧a̧r díŋ ní pai. Yír ya yá̧a̧ŋ kúsà̧a̧r ní, wə yá̧a̧n Bàa Vannáb koo símá̧a̧r di pai. ","Ìì í' yɛ́b aa sí, sínkɔ̀ ìì í' in bəraa zɔ̀ŋə yɛ́b bərə sí. Dáà nɛ́ŋə̀ nə́ŋ̀ í' yɛ́b aaì gə́, oò gə́, kə̀ í'sɛ̀l Báá bə̀ naà sé. ","Ki diriti yai ɗa kai, wazagai na warɗi yai ɗa kaalai. Na ɓa ɗif a diriti yai ɗa, a dara Alaw n’Api ɗa kai. ","N'aimez point le monde, ni ce qui est dans le monde. Si quelqu'un aime le monde, l'amour du Père n'est point en lui.","Love not the world, neither the things that are in the world. If any man love the world, the love of the Father is not in him.","Mingi nagatɗi, slen ma hay nagatɗi kaw. La san min nagata, minda vi bumna may hayamɗi, ","Te nyeʼane si nyô nge mam me ne été. Nge môt éziñ a nyeʼe si nyô, nyeʼan Esaa ô nji bo e be nye, ","Anja ki wuɗam duniya ta, ko gwat ngir duniya, ki wuɗam ta. Da mbur ara wuɗ duniya na, naɓa wuɗa Cine ndr'anta a hur naŋ ta.","Taa ngiɗe duniyaaru ndu'u e kuuje maaru fuu. To goɗɗo yiɗi duniyaaru, o walaa yiide ngam Baabiraawo nder maako. ","Taa ngiɗe duniyaaru ndu'u e kuuje maaru fuu. To goɗɗo yiɗi duniyaaru, o walaa yiide ngam Baabiraawo nder maako. ","K’ɛ́nɛ́ kɔ̧ mɔɔ-zaŋnu na, kóó mɔ nɛ̀ a̧a̧ zaŋnu na mbɛt. Kà ŋma bíí nɛ́ kɔ̧ɔ̧ mɔɔ-zaŋnu, ɓɛɛ  kɔ̧ɔ̧mɔ  kó Dáà bó tɛ̀ wi’ɛi na, ","K’ɛ́nɛ́ kɔ̧ mɔɔ-zaŋnu na, kóó mɔ nɛ̀ a̧a̧ zaŋnu na mbɛt. Kà ŋma bíí nɛ́ kɔ̧ɔ̧ mɔɔ-zaŋnu, ɓɛɛ  kɔ̧ɔ̧mɔ  kó Dáà bó tɛ̀ wi’ɛi na, ","Mba yɛ keɗe ghena nya te hɛɗi lema nya, ya wəsə nya kaŋa hɛɗi lema. Ma kenza wəndə kaɗe hɛɗi lema ne, kanza ɗe ta Yita mbe we. ","Da wee tamsir wa hase, da wee feçeçre ma ti tamsirn wa lay. Day je maga yañ da tamsir no, dage maga aà da Paçaçben joñ äil äe ga so hase. "
1JN.2.16,"ɓisuulɛ, ɓìɓan ɓìcèm ɓi ɓi ri ɓi ziinɛ lɛ rì zày ì ɓìɓeɓtàg ɓi ɓiɓan, ɓi ɓi mɛ̀mùù, yàaka à mis, rì ǹcàŋà wu ìkum wu ti wu falàg mum, ɓi pɛsɛɛ yì ɓi yɛ̀ɛ Tààta, ɓyɛɛ̀ pɛ̀ɛpɛsàg yì ɓi ziinɛ. ","Hȩn hí̧í̧lí̧ nán voo máa, wu̵ hȩn ɓı̵́d ı̵́ ka to̧o̧d fó̧ó̧ má nɔ, kan hȩn hı̵́ı̵́lı̵́, kan hȩn 'waapád nán ku̵u̵ na' yúú voo yúú voolı̵́ máa á̧ḿ. Hȩn yȩ vu̵ pád, vu̵ yaan Tayɨɨ woolı̵́ né, a̧máa vu̵ yaa dɨ nánán voolı̵́. ","Chénchén achot ka ngun nnyí noŋ ekot achot abhí, noŋ ekpatə́m eyə̂t ekíím ka iyîm í ngun, noŋ iyîm enyaŋe eyúp-eyúp nji se, “Ḿ gbo efaŋ,” á ká dʉ mbâ Obhasi Ńsé. Chénchén a ri achot í ngun. ","Nə pa' tsə dzʉ, ghi'nyə nɑ, ghi'nyə mnyə, ŋa'nɑ nə fʉ dzʉ tə fɑ m bi Ta pɑ. A fɑ m bi dzʉ.","Nɨ́ɨ́b ɓáŋhɨ́b ɗɔ̀bɨ́nné hȩ mɨ̀lə́mkáín ɓáŋhɨ́b nɨ̀vɨ́tèé sumíì, sunɨ̀b, ɓe wútèé síhé ɗoŋwo njɔdɨ̀b ɗɔ̀bɨ́nné ya kwe; nɨ́ɨ́b kɨ́ lâs, nɨ Tá sé ɨ́ du nànɨ, du nɨ nɨ́ɨ́b ɗɔ̀bɨ́nné á. ","njobeè' buu enjep ñgoèñ vi loè ese Taèr ka', vi loè ese ñgoèñ. Buu enjep ñgoèñ ca yu buu bbebep ce nyor ce roèo, ba mbaèñ mmir aè rtúr buu wááwá ce aè ce yá, ker ba naèanyor aè buu ce aè túr. ","Amu e mam mësë ya si-ndon, ndòg nyòl, byem bi mò, biasò ki abë tara, biasò a si-ndon. ","Aman skwi tèlèba man a zhè t""herkeda, skwi man ndav ndo a tètèkè""a, skwi man dai a tètèkè'a, nfi va ambalai, a shkè te Bab Zhiklè ka ɓai, aman t'herkeda. ","Mavəday tek ana hay tabiyaha da bəla na na, - tek me sey ma slaw vaw, tek me sey me dey, ma vəladara vaw da me ŋgelekey a zleley- a sawa na da Baba tikay, amana da bəla neney. ","Ee tjaameiⁿcwii na matseixmaⁿ tsjoomnancue na jnaⁿnaꞌ na mꞌaaⁿ nquii Tsotya̱a̱ya Tyꞌo̱o̱tsꞌom, ñequiiꞌcheⁿ cwinaⁿ joonaꞌ cantyja ꞌnaaⁿꞌ tsjoomnancue, chaꞌna natia na queeⁿ tsꞌom tsꞌaⁿ na macanda̱ laxmaⁿ joonaꞌ na teincooñê na tsꞌaⁿ jnaⁿ jom, na queeⁿ tsꞌoom na jndyeti ꞌnaⁿ na ntyꞌiaaⁿꞌaⁿ cuaanaꞌ lꞌo̱o̱ⁿ, ndoꞌ na macwjiꞌsꞌañê macwjiꞌscuñê ncꞌe ꞌnaⁿ na maleichom. Chaꞌtso nmeiiⁿꞌ laxmaⁿnaꞌ cantyja ꞌnaaⁿꞌ tsjoomnancue. ","Yɔ anbɔ, hinwɔ hi gi waal du sɛw, hinyɔ kpoos gi ɗɔkingo, hinyɔ lɔl gi ɗɔkingo, hi rɔɔs yɔ gi wɛɛnik dood an hi pɛɛ zulɛ, hin wɔrɔ sɛw hi fu̧u̧ a Baa wɛ Bɛt ge gɛ, hi fu̧u̧ a waal du. ","Mbarmbari duniya van asan vas di? Ɗii tahəŋ əmbataŋ də zəga na duniya, də wəsim zəga neti, tahəŋ ulanən zəga, yaŋ adaŋglaŋ dərəhən gəni, yaŋ adagakdakanən arya net də wəgakdakan ziti, as pak dəde səza Affən ɓa, amma səza duniya ade. ","Və́ gàaro ɛntò ya kúsà̧a̧r díi: Yír símá̧a̧r tìi yá̧a̧ŋ ɛnɛ̀, yír tə̀ kɛ̧̀ŋgəŋ ɛnɛ̀, yír ləggənəŋ ɛntò də́ə, ɛntò bee pɛ́m vínə̀i Bàa Vannáb na̧a̧ ri pai, kúsà̧a̧r vìr dì. ","In bəraa zɔŋə yɛ́b bərə gə́ kóólé' inlɛ'kè vaksə́ tɛ́m bə bə̀ bərá, inselké vaksə́ bərá, kə̀ yíl pa'ǹmbə̀ kə̀ gbaŋə̀ bəraa zɔ̀ŋə yɛ́b bəroó. In bəraa rə, vúgə́là Báá Vɛnɛ́b naà gá, zá in zɔ̀ŋə yɛ́b bə bə̀ bərá. ","Buri wazagai na warɗi yai ɗa paŋ: dirini neŋ-si gaini suuna na wiini arai, gaini kûlûni-si na pin wazagai zi der, wazagai hanɗa paŋ a na sin Api par kai, amma siɗi yai par. ","Car tout ce qui est dans le monde, la concupiscence de la chair, la concupiscence des yeux, et l'orgueil de la vie, ne vient point du Père, mais du monde.","For all that is in the world, the lust of the flesh, and the lust of the eyes, and the pride of life, is not of the Father, but is of the world.","kay sle ma ka hay nagat petna, darta vi sliw-tuwna, darta vi ira hiɗi subur-tuwta kay slena vi nagata, kayni may vi bumnaɗi, may vi nagata. ","amu mam mese me ne si nyô aval ane: nkômbane ya minsôn, nkômban ya bi e mam ma yené a mis a ntabane mebun e be mame ya si nyô, bi nji so e be Esaa, ve si ndôn.","Gwat ngir duniya gar, kaɓa: may gwat ngi dumvu, hiyĩ gwat ngi hiri mapura gar waɗ pula vu mbak da huhumvu ti zlili gar na, a so tivi Cine ndra ta, amma a so tivu duniya.","Ngam ko woni nder duniyaaru fuu, ɗum suuno ɓanndu, suunaago ko gite ngi'ata e mawnitaago bee risku mum, ɗum fuu ɗum iwaay haa Baabiraawo, ammaa haa duniyaaru ɗum iwi. ","Ngam ko woni nder duniyaaru fuu, ɗum suuno ɓanndu, suunaago ko gite ngi'ata e mawnitaago bee risku mum, ɗum fuu ɗum iwaay haa Baabiraawo, ammaa haa duniyaaru ɗum iwi. ","wen mɔɔ-zaŋnu lɛŋ, wɔ-mɔ wan mɛ́ ko mur-tɛ, wɔ-mɔ nɛ̀ yí-wi zɔk, in duka-tɛ gasi nɛ̀ zu nɛ̀ kpaamɔ, nɛ́ o géé mɔɔ-zaŋnu, nɛ̀ bó nɛ́ tɛ̀ɛ́ nɛ̀ tɛ̀ Dáà na. ","wen mɔɔ-zaŋnu lɛŋ, wɔ-mɔ wan mɛ́ ko mur-tɛ, wɔ-mɔ nɛ̀ yí-wi zɔk, in duka-tɛ gasi nɛ̀ zu nɛ̀ kpaamɔ, nɛ́ o géé mɔɔ-zaŋnu, nɛ̀ bó nɛ́ tɛ̀ɛ́ nɛ̀ tɛ̀ Dáà na. ","Kwa nza ŋkɛ wa nyi wəshi nyi kaŋa hɛɗi lema nyi: ɗe mene wəshi mawe geva keɗema sla ntsə yitea wəshi, kele ghə nya kese mbe galɛpi. Kenza pɛtɛa wəshia shɛhɛ kawəshi nyi kese va Yita we, ama va hɛɗi lema. ","Werga feçeçre maga wo ti tamsir lam äuy, wo diñ ëiggi ma de älagge maga je tabay ëig ra, feçeçre ma slag nen se wo de feçeçre maga naa rag ëu naa ciñ de äaara ti tamsir lam äuy no, sen äuy a de äaara ne naa diñ Paçaçben ga, ama diñ tamsir no. "
1JN.2.17,"Nni ziinɛ yɛɛ̀ ghaghààgh, kìkɔ̀nɛɛ ki ɓiɓan ɓi miì ki ghaghààgh girig, wɔ̀lɛ ŋwaànɛ a kìki rikɔ̀n ɗi Bɛ̀ll à ɓiì kɔ̀rii fiɗyàɓ fikɔ̀ɔ̀.","Hȩn hágá yɛ vu̵ dɨ 'wáanée, kan hȩn hí̧í̧lí̧ nán voo yȩ á̧ḿ. A̧máa nán ı̵́ ka kɔ́ hȩn hí̧í̧lí̧ Tayɨɨ woo máa, wú̵ń mbaa há̧á̧ káákáá.","Iyîm mbí sê ngun na achot obhí chénchén mma ane á kóra í kí manâ í jak, kən nne nnyo a kí yim ekpin ka ekpak nji Obhasi a wóme, a kí fon ekpin ótúm-ótúm.",Dzʉ ba ghi'nyə e shyə. Tə mo yə e gə ywə yə Si shəŋ a shwə mama.,"Nɨ́ɨ́b ɓáŋhɨ́b ɗɔ̀bɨ́nné á bɨ cɔ̧́nɨ, dùgɨ̀ kɨ́b nɨ̀vɨ́tè du súnɨ̀niì. Ɨ́dù nò ndɨŋ nɨ́m Mèín ɗúré kwá dulɨ́ŋ tɨ́k kɨ̀ tɨ́k.","Ñgoèñ yi be mïì, tá buu wááwá ce beèe a ce yá mbo, a ce roèo aè rtúr, vi mi foñ. Geewa'a, ñwáè ce e ka' ce geèe yuu ce Nyúè ce roèo, baná ñgaèñ be cu nfeseè.","Ndò hm si-ndon yalod ai ndòg dzie, e nyò ki abò ṅyian Zamba alaṅan kole.","Herkeda a di a ndiv na, a nda ntètèkè nenga""a tèlèba. Aman ndo man a gi skwi man Bi Zhiklè a woya'a, nenga'a a nzi a mèdèp.","Ama tok na, bəla na a ndəvey, ŋga na ta tek me sey ŋga na dzay, ama ndaw me key andza ma Bay ma Bəla me wuɗey ana na, a ndzey na ma kwoza ha. ","Ndoꞌ joo na matseixmaⁿ tsjoomnancue na cwilaqueeⁿ nꞌom nnꞌaⁿ, mawjaatseicjenaꞌ, ñequio chaꞌtso natia na queeⁿ nꞌom nnꞌaⁿ na matseixmaⁿnaꞌ. Sa̱a̱ tsꞌaⁿ na machꞌee yuu na lꞌue tsꞌom Tyꞌo̱o̱tsꞌom, ticantycwii na wandoꞌ.",Waal gi da̧a̧ko hi ɗɔkumɔ sɛw. Yɛrɛ za̧a̧nyɔ woo hinyɔ Bɛt ha̧a̧ge gi waak faa.,"Duniya də zəga nadəv pak wagrak də an məs ɗəf aŋgəl adəvən pakə, amma ɗəf məgəɗ əŋgla na Maŋgəlva nan wasan ha faɗə.",Kúsà̧a̧r vəŋ ɛntò ya yír yá̧a̧ŋ ti ní pɛ́m tálgənì. Yír tò̧ŋ ɛn ya Vannáb yá̧a̧ ní ní wə kə̧ və̀ə dùggənì.,"Yɛ́b tə́ kíìn taanàá, kə̀ in bəraa nɛ́b bəd tə́ í'ǹ zɔ̀ŋə yɛ́b bərə tə́ kóólé; zá màn aa mà' in aa Vɛnɛ́b í' rəì rə gə́, dá kuùm zèd kə̀ zèrá.","Yai aga te vada edi gaini diriɗi lai, amma ni n’a na za diri na wiini Alaw ɗa aga a sumna haa hlai n’a vada kai.","Le monde passe, et sa concupiscence aussi; mais celui qui fait la volonté de Dieu demeure éternellement.","And the world passeth away, and the lust thereof: but he that doeth the will of God abideth for ever.","Nagata ma vat goyo hiɗi darta va'a, may sa ma li minda vi Lawna, nam ma mus ta-ta hay vatɗita.","Amu si ndôn ja lôt, ébien a mbia nkômban ya été. Ve môt a bo nkômbane Zambe a tabe nnôm éto.","Asi duniya ati hiyĩ gwat naŋ gar na, ara kiɗ mi. Amma mbur magi gwat Buymisemuŋ mawuɗo, a zik hã ngi sete.",Duniyaaru bee ko suunete nder maaru fuu caaloto. Ammaa ɗowtantooɗo muuyo Allah yeeɗan haa foroy.,Duniyaaru bee ko suunete nder maaru fuu caaloto. Ammaa ɗowtantooɗo muuyo Allah yeeɗan haa foroy.,"Mɔɔ-zaŋnu in wɔ-a kaɗi kaɗi, ɓɛɛ wi nɛ̀ de mɔ nɛ̀ Sɔ̧ kɔ̧a̧ dúk kɔ‘i ɓɔnsɛnɛ.","Mɔɔ-zaŋnu in wɔ-a kaɗi kaɗi, ɓɛɛ wi nɛ̀ de mɔ nɛ̀ Sɔ̧ kɔ̧a̧ dúk kɔ‘i ɓɔnsɛnɛ.","Kiɗi yakiɗi hɛɗi lema, tsagha sla ntsə yitea wəshi nyi te, ama kanza wəndə nya kemene ɗe ta Shala teghweme kaghala ghala.","Tamsirn go de taw ge de coçoçre äen äuy, ama je maga yañ joñ fen maga äil Baa dan no, je sen hay yañ tenen haçaç tum."
