livre.chapitre.verset,Bafia,Dii,Ejagham,Ghomala,Vute,Limbum,MKPAMAN_AMVOE_Ewondo,Mofa,Mofu_Gudur,Ngiemboon,Doyayo,Guidar,Peere_Nt&Psalms,Samba_Leko,Du_na_sdik_na_wiini_Alaw,Francais,Anglais,BIBALDA_TA_PELDETTA,Bulu,Guiziga,Fulfulde_Adamaoua,Fulfulde_DC,KALATA_KO_SC_Gbaya,KALATA_KO_DC_Gbaya,Kapsiki_DC,Tupurri
1JN.1.1,"Tì kàni mìni kìɓan ki jɛ̀ɛ̀ ì cɛɓ ìnɛ ì ɓaghà, a rìtumɛ̀n ɗi ɓyom ɓìcèm; tì wokà yɔ̀ di yɛɛ̀ tòtòg, tì ghɛn yɔ̀ ri mis, tì sìŋì yɔ̀, tì ki kòm yɔ̀ ri ɓyàg ɓis. ","Vɔ́ bíńda ví ɗerwəl yɛ yúú Moo ı̵́ ka pú̵ vágád máa woolı̵́. Moo yɛ ká mbaa tíŋ́ pȩ́ń, hȩn 'waapád yı̵́b. Vɔ́ ki moo woo kan tɔ́g vóó, vɔ́ ho̧go̧ kan nɔ́ɔ́ vóó, vɔ́ tə́ggu̵, vɔ́ za""u̵ kan nag vóó á̧ḿ. ","E kí chot nchot ka nwet eyəré nnyí é kpê na nne nnyo a ri eyum Obhasi nji é kí karé nne ekpin. Nne nnyó a râŋ mbá a jóe kən kpe ngun a róghé. Êt áfoné e yûk esə́re ejê, e yên yê na amə̂t amə́ré e kêp, e kə́me yê na abhô amə́ré.  ","Ywə yə a lə bɑ tə fə nə to', ywə yə pyə lə yǔ', ywə yə pyə lə lɑ mnyə mɔk jɔ, ywə yə pyə lə cəŋtə dyəŋtə, ywə yə pyə lə co' pu nə a: Ghɔm vɔk. ","Kìn nò du nànɨ mèè á nɨ́m du nyí tànànɨ rè. Yànɨ ɓwâ Mèín ya nyaŋhȩ nɨ́ɨ́b lâs, ŋgə́ yaácɨ̀ nɨ ku. Nɨ́m yi óó ŋgə́ nyìnnɨ, nɨ́m yi pə́ɓatɨ́ ŋgə́ ɓe íí nɨ́mè, nɨ́m ɨ́ góòmnyààŋɓà ŋgə́, nɨ́m ɨ́ dì̧nɨ̀ɓàcéyè ŋgə́ ɓe ŋgáár nɨ́mè. ","Yuu ce yi m ba efa rkáè' ce weèr aè yu', a yá neè mer mmir, a ke'shïî, a ker joo neè mer mmbo yu nlaèa ce e ce fa ryoèñ. ","E dzi ya engabë atarigi a mëtari  , e dzi bingawog, e dzi bingayen ai mis maan, e dzi bingafòmbò, e dzi mò maan mënganamba a ebug enyiṅ ","Nasa skwi man a zhè te nhinkaƌ na, a géƋ ma nshèffè, man nga tsena'a, man nga rka a di nga, man nga wora, man nga lama na a ri nga. ","Tek ana me key zla da mezley ana, tek ana la ma tsənadəmərawa na, la ma nəkadəmərawa ta dey la na, tek ana la ma zazurəmərawa na, arka na har ala ma ləmərawa na, Ndaw ana Mey ma Bay’ərlam ma mesəfrey ana. ","Cwilaljeiiyâ ñꞌoom na cwilacwano̱o̱ⁿyâ nda̱a̱ꞌyoꞌ cantyja ꞌnaaⁿꞌ nqueⁿ na maxjeⁿ mꞌaaⁿ cwitjo̱o̱cheⁿ na jnaⁿ chaꞌtso. Jnda̱ jndya̱a̱yâ na seineiiⁿ ndoꞌ jnda̱ ntyꞌiaa nda̱a̱yâ jom. Ntyꞌiaayaayâ jom ndoꞌ jnda̱ tꞌua̱a̱ ntyja̱a̱yâ lua̱a̱yâ ñꞌeⁿñê, nqueⁿ na cwiluiiñê Ñꞌoom na mañequiaa na cwitando̱o̱ꞌa. ","Mii Yohana, hi saam mi hiya, wi boonɛ. Hinyɔ wi gisin dɔglɔ dɔko ginɛ gi amntɔnɔ, yɛɛl a biitirnaandu yɔ Bɛt kimdir nɛ waal kɛn gɛ. Wi kɛŋge yɔ gi ya̧a̧booko, wi gbɛnig hi lɔl winɛ hɛw. Hɔɔ hi rɔbo, wi seege, wi ki̧i̧ge hi naan winɛ. Hinɔ gi ma za̧a̧tig dɔglɛ. ","Mənam tatə versukum, aka wənna ɗəf məs adawyaŋ na əpel na zeŋgille, daga duniya tay tagay ɓa, əpel nan tay dabəŋ ki wətəŋ zəga pakə. Məpprəmək pay adaw pele, mulak də haramə, gesiŋ mulaka, mərəŋ gənək də vamə. ","Bə́ dì̧i̧nà pə́və́ muur ya pə́ŋ yír yo̧ŋkì ní. Muur bee wəi kə̧ bìi laa dùg dì. Bə́ kìilè muur bee rì, bə́ tə̀lə̀ vəŋ nór bə́na̧, bə́ gù̧u̧ nàmlèrì. Sóo ya yo̧ŋkì bee ví ní, bə́ tə̀lèrì. Wəi kó rì bə́ mùuŋ pə́və́ zɛ. ","Bə́ bári núúboòraa yée, Nwɔŋ aa tə́ gɔ̀ŋsə́ piìn də yílú. Nwɔŋ aa tə́ gɔ̀ŋsə́ piìn yérə, sɔ̀d nyàamdoorú, bɔ̀b bə́ŋ̀ in bəd kóólé séémíìn sé. Bə́ kìì nwɔŋ oò yàá, bə́ bé'ùwì kə̀ núù bə́ra. Bə́ ɛ̀gə̀ yàá, bít nɛɛ̀n bə́ bəd kɔ̀ pigə̀ yàá. ","Wala n’a nasi ka war pi zi tiki par, na tiyi mi ɵiniŋ, na mi tiliŋ gaini aryi, na mi tiki hangalyi sini aŋ tiliŋ, na tiyi a tetemaŋ lai, hanɗa a seŋ zi suŋfa. ","Ce qui était dès le commencement, ce que nous avons entendu, ce que nous avons vu de nos yeux, ce que nous avons contemplé et ce que nos mains ont touché, du Verbe de vie,—","That which was from the beginning, which we have heard, which we have seen with our eyes, which we have looked upon, and our hands have handled, of the Word of life;","Va ma ay hay cawa'ta tunita pa, va ma numa humi kalamu, va ma numa wum hiɗi irma'a kaw, va ma numa wum goy ŋaa'a, ɓuma tuni talamu kaw, kayni mi yoboyna vi irita, ","E jam e nga too a so atataʼa, e jam bi nga yen a mise mangan, e jam bi nga fombô ne tooñ a e mo mangan me nga nambe. A jô ya ényiñ. ","Ndr'i ra tuhukum ɓi vur mingiɓi mavul siifa. N'ada zle ti gwatay gar muɗuvam virzi na. I cinaka le, i puraka le ti hiri ndra. I singilaka le singal singal, yo i tutumaka le ti haŋ ndraˀahaya.","Min ɗon mbinndana on dow Wolde hokkannde ngeendam, wonnoonde diga fuɗɗam, ko min nani, ko min ngi'i bee gite amin, ko min ndaari e ko min meemi bee juuɗe amin . ","Min ɗon mbinndana on dow Wolde hokkannde ngeendam, wonnoonde diga fuɗɗam, ko min nani, ko min ngi'i bee gite amin, ko min ndaari e ko min meemi bee juuɗe amin . ","Mɔ n’ɛ̀ɛ̀ yɔr mɔ h’ɛ́nɛ́ wen-aa’ɛ nɛ́ mɔ nɛ̀ duka so nɛ̀ ku̧u̧naŋ-a mɛ̀ tɛnɛ, nɛ́ mɔ n’ɛ̀ɛ́ zia, n’ɛ̀ɛ́ zɔka nɛ̀ yí-ɛ́ɛ́, n’ɛ̀ɛ́ mbaɗa, ɓɛɛ ɛɛ tam nɛ̀ er yɛ́ mbɛt; wen'i nɛ́ Wen-duka-kpasa.  ","Mɔ n’ɛ̀ɛ̀ yɔr mɔ h’ɛ́nɛ́ wen-aa’ɛ nɛ́ mɔ nɛ̀ duka so nɛ̀ ku̧u̧naŋ-a mɛ̀ tɛnɛ, nɛ́ mɔ n’ɛ̀ɛ́ zia, n’ɛ̀ɛ́ zɔka nɛ̀ yí-ɛ́ɛ́, n’ɛ̀ɛ́ mbaɗa, ɓɛɛ ɛɛ tam nɛ̀ er yɛ́ mbɛt; wen'i nɛ́ Wen-duka-kpasa.  ","Ma ghena nya rafete ŋayɛ nya ghen'yɛ ne, te ghena nya nza mpi mbe ŋkɛ, te ŋwela ghena shɛ nda teghate geva wəshi pɛtɛ. Nahe ghen'yɛ kefate ŋkɛ, nahe ghen'yɛ kenakɛ ŋkɛ le ntsə ta n'yɛ, nahe ghen'yɛ kemareve ŋkɛ, nahe dzeve ta n'yɛ kekwaɗakɛ ŋkɛ. ","Waçaçre maga hay le tañgu äaa mono, wuur laa ne, wuur ko ne, wuur de ko ge äe go de ele, wuur duën de do wuuri, diñ Waçaçre ma kol jar tenen no, wuur yer wo wee diñ ti äe. "
1JN.1.2,"Yɛ̀ɛ cɛɓ ki resɛ̀ngày, ɓìsii ghɛngà kɔ; fɔɔnnɛ ti kpaakpaa mini kìɓan ki miì, tì ki ghagsi mini ɓɔlɛ à cɛɓ ki fiɗyàɓ fikɔ̀ɔ̀ ki ki ɓaghà jàŋbog rì Seŋi, cɛɓ kìn kɛɛ̀ki ɓɛ resìghà ɓìsi, lɛ ti yi kɔ. ","Sey ı̵́ vágád pú̵lı̵́ yȩ ka gbɔ vúd máa, vɔ́ ho̧go̧ ó̧, vɔ́ du̵ddu̵ ya̧g, vɔ́ pá'ad ví moo vágád ı̵́ káákáá ká ka mbaa dáŋ́ Ba'á woolı̵́ yȩ, Tayɨɨ ká vud tú'ud vɔ́ kannɔ á̧ḿ. ","Nne nnyó a bháe a bhâ kúmi na êt, e yên ekpin ejê. Nâ echî e kí səre ên mân mfá-mfá noŋ atî-isê nne nnyó, yê nâ a ri fə́ne ekpin ótúm-ótúm. Nne nnyó a ri kpá na Obhasi Ńsé, kən Ńsé a tûm yê se a bhá kumí na êt.  ","Nə pa' vɔk lə təm, pyə yɔ e, shʉ' mghɛ kwinthɛ pyə; pyə bɑwə gɔm nwə vɔk bɔ bi po, vɔk mama yə e lə bɑ bəŋ Ta, gə pyə yɔ e a, ","Ɓwâ nò du nànɨ mèè kɨ́ yi túmne síhé, nɨ́m yi péé ŋgə́. Nɨ́m á ə́ə̀ŋnɨ mɨ̀námé, nɨ́m a ɓéece àm nò du nànɨ mè mɨ̀cɨ̧̀ɨ̧́ kɨ́. Ŋgə́ ya dukom gín Táà, ŋgə́ túumnaceé nɨ́m síí. ","A m duèñshi ryoèñ ca, weèr aè yáê, a ce suñ weèe aèmboè ryoèñ ca ce yu ryoèñ ce nfeseè ce li m ba a Taèr a duñshïì li neè weèr. ","-ndò enyiṅ engakulëban, ndò bingayen dzò; ndò hm biabòòlò bibendëge fë mina enyiṅ kòm ya engabë abë esya ndò engakulëban bia- ","A nshèffè a ngudko va a dai, a nga rka'a, a nga gi malwuƋi nenga'a, a nga njè kinè nshèffè mbia'a man a ndivè azɓai, a mèdèp, man a zhè a sam Bab nga, a ngudoko nga va a dai.","-Hərway mendzey ana ka ɓey vaw ba, la ka nəkadəmərawa ba, la kam seydewe ŋga na, arka la ma tələkadəmakwar mey, ta mendzey na me ndəvey kakay ana, na ma mbəɗa dey aha 'ar 'ay Baba na, ma ɓandar vaw ala-. ","Ndoꞌ jom na mañequiaaⁿ na wandoꞌ añmaaⁿꞌ tsꞌaⁿ, teitquiooꞌñê ndoꞌ jnda̱ ntyꞌiaa nda̱a̱yâ jom ndoꞌ cwitjeiꞌyuuꞌndyô̱ nda̱a̱ꞌyoꞌ cantyja ꞌnaaⁿꞌ na matseixmaaⁿ. Cwiñequiaayâ ñꞌoom nda̱a̱ꞌyoꞌ na mañequiaaⁿ na ticantycwii na wandoꞌ añmaaⁿꞌ tsꞌaⁿ. Tyomꞌaaⁿ ñequio Tsotya̱a̱ya Tyꞌo̱o̱tsꞌom ndoꞌ tyjeeꞌcañoom jaa. ","Yɔ za̧a̧tig bɔ midz wi gbɛnige, wi gisin dɔglɔ gii dɔko. Wi gisin dɔglɔ gii raako a wi gbɛn za̧a̧tig faa bɔ gi nɛ hi Baa wɛ Bɛto, gii wɛɛ gi midz a wɛ tees du.","Daga əpeliŋ ade, arbanək zəni, mulaka. Vini mədaw pel sukum wənnani, zəga an muwəl mədarbani ndəni zeŋgille məs nasan ha faɗə, tay də Maŋgəlva daga farfarə. Ndəni kan Maŋgəlva arban səmə. ","Bə́ dòn yà̧mgəŋ yo̧ŋkì muurɛ̀, yo̧ŋkì ya dàn kúr bíi. Yo̧ŋkì bee bal yòo Bàa Vannáb tuŋ, yaa fùu vìr pə́bənəno. ","Sɛŋ aa gɔ̀ŋsə́ aarə vúg bərə, bə́ bé'ù yàá; kə̀ taàbìá, bàà bə́ tə́ ii taà nwɔŋ oò nyɛ́'nàá, bít bə́ tə́ ii taà gɔ̀ŋsə́ bùúd aa kùmà Báá bə́n Vɛnɛ́b səǹ də nwɔŋ oò baanàá; gɔ̀ŋsə́ bùúraa Vɛnɛ́b pii bə́n doó. ","Buri Suŋfa a siŋkasi sini edi gaglai, tiyi mi tiliŋ, mi zi zaida midini, tiyi mi miɗiki midini suŋfa n’a vada kai, n’a nasi ka gaini Api, na tiyana a siŋkasi sini edi siyi lai. ","car la Vie a été manifestée, et nous l'avons vue, et nous lui rendons témoignage, et nous vous annonçons la Vie éternelle, qui était dans le  sein du  Père et qui nous a été manifestée—","(For the life was manifested, and we have seen it, and bear witness, and shew unto you that eternal life, which was with the Father, and was manifested unto us;)","irita vul tuwa' goy haraŋi, numa wa'a, numa di goy ka'a, numa ka kus tigiya kay irita vatɗita, ta ay kat Bumna, ta vul tuwa' goy haraŋi. ","Amu ényiñ é nga yenéban, a bi nga yene je. Bi ne bekañete, a bia kañete mia ényiñe ya melu mese é nga so e be Esaa a yené e be bia. ","Asi siifa nah na, a bugo vu le, i puraka le. Vurˀe, i ra gaka sedewo naŋ, yo i ra tulukum mi ti ɓi ngi siifa ngi sete, misi zleˀe aciki Cine, yo mubugo ndra vu na.","Ngam ngeendam man waŋgi, min ngi'i ɗam, min ɗon ceedo ɗam, min ɗon anndina on ngeendam nduumiiɗam ngonnooɗam kommbi Baabiraawo e ɗam waŋgani min . ","Ngam ngeendam man waŋgi, min ngi'i ɗam, min ɗon ceedo ɗam, min ɗon anndina on ngeendam nduumiiɗam ngonnooɗam kommbi Baabiraawo e ɗam waŋgani min . ","Duka-kpasa usa tɛ̀, ɛ́ɛ́ zɔka a̧, ɓɛɛ ɛ́ɛ́ dé sedaako, tɔ̧́ nɛ̀ wen-aa h’ɛ́nɛ́. Duka-kpasa'i nɛ́ wan nɛ̀ dúk ɓɔnsɛnɛ, nɛ̀ duka so katɛ Dáà, ɓɛɛ usi tɛ̀ h’ɛ́ɛ́.  ","Duka-kpasa usa tɛ̀, ɛ́ɛ́ zɔka a̧, ɓɛɛ ɛ́ɛ́ dé sedaako, tɔ̧́ nɛ̀ wen-aa h’ɛ́nɛ́. Duka-kpasa'i nɛ́ wan nɛ̀ dúk ɓɔnsɛnɛ, nɛ̀ duka so katɛ Dáà, ɓɛɛ usi tɛ̀ h’ɛ́ɛ́.  ","Kwa nza ŋkɛ nahe mpia shɛ kencɛte geva, nahe ghen'yɛ kenakɛ ŋkɛ, vatse negha fete ghen'yɛ yitea ghena shɛ ba'a zlape ŋayɛ mpi nya kaghala ghala nya kese vare Yita ba'a nya kencɛte n'yɛ geva ghen'yɛ. ","AÀ naa nen waçaçre se ma kol jar tenen go ne jare, nen wuur raw koge äe, wuur raw joñ sedewa go ti äe, wuur sii wo wee diñ ti Waçaçre se ma kol jar tenen tum ga hay le see Paçaçbe mono, maga aà naa nen äe go ne wuur mono. "
1JN.1.3,"Kìɓan ki tì kìghà lɛ, tì ghɛn tì ki wog kɛɛ̀ki ti ghaaghagsì girig mìni, lɛ di mìni girig, ɓi ɓa ɓɛ̀ràrɛn ri ɓìsi. Nni ɓìsii ri ɓɛ̀ràrɛn lɛ rì Seŋi, rì Yeesus Kiris à Man wiì. ","Hȩn kóó ho̧, kóó ki máa, vɔ́ pá'ad ví wu̵ yu̵ á̧ḿ, moo i sú̵gú̵n kan vɔ́, kɔ́ ı̵́ kóó sú̵gú̵n kan Ba'á kan Waa woo Yesu Krístu yɛ wɔgɔ á̧ḿ. ","Nji e yúghi na atûŋ, e yên na amə̂t, e kí səre ên fə́ne sê ên ó chə̂m na êt ka ochəma-biji mbi e fonê na Ńsé na Mmon owe Jisos Krayis. ","ywə yə pyə lə yɔ biŋ ju' a, pyə wə siŋ ba wɔ ya po'o gɑ pɑ tamtə. Yɔk pɑ nə tamtə pɑ a Ta, ba nə tamtə pɑ a Mu e Kristo. ","Nɨ́m nɨ́m yi pə́ré ɓe kɨ́ nɨ́m yi óklé, nɨ́m á nyí átɨ̀nàɓwênɨ, àm nyí ɓáaróó nɨ́m no, ju ɓaín nɨ́m du ɓe Mèín, ɓe mwin nóò Yésù Krístùù, nyí a dùɓwê ju kɨ́. ","Yuu ce weèr aè yá a ker yu', weèr ce suñ weèe foñ tá seèe bo ba aèbee. Yu ba seèe Taèr ba Muu yïû Jisos Kraâis weèe, ce seèe yu aèbee. ","e dzi bingayen, biwogo fë, mina biayedan dzò asu yë na mina fë mibi ngab ai bia. Ngab dzaan enë hm ai esya ban mòn woe Yesus Kristus. ","Skwi man nga rka ma, nga tsena'a, nga njè kinè, aman kinè ba kin humdè a nda nga; a nga, nga hümdè a nda Bab nga, a nda kra nenga'a, Yèsu Kristi. ","Na la ma nəkadəmərawa, ma tsənadəmərawa na na, la ɓadəmakwar a kuray tiyatsa, ma aza kuray tiyatsa na, la ka dzəmakwama dzaya. Me dzəmey vaw lakwa na na, me dzəmey vaw ta Baba, ta Bəzey ŋga na Yezu Kriste. ","Ndoꞌ cwitꞌmo̱o̱ⁿyâ nda̱a̱ꞌyoꞌ cantyja ꞌnaaⁿꞌ na tyontyꞌiaa nda̱a̱yâ na tyochꞌeeⁿ, ñequio ñꞌoom na tyoñequiaaⁿ na tyondya̱a̱yâ, cha nnda̱a̱ nlaꞌjomndyoꞌ ñꞌeⁿndyô̱ ee juu na cwilajomndyô̱ mꞌaaⁿnaꞌ ñequio Tsotya̱a̱ya Tyꞌo̱o̱tsꞌom ndoꞌ ñequio Jnaaⁿ Jesucristo. ","Hinyɔ wi gbɛnɔ wi wɛɛ wi kɛmɔ wi gisin gii dɔk hɛw an nɛ ɔks hi wiya. Winɛ wi ɔɔksɔ hi Baa wɛ Bɛto, hi waaɔ Yeesu Kristu. ","Zəga an məs muwəl də haramə, an məs məpprəm də sləmamə, ndəni mədaw nah sukum tamə, vi kəsapaŋ gən də mənamə, vi wəsap nam dəsan gən də Affəni gəm də Wətəni ndəni Zezu Krestu. ","Ɛn ya bə́ tə̀lè ní vəŋ bə́ kìilè ní bə́ daŋgəŋ pə́və́ wəi. Bə́ yá̧a̧ ní mú ya bə́ kə̧ má̧a̧nəŋ Bàa Vannáb vəŋ Wowa Yeesu Kiristu ní yò, və́ pɛ́m bəŋ kə̧ má̧a̧nəmà̧ tívɛ́. ","In aa bə́ bé'à kə̀ núù bə́, bít bə́ kììà kə̀ túŋ bə́ rə, bə́ tə́ ii taà baanàá, bɔ̀b aí kɔ̀ ìì wál kə̀ obə́ tá. Kàandə, wálke obə́ bə̀ rə, tə́ kə̀ Báá tá, bít kə̀ Wàà oò Yéésù Krístù tá. ","-Wala na tiyi mi tiliŋ, mi ɵiniŋ lai ɗa, mi miɗiŋki wiiki tiki laikapai tiki lai ki siɗi aŋ tipi gaiyi, tpi na wiyi ɗa a na gaini Api, gaini Yesu Kristu n’Ahini lai. ","ce que nous avons vu et entendu, nous vous l'annonçons, afin que vous aussi vous soyez en communion avec nous, et que notre communion soit avec le Père et avec son Fils Jésus-Christ.","That which we have seen and heard declare we unto you, that ye also may have fellowship with us: and truly our fellowship is with the Father, and with his Son Jesus Christ.","va ma numa wi'e humi kaw, numa dum goy tigi nigiya, kay nigi fi tap kepe hiɗi numa'a. May tapta-kepta vuma'a ka hiɗi bumna, hiɗi goora valamu Yesu Kristu kaw.  ","E jam bi nga yen a wôk, bia kate mia de, nde bia be mia bia ye fulane minlem. A mfulaʼane minleme wongan a ne nyô bia be Esaa a Mone wé Yésus Krist. ","Gwat ndra mupuraka ati ndra micinaka na, i ra tulukum di mi ya, ɓa kumo kwana, ki ndiram jom ati ndra. Jum ndra na, i jum ati Cine, waɗ ati Mangal naŋ Yesu Kristu.","Ko min ngi'i e ko min nani, kanjum min anndinta on, onon boo, ngam haa on kawta bee amin nder kawtal amin bee Baabiraawo e bee  Ɓiɗɗo  mum Yeesu Almasiihu. ","Ko min ngi'i e ko min nani, kanjum min anndinta on, onon boo, ngam haa on kawta bee amin nder kawtal amin bee Baabiraawo e bee  Ɓiɗɗo  mum Yeesu Almasiihu. ","Mɔ n’ɛ̀ɛ́ zɔka in n’ɛ̀ɛ́ zia, nɛ́ mɔ‘i ɛ̀ɛ̀ tɔ̧́ wen-aa h’ɛ́nɛ́ wen h’ɛ́nɛ́ mɛ́ duk kpɔk in yɛɛ mbɛt; ɓɛɛ duka-a k’ɛ́ɛ́ kpɔk'i, nɛ́ duka-a kpɔk in Dáà in Bem kɔ̧-a̧ Jesu Krist. ","Mɔ n’ɛ̀ɛ́ zɔka in n’ɛ̀ɛ́ zia, nɛ́ mɔ‘i ɛ̀ɛ̀ tɔ̧́ wen-aa h’ɛ́nɛ́ wen h’ɛ́nɛ́ mɛ́ duk kpɔk in yɛɛ mbɛt; ɓɛɛ duka-a k’ɛ́ɛ́ kpɔk'i, nɛ́ duka-a kpɔk in Dáà in Bem kɔ̧-a̧ Jesu Krist. ","Wəsə nya nakɛ ba'a nya fate ghen'yɛ yazlape ŋayɛ ghen'yɛ perə. Ma tsagha ne, katenza yɛ jikə le ghen'yɛ. Kanya kwetɛŋe ne, katenza gheɓəmə jikə le Yita ba'a le Wəzege ta ŋkɛ Yɛsə Kriste. ","Fen maga wuur ko ne, wuur laa waçaçre äe mono, wuur sii wo wee ti äe lay, nen maga nday mo tay go de wuur do maga wuur tay go de Paçaçben wo de Weel äe Yeso Kris no lay no. "
1JN.1.4,Tì kàni mìni ɓìɓan ɓi lɛ di kìnyàà kis kɛɛ roǹ lɛ pisa.,Vɔ́ bíńda ví hȩn yɛ moo zó̧ó̧ vóó a dȩ' sí̧' la gbug.,"É seŋa nná, sê ogyebhá-ḿbə́ŋé mbi e fonê ên ó súi ó fâŋ ó chíŋ ochíŋ.",Pyə bvə ya bi po po'o gɑ ŋwɛnyə yɔk pɑ pəmtə nyənyɔ. ,Nɨ́m tɨnna nyí nɨ́ɨ́b kɨ́ àm mɨ̀tù nɨ́mè sumíì a dùɓà yúklɨ́nne á.,Weèr ce sañ buu ca tá seèe bo ruu neè rlu'shïì.,"Ndò biatil mina e mam ma, asu yë na mintag mian mibui.","Ma haha nga winda kinè, aman mwuffè nga a gi jèlèlè'a. ","Arka la ma windəməkuraɓa neney na, ma wuiya lakwa ka key na kərem.","Ncꞌe na luaaꞌ, cwilaꞌljeiiyâ ñꞌoommeiiⁿ cha canda̱a̱ꞌ nncꞌomꞌyoꞌ na neiⁿꞌyoꞌ.",Wi wɛɛ wi gisin bi̧i̧k hin yɛrɛ an hat gi hi̧i̧s a wɛ kpoos du. ,"Mədaw ver sukum wənnəs na, vi wənek dəknah gən amakramə.","Sáan pə́bə́ ní bə́ dì̧i̧rà pə́və́bà bə̀ri, símá̧a̧r bə́ní kə pùu wár zɛ.","Bə́ bári nwɔŋ aa yée, bɔ̀b tɛ́m bə́n oò nyìì kə̀ làmkèá.",Wazagai hanɗa mi ɗuŋ siki kapai firiyi na wiyi a va amai.,"Et nous vous écrivons ces choses, afin que votre joie soit complète.","And these things write we unto you, that your joy may be full.",Slen kayni numa ɗomu kay firita vuma'a fi li goy hay liya'a.,"A bia tili mia jame te, nalé ate avaʼa dangan da ye bo ngumba.","Ndra matuhukum ɗerewol hana na, ɓa i mumulom haɗa wãˀ.",Kanjum min ɗon mbinndana on ɗum ngam haa seyo meeɗen heewa.,Kanjum min ɗon mbinndana on ɗum ngam haa seyo meeɗen heewa.,Ɛ́ɛ́ yɔ́r mɔ‘i lɛŋ h’ɛ́nɛ́ wen há̧ desee k’ɛ́ɛ́ mɛ́ dùk nɛ́ kpasa desee.,Ɛ́ɛ́ yɔ́r mɔ‘i lɛŋ h’ɛ́nɛ́ wen há̧ desee k’ɛ́ɛ́ mɛ́ dùk nɛ́ kpasa desee.,Ghen'yɛ karafe ŋayɛ ghena shɛ kezha viɗikɛ geva zlama ta n'yɛ.,Wuur yer feçeçre sen wo wo wee maga fruygi naa mo hay go de baa jage.
1JN.1.5,"Ɓɔlɛ ànɛ ɓìsii wokà rì nyi, innɛ ɓìsii ki ghagsii mìni; nnyɛɛ lɛ: Bɛ̀ll à rì kìtɛɛtɛn, birìm ì yin a lɔ̀ŋkii. ","Ya̧g ba'ad kóó ki yúú Yesu Krístu woolı̵́ máa, vɔ́ o̧d ví wu̵ yu̵ yɛ nɔ: Tayɨɨ máa, wu̵ túlí, ya dim tóó woolı̵́ waaná' aga pɛ́lı̵́. ","Deê é sə́ré ên mân otîp mbi Mmon Obhasi a kóe a bhák. A sə́re êt se Obhasi nâ ebhát, ejírim na yê kpák cháŋ. ","Ŋkhʉɔ yə pyə lə yu' bi e, biŋ bɑwə shwi bi po a bɑ gɑ Si bɑ ŋkha', la' sɔmywə jʉ́m pɑ nə e. ","Kìn nɨ́m ókwo Yésù Krístù ɓɔ̧ne á nɨ́m du nyí tànànɨ rè. Kìn kɨ́ ta ɨnayâna Mèín du mwa á, sɨ́mnɨ̀r nɨ yɨ́ ŋgə́ duré ɗàà na á. ","Nsuñ ce weèr aè yu' ese ye, a ce suñ weèe, yu ená Nyúè yu rraa, túè'nji yu njep ye ka', ","E ndòṅ bingawog abë nyè, ndzò biabende mina nyi: Zamba anë mfyè, ndò dibi ziṅ lasëki abë nyè. ","Ma haha, nga tsena'a a sam Yèsu, a nga njè kinè: Zhiklè, skwi nhél sam, ruva az a sam na ɓai. ","Neney na bəzay ma guma na la ma tsənadəmərawa ka ŋga na; arka na la ma ɓadəmakwar: Bay ma Bəla na waw me nəkey dey, ləvaŋ ɗaw? Ka ŋga na kwa ketekwəɗey daha tikay. ","Luaa waa ñꞌoom na tyonda̱a̱yâ na tyoñequiaa Jesucristo na cwitꞌmo̱o̱ⁿyâ nda̱a̱ꞌyoꞌ, cwiluiiñe Tyꞌo̱o̱tsꞌom na xueeñe meiⁿ tjaaꞌnaⁿ na matseixmaaⁿ na jaaⁿ. ","Dɔgl yɔ wi lag a Yeesu Kristu ya̧a̧ du wi gisin dɔk gɛrɛ a Bɛt gi lɛlgaalɛ, lɛlwil taa a ge zaŋ. ","Aŋki labara an məs məpprəm səza Zezu Krestu, annani mədarban sukum: Maŋgəlvayi təki babara, guzli taya zan ko suɗike ɓa. ","Bə́ kìiro muur də́ə Yeesu Kiristu yag di, bə́ dòn yà̧mgəŋ pə́və́ wəi. Və́ kìibà muur bee: Vannáb yòo túrə̀m, zɛ̀g kə̧n koo tuŋ pai. ","Ìì zɛ̀ŋ nwɔŋ aa bə́ kììà Yéésù Krístù naà, bít bə́ tə́ ii baàn doó. Vɛnɛ́b kùmsə̀n laa nyɛdkèá; oò gə́, tígə́l zɔ̀gɔ̀má oò naà sé. ","Seŋ na mi ɵiniŋ mini par, na mi dir mi miɗiŋki lai a na ɓa: Alaw a gaglai, gegeŋ aŋ warni kai.","Le message qu'il nous a fait entendre, et que nous vous annonçons à notre tour, c'est que Dieu est lumière, et qu'il n'y a point en lui de ténèbres.","This then is the message which we have heard of him, and declare unto you, that God is light, and in him is no darkness at all.","Kayni mi labara ma numa humumi vunamna, ma numa'a di goy tigiya kaw, ala: Lawna mi haraŋa, jufunda may hayam noŋɗi. ","Nyôna é ne foé bi nga wôʼô e be nye, a bia kalane mia je, e ne na: Zambe a ne éfufup, a teke atañe dibi e kui nye bebé. ","Ɓi ndra micinaka avu Yesu Kristu, ndra manjikukum di na, n'anihĩ: Buymisemuŋ i li minjahha, ko luvuŋ neˀ anta ava ta.","Ndaa kubaruwol ngol min nani haa Yeesu Almasiihu, kaŋgol min anndinta on: Allah o annoora, walaa nyiɓre nder maako koo seɗɗa. ","Ndaa kubaruwol ngol min nani haa Yeesu Almasiihu, kaŋgol min anndinta on: Allah o annoora, walaa nyiɓre nder maako koo seɗɗa. ",Gba̧a̧ wen n’ɛ̀ɛ́ zia nú Bem kɔ̧-a̧ nɛ́ mɔ'ɔ n’ɛ̀ɛ̀ tɔ̧́ h’ɛ́nɛ́'ɛ: Sɔ̧ nɛ́ sa̧a̧mɔ; tum kóó tikiɗi bó tɛ́ a̧ na. ,Gba̧a̧ wen n’ɛ̀ɛ́ zia nú Bem kɔ̧-a̧ nɛ́ mɔ'ɔ n’ɛ̀ɛ̀ tɔ̧́ h’ɛ́nɛ́'ɛ: Sɔ̧ nɛ́ sa̧a̧mɔ; tum kóó tikiɗi bó tɛ́ a̧ na. ,"Wa nya ghena nya fate ghen'yɛ va Yɛsə Kriste ba'a nya zlape ŋayɛ ghen'yɛ nya: Shala ya kawaŋe, ŋkwesle shɛ ya ci'a mbe we. ","Co' wee sug waçaçre maga wuur laan le jag äe mono maga wuur de sii gi äe wee lay mono, ga Baa diñ je ler ngeel go, suñgu bay ni äe wa hase. "
