livre.chapitre.verset,Bafia,Dii,Ejagham,Ghomala,Vute,Limbum,MKPAMAN_AMVOE_Ewondo,Mofa,Mofu_Gudur,Ngiemboon,Doyayo,Guidar,Peere_Nt&Psalms,Samba_Leko,Du_na_sdik_na_wiini_Alaw,Francais,Anglais,BIBALDA_TA_PELDETTA,Bulu,Guiziga,Fulfulde_Adamaoua,Fulfulde_DC,KALATA_KO_SC_Gbaya,KALATA_KO_DC_Gbaya,Kapsiki_DC,Tupurri
1JN.3.12,"Tì ghɛ̀ɛ̀sɛɛ ɓi ki pisɛɛ Kayin ànɛ à ɓaghà ɓi kìkàmì ki ghèghey à mum, nnyɛɛ wolà geni. À wolà nyi lɛ cɛ? Lɛ mɛ̀kìkìì mɛ geni mɛ ɓaghà lɛ saaɗ, mɛŋkii mɛ̀ kɛɛ̀ rɔɔtɛn. ","Ba mbaa ví kɔ́ ı̵́ Kayí̧n wɔgɔ sá. Ká woo nán gbaŋ hȩn ɓı̵́d woo nɔ, ká nɔɔ daa sá̧ŋ́. Nɔɔwo̧ moo ȩná? Moo ba'ad woo aga ka kɔ́ máa, ba'ad ɓı̵́ddɨ, ba'ad daa sá̧ŋ́ woo ká wu̵ to̧o̧d Tayɨɨ.","Deê e kâ fôn ekpin noŋ nne etat ka ane-atəm nnyo a kamê mbiŋ se Keyin. Keyin a fonê ekpin nji mmon i Satan. A fî fə́ne enyeré ejê a yúi. Echî etat cháŋ nji a yúi enyeré ejê, é ká chiŋi sê Keyin a fonê ekpin ebhí, enyeré ejê a fonê nnyen ekpin.","Ka pɑ hwə Kaen, yʉ yə e lə pɑ mo Sata gwa fɑ e a. E lə gwa e gɑ kɑ? Nə kɑlə mfa' myə lə bɑ mfa' cwəpuŋ tə myə́ fɑ e pɑ mfa' nyənyɔ. ","Nɨ ɗúwa nɨ́m dùná hȩ Kàyə̧̂:  ŋgə́ yɨɨ́m nò Sátààìn á, ŋgə́ ɨ́ wòmɨ̀kî wúrúb ɓe kpɨklɨ. Àm níì á ŋgə́ ya womɨkɨ́ce kùùŋ? Àm nɨ́ɨ́b nò kɨ́ yi du ndɨ̀ŋniì yi du bɨ́ ɗɨ́ɗɨ̧́, kɨ́b noò macè bɨ́ ɓáŋhɨ́bí á.","Weèe fa ba aèmboè Kán ce e m ba ñwáè Sataèn a yú nfúr yïì naè ka'. E m yú nfúr yïì ba njoká? AÈ m ba njobeè' buu ce e m geèe aè m ba buu bbebep, vïû nfúr yïì vi ba yáánïì.","së ki anë Kain angabë asòò abë Mbe, ndò angawoe manyaṅ. Ndò hm ki, asu dze angawoe nyè? Mbol mimboan mie mingabë abe, e mi mi manyaṅ mitoa sosoo. ","ara Cain ka ɓai. Nenga'a nte ndo man ambaɓai, a nkeƋa kramam nenga'a. A keƌa'a èhèmè? A géƌ skwi man a gau, ambaɓai, a skwi man kramam nenga'a a gau, zura'a.","Zləna andza ma Kayieŋ kakay, Ndaw hayakakay ana ka war 'ar ba na, ma slar ɗay ba a malam aŋga. Arka ɗagay a slara ɗay ba na ka mey? Hərway tek aŋga me key na haya hiya kakay, ama tek ma malam aŋga me key na, dzerey ahiya. ","Caín tyotseixmaaⁿ cantyja ꞌnaaⁿꞌ tsaⁿjndii. Ticatyꞌiomnaꞌ na nlꞌaaya chaꞌna sꞌaaⁿ na seicueⁿꞌeⁿ tyjeeⁿ. Ndoꞌ ¿chiuu na sꞌaaⁿ na luaaꞌ? Sꞌaaⁿ na ljoꞌ ee tyotseijomñê cantyja na ticatyꞌiomyanaꞌ, sa̱a̱ juu tyjeeⁿ tyochꞌee na matyꞌiomyanaꞌ.","Bɔwɛ riitin an za̧a̧n bɔ nuŋgɔ a Kaynu, yɔ gi Saydanu za̧a̧n bɔbtin bɔ doo ɔnɛ gi lɛbr yɛ̧ɛ̧tɔ yɔ hi mɔɔtinihi buu gbun du. Gbɔŋg a nɔ dɔŋg nɔ? Gbɔŋg a hinriit yɔ gi wook gi dɔŋgo, anyɔ hinwɔ gii gi wook ha̧a̧lɔ.","Mədawsam va Kaynu ɓa, nan abayək məlməni. Vi mi abay di? Vi wəza məs Kaynu agəɗ mbrayeni, na məlmən mogoni.","Bəŋ kə̧nəŋ mú Kain pai. Kain ní Dumpántóo  kàlèu yúlɛ̀, yaa mà̧a̧ dòosɛ́n zɛ. Ɛn kó rɛ mà̧a̧ dòosɛ́n ní? Kain tonóm əní duun pai, dòosɛ́n ní duu rì, wəi kó rì mà̧a̧u zɛ.","Báà kuùm kìínmbə̀ Kainu kíin sí. Oò gə́, Nɛ́ŋə̀ Vaksə́ wàá, lò' taà kudvɛɛ̀l oòra. Kə̀ níìbə̀ lò'ù taà gú? Oò gə́, mà' tù' vaksá. Zá kudvɛɛ̀l oò gə́, mà' tù' wɔ̀ɔ̀làá, lò'ù taàbìá.","Aga mu zumu maini Kayin n’a na sini na meefeŋ ar n’a fuɗa tawalni edi nɵa kai. A fuɗaŋ edi buri ma ɗa? Buri ɓa sda na wiini ni Kayin ɗa a meefeŋ, na wiini tawalni ɗa a jre.","non point comme Caïn, qui était du malin et qui tua son frère. Et pourquoi le tua-t-il ? Parce que ses œuvres étaient mauvaises, tandis que celles de son frère étaient justes.","Not as Cain, who was of that wicked one, and slew his brother. And wherefore slew he him? Because his own works were evil, and his brother's righteous.","nay ma li ki Kayin naɗi, nam ay vi ma Joona, nam ci ɓasulumna goyo. Nam cum goyo kay mige? Kay lopna valam nam joo'o, may lopna vi ɓasulumna ay ɗigere.","Saa aval ane Kaéñ, amu a mbe nyô mbia môt, a nga tyiʼi monyañe wé tyiñ . A nga tyiʼi nye tyiñ amu jé? Amu mimboone mié mi mbe abé , e mi mi monyañ ke mvaé. ","I gam ka Kayin ta. Naŋ, mbur migi mungra nah, a sla ˀay ngi sukum naŋ. A slaŋ ˀay vuna asi mike? Asi gwat ngi gi nga naŋ miga na, i malambaˀa, amma ngi sukum naŋ, naŋ jeŋŋe.","Taa en mbaɗa bana Kayinu mo mbari deerɗum ngam o laati mo Kalluɗo . Koni o mbari mo? Ngam kuuɗe maako ɗe kalluɗe, ammaa kuuɗe deerɗiiko ɗe adiliije .","Taa en mbaɗa bana Kayinu mo mbari deerɗum ngam o laati mo Kalluɗo . Koni o mbari mo? Ngam kuuɗe maako ɗe kalluɗe, ammaa kuuɗe deerɗiiko ɗe adiliije .","bó nɛ́ hee ko Kain, bíí ko Wan-ɗaŋ nɛ̀ gɔna so ger nya-wi ga na. Kain gɔna so ger nya-wi wen ge? Wen tom kɔ̧-a̧ de so na, ɓɛɛ ko nya-a̧ duka so nɛ̀ yuwar-a.","bó nɛ́ hee ko Kain, bíí ko Wan-ɗaŋ nɛ̀ gɔna so ger nya-wi ga na. Kain gɔna so ger nya-wi wen ge? Wen tom kɔ̧-a̧ de so na, ɓɛɛ ko nya-a̧ duka so nɛ̀ yuwar-a.","Nzama gheɓəmə kala Kayin ma, wəndəa Nde ndiremia mehele ŋkɛ, nahe ŋkɛ keslamte ghə te wəza meghekɛ. Tewəmbəreke wa slamte ghə ŋkɛ te wa? Va nya nza slene nyi mene Kayin kendiremi ndireminji, vəa ŋkwa nya nza ŋa wəza meghekɛ tiɗiɗia tiɗiɗia.","Ama naa mo joñ do Kayï¡ no wa. AÀ äen diñ ma Je älagge no, raw ï¡ï¡ hen äen go. AÀ ï¡ï¡n go wer may? A ï¡ï¡n go werga joñre ma äen de älagge, ma hen äen de deele."
1JN.3.13,Ɓɔɔsoŋ̀! Kɛ̀ ɓi kuurag lɛ ziinɛ ì ɓèèzɛɛ mìni. ,"Dan kirtȩ́n vu̵, nán hágá yɛ u̵u̵ máń ví tée, hȩn woo a kɔ́ ví ɓá' sá. ","Atem-abhon-í-nnyen, deê mân é kâ jóe ên ejûm okpógha-biji nji ngun á bhána ên. ","Mfɑ pɑ, ka nwə cyə wɔ gɑ́ dzʉ̌ pɔ wɔ. ","Mwin yàáb péín ə́mní, nùb ɗɔ̀ɔ́b lè noò ɨ́ ɓə̀ndè bɨ́ nyí, nyí nɨ gbɨ̀ŋhɨ̀r. ","Bfúr waê, ñgoèñ yi ka' baa weèe, weèe fa ba neè rgha'nïì-ñwáè ka'. ","Te miakam, a babëdzaṅ, ngë si-ndon yasiṅ mina. ","Kramamhi ga, kin rzl kinè ɓai, aman herkeda a gi shèwa a kinè. ","Ka da rəzlakwar zlay malam a ɗaw hay, kendzey andza bəla a ŋgəladakwar dey kakay na. ","Joꞌ chii ꞌo nnꞌaⁿya na cwilaꞌyuꞌyoꞌ, ncꞌe na luaaꞌ waa tintseiñꞌeeⁿꞌñenaꞌ ꞌo na joo nnꞌaⁿ na tyoolaꞌyuꞌ mꞌaⁿna na jndoona ꞌo. ","Nɛya, yɛ̧ɛ̧dɛ be, waal gi gin lɔlhɛ̧ɛ̧nuko, bɔ hinɔ gi kɔmsin gɛrsɛ. ","Milmiŋgiɗwa, kəda gətaŋ an ɗii na duniya azel kumənək ɓa. ","Dàavɛ, tò kúsà̧a̧r zə́bgənəvə́rì pɛ́m, kìŋəvə́ pai. ","Ɔ̀dkudvɛɛ̀l mə́ í'sɛ̀lbə̀ bərá, dáà nɛ́b bəraa zɔ̀ŋə yɛ́b bərə tə́ ii zeèn gə́, oò kò' ii yíl sí. ","Tawalakai, aga ki bindi hiyak kai na ɓa ɗai na yai e bili gaw siki ɗa. ","Ne vous étonnez pas,  mes  frères, si le monde vous hait.","Marvel not, my brethren, if the world hate you.","Ɓosiyonna, la sa nagatna ka gaw kigiya, nigi ma muɗ ɦuyum' kay kaynɗi. ","Te seman, a bobejañ nge si nyô ja siñe mia. ","Sukum ɗuwoy, da duniya ara hirsukum na, anja ɓi nah a zumukum hirnga ta.","Deerɗam'en, taa kayɗine to duniyaaru ɗon wanya on. ","Deerɗam'en, taa kayɗine to duniyaaru ɗon wanya on. ","O nya'm, kà o bíí zaŋnu nɛ́ sɛna'nɛ́, ká ɗɛɗɛ‘nɛ́ gɔn na. ","O nya'm, kà o bíí zaŋnu nɛ́ sɛna'nɛ́, ká ɗɛɗɛ‘nɛ́ gɔn na. ","Ka kesaka ma, nzama yɛ heheɓake kenza mbeli nyi te hɛɗi kazlɛ va gheyɛ ma. ","Heçeçre äi no, hayga tamsir da wee we ga no, ni sen mo ngel wee wa. "
1JN.3.14,"Ɓìsii yii lɛ tì mɛ pɛ̀sɛn ɓi rìwu, tì ɗiŋì ɓi cɛɓ; tì yii fɔlɔɔ lɛ tì keesii ɓɛ̀geni ɓis; ŋwaànɛ à yin ɗi ǹkɔ̀nɛ̀n, à kaka ɓi rìwu ɓi ɗùm. ","Kaa hí̧í̧ ví da ba ví kirtȩ́n vu̵ yȩ, ba gaa ví ba gbɔ ví ya nɔm, ba dɔ́ ví ya vágádı̵́. Nán ka hí̧i̧n daga kirtȩ́n né tée, dɨ lá ya nɔmmé. ","É məŋe sê é maghe ekʉ̂ é gye ka ekpin, ka é fon okot na atem-abhon-í-nnyen. Nne kpe nnyón nnyo á ka fon okot na ntem-nne Krayis, a nyə́ne ka óséré ekʉ̂.  ","Pɑ zhyə gɑ a bɑ pɑ lě da' shyə nə vʉ̌ kho nə vɔk, nə kɑ lə pɑ ŋkhuŋ mfɑ pɔk pɑ; Mo yə e tə ŋkhuŋ mo a pɑ bɑ m nthʉm vʉ. ",Nɨ́m ɗəəŋtɨ́ nɨ́m éíhó̧kíí yɨ́ cwé du ŋgáŋniì àm nɨ́m gɨ lénɨ yɨ́ mèè; nɨ́m ɗəŋhɨ ɓè nɨ́m éíhó̧kɨ́ré àm nɨ́m du ɗúnɨ kùŋ mwin yàá ə́mní rè á. Nò du nɨ́ ɗúnɨ mwin yàá ə́mní ɗàwáá á nɨ dùháyènɨ yɨ́ cwé du ŋgáŋniì. ,"Seèe riñ ená seèe aè fúú efa ñgúè' rkwe a ba aè ñgúè' ryoèñ njobeè' seèe koèñ bfúr viseèe. Ñwáè ce e baèa bfúr yïì, ñgaèñ yu ñwáè ce e kwe. ","Biayëm na bingasò a awu, ndò bialod a enyiṅ, amu biadiṅ babëdzaṅ. E nyò adiṅ ki alaṅan a awu. ","Nga suna, nga shkè auda te m'metsai a nga dè a nshèffè; te man nga woy kramamhi nga. Ndo man a woy kramam na ɓai, nte m'metsi dai. ","Lakwa na ka səradakwa, lakwa na ka tasəkwawa na ta memətsey a Mesəfrey, kavəday ka wuɗəkwata malam alakwa hay. Ndaw me wuɗey ndaw kakay na, ma ndza ha na da memətsey. ","Jaa na cwilayuuꞌa ñetꞌo̱o̱ⁿya nacje ꞌnaaⁿꞌ na cwitsuundye nnꞌaⁿ sa̱a̱ jeꞌ laxmaaⁿya na ticantycwii na cwitando̱o̱ꞌa. Cwilaꞌno̱o̱ⁿꞌa na ljoꞌ ncꞌe na jnda nquiuuya nnꞌaaⁿya na cwilayuꞌ. Tsꞌaⁿ na ticajnda ntyjii xꞌiaaꞌ na matseiyuꞌ, ndicwaⁿ mꞌaaⁿ nacje ꞌnaaⁿꞌ na cwitsuundye añmaaⁿ nnꞌaⁿ. ","Wɛnɛ wɛ mɛɛ a wɛ tuuz wɔrk du, wɛ wɛɛ wɛ gul a za̧a̧tig waal du da̧a̧da̧, wɛ mɛɛ anyɔ ha̧a̧wɛ a yɛ̧ɛ̧dɛ wɛ Yeesu fɔkya wɔ hi muulɛ, ya̧a̧nɛ. Za̧a̧nyɔ hā̧a̧g Yeesu fɔkya zaadɛ gɛ, gis a wɔrk du tɛ̧. ","Məsənka məzarək səza əmta mətoŋguk adəv zeŋgille. Məsən vasna, vi məŋglu milmiŋgiɗmi. Ɗəf məzel məlməni, nan dəɓəl wəzar sətəki namta ɓa. ","Bəŋ gàanəno bəŋ ví yágnəno vool bàarɛ̀, bəŋ yòonəŋ yo̧ŋkì bàar di. Bəŋ yá̧a̧nəŋ dàavag bənəní ní yò, wəi kó rì bəŋ gàanəŋ ɛn yò zɛ. Yír ya yá̧a̧n dòowa bíi wə kə̧ŋnəŋ vool bàar di tívɛ́. ","Bə́n gabm̀ yàá, nyàam də, bə́n kuùmmà valú. Zá bə́ŋyée gə́, bə́n piìnnì gɔ̀ŋsə́ rú. Bə́n í'ǹ ɔ̀dnə́ŋ̀ bəd də, bə́n piìn taà gɔ̀ŋsə́ rú. Zá màn aa í' ɔ̀d oò nə́ŋ̀ síndə, bə́ŋ̀ tə́ val nɛɛ̀n tɛ́mú. ","Tumu mu suɗumo ɓa mu vugumusi war mri par sini suŋfa; buri ɓa mu duruɗumu tawalakai, ni n’a dara tawalni kai ɗa a sumna war mri. ","Nous, nous savons que nous sommes passés de la mort à la vie, parce que nous aimons nos frères. Celui qui n'aime pas demeure dans la mort.","We know that we have passed from death unto life, because we love the brethren. He that loveth not his brother abideth in death.","Nay wi ala nay jikiyawa hay mitta pa kal hay irita, kay nay min ɓosiyayna. Sa ma min ɓasulumɗina mus hay mitta. ",Mfaʼa wongan bia yeme na bi kôlô ya awu a kui ényiñ ve nné ane bia nyeʼe bobejañ. E nyô a ne te nyeʼe a too awu été. ,"Ndr'i sinaka le, i cohom le tir muco ng'ar li ngi siifa, asi ndra i ra wuɗam sukum ndraˀahaya. Mbur mawuɗ vu ta na, muc ara zum buy ar naŋ.","En anndi en ngurtake diga maayde, en nasti ngeendam, ngam en ngiɗi deerɗiraaɓe men. Ammaa mo walaa yiide, o ɗon jooɗi nder maayde tawon . ","En anndi en ngurtake diga maayde, en nasti ngeendam, ngam en ngiɗi deerɗiraaɓe men. Ammaa mo walaa yiide, o ɗon jooɗi nder maayde tawon . ","K’ɛ́ɛ́, ɛ́ɛ́ iŋa'e ɛ́ɛ́ gboo tɛ́ fio h’ɛ́ɛ́ mɛ́ duk kpasa wen ɛ́ɛ́ kɔ̧ɔ̧ o nya-ɛɛ. Wi nɛ̀ kɔ̧ ŋma-wi na, ɓɔna tɛ́ fio.  ","K’ɛ́ɛ́, ɛ́ɛ́ iŋa'e ɛ́ɛ́ gboo tɛ́ fio h’ɛ́ɛ́ mɛ́ duk kpasa wen ɛ́ɛ́ kɔ̧ɔ̧ o nya-ɛɛ. Wi nɛ̀ kɔ̧ ŋma-wi na, ɓɔna tɛ́ fio.  ","Nahe mə keɗepe nahe gheɓəmə keshave mbe mte kadzembe mpi, va nya ɗe ka kesaka meyɛ ɓəmə gheɓəmə. Ma wəndə nya keɗema ŋkwa ne, kenaka wəndə shɛ kashave mbe dzeve ta mte we. ","Naa de koge ga naa cegaë we go ne huli ti ma kol ge go tenen, werga naa da heçeçre naa wo. Je maga bay da hen äe wa, ni je sen yañ nen huli ëa."
1JN.3.15,"Mum ǹcèm ànɛ à ɓèèzɛɛ geni, à rì ǹwolì-ɓum; ɓì ki yii lɛ ǹwolì-ɓum, à yin ɗi cɛɓ ki fiɗyàɓ fikɔ̀ɔ̀ ɓi nyimiɗ.","Nán 'waapád ka máń daga tóó tée, nán nɔm nɔɔnée. Ví gaa nán nɔm nɔɔné vu̵ kan vágád káákáá voolı̵́ pɛ́lı̵́. ","Kpe énê nnyo á bhaná ntem-mmon-i-nnyen, a ri nyúa-nne. Ó məŋe ên ngá fə́ne sê nyúa-nne kpe yót nnyo a kí fon ekpin Obhasi nji ótúm-ótúm cháŋ.",Mo yə e bɔ fɑ e a bɑ jwə mo. Po zhyə gɑ vɔk mama tə bɑ nə sɔm jwə mo pɑ. ,Nò lâs du ɓə̀ndɨ̀nɨ kùŋ mwin yàá nɨ nò kwíhɨ nɨ̀rì á. Nyí ɗəəŋceé ɨnayâna nò kwíhɨ nɨ̀rì nɨ ɓe mè mɨ̀cɨ̧̀ ɗàà. ,"Ñwáè ce e ka' baa nfúr yïì, baná ñgaèñ yu ñwáè nyú beèe. Weèe yi weená ñwáè nyú beèe aè koni ryoèñ ce nfeseè ka'. ","E mod osë adiṅ ki manyaṅ anë ṅwoe bod, ndò fë miayëm na ṅwoe bod ziṅ abëlë ki enyiṅ kòm abë nyè. ","Ndo man a gi shèwa a kramam nenga'a, nara ndo nkeƌ ndo. A kin suna, nshèffè man a ndivè azɓai a mèdèp, a te ndav ndo nkeƌ ndo ɓai. ","Kwa way way ma ŋgəlada dey ta malam aŋga kakay na, ŋga na ndaw me kəɗey ndaw vagay aha, ka səradama ha seŋgey, ɗaɗa ndaw me kəɗey ndaw vagay aha na, mendzey me ndəvey kakay ana, da vaw ŋga dakay. ",Meiⁿquia tsꞌaⁿ na jndooꞌ xꞌiaaꞌ na matseiyuꞌ cwiluiiñe tsꞌaⁿ na matseicwjee nnꞌaⁿ ndoꞌ manquiuꞌyoꞌ tsꞌaⁿ na matseicwjee nnꞌaⁿ ticatseixmaⁿ na tintycwii na wandoꞌ. ,Za̧a̧nyɔ gi hɛ̧ɛ̧nik naaza lɔlɛ gi zul gbɔŋkyayɔ. Nɛɛ mɛɛ a zulgbɔŋkya taan za̧a̧tig faa; za̧a̧tig bɔ ɗɛ̄ɛ̄ an gi waa gi kpoos du gɛ. ,"Ko naway məzu zel məlməni, məbay gəbayi, kəsənənək bo məbay gəbay arah na zeŋgille nawsan ha faɗ ɓa. ","Yír ya zə́bgəŋ dòowa ní, wə yòo mà̧a̧vooltóo. Və́ gàaro mà̧a̧vooltóo dín yo̧ŋkì ya kùn míi pai. ","Kóó nɛ́ɛ̀réè, tə́ ɔ̀d oò nə́ŋ̀ zeèn gə́, nɛ́d yíl bə̀ lo'ǹná. Nɛ́d yíl bə̀ lo'ǹ nə́ŋ̀má kə̀  * gɔ̀ŋsə́ aa bɛ́d bə gá rə naà sé. ","Asiya ɗi paŋ n’a bula gaw sini tawalni ɗa, ni a ɗif zi ɵiɓi belek; tiki ki siɗi ɓa ɗif zi ɵiɓi belek ɗa zuŋfa n’a vada kai aŋ warni kai. ","Quiconque hait son frère est un meurtrier, et vous savez qu'aucun meurtrier n'a la vie éternelle demeurant en lui.",Whosoever hateth his brother is a murderer: and ye know that no murderer hath eternal life abiding in him.,"Gigekaw ma ka gawt tam ɓasulumna nam sa ma ci mati, nigi wi ala sa ma ci mati irita vatɗita may mus hayam noŋɗi. ","Nyô a vini monyañ a ne ñwôé bôt. A mia yeme de na, teke ñwôé bôt a bili ngap ényiñe ya nnôm éto é too e be nye, ","Ko wa gar mahirsa sukum naŋ na, i mikiɗa hirnga. Na, ki sinaka le, mbur makiɗ hirnga na, siifa ngi sete anta a hur naŋ ta.",Ganyɗo deerɗum fuu o mbaroowo ko'e. On anndi ngeendam nduumiiɗam wonataa nder mbaroowo ko'e. ,Ganyɗo deerɗum fuu o mbaroowo ko'e. On anndi ngeendam nduumiiɗam wonataa nder mbaroowo ko'e. ,"Kóó o ndé nɛ̀ sɛn nya-wi nɛ́ wi-gbɛ-zu, ɓɛɛ ɛ́nɛ́ iŋa'e ŋma wi-gbɛ-zu beka dúk kpasa kpoo nɛ kpoo na.  ","Kóó o ndé nɛ̀ sɛn nya-wi nɛ́ wi-gbɛ-zu, ɓɛɛ ɛ́nɛ́ iŋa'e ŋma wi-gbɛ-zu beka dúk kpasa kpoo nɛ kpoo na.  ","Ma yayata wəndə nya kezlɛ va wəza meghekɛ ne, nde pesle ŋkwa ŋkɛ. Nahe yɛ keɗepe kaɗema ŋkwa kenza ta mpi nya kaghala ghala shɛ mbe nde pesle ŋkwa. ","Je maga bay da hen äe wa, diñ je ï¡d jare, day nday yañ de koge ga je ï¡d jar bay de eegre ma hay ge tenen tum äil äe wa hase. "
1JN.3.16,"Rìyi ɗi tì yii com ki lɛ ǹkɔ̀nɛ̀n ɗyɛɛ̀ɗi lɛ, Yeesus Kiris à faghà cɛɓ kii ɓisu wis; fɔɔnnɛ ɓìsi girig, tì ghɛ̀ɛ̀sɛɛ kì faà cɛɓ kis ɓisuu ɓɛgeni ɓis. ","Hȩn aa gaan ví hí̧nní wu̵lı̵́ máa, wu̵ yɛ nɔ: Yesu Krístu pú̵ fó̧ó̧ woo moo baa ví. Tée ba pú̵ ví fó̧ó̧ baa ví moo da ba ví kirtȩ́n voo á̧ḿ. ","Krayis yê ḿfoné a tóŋe êt ejûm nji á bhíŋa sê okot ka ekʉ̂ nji a kpóe ka echî ejə́ré. Ka ekpak njí, kə́n êt eróŋ e fonê ka ekamám ekʉ̂ ka echî atem-abhon-í-nnyen. ","Ywə yə pɑ nə jyə ŋkhuŋnyə cwəlɔ a bɑ gɑ kwa' yʉ Yeso lě hɑ vɔk e nə thə yɔk pɑ; ba wɔk pɑ, pɑ gɔ hɑ vɔk yɔk pɑ nə thə pyəshɑ mfɑ pɔk pɑ. ",Yésù Krístù yi kaikíí mè noò ɓe ɨ́r nɨ́mè. Á ɗúcénɨ nɨ́m kàìkɨ́ɓwê mè nɨ́mè ɓe ɨ́r kùŋ mwin yàáb ə́mní. Nɨ́m du nɨ́m túùmnànɨ ɗûnɨ́mí á kí. ,"Yuu ce yi geèe seèe, seèe aè riñ aèmboè rkoèñnïì li yu, yu ená Kraâis aè m fa yi tu, a kwe njo' seèe. See seèe túr aè rfa viseèe btu njobeè' bfúr viseèe. ",Eyë hm bingayëm ediṅ na: Angavë enyiṅ dzie asu daan. Ndò bia biayean vë enyiṅ dzaan asu babëdzan. ,"Nga rka mwoy-ndo, aman Kristi a mvu nshèffè na a géƋ nga. Nga ba, sèi nga vi nshèffè nga a géƋ kramamhi nga.","Zla ekəɗey ka səradakwa ma wuɗa vaw na ka neney: ŋga na Yezu ana na, ma vəlada mendzey ŋga hərway lakwa. Lakwa tiyatsa na, hayna lakwa ka vəladakwa mendzey lakwa, hərway ma malam a lakwa hay tey. ","Luaa waa na maꞌmo̱ⁿnaꞌ nda̱a̱ya chiuu tseixmaⁿnaꞌ na mꞌaaⁿ tsꞌaⁿ na wiꞌ tsꞌom xꞌiaaꞌ. Nquii Jesús tquiaañe cheⁿnqueⁿ na tueeⁿꞌeⁿ cwentaaya. Ndoꞌ na ljoꞌ, juu na cwitando̱o̱ꞌa laxmaaⁿya na nndya̱ꞌntjo̱o̱ⁿya nda̱a̱ nnꞌaaⁿya na cwilayuꞌ. ","Hinyɔ wɛ mɛɛn Bɛt ha̧a̧kɔ ha̧a̧g gɛrɛ: anyɔ Kristu ta̧a̧ an gi wɔr a wɛ dɔŋgo, gi an wɛ ta̧a̧ an wɛ wɔr a nawɛza zaadɛ wɔ hi gi a Bɛt gbɔnɔ du hi dɔŋg be.","Də aŋki məsən wəŋgla na Zezu Krestu, aŋgələməka appanək zəni amtək vimə. Aslək nam bo məppan gən ki zem viyit milmiŋgiɗmə. ",Yeesu Kiristu pə́ró yúl əní kəbənəŋ yúl li. Wəi kó rì bəŋ gàanəŋ yá̧a̧sàŋ muur zɛ. Bənəŋ pɛ́m bà̧a̧ ní bəŋ pə́nəmà̧ yúl bənəní dàavag bənəní yúl li bə̀ri. ,"Ìì zɛ̀ŋ nɛɛ̀n aa bə́n gabm̀ í'sɛ̀l kùm dú roó. Yéésù Krístù pii yíl oò obə́n bòórú. Kə̀ aarə kíin, obə́n kɔ̀ báà piìn yíl bə́n ɔ̀dkudvɛɛ̀l bə́n í'sɛ̀lbə̀ bəd bòórú. ","Aga mu suɗumu diri ɗa warni hanɗa: Kristu a sa suŋfani edi burimu, tumu lai aga mu sumu suŋfamu edi buriɗi tawalakai. ","A ceci nous avons connu l'amour, c'est que Lui a donné sa vie pour nous. Nous aussi, nous devons donner notre vie pour nos frères.","Hereby perceive we the love of God, because he laid down his life for us: and we ought to lay down our lives for the brethren.",Nay wi ti-kamda na'ta kayni: kay nam vul irita valam goy kaya. Nala kaw nay ma vul irita vay goy kay ɓosiyayna. ,"Amu jame di, a taté éyoñe ji, bia yen nyeʼan Yésus Krist a nga ve ényiñe jé amu ajô dangan. Bia fe bia yiane ve ényiñ jangan ajô bobejañ. ","Kristu a vula siifa naŋ le vur ndra, zle dana, ndra masinaka wuɗavu na, avaˀa. Ndra kwana, sey i vulaka siifa ndra vur sukum ndraˀahaya ya.","Almasiihu hokki yoŋki muuɗum ngam meeɗen. Bee maajum en paami ko woni yiide. Enen boo, sey en ndokka yoŋkiiji meeɗen ngam deerɗiraaɓe meeɗen. ","Almasiihu hokki yoŋki muuɗum ngam meeɗen. Bee maajum en paami ko woni yiide. Enen boo, sey en ndokka yoŋkiiji meeɗen ngam deerɗiraaɓe meeɗen. ","Mɔ n’ɛ̀ɛ̀ iŋa nɛ̀  kɔ̧ɔ̧mɔ  nɛ́ mɔ'ɔ: Jesu ha̧a̧ tɛ-wi mɛ́ fe wen zu yɛ, ɓɛɛ ɛ́ɛ́ mbɛt tɛ́ ha̧ kànà tɛ̀ yɛ fe nɛnɛ wen zu o nya yɛ. ","Mɔ n’ɛ̀ɛ̀ iŋa nɛ̀  kɔ̧ɔ̧mɔ  nɛ́ mɔ'ɔ: Jesu ha̧a̧ tɛ-wi mɛ́ fe wen zu yɛ, ɓɛɛ ɛ́ɛ́ mbɛt tɛ́ ha̧ kànà tɛ̀ yɛ fe nɛnɛ wen zu o nya yɛ. ","Wa nya tsetse ɗepete ɗe gheɓəmə: nahe Yɛsə Kriste kezamte mpia ŋkɛ kezha gheɓəmə. Ma gheɓəmə perə ne, nahe gheɓəmə kehi kaza mpia ɓəmə kezha ka kesaka meyɛ ɓəmə. ","Naa ko ga kay diñ dage mono, wer maga Yeso Kris haç äil äe go ti bol naa. Naa lay, naa mo haç äil naa go ti bol heçeçre naa wo lay."
1JN.3.17,"I ŋwaànɛ à rì rì ìkum à ghɛɛ geni di à rì ɓi kìyɛɓà, kɛ̀ɛ wog nyi nyìighnyìg, lannɛ à rì lɛ à kpaa lɛ à keesii Bɛ̀ll ɓi nɗem wii?","Nán tóó ka kɔ́ naa pȩ́ń, ka ho̧ daga kirtȩ́n tóó ka 'yɛ́n hȩn né, a̧máa ka sȩȩ nɔ́ɔ́ ya̧a̧wo̧ daa tée, wú̵ń duu o̧ ba bin hí̧í̧ Tayɨɨ zó̧ó̧ biilí áa? ","Ájoé ó fon iyîm í ngun kən o yên ntem-mmon-i-nnyen a ri ka eket, kən o yíghi amə̂t ó ka nyáŋé, okot Obhasi ó kí yim nan ó jóe wâ ka ḿbə́ŋé. ","A po'o bi a mo ghə́ tsə dzʉ, tə jɔ fɑ e, ywə pɑwə jak e, e lə cɔm mtso myə́, bɑ bi a pɑ́ ŋkhuŋnyə Si pɑ nə e m gɑ kɑ? ","Nɨ́m kù ɨ́ tùŋ mwin yàá ə́mní kù, kùŋ noò du ɓe njɔdìì ɨ́ pê, ŋgə́ ɨ́ ákî nɨ́ íí, ŋgə́ ɓa tànɨ ní á ɓàhá ɓe ɗûnɨ́m Mèèín á à? ","Ñwáè ka' túr buu enjep ñgoèñ na, yá ená nfúr yïì buu yuu, tee mmbo, aètaè rkoèñnïì Nyúè li ba njep ye aè njáâá ká? ","E nyò abëlë byem bi mò abëbëgë e manyaṅ anë a mëyaṅan, afëdë nyè nnëm woe, eyë ediṅ Zamba enë dzam laṅan abë nyè ya? ","Ndo man a ngots skwi a géƋ herkeda haha, a rka kramam nenga'a ntawassa, a sassaya ndav na a sam nenga'a, mwoy-ndo Zhiklè nenga'a tema? ","Kendzey ndaw ana zleley ma bəla neney a rafa daha, arka a nəkada malam aŋga tek a hətsar na, arka na ŋga wuɗarada dey ba, mandzara ka kar da vaw na, na ŋga na na, ma wuɗa vaw ma Bay ma Bəla ana a da ndzey da vaw ŋga na teŋgey? ","Ndoꞌ mati quia mꞌaaⁿ cwii tsꞌaⁿ na matseiyuꞌ ndoꞌ maya ꞌnaⁿ na maljeii, ndoꞌ meiiⁿ na maqueⁿ tsaⁿꞌñeeⁿ cwenta na matseitjo̱o̱naꞌ cwii xꞌiaaⁿꞌaⁿ na matseiyuꞌ, sa̱a̱ tiquioo na wiꞌ tsꞌoom juu, ¿yuu waa na maꞌmo̱o̱ⁿ na jnda ntyjeeⁿ Tyꞌo̱o̱tsꞌom? ","Yɛrɛ doo za gi gin rɔɔsɛ, wɛɛ gi gbɛn naaza gi ha̧a̧k ya̧a̧rɛ, gi tā̧ā̧ an gi mɛɛsigya̧a̧r gɛ, yɔ raa ri a ha̧a̧be Bɛt nɔ? ","An ɗəf tay də arya avani, awlak məlmən tay də wəray na zəga, amma akpaŋganək gəɓan səni dəbaah sən ɓa, ya ɗəffəs tay də əŋgla na Maŋgəlva amakran sa? ","Yír díŋ zaudì, tə̀ŋ dòowa ní dín mai, wə pìŋ pu símá̧a̧rɛ̀ gá, kó sɛ wə dà dáŋnì bə yá̧a̧ŋ Vannábò ní? ","Dáà nɛ́d gbaŋə̀ bə̀ nə́ŋ̀, bé' ɔ̀dkudvɛɛ̀l oò í'sɛ̀lbə̀ nə́ŋ̀ tə́ búúrú, zá ɛ̀g bé'ù búúd síngə́, ééleè dá taà seèl baàn, bəǹ tə́ kə̀ í'sɛ̀l Vɛnɛ́b bə̀ naà obəǹ tɛ́mú gú? ","Amma na ɓa ɗif aŋ gaini der warɗi yai, a tala maini aŋ war gir, amma a dûgûti agulni sini ɗa, dir na wiini Alaw a sumna warni maɵa maɵa ɗa? ","Si quelqu'un possède les biens de ce monde et que, voyant son frère dans la nécessité, il lui ferme ses entrailles, comment l'amour de Dieu demeure-t-il en lui?","But whoso hath this world's good, and seeth his brother have need, and shutteth up his bowels of compassion from him, how dwelleth the love of God in him?","La san ka hiɗi slen hay ɓalamu, la nam wi ɓasulumna hay kiɗata, may duk dikam talamu ni, ti-kamda vi Lawna fi mus hayam ir nanige? ","Nge môt éziñ a bili akume ya si nyô a lôô monyañe wé e mebua été, a bo te mvamane nye, nyeʼane Zambe ô too e be nye aya? ","Da mburo, naŋ da ti zlili ngi duniya hana, yo da naŋ mupura sukum naŋ le, a ro ti may ngi gwat, amma da a puraŋ ˀircece ta na, wuɗavu ngi Buymisemuŋ a cifi a mevele mbri mbrike?","To marɗo yi'i haaje deerɗum, ammaa o sali enɗugo ɗum, bana noy yiide Allah tabitirta nder maako? ","To marɗo yi'i haaje deerɗum, ammaa o sali enɗugo ɗum, bana noy yiide Allah tabitirta nder maako? ","Wi nɛ̀ a̧a̧ nɛ̀ kpaamɔ zaŋnu’ɛ, kà a̧ zɔ́k nya-a̧ tɛ́ san, ɓɛɛ kà a̧ gbák a̧ na,  kɔ̧ɔ̧mɔ  ko Sɔ̧ tɛ́ duk tɛ a̧ hee ge? ","Wi nɛ̀ a̧a̧ nɛ̀ kpaamɔ zaŋnu’ɛ, kà a̧ zɔ́k nya-a̧ tɛ́ san, ɓɛɛ kà a̧ gbák a̧ na,  kɔ̧ɔ̧mɔ  ko Sɔ̧ tɛ́ duk tɛ a̧ hee ge? ","Ma kenza kwete wəndə nya nza wəshi kezeme nyi kwake te hɛɗi shɛ ve, nda nakɛ wəza meghekɛ ŋkɛ shewə va titikwə ba'a nda ɗema ŋkɛ zəzə wəndəa shɛ ne, tsema nza ŋkɛ kaveyi ghəa kande ɗe Shala wa? ","Hayga jobo yañ de feçeçre ma ti tamsir la wo do, aà raw ko hen äe de saçy mopo ti, aà ko decoo äe we ga no, dage maga aà da Baa joñ äil äe joñ ge ne? "
