livre.chapitre.verset,Bafia,Dii,Ejagham,Ghomala,Vute,Limbum,MKPAMAN_AMVOE_Ewondo,Mofa,Mofu_Gudur,Ngiemboon,Doyayo,Guidar,Peere_Nt&Psalms,Samba_Leko,Du_na_sdik_na_wiini_Alaw,Francais,Anglais,BIBALDA_TA_PELDETTA,Bulu,Guiziga,Fulfulde_Adamaoua,Fulfulde_DC,KALATA_KO_SC_Gbaya,KALATA_KO_DC_Gbaya,Kapsiki_DC,Tupurri
1JN.4.17,"I ǹkɔ̀nɛ̀n à rì a lɔ̀ŋkis syeesyee à rìɓa, fɔɔnnɛ tì rì ɓiì ɓaà kɛ̀ɛ̀ ìris ŋwosi ɓɛyɔ̀m, ɓisuulɛ cɛɓ kis ki fɛ ɓi ziinɛ ki pisɛɛ rì ki Yeesus Kiris. ","Zó̧ó̧ nán woo a kɔ́ ba'ad baa vílí sí̧' sı̵́ gbuggú tée, dú̵ú̵ wú̵ń kɔ́n ba ví zá̧ga̧ moo sə̧""ȩ́lȩ́ né á̧ḿ, moo mbaalı̵́ baa ví hágá yɛlı̵́ yɛ, man kan mbaalı̵́ ı̵́ Yesu Krístu woo sú̵'ú̵. ","Ájoé okot mbi e fonê na Obhasi ó son nnyen esonóm, ḿbə́ŋé á bhó rəm êt ka ofú mbi yê a kí taŋ ngun. Á bhó rəm êt fə́ne, ka ekpin ejə́ré ka nsi nnyí é rî noŋ nji Jisos Krayis. ","A pɑ gɑ ŋkhuŋnyə cəŋtə bɑ nə pɑ, bɑ pɑ tə bwɔk tyɛ' fyɛ' pɑ nə pa' vɔk yɔk pɑ nthʉm yəŋ dzʉ̌ bɑ pa' vɔk Yeso a. ","Nɨ́m ɨ́ dùɓà yúklîn ɓe ɗûnɨ́m, ye ŋgù̧ní nɨ́m ɓa ə́ə̀ŋɓànɨ Mèèín tíí ŋgwé wááŋ á. Ɓetí mè nɨ́mè ɗɔ̀bín hò̧ á hȩ kɨ́ Yésù Krístùù. ","Seèe aè koèñni a du a misi wa'a, tá seèe bo keè wáp yuu mo' aè noèñ mnsa' ka', njobeè' seèe cu njep ñgoèñ na, a ba aèmboè ye. ","Na ngò ediṅ engabò mfaṅ mfaṅ a bë bia, asu yë na bibi afidi a amos nkat, amu e kan anë, nala ngò fë bia binë e si-ndon nyi. Wòṅ osëki a ediṅ, ","Mwoy-ndo n'nga'a njèlèlè'a a sam nga, aman nga da wuffò a pats kita, te man t'herkeda haha nshèffè nga lèmèlèmè ara nshèffè Yèsu. ","Da tek a neney tok na, ma wuɗa vaw da walaŋ a lakwa ka ndesley ba, ma lakwa ka da ndzakwa da ma sərafa ka pas ma sariya, ma vəday ŋga na, ŋga andza na ha na na, lakwa tey na, i da kakwama andza ha tey da bəla na tiyatsa. ","Luaa waa na maꞌmo̱ⁿnaꞌ na juu na mꞌaaⁿ na candyaꞌ tsꞌoom jaa matseicanda̱a̱ꞌñenaꞌ na tixolaꞌcatyuendyo̱ juu xuee quia na nncuꞌxeeⁿ nnꞌaⁿ, ncꞌe na mꞌaaⁿya tsjoomnancue chaꞌna Jesucristo. ","Hinyɔ gi zuunik a Bɛt ha̧a̧tigɔ tɔɔ da̧a̧da̧ a wɛ kpoos du gɛ: a anyɔ ɛmbil wɛ gi a waali du an Yeesu ɔnɛ be, wɛ mɛɛ a wɛ gin kpoos saŋtum a ɔ̧tyɔ Bɛt gɔ gi gbaas dood dɔgl gedu. ","An əŋgla na Maŋgəlva aɗɗak an məs aŋgəl amakramə, asana məgeslne na pay na kita ɓa, vi wədaw nam annaka dəlvəŋ na, agilik va wədaw na Zezu Krestu. ","Yakai kə̧sàŋ bənəní ya kúsà̧a̧r di ní yòo mú Yeesu Kiristu kə̧sàŋ. Vəŋ wəi, yó̧ŋ ya fág dàŋ kórì ní, símá̧a̧r bənəní dàn lórì Vannáb nə́n ni pai. Kə̧ nì, Vannáb yá̧a̧sàŋ tò̧no ɛn ya pùu pu ní. ","Bə́n tə́ən kə̀ í'sɛ̀l nyɛdkè obə́n tɛ́mə́ gə́, də́dǹ mà' bə́n fágə́n nyàmú gá. Nɛɛ̀n aa Yéésù Krístù kùm dú rə, obə́n kɔ̀ bə́n tə́ən kə̀ oò kíin, zɔ̀ŋə yɛ́b ba. ","War hanɗa, diri n’arbamu aga a va amai, war hanɗa, kapai mu sumnumu gaini yimi war mefeŋ zi sariya, maini na ni a na ɗa ɵa, tumu agamu bundumu maiɗi ɵa lai, warɗi yai hanɗa. ","La perfection de l'amour en nous, c'est que nous ayons une confiance assurée au jour du jugement; car tel est  Jésus-Christ , tels nous sommes aussi dans ce monde.","Herein is our love made perfect, that we may have boldness in the day of judgment: because as he is, so are we in this world.","Kayni mi va ma ɗek ala ti-kamda nagawa hayaya, kay nay ma fi teŋ-irta hay fatta fi kitata: Kay ki nam ka nala, nay ka nala hay nagat tani kaw. ","E jame di nde nyeʼan wo jaléban e be bia; e ne na: Bi ne njalan a ndi minlem môse ntyiʼane mejô. Amu aval a né, avale te fe nde bi ne si nyô, ","Gwat mabiga wuɗavu ngi Buymisemuŋ, a ndila le kaslsla a hur ndra na, n'anihĩ: angi hin ngi Buymisemuŋ masa ga kiita da mizli na, ndr'anta sa zluwunam ko neˀ ta, asi gwat ngi gi ndra ar duniya a bam vu le rak rak ati ngi Yesu Kristu.","To en ɗon bee yiide timmunde, en keɓan hoolɗinaare nyalaade kiita, bana no o wa'i, non ngoneten nder duniyaaru boo. ","To en ɗon bee yiide timmunde, en keɓan hoolɗinaare nyalaade kiita, bana no o wa'i, non ngoneten nder duniyaaru boo. ","Kɔ̧ɔ̧mɔ  hɔɔ gba̧a̧ tɛ̀ yɛ tɛ́ mɔ'ɔ: ɛ́ɛ́ tɛ́ duk nɛ̀ nɔɔ-ŋgiɗi wese kita, wen hee mɔ'ɔ nɛ̀ Jesu duk ga, ɛ́ɛ́ dúk hegɔ mbɛt sɛn zaŋnu’ɛ. ","Kɔ̧ɔ̧mɔ  hɔɔ gba̧a̧ tɛ̀ yɛ tɛ́ mɔ'ɔ: ɛ́ɛ́ tɛ́ duk nɛ̀ nɔɔ-ŋgiɗi wese kita, wen hee mɔ'ɔ nɛ̀ Jesu duk ga, ɛ́ɛ́ dúk hegɔ mbɛt sɛn zaŋnu’ɛ. ","Ma kenza ŋkɛ tiɗiɗi ɗe nya mbe gheɓəmə ne, katenza gheɓəmə le gezleŋema ghə te vecia meha ghwə, va nya nza nza ta ɓəmə teke te hɛɗi nya yipə yipə le ŋa Yɛsə Kriste. ","Mokay diñ fen ma kañ nen naa ga dage go de baa jag äil naa keëed ga naa mo hay de coä ge wur Cag ge waçaçre no, werga joñre naa ti tamsir la do mani Yeso Krisn no lay. "
1JN.4.18,"Ìris wu yin ɓi nkɔ̀nɛ̀n, syeesyee à ǹkɔ̀nɛ̀n à ti à lègsàg ìris, lɛ ìris wu resii yɛɛ lɔɔ lɛ, ǹkulɛ̀n à rì lɛ à ɓa, nni ŋwaànɛ à rì rì ìris, à yin ɗi ǹkɔ̀nɛ̀n syeesyee à rìɓa. ","Hí̧nní máa, dú̵ú̵ wu̵lı̵́ pɛ́lı̵́. Hí̧nní ı̵́ ka sí̧' la gbug máa, hȩd dú̵ú̵ gbɔ la zulí. Dú̵ú̵ ka kɔ́ nán tée, gaa hȩn si̧'i̧ní bii ba dɨlı̵́, moo gaa ba bin hí̧í̧ da bi vu̵ sí̧'i̧n gbug ní.","Nji Obhasi a fôn okot na êt, é bhó fon orəmá-ḿbə́ŋé. Okot Obhasi mbí ó son nnyen esonóm, ó kí yighí orəmá-ḿbə́ŋé, ka orəmá-ḿbə́ŋé na ekpərə́m Obhasi á jéna ekát jə́t. Nne nnyo a ri na efup nâ okot Obhasi ó ká son nnyen esonóm ka ḿbə́ŋé eye.","Pwɔk tə bɑ nə kuŋnyə pɑ, nə pa' kuŋnyə nyənyɔ tə jyə pwɔk pɑ̀. Mo bwɔk go' yə bi a pu nə jɔ e a; mo yə e bwɔk a tə bɑ e ghə kuŋnyə nyənyɔ pɑ. ","Nò du ɓe ɗûnɨ́mí nɨ óknɨ vùù ɗàà, ɗûnɨ́m duɓa yúklɨ́nne á nɨ ŋgɨ́íkɨ́nɨ vùù. Nò du ɓe vùù sumíì nɨ ɓe ɗûnɨ́m yúklîn ɗàà, ɓetí vùù á ndɨ̀ŋnɨ nɨ̀vɨ́tè dù hȩ ŋgə́ á nɨ jábɨ́rí tə̧ə̧́ rɨ u̧.","Rwáp li yu njep rkoèñnïì ka'. Yi yu ená rkoèñnïì ce li mïìsi li ke juèu rwáp, njobeè' rwáp li ke ba ba aè nfeè' ce seèe aè rïìñ ená a be fa seèe ñgá' njobeè' seèe aè geèe yuu bebep. Baná rkoèñnïì lïû ñwáè ce e ce wáp buu li yu aè bábá'. ","amu mfaṅ ediṅ wawoa wòṅ a nsëṅ ; wòṅ obëlë endegëlë, hë da e mod ambara asëki a ediṅ mfaṅ. ","Te mwoy-ndo, zlau azɓai. Aman mwoy-ndo njèlèlè'a a dzar da zlau aussa. Zlau a gudzai a géƋ kita. Aman ndo man a gi zlau, a n'ngatsa mwoy-ndo zura ɓai.","Zluwer da ma wuɗa vaw na daha tikay, ama ma wuɗa vaw na hayna na, a kəlada zluwer ba a bəla, hərway zluwer na, me wesey ta me hətey, arka na ndaw me wesey na, ma ndasla ha da ma wuɗa vaw kakay. ","Quia na matseixmaⁿ tsꞌaⁿ juu na mꞌaaⁿ Tyꞌo̱o̱tsꞌom na candyaꞌ tsꞌoom nnꞌaⁿ ticatyꞌue na nncuꞌxeeⁿ juu ee juu macanda̱a̱ꞌ na matseixmaⁿ na mꞌaaⁿ na candyaꞌ tsꞌoom, macwjiꞌnaꞌ na nquiaaꞌ. Xeⁿ na mꞌaaⁿya na nquiaaya, luaaꞌ waa ncꞌe na mꞌaaⁿꞌ nꞌo̱o̱ⁿya na nncuꞌxeeⁿ jaa. Ndoꞌ na ljoꞌ maꞌmo̱ⁿnaꞌ na juu na mꞌaaⁿ na candyaꞌ tsꞌoom jaa, ticanda̱a̱ꞌ laxmaaⁿya juu joꞌ.","Hat ɔks hi hoob gɛ. Bɛt ha̧a̧tigɔ yɔ tɔɔ gi da̧a̧ a wɛ kpoos du nin hoob ninɔ, an yɔ hoob fu̧u̧ a ya̧a̧rhantyɔ Bɛt gɔ gi gaa dood gedu. Za̧a̧nyɔ hoobha̧a̧ge, Bɛt ha̧a̧tigɔ tɔ̄ɔ̄ dā̧ā̧ gi kpoos du gɛ.","Ɗəf məs də əŋgla geslne adana ɓa, amma wəŋgla an də goŋga wagil gən geslne pakə, an ɗəf tay də geslne, va wənah na wəŋgla dərah wəɗɗa wəza amkran va Maŋgəlva aŋgəl ɓa, vi geslne asapək də kita.","Yír gàaro Vannáb yá̧a̧urì ní kón dúul pai. Yá̧a̧sàŋ bee nɛ̧̀ sòrgəŋ dúulɛ̀. Gàm yír wà̧a̧ŋ fágò, kóŋ dúul zɛ. Yír ya kóŋ dúul ní gàa dì̧i̧rnə̀ mú ya Vannáb yá̧a̧u ní pai. ","Də́dǹ gə́, wál kə̀ í'sɛ̀l gá, í'sɛ̀l nyɛdkè nìŋ də́dǹ kúnú. Də́dǹ ì' gə́, fágə́n tə́ túrú. Kə̀ aakíin sɔ̀ŋ, màn aa tə́ kə̀ də́dǹ naà rə, í'sɛ̀l nyɛdkè oò naà sé.","Hunai t'aŋ war diri kai, amma diri na gaini vi amai ta ɗa a vada hunai edi, buri ɓa hunai te siŋka ɓa wala zi gir a na gizi, ni n’a huna ɗa aŋ gai vi amai war diri kai. ","Il n'y a point de crainte dans l'amour; mais l'amour parfait bannit la crainte, car la crainte suppose un châtiment; celui qui craint n'est pas parfait dans l'amour.",There is no fear in love; but perfect love casteth out fear: because fear hath torment. He that feareth is not made perfect in love.,"Narta may hay ti-kamdaɗi, ti-kamda ta gasita ci narta goyo, kay narta mar kitat kuɗa'a, may sa ma li nari nam asay hiɗi mindaɗi.","Woñ ô nji bo nyeʼan été. Ve nya nyeʼane a vaa woñ, amu woñ ô ne amu melep . A môt a ko woñ a nji bo njalan e nyeʼan été. ","Zluwun anta ar wuɗavu ta, wuɗavu mikaslsla wãˀ na, a bi ti zluwun avra jaka, asi zluwuno, taŋ zlaɓ ati kiita. Mbur mazluwun na, naɓa wuɗavu naŋ a ndila kaslsla ta.","Marɗo yiide hulataa, ngam yiide timmunde ittan kulol. Ngam kulol ɗon hawti bee yaŋgada. Kulanɗo wonaay nder yiide timmunde.","Marɗo yiide hulataa, ngam yiide timmunde ittan kulol. Ngam kulol ɗon hawti bee yaŋgada. Kulanɗo wonaay nder yiide timmunde.","Kíì bó tɛ̀  kɔ̧ɔ̧mɔ  na; kpasa  kɔ̧ɔ̧mɔ  bá nɛ́ kíì tɛ-wi yinɛ, wen kíì ndaɗa in bɔnɛ-oi-ɗaŋmɔ, ɓɛɛ wi nɛ̀ de kíì bó nɛ̀ kpasa  kɔ̧ɔ̧mɔ  na.","Kíì bó tɛ̀  kɔ̧ɔ̧mɔ  na; kpasa  kɔ̧ɔ̧mɔ  bá nɛ́ kíì tɛ-wi yinɛ, wen kíì ndaɗa in bɔnɛ-oi-ɗaŋmɔ, ɓɛɛ wi nɛ̀ de kíì bó nɛ̀ kpasa  kɔ̧ɔ̧mɔ  na.","Ghazlənə shɛ mbe ɗe we. Kaŋka ghazlənə ɗe ganyɛ. Kwa nza ŋkɛ ma kenza ghazlənə kazhɛ nda ke wəndə ne, ɗa ya neghe ŋkɛ. Kaɗe ŋkwa nde ghazlənə fate fate we.","Dage joñ heçeçne ga, ama dage ma ti ngeel äe keëedn nii heçeçne wo go haçaç. Je maga heçeçne yañ joñge äe mono, ni dage äen bay go ti ngeel äe keëed wa, werga heçeçne see wo äaaran wer kaçaçra de bone."
1JN.4.19,"Ɓi ɓɛg wìs, tì keesii Bɛ̀ll lɛ, nyimiɗ yɛɛ lokà ɓìsi kì keesii.","Ɨ́ baa ví máa, ba hí̧í̧ ví Tayɨɨ, moo ká wu̵ dəŋ hí̧í̧ ba ví. ","E kí toŋe okot, ka Obhasi a râŋ mbá a tóŋe êt okot. ",Pɑ̌ ŋkhùŋnyə cəcɑ̌ pɑ nə pa' a bɑ e le dəŋdzə ŋkhuŋ wɔk pɑ. ,"Kɨ́ nɨ́mè, nɨ́m du nɨ ɓe ɗûnɨ́m àm Mèín ɗúyaye nɨ́ nɨ́mè á. ",Seèe aè koèñni njobeè' e m koèñ seèe entombïì. ,Bia biadiṅ a mu angatari bia diṅ. ,"Nga woya'a, te man nenga'a a nwoy nga nshèlèkura'a. ","Ka wuɗakwama vaw na, ka vəday ma wuɗandukurawa tsəfəmey aha na, ŋga na. ",Jaa mꞌaaⁿya na candyaꞌ nꞌo̱o̱ⁿya Tyꞌo̱o̱tsꞌom ncꞌe jom tyꞌoomjñeeⁿ na candyaꞌ tsꞌoom jaa. ,"Bɛt ha̧a̧ge a wɛɛge doos ro, ya̧a̧nɛ gi ha̧a̧wɛ a ge hi doodɛ. ","Nam məŋglu Maŋgəlva na, vi ndəni dəŋgələm dabəŋ. ","Bənəŋ ní Vannáb yá̧a̧ bìibənəŋ nì, bəŋ yaa yá̧a̧nəŋ yír zɛ. ","Obə́n gə́, Vɛnɛ́b sɔ̀d í' bə́n sùnú; kə̀ taàbìá, bə́n tə́ən taà ɔ̀dnə́ŋ̀ bəd í'ǹ kɔ̀. ","Amma tumo mu durumu, buri ɓa ni a durumu avut. ","Nous donc, aimons Dieu, puisque Dieu nous a aimés le premier.","We love him, because he first loved us.","May naya, nay minimu kay nam minay jewe. ",Bia nyeʼesan amu nye a nga taté nyeʼe bia. ,"Ndra, ndra mawuɗam vu na, asi Buymisemuŋ a wuɗ ndra le dumbuŋ.","Enen en ɗon ngiɗindira, ngam Allah aarti yiɗugo en. ","Enen en ɗon ngiɗindira, ngam Allah aarti yiɗugo en. ","K’ɛ́ɛ́, ɛ́ɛ́ a̧a̧ nɛ̀  kɔ̧ɔ̧mɔ  wen Sɔ̧ kɔ̧ɔ̧ yɛ nɛti. ","K’ɛ́ɛ́, ɛ́ɛ́ a̧a̧ nɛ̀  kɔ̧ɔ̧mɔ  wen Sɔ̧ kɔ̧ɔ̧ yɛ nɛti. ","Ma gheɓəmə ne, kaɗe ŋkwa gheɓəmə va nya ɗehwe ɓəmə Shala kande ghate. ","Ma naa, naa dan werga Baa da naa go tañgu. "
1JN.4.20,"I mum à kpaa lɛ: Ǹkeesii Bɛ̀ll nni à ɓèèzɛɛ geni, di à rì pwààpwaà, ɓisuulɛ, i mum à keesii ɓi geni ànɛ a seesèè, lannɛ à rì lɛ à keesì Bɛ̀ll ànɛ à ghɛɛ ɓi? ","Tow nán tóó a o̧: “Mí hí̧í̧ Tayɨɨ ú̵,” a̧máa a máń daga tóó tée, kɔ́ vbáddɨ. Nán sú̵u̵ a ho̧ daga vu̵ nɔ́lȩ́ ma, a hí̧i̧n vu̵ né tée, wú̵ń hí̧i̧n Tayɨɨ né á̧ḿ, moo nán sú̵u̵ ho̧n Tayɨɨ né. ","Nne kpe nnyón nnyo a kí to se, “Ń kot Obhasi,” kən a kí bhan ntem-mmon-i-nnyen, a ri áfúbhí nâ á səra. Echî aŋ? Ntem-mmon-i-nnyen nnyo we o kí yen na amə̂t, ó ka kot, o kí yim nan ó kôt Obhasi nnyo ó ka nok oyén bhúghí-bhúghí. ","Mo ghɔm gɑ e khuŋ Si tə bɑ bɔ fɑ e bɑ e bɑ shwanwə. Nə pa' mo pɑ tə kuŋ fɑ e yə e jɔ e a, bɑ e gɔ kuŋ Si yə e tə jɔ e a m gɑ kɑ? ","Nò kù ɨ́ tà: «Mɨ á ɗúnɨ Mèín», u̧ kɨ́ ŋgə́ a jɨce nɨ́ kùŋ mwin yàá ə́mní, ŋgə́ du nɨ tɨ́kàŋkɨ̧́ á. Ɓetí, ɓwâ ŋgə́ jɨkɨ́yaye kùŋ mwin yàá ŋgə́ du péniì rɨ, ŋgə́ tɨ̀ ɗúce Mèín nò ŋgə́ du pénɨ ɗàwáá ɨna? ","Ñwáè moè' ka' laa enáê, “M koèñ Nyúè,” baa nfúr yïì, baná ñgaèñ yu ñwáè mnde' njobeè' ñwáè ka' baa nfúr yïì ce e ce yá, aède' e koñ Nyúè ce e ce yá ka' aè njáâá ká? ","Ngë mod ziṅ adzo na «Madiṅ Zamba», dzam da asiṅi manyaṅ, mod te anë mod-minnal. Amu e nyòb adiṅ ki e manyaṅ woe ya ayen asëki dzam diṅ e Zamba ya andzëki yen. ","Ndo man a gaƋa: l woy Zhiklè, aman a gi shèwa a kramam nenga'a, ndo ncèkèlma. Ndo man a woy kramam nenga'a, man a rka'a a di ɓai, a slaha a nwoy Zhiklè, man a rka'a ɓi ƌè? ","Haɗaw ndaw a ləvey: «I wuɗa Bay ma Bəla» ama a ŋgəladata dey ta malam aŋga hay kakay na, ŋga na ndaw maləwaɗay. Azlakwa ndaw a wuɗa malam aŋga, na ŋga ma nəkada na kakay na, a da slafa ma wuɗa Bay ma Bəla, ma nəkada kakay ana na, kakay. ","Xeⁿ na nntso tsꞌaⁿ: “Ja candyaꞌ tsꞌo̱o̱ⁿya Tyꞌo̱o̱tsꞌom”, sa̱a̱ mꞌaaⁿ na jnoomꞌm cwii xꞌiaaⁿꞌaⁿ na matseiyuꞌ, cweꞌ tsaⁿcantu jom. Ee xeⁿ ticꞌoom na jnda ntyjeeⁿ xꞌiaaⁿꞌa na mantyꞌiaaⁿꞌaⁿ xonda̱a̱ nncꞌoom na candyaꞌ tsꞌoom Tyꞌo̱o̱tsꞌom na tyoontyꞌiaaⁿꞌaⁿ. ","Za̧a̧n za gi dɔg a ha̧a̧b Bɛto, gi wɛɛ gigi naazaza lɔlhɛ̧ɛ̧nuko, gi ya̧a̧gɔ̧ɔ̧nyayɔ. Za̧a̧nyɔ hā̧a̧g naaza yɔ gi gbɛnik gɛ rɛ, ɗɛɛ an gi ha̧a̧ge Bɛt yɔ gbɛnig gɛ ri ma nɔ? ","An ɗəf anahək na: Nəŋgluwək Maŋgəlva, amma dəppan wəzel məlmən ɓa, tepelke adawa. An ɗəf dəŋglu məlmən məs adawla aza haran ɓa, mbarmbari adəŋglu Maŋgəlva məs dula ɗaah aza haran ɓa di? ","Yír ya daŋ bə yá̧a̧ŋ Vannábò, wə zə́bgəŋ dòowa ní, wə yòo míiltóo. Dàamwa ya a tə̀ gù̧u̧nu bə̀ri yò, a yá̧a̧nə̀u bai gá, kaa yá̧a̧ Vannáb ya a tə̀n míi rɛ? ","Nɛ́ŋə̀ bààì obəǹ gə́, bəǹ í' Vɛnɛ́b yàá, bít tə́ ɔ̀d oò nə́ŋ̀ zeèn gə́, oò gə́, nɛ́d gúsuúm bìá. Kə̀ aarə kíin sɔ̀ŋ, í' ɔ̀d oò nə́ŋ̀ aa bé' núùrú rə síngə́, bán Vɛnɛ́b aa bé' núùrú síndə í'ǹmbə̀ gá. ","Ɓa ɗif a muɗa ɓa: mu dara Alaw, amma a bula gaw sini tawalni, ni a ɗif z'eles; buri ɓa ni n’a dara tawalni n’a na talaŋ kai ɗa, a siɗa aŋ dara Alaw n’a talaŋ kai maɵa maɵa ɗa? ","Si quelqu'un dit: ""J'aime Dieu"", et qu'il haïsse son frère, c'est un menteur; comment celui qui n'aime pas son frère qu'il voit, peut-il aimer Dieu qu'il ne voit pas?","If a man say, I love God, and hateth his brother, he is a liar: for he that loveth not his brother whom he hath seen, how can he love God whom he hath not seen?","La san di ala nam min Lawna, may nam ka gawt tam ɓasulumna ni, nam mi sa ma sinda, kay la san min ɓasulum ma nam wumnaɗi, nam as min Lawna ma nam bay wumnaɗi. ","Nge môt éziñ a jô na: Ma nyeʼe Zambe! Ve a viniʼi monyañ wé, a ne nlaa minsos. Amu, e môt a ne te nyeʼe monyañ a lôô a mis, a se ngule ya nyeʼe Zambe a nji yen. ","Da mbur a ɓi: «I ra wuɗ Buymisemuŋ», amma ara hirsa sukum naŋ na, naɓa i mbur misi slir. Asi mike na, sukum naŋ, naŋ mapura, da naŋ anta wuɗaŋ ta na, a sa wuɗa Buymisemuŋ, naŋ mapura gu ta mbri mbrike?","To goɗɗo wi'i: Mi yiɗi Allah, ammaa ɗon wanya deerɗum, o pewoowo. Ngam to o yiɗaa deerɗiiko mo o yi'ata, noy o waawrata yiɗugo Allah mo o yi'aay? ","To goɗɗo wi'i: Mi yiɗi Allah, ammaa ɗon wanya deerɗum, o pewoowo. Ngam to o yiɗaa deerɗiiko mo o yi'ata, noy o waawrata yiɗugo Allah mo o yi'aay? ","Kà ŋma bíí tɔ̧́‘e nde, wi kɔ̧ɔ̧ Sɔ̧, ɓɛɛ kà a̧ sɛn nya-a̧, wi’ɛi nɛ́ wi-ndela; wen wi nɛ̀ sɛn nya-a̧ n'aa zɔk, tɛ́ kɔ̧ Sɔ̧ n'aa zɔk na’ɛ hee ge? ","Kà ŋma bíí tɔ̧́‘e nde, wi kɔ̧ɔ̧ Sɔ̧, ɓɛɛ kà a̧ sɛn nya-a̧, wi’ɛi nɛ́ wi-ndela; wen wi nɛ̀ sɛn nya-a̧ n'aa zɔk, tɛ́ kɔ̧ Sɔ̧ n'aa zɔk na’ɛ hee ge? ","Ma kegeze wəndə: «Kaɗe Shala 'ya», a ke, kazlɛ ŋkɛ va menənyɛ ne, nde sla tseŋwə ŋkɛ. Kwa nza ŋkɛ ma wəndə nya keɗema menənyɛ nya newe ŋkɛ ne, kaɗete Shala nya nakɛma ŋkɛ ŋkɛ we. ","Hayga jobo yañ waçaç ge ga: Se de da Baa, day aà bay da hen äe wa no, ni je sen diñ je gete'e, werga je maga bay da hen äe maga nen äe de ko ge äe wa mono, da Baa maga nen äe bay ko ge äe wa gaè. "
1JN.4.21,"Kìdɔ̀gsɛna ki Kiris à faghà ɓìsi kɛɛ̀ki lɛ: Ŋwaànɛ à keesii Bɛ̀ll, a keèsì girig geni.","Dooká Krístu woo ka pú̵ ba ví máa, wu̵ yɛ nɔ: nán ka hí̧í̧ Tayɨɨ tée, a hí̧í̧ daga vu̵ á̧ḿ.",Ḿfa mân nâ ebhín nji Krayis a karê êt: se kpe énê nnyo a kí kot Obhasi a ri a kot ntem-mmon-i-nnyen.,"Mcò' myə e hɑ bi pɑ a bɑ gɑ: Mo yə e ŋkhuŋ Si a, e kuŋ ba fɑ e.","Nò ɗú Mèèín, ɗúɓwê kùŋ mwin yàá no ə́mní. Ɓíì Mèín na nɨ́mè á ná kí.","Nyúè aè laèa ca neè seèe, e laèa enáê, “Ñwáè ce e ka' koñ Nyúè, baná e be kuè koèñ nfúr yïì foñ.”","Bibëlë e mvende nyi abë nyè na e nyò adiṅ Zamba, adiṅi fë manyaṅ.","Na haha ma nkwèr man nga ngots te ri nenga'a: Ndo man a woy Zhiklè, da woy kramam nenga'a lèmèlèmè.","Nəkadama mey ma mewey ana la ma ndzafəmərawa da ŋga na: «Ndaw ana ma wuɗa Bay ma Bəla na, ka wuɗa malam aŋga tiyatsa.»",Luaa waa ñꞌoom na matsa̱ꞌntjomnaꞌ na mañequiaaⁿ nda̱a̱ya na cꞌo̱o̱ⁿya na wiꞌ nꞌo̱o̱ⁿya nnꞌaaⁿya na cwilaꞌyuꞌ.,Dɔgl yɔ Yeesu raawɛ: gɛ a za̧a̧nɔ gi ha̧a̧g Bɛto gi ha̧a̧g naaza hɛw.,"Apprəm dawka an məs Krestu aɗi səm naɗɗa: Ɗəf məs dəŋglu Maŋgəlva, say dəŋglu məlməni.",Və́ kìibà ɛn ya Yeesu Kiristu dòn yáglé pə́bənəŋ ní daŋ: Yír ya yá̧a̧ŋ Vannáb ní wə yá̧a̧bà dòowa bə̀ri.,"Ìì ɛ̀g indaŋ̀mbə̀ aa Vɛnɛ́b bàà báà ko'ǹ doó' màn aa bàà bəǹ í' Vɛnɛ́bì rə, oò í' ɔ̀d oò nə́ŋ̀ kɔ̀.","Tumu mu nivumu gadai hanɗa sini par, ni n’a dara Alaw ɗa, a dara tawalni lai.","Et nous avons reçu de lui ce commandement: ""Que celui qui aime Dieu aime aussi son frère.""","And this commandment have we from him, That he who loveth God love his brother also.",Vun-ma-gatna kayni nay fumi kalam pa ala: Sa ma min Lawna min ɓasulumna kaw.,"Atiñe di nde a nga ve bia. E môt a nyeʼe Zambe, a nyekeʼe fe monyañe wé.","Ɓimuɗuva ngi Kristu muvula ndra di, n'ani: mbur mawuɗ Buymisemuŋ na, anja a wuɗ sukum naŋ ya.","Ndaa umroore nde Almasiihu umri en: Mo yiɗi Allah, sey o yiɗa deerɗiiko boo.","Ndaa umroore nde Almasiihu umri en: Mo yiɗi Allah, sey o yiɗa deerɗiiko boo.","Heembea n'aa ha̧a̧ h’ɛ́ɛ́ nɛ́ mɔ'ɔ: wi nɛ̀ kɔ̧ɔ̧ Sɔ̧, a̧ kɔ̧́ nya-wi mbɛt.","Heembea n'aa ha̧a̧ h’ɛ́ɛ́ nɛ́ mɔ'ɔ: wi nɛ̀ kɔ̧ɔ̧ Sɔ̧, a̧ kɔ̧́ nya-wi mbɛt.","Wa nya ghena nya gezete ɓəmə Kriste nya: ma wəndə nya keɗe Shala ne, nda ŋkɛ kaɗe menənyɛ perə.","Jag liñgi maga Kris haçn ne naa mokay diñ ga je maga yañ da Baa no, mo da hen äen lay."
1JN.5.1,"Mum bimiɗ ànɛ à gherɛɛ lɛ Yeesus à rì Kiris, à rì ŋwaànɛ à gherɛɛ Bɛ̀ll; nni ŋwaànɛ à keesii seŋi, à ti à keesàg girig ɓɔn ɓɛ seŋi ànɛ̀n à yali. ","Nán 'waapád ka fȩȩ Yesu ba wu̵ Krístu tée, Tayɨɨ wu̵ ha̧a̧wo̧. Kóó nɔ́nná ka hí̧í̧ waa ba'a tée, hí̧í̧ waa woo vu̵ á̧ḿ. ","Kpe énê nnyo á kam se Jisos nâ a ri Krayis, nne nnyo Obhasi a túmi se a bhá yim êt é sém, a chə́bhe mmon Obhasi. Nne fə́ne kpe nnyón nnyo á kot ńsé nne, a kí kot mmon eróŋ. ","Mo yə e piŋ gɑ Yeso bɑ Kristo a, mo bɔ bɑ pu tsə e m nə Si; mo yə e nəŋ ŋkhuŋ Si yə e dzə̀ mo a, ŋkhuŋ mo yə pu tsə e m̀ nə Si a. ","Nò ə́mne ɨnayâna Yésù du Krístù á rɨ, nò kɨ́ du mwin Mèèín á. Nɨ̀vɨ́tè wu ɗúú tá, wu a ɗúɓwê munɨ́b. ","Ñwáè wááwá ce e byemi ená Jisoès yu Kraêis, ñgaèñ yu muu Nyúè. Ñwáè wááwá ce e koèñ tar muu, koèñ muu anaè foñ. ","E mod ose ayëbë na Yesus anë Kristus anë mbyalan abë Zamba, ndò fë e mod osë adiṅ mbonde adiṅ fë e nyò angabyali abë nyè. ","Ndo man a nco a ndav, Yèsu, nenga'a Kristi, nenga'a nyaka te Bi Zhiklè. Ara man mwoy Zhiklè man a yaka nga, lèmèlèmè mwoy nenga'a man Zhiklè a yau. ","Kwa way way me pey 'ar Yezu na Kriste na, ŋga na ma ya ha da Bay ma Bəla. Arka kwa way way ma wuɗa Bay ma Bəla Baba na, a key na a wuɗa ndaw ana, ŋga na na ma yaha da Bay ma Bəla na. ","Ticwii cwii tsꞌaⁿ na matseiyuꞌya tsꞌom na Jesús cwiluiiñe Cristo, macwiluiiñê cwii jnda Tyꞌo̱o̱tsꞌom. Ndoꞌ ticwii cwii tsꞌaⁿ na candyaꞌ tsꞌom nqueⁿ na cwiluiiñê Tsotya̱a̱ya, mati matsonaꞌ na cꞌoom tsaⁿꞌñeeⁿ na jnda ntyjii nnꞌaⁿ na cwiluiindye ntseinaaⁿ. ","Za̧a̧nyɔ ɗɔbsɔ a Yeesu gii Masihu bɔ gi Bɛt waayɔ. Za̧a̧nyɔ ha̧a̧g a Baa wɛ Bɛt ge, ha̧a̧g waaɔ hɛw. ","Ko naway dətaf na Messiyayi Krestu, nan wətən Maŋgəlvayi. Ko naway dəŋglu affən waŋglu wətəni. ",Yír ya íiro daŋ Yeesu yòo Kiristui ní wə yòo Vannáb Wowa. Yír yá̧a̧ró túnú ní dàŋ yá̧a̧rì wowa bə̀ri. ,"Nɛ́ŋə̀ aa kè' yàá, Yéésù kùmsə̀n Krístù rə, nɛ́ŋə̀ aarə, kùmsə̀n Vɛnɛ́b Wàá. Màn aa í' Báá rə, dá í'ǹ kə̀ yɛb oò bəd tá. ","Asiya ɗi paŋ n’a yima ɓa Yesu a Kristu ɗa, a waŋsi a Alaw, a siyaɗi paŋ n’a dara Api, a dara Ahi n’a waŋ ɗa lai. ","Quiconque croit que Jésus est le Christ, est né de Dieu; et quiconque aime celui qui l'a engendré, aime aussi celui qui est né de lui.",Whosoever believeth that Jesus is the Christ is born of God: and every one that loveth him that begat loveth him also that is begotten of him.,"Gigekaw ma vi ala Yesu mi Kristu, vuɗum mi Lawna, gigekaw min nam ma vuɗumna min nam ma nam vuɗumna kaw. ","E môt ase a buni na Yésus a ne Krist, a bialéya e be Zambe. A nyô ase a nyeʼe Zambe a ne mbiaé, a nyeʼe fe nyô a ne mbilane be Zambe.","Ko wa gar matiɓa, Yesu i Kristu na, i zuŋ ngi Buymisemuŋ, yo ko wa gar mawuɗ Buymisemuŋ Cine ngi mizli na, naɓa a wuɗ zuŋ ngi Buymisemuŋ vuna ya.","Koo moy nuɗɗini Yeesu woni  Almasiihu,  o laati ɓiŋngel Allah. Koo moy yiɗi baaba, yiɗi ɓiŋngel boo. ","Koo moy nuɗɗini Yeesu woni  Almasiihu,  o laati ɓiŋngel Allah. Koo moy yiɗi baaba, yiɗi ɓiŋngel boo. ","Kóó o ndé nɛ̀ kɔ̧ɔ̧ ɗɔaa'e Jesu nɛ́ Krist, Sɔ̧ koo wi’ɛi; ɓɛɛ kóó o ndé nɛ̀ kɔ̧́ Sɔ̧ nɛ̀ kó bíí'ɛ tɛ́ kɔ̧ kànà wi nɛ̀ Sɔ̧ kó'ɛ mbɛt.  ","Kóó o ndé nɛ̀ kɔ̧ɔ̧ ɗɔaa'e Jesu nɛ́ Krist, Sɔ̧ koo wi’ɛi; ɓɛɛ kóó o ndé nɛ̀ kɔ̧́ Sɔ̧ nɛ̀ kó bíí'ɛ tɛ́ kɔ̧ kànà wi nɛ̀ Sɔ̧ kó'ɛ mbɛt.  ","Yayata wəndə nya keyɛte Yɛsə ya kaKriste ne, wəzege ta Shala ŋkɛ. Yayata wəndə nya keɗe Shala Yita ne, kaɗe ŋwalea ŋkɛ ŋkɛ perə. ","Je maga yañ de yaçaç ge ga Yeso diñ Kris no, je ma sen diñ weel Baa. Day je maga yañ da pan weel, da weel äen lay. "
