livre.chapitre.verset,Bafia,Dii,Ejagham,Ghomala,Vute,Limbum,MKPAMAN_AMVOE_Ewondo,Mofa,Mofu_Gudur,Ngiemboon,Doyayo,Guidar,Peere_Nt&Psalms,Samba_Leko,Du_na_sdik_na_wiini_Alaw,Francais,Anglais,BIBALDA_TA_PELDETTA,Bulu,Guiziga,Fulfulde_Adamaoua,Fulfulde_DC,KALATA_KO_SC_Gbaya,KALATA_KO_DC_Gbaya,Kapsiki_DC,Tupurri
1PE.2.2,"ɓaana fɛlɛ yɛ̀ɛ ɓɔn ɓɛ ɓwɛɗ, ɓì keesì milig mɛ ɓi nghay mɛ mɛ ri lɛ syeesyee mɛɛ ri jɛ̀ɛ̀ ì Bɛ̀ll di fɔɔnnɛ ɓi tɔɔ̀, ɓì ki ghɛn cɛɓ, ","I baa hí̧í̧ moo yȩ́ń kɔ́ ı̵́ waa pə̧́ə̧d ku̵u̵ hí̧í̧ va̧a̧ máa wɔgɔ, moo i ki tée, víń na', víń sə́d á̧ḿ. ","Deê ekpin ejə́né é jóe noŋ mmon i mfê nnyo á korá a yábhá abhê nnyen. Deê ó kə́t o korá ên mfoné-mfoné abhê áma, mma á rî nâ eyum Obhasi. Nâ nji é kí yim ên ó sôn ka ekpin ejə́né na Obhasi. ","Də́ŋdə́ŋ pa' pó bwǎ pyə pú wə tə dzə́ wap a, po cəŋ pʉɔ tə ŋi'nyə ghɔ̀m, po'o gɑ po cyə́ m̀ nə́ e ŋkwyə nə ywə vɔk, ","Dunáam hȩ mucutɨ́b nánááb: ɗúnáɓam ma̧à̧ jɨ́nɨ̀m no ɗàwáá Kìn Nyɔ̧ɔ̧́ du nàniì, àm ɓwâ nyí ɓa mà̧à̧niì, nyí a hàm, nyí a kwàɓwéhè ɓə́r. ","Weèe yu seè'ni aèmboè boo bbeer ce a bi wa'a. Baná weèe aè ba koèñ aè rnyoñ mmbee ce aè yú' ce mi yu mrara, tá weèe bo kuè', luèñ. ","Anë minkëṅëlë mi bòn, dzëṅan fò mënyaṅ më nsisim ya masëki dzam ndaman, asu yë na minaṅ ete asu akode. ","Vagu ara wudahi man a wa: vawoy wa man amba zura'a, wa te Mèzhèɓ Zhiklè, aman a nenga'a kin grè a ma ma a sam m'mbél kinè, ","Kal kal andza na ma wawa gwendez ahiya na na, wuɗam na 'uwa tsəzlakka ana ma Guma, ma aza ta ŋga na, kuray ka da gəlam a me buwey, ","Chaꞌxjeⁿ yoꞌndaa na ꞌndaandye cwilꞌueena ndaatsuuꞌ tsondyeena, cjooꞌ nꞌomꞌyoꞌ na calꞌueꞌyoꞌ ndaatsuu ñequiiꞌ cantyja ꞌnaaⁿꞌ Espíritu, cha cantyja ꞌnaaⁿꞌ joꞌ nntsanajnda̱ꞌyoꞌ na laxmaⁿꞌyoꞌ nnꞌaⁿ na macwjiꞌnꞌmaaⁿñe Tyꞌo̱o̱tsꞌom, ","Yɔ nɛ gi an waat burko, yɛgi ha̧a̧n wa̧a̧l gaat mɔkilya bɔ an waayɛ̧s yɔ gɔ ha̧a̧g nɔɔtɔ wa̧a̧l be, an nɛ tɔɔn nɛ za̧a̧nɔ. ","Məsoŋ va kirin muwet kakaŋka, adaŋglaŋ momvo, məŋglu əpel na Maŋgəlva an də goŋga, vi kəɓayaŋ gən dəndən kəkohoŋ gən dəndəni, kənanənək nenek na Ɗəfdaya. ","Və́ kə̧mà̧ mú varə́m yɛ̀lə̀ŋ ya àmgəŋ va̧a̧ ní. Vannáb muur kə̧ nì va̧a̧ və́n bee, kə və́ kàŋəmmà̧ wəi, kə və́ só ví zɛ. ","Kìínmbə̀ nɛɛ̀n aa yɛb bəə í' vuùm uùm bə̀ rə kíin, aí kɔ̀ ìì í' insánke aa nyɛdkè bít ɔ̀gke roó. Kə̀ oòra, íí dá taà báàn kaŋ̀mbìá, bít íí dá taà báàn súùnmbìá. ","Maiɗi aliyagoi na kuɗu kuɗu nɵa, aga ki piyi aŋ ci fiyaw na gaini jilni kai na wiini seŋni Alaw, kapai gaini hanɗa ki siɗi aŋ wili amai sin kûri, ","comme des enfants nouvellement nés, désirez ardemment le pur lait spirituel, afin qu'il vous fasse grandir pour le salut,","As newborn babes, desire the sincere milk of the word, that ye may grow thereby:","Ki guro sa vuɗi wulina nala, nigi ma dar miira vi Ŋusta ma bay ɗutta, kay nigi ma wul kulo'o hiɗi namu tam su'da. ","Aval ane minkeñelé mi bon mi ndôme bialé, mia yiane foʼo ve menyañe ya nsisim me ne mfuban nde mia ye yaé a zu kui nyian.","Ziri gazahay mawuɗam ɗuwa ndrehhe na, kumo kwana, wuɗam mingiɓi ngi Buymisemuŋ, ɗuwa mikaslsla na, ɓa ki gilam, ki laham ti naŋ. ","Bana no ɓikkoy keccoy ngiɗiri kosam tum, onon boo ngiɗe wolde Allah gooŋgaare bana non, haa on mawna bee maare, on keɓa kisndam. ","Bana no ɓikkoy keccoy ngiɗiri kosam tum, onon boo ngiɗe wolde Allah gooŋgaare bana non, haa on mawna bee maare, on keɓa kisndam. ","Ɛ̀nɛ̀ dé wɔ yibere nɛ̀ duk nɛ̀ sa̧a̧-a̧, hee o be-zɔɗi ga; yibere'i nɛ́ wen ko Sɔ̧ nɛ̀ tɛ́ de h’ɛ́nɛ́ mɛ́ gasi, ɓɛɛ ɛ́nɛ́ kpasa. ","Ɛ̀nɛ̀ dé wɔ yibere nɛ̀ duk nɛ̀ sa̧a̧-a̧, hee o be-zɔɗi ga; yibere'i nɛ́ wen ko Sɔ̧ nɛ̀ tɛ́ de h’ɛ́nɛ́ mɛ́ gasi, ɓɛɛ ɛ́nɛ́ kpasa. ","Kala velɛnjɛ nyi kezləmə zləmə yitea ŋ'wa ne, ɗe mə ŋ'wa nya mbe ghena ta Shala, ŋ'wa nya kegweɗətema geva yitea sa yɛ kezha kele le ba'a yitea ntsehe yɛ mbe mbele. ","Lag wee do weere kleere ma de biñ gi defay ga wo desaçy paçaç tin no, da wee waçaçre Baa dosen no lay, maga nday mo geçeç de äe, aà mo yaçaç wee go. "
1PE.2.3,"i ɓì mɛ ɓoɓti ki ghɛɛ̀ lɛ Kan à rɔɔtɛɛ, lɔŋ yɛ̀ɛ ki ri kì kànɛn.","Kɔ́ ı̵́  debtere  ka o̧ wɔgɔ, o̧: “Ví dəŋ ki to̧m ı̵́ 'yɛ́lı̵́ woo ho̧ sú̵'ú̵.”",Echî é rî sê mfá-mfá ó məŋe ên ekpak onobhá-eji Ńtâ Obhasi ó rî.,bi a pɑ gɑ pǒ zhwi'tə gɑ Cyəpɔ bɑ ě puŋ a.,Káàtà Mèèín á tànɨ ɨnè: «Nyí péé hȩ Kéké du nyɔ̧né.»,Weèe aè yá war ená Tata aè geèe yuu boèñboñ neè weèe.,Amu miyëm ya na Nti anë dzam mbëṅ. ,man kin tor pombi Bi Zhiklé ma.,"haɗaw ha ndzəkama Bay’ərlam ba, a tsəray na!",xeⁿ na aa mayuuꞌcheⁿ jnda̱ cwiqueⁿꞌyoꞌ cwenta na jeeⁿ ya cwiluiiñe nqueⁿ na matsa̱ꞌntjoom ꞌo.,"Nɛ́ dag Waar Yeesu dɔglɔ hɛmntigɔ dag be, nɛ́ mɛɛ gɔ a Waar bɔ gi Doo rɔbo.",Va ɗerewel məsvan annahə:,Dɛbter dòngəŋ wəi daŋ: Və́ kìilèro Gɛnbògə̀r puurɛ̀.,"Kàandə, kə̀ nɛɛ̀n aa Núúboòd Gìdń bàà rə kíin: «Bə́ŋyée íí bé' sɔ̀ɔ̀nkè Báátììkpɛ̀ŋ bə̀ yàá!»",na ɓa ki titimi pɗemni Epiɗ-ɗai ya ɗa.,"si ""vous avez goûté que le Seigneur est bon.""",If so be ye have tasted that the Lord is gracious.,La nigi jugo ŋaata vi Bum-Sumunawana.,"Nge mi tyeʼeya na, Nti a ne mvaé,","Ɓimutoho a ɓi na: «Bumbulvuŋ ndra i mezle, ki titilaka le.»",Ngam bana Deftere wi'i: “On metti mbooɗeeŋga Jawmiraawo .”,Ngam bana Deftere wi'i: “On metti mbooɗeeŋga Jawmiraawo .”,"Wen ɛ́nɛ́ wee Gasa Wan hee leeko ga, ɓɛɛ ɛ́nɛ́ iŋ‘e a̧ ɔ dee.","Wen ɛ́nɛ́ wee Gasa Wan hee leeko ga, ɓɛɛ ɛ́nɛ́ iŋ‘e a̧ ɔ dee.",Kwa nza ŋkɛ ma ke Ghena ta Shala: «Nahe yɛ kendɛamakɛ tsema tsema zeɗe nya mbe Nde sleke ŋkwa.»,Wersen aà go de yerge ga: Nday yañ de gus de el Wañkluu.
1PE.2.4,"Kɛ̀ɛna jàŋbog rì nyi, nyi ànɛ à rì gɔ̀g ì cem inɛ ɓum ɓɛ ɓengà, kìɓan kifog ì ɓa gɔ̀g ìnɛ Bɛ̀ll à ɓɔ̀ngà, yɛ̀ɛ ki rì gìn i com ɓi mis mii, ","I séé ya ı̵́ 'yɛ́lı̵́ Yesu woolı̵́. Wu̵ 'yɛgɛ zá̧a̧d nán ku̵u̵ ma gbɔ máa, a̧máa Tayɨɨ yee 'yɛ́gɛ hȩn gbo̧o̧ sú̵'ú̵. ","Nâ bhák ên mân mbâ Ńtâ Jisos Krayis. Yê nâ a ri isôk ekpin áfi mfi ngun á jíŋi sê chichi, kən Obhasi a sâŋ yê se a chîŋ ochíŋ. ","A gɔ cyə m̀ nə yɔ nə fʉ'tə nɑ gɔ bəŋ e, yʉ yə e bɑ gwɔ' yə a tə pfʉ́ a pɑ́, yə pɔmnəŋ lə wǎ', da' gɑ Si cwɔ' e, dəŋ dzə e,","Ŋgɨɨrénáam Kéké nó, ŋgə́ nò du hȩ sìn dúhéé du nànɨ mèè nɨ̀vɨ́tɨ̀b ya leehó̧kɨ́ gə́nȩ̀ȩ́, ɨ́dù Mèín ɨ́ cà àm ŋgə́ yi pə́ nyɔ̧né. ","Weèe ko'shi aègee Tata ce e yu luèr ce nteèe. Beèe a m maè' luèr ana, aè ba luèr ce Nyúè aè m ce, e luu ntaa neè ye seê. ","Zaan abë nyè, nnom akòg ya bod bëngawoa a fyè, Zamba nyè atòb nyè na anë ai mfi abui, ","Vaherda na va, ara a sam kwa nshèffè man ndohi ta kwola'a, man Zhiklè a nco a skwi mbela'a a sam di na. ","Da ma gurey kwar ka tsakay ma Yezu, ŋgwa na ta dey ana, na ndaw hay ma kəladama ba na, amana, Bay ma Bəla ka gaɗəma ba, hayaha bəza kakay. ","Joꞌ chii calaꞌcandyooꞌndyoꞌ jo nnom nqueⁿ na cwiluiiñê tsjo̱ꞌ na wandoꞌ, nqueⁿ na tjeiiꞌ nnꞌaⁿ cwenta na xocwilꞌueñê, sa̱a̱ tjeiꞌ Tyꞌo̱o̱tsꞌom jom na lꞌueñê ndoꞌ jnda ntyjii jom. ","Zaan a Waar Yeesu ge. Gii gi bet za̧a̧til yɔ dood hi bisige. Anyɔ Bɛt herig nɛko, wɛɛsig hin rɔb yɔ daarlɛlɛ. ","Məde zani, ndəni gərəm məs də zeŋgille, məs ɗii asgaŋ, amma Maŋgəlva awelike vi zəga na sləmayi diiɗa. ","Və́ sò'óribà Gɛ̀nbògə̀r Yeesu tuŋ, yòo vàal lagə́li. Yír gá mìn zù̧uro, Vannáb ní tə̀ ní duuŋ purì, yaa tìil vìru zɛ. ","Ìì gbarà Báátììkpɛ̀ŋ Yéésù səǹ íí kóólé. Oòrə, bəŋ gɔ̀ŋsə́ bə̀ aa nɛ́b bəd làà bə̀ lɛ́', bít Vɛnɛ́b sààvúŋà roó. Vɛnɛ́b ɛ̀g bé'ù kìínmbə̀ bəŋ pɛ̀sə́ bə̀ kíin. ","Hilisi sini, ni ahi-fuŋ na karni, na ɗai e biliŋ edi su, a na ɵa lai, amma aŋ gaini viri ɗaw, a zuva gara lai arni Alaw. ","Approchez-vous de lui, pierre vivante, rejetée des hommes, il est vrai, mais choisie et précieuse devant Dieu;","To whom coming, as unto a living stone, disallowed indeed of men, but chosen of God, and precious,","Nigiyay goboy talamu, namu mi hiɗiyn ma irina, ma sumun gum goyna, may vilekay goyo, jifiy ŋolo kaw vok ir Lawna. ","subaʼane nye bebé, veveakok, e di bôte be nga ben, ve de e nto ntoban, a édima e mise me Zambe.","Kirohoko ng'avu Buy Yesu, naŋ i ɗugur misi titiri, mizli mihizigaka avra na. Amma Buymisemuŋ, a winaŋ le, i ɗugur hirnga wãˀ. ","Ɓadite mo. O laati hayre yeere nde yimɓe meeriɗini, ammaa nde Allah suɓi ngam nde mari saman. ","Ɓadite mo. O laati hayre yeere nde yimɓe meeriɗini, ammaa nde Allah suɓi ngam nde mari saman. ","Ɛ̀nɛ̀ ɗɔ́ŋ píí katɛ a̧, wen a̧ nɛ́ kpasa ta wan nɛ̀ duk kpasa nɛ̀ o bíí pi̧i̧ so taŋ; nɛ́ Sɔ̧'ɔ̧ hoka a̧, ɓɛɛ a̧ duk nɛ́ gasamɔ nyɛmna yí Sɔ̧. ","Ɛ̀nɛ̀ ɗɔ́ŋ píí katɛ a̧, wen a̧ nɛ́ kpasa ta wan nɛ̀ duk kpasa nɛ̀ o bíí pi̧i̧ so taŋ; nɛ́ Sɔ̧'ɔ̧ hoka a̧, ɓɛɛ a̧ duk nɛ́ gasamɔ nyɛmna yí Sɔ̧. ","Hende nda mə geva ke Nde sleke ŋkwa, pelɛ nya nza mpi hwe, nya neghakɛ mbeli, ama nahe Shala kentave kaveyi kapelɛa nya nza zləvə te shɛ. ","Ya' wee see äay äiñ Wañkluu mbañ, huuli ma tenen maga jar tebere äo'n wo gom, Baa raw koge äe ga aà de ele, raw mañ ge äe. "
1PE.2.5,"fɔɔnnɛ mìni girig, fɛlɛ yɛ̀ɛ gɔ̀g yi yi ri cencem, ɓì rì ɓɛ̀toŋɛn lɛ ɓi ɓa mɛɛ mɛ ɓi Nghay, ɓì ɓa ǹɗaŋ wu ɓɛpìrɛɛtìrɛ̀ ɓɛ ɓɛ ri ɓɛ̀tɛnɛn ɓɛ ɓɛɛ̀ fùufunɛ̀n Bɛ̀ll ɓyom ɓi ɓi Nghay ɓi ɓi ri rɔɔ nyi, lɛ Yeesus Kiris. ","Ví á̧ḿ, ví mbaa kɔ́ ı̵́ 'yɛgɛ zá̧a̧d yigid Tayɨɨ woo ka yo̧o̧n lig Tayɨɨ woo wu̵lı̵́ máa wɔgɔ. Tée víń mbaa nán  hȩn  ha""ı̵́ Tayɨɨ woo vu̵, víń kɔ́ ba'ad ı̵́ yigid Tayɨɨ woo ka pú̵ ví, ı̵́ ka to̧o̧d Tayɨɨ yúú Yesu Krístu woolı̵́ máa. ","Nâ bhák ên noŋ isôk ekpin, Obhasi a kó ên a gbe ókʉ́rí Ntʉgantʉ owe. Ka ókʉ́rí mbí, ên o kí joé ên akará-agore Obhasi mba ekpin é ká fon akôp. O kí karé ên ekûp na ejík noŋ efin ejə́né nji Obhasi a kí ko ka mbiŋ i Jisos Krayis. ","tə ba wɔ yɔ́ dəŋdəŋ pa' mwɔ' tə pfʉ a, pu pəm wɔ, po pɑ pa' dyə zhwenyə, po pɑ cu'tə pɑ nuŋpwɔ', cu'tə dɔlɔ̌, nə pɑ nuŋpwɔ' Zhwenyə, pwɔ' pɑpúŋ bi Si shyə m̀ nə Yeso Kristo.","Ŋgɨɨrénáam, àm kùb a áɓwéhè nyí hȩ sìn dúhéé du ɓe mèè, óŋnɨ Dúú Mèèín ɓe kí. Yó ku, nyí ɓa dùnɨ kúùŋ nùb sarɨ́b du nànɨ satɨgà Nyéhè Mèèín ɗúré, satɨgà nyaŋ Mèín sumí ɓe ɨ́r Yésù Krístùù á. ","Wee weèe foñ yu aèmboè bluâr bteèe wa'a. Baná weèe ko'shi a yeâ geñ tá e bo loèr weèe baè'ri Ndap Nyúè yïû aè yú' aègho, tá weèe bo faè' mbo aèmboè ñgaâa tañshi tañshïì ce a yu brara, a ce tañshi btañshïì ce aè yú', ce vi yu byáánïì aè bsii Nyúè njo' yuu ce Jisos Kraâis aè m geèe. ","mina bëben, mbol minë bëvëvë mëkòg, boan na bëloṅ mina anë nda ya nsisim, asu yë na mivëṅan mfufub ayòṅ bëfada, mituni Zamba mëtunëṅa më nsisim ya ayëbë asu Yesus Kristus. ","Kinè ara kwahi nshèffè, man ta gi gi Mèzhèɓ Zhiklè a vna, kinè ndohi mvi skwi a Zhiklè nkezla'a, man ta zli skwi te Mèzhèɓ a Zhiklè, man te Yèsu Kristi ta ambaba Zhiklè. ","kuray ana na, andza ŋgwa ta dey ana hay, fuləkwam a me zley ma ’ay ma mesəfrey ana, ma da tərada səkway kokwoɗ ana, ma baba me key kuley ahiya, ma da kar kuley ta mezek, na ma dar 'ar a Bay ma Bəla ana, ta har ma Yezu Kriste. ","Ndoꞌ mati ꞌo, na cwiluiindyoꞌ ljo̱ꞌ na cwitaꞌndoꞌ, quiandyoꞌ na mawilꞌueeꞌñe Tyꞌo̱o̱tsꞌom ꞌo na cwiluiindyoꞌ watsꞌom yuu na mꞌaaⁿ Espíritu, cwiluiindyoꞌ cwii tmaaⁿꞌ ntyee na ljuꞌ nꞌom, na cantyja ꞌnaaⁿꞌ Jesucristo cwilaꞌtꞌmaaⁿꞌndyoꞌ Tyꞌo̱o̱tsꞌom, tsꞌiaaⁿ cantyja ꞌnaaⁿꞌ Espíritu na jeeⁿ cwijaaweeꞌ tsꞌoom.","Nɛɛ hɛw, ɔɔn Bɛt gi loon an bet za̧a̧tili gi wɔmnin lukɔ yɔ Mɔkilɔ gɔ gi waa gedu. Nɛ wɛɛsig maakwookɔya gaatɛ an nɛ gɔsig maak rɔb mɔkilyaadɛ wɔ hi bɛsig a Yeesu Kristu dɔŋgo. ","Məde, məkpaŋ gərəm madarokum, karka gəla nasuwa na Əmpəs Salala də munokum. Məppan Zezu Krestu amakrokum dəpsukum gən sembe nakpaŋ məs dəlvəŋge en salala, napsən zəga an dəslə sən Maŋgəlva. ","Və́ pɛ́m və́ kə̧mà̧ mú vàal lagə́ltò. Və́ sò'óribà Gɛ̀nbògə̀r tuŋ, kə yu̧u̧nəvə́bà lig ya Fú̧u̧ig əní kə kə̧ ti ní. Yeesu Kiristu kóbà və́ kə̧mà̧ dùgnáb há̧a̧ lig bee ri, və́ tò̧ pubà Vannáb símá̧a̧r də́əvɛ, kə pùu pu zɛ. ","Aí kɔ̀ íí tə́ kìínmbə̀ bəŋ gɔ̀ŋsə́ bə̀ bəd kíin; ìì dàà yíl íí boò wə̀ə̀ ii kə̀ Vɛnɛ́b wúl  * Gìdńná. Wál íí dá kuùm nɛ́b láŋsə́ bə̀ ma'ǹ  * gìdń bəd gə̀b aa bə̀ zíg bə̀, bɔ̀b boò pii sadaka  * Gìdń bəraa dá Vɛnɛ́b sɔɔ̀n, tù' bəraa Yéésù Krístù mà' rə bòórú roó. ","Tiki lai, maini ahi-fuŋ na karni nɵa, ki rgi siki amai, kapai ki zi aŋ dalam zi seze, aŋ paakai zi ɓaka na sɗik, kapai ki zi ɓaka zi seze, n’Alaw a daraŋ war Yesu Kristu. ","et, vous-mêmes comme des pierres vivantes, entrez dans la structure de l'édifice, pour former un temple spirituel, un sacerdoce saint, afin d'offrir des sacrifices spirituels, agréables à Dieu, par Jésus-Christ.","Ye also, as lively stones, are built up a spiritual house, an holy priesthood, to offer up spiritual sacrifices, acceptable to God by Jesus Christ.","Nigi nala kaw ki hiɗiyn ma irina nala, nigi ma wul kulo'o tam Tempella ma Ŋusta, kay nigi ma muɗ goy si sum sa li ɗifinna ma peldetna, ma kir Lawn ŋaa'a hay Kristu. ","Miabebien, aval ane bevevee mekok , nyiʼan e nlôñane nda Nsisim a too, a bo mfufube nsamba betuni, asu ya ve bityiʼa ya nsisim , bi Zambe a yene mvaé, amu Yésus Krist. Metunaʼa ya Nsisim a zene ya e be Yésus Krist.","Kumo kwana, kirohoko, kum i ɗugur misi titirihey, ɓa a ndiram ti kum hay ngi ˀUf Mipal, ɓa ki tiram mijiviɗey, ngi gaŋ mikuli maciraŋ hiri tisi Yesu Kristu. ","Onon boo bana kaa'e geete, laate mahruɗe haykaliiru Ruuhu Ceniiɗo. Laate liman'en senaaɓe haa lii'anon Allah kirseteeɗi pottananɗi mo barka Yeesu Almasiihu. ","Onon boo bana kaa'e geete, laate mahruɗe haykaliiru Ruuhu Ceniiɗo. Laate liman'en senaaɓe haa lii'anon Allah kirseteeɗi pottananɗi mo barka Yeesu Almasiihu. ","Ɛ́nɛ́ dúk hee ta nɛ̀ duk kpasa ga mbɛt, ha̧ Sɔ̧ mɛ́ kai'nɛ́ mbo nɛ̀ tua ko Sa̧a̧  Ɔmi . Ɛ́nɛ́ tɛ́ ya nɛ́ zuduk sa̧a̧ o wi-ɗafi-sɔ̧ nɛ̀ tɛ́ ha̧ mɔɔ-ɗafi-sɔ̧ wan mɛ́ ko Sa̧a̧  Ɔmi  nɛ̀ tɛ́ de tɛ́ Sɔ̧ nɛ̀ ɗoŋ Jesu Krist. ","Ɛ́nɛ́ dúk hee ta nɛ̀ duk kpasa ga mbɛt, ha̧ Sɔ̧ mɛ́ kai'nɛ́ mbo nɛ̀ tua ko Sa̧a̧  Ɔmi . Ɛ́nɛ́ tɛ́ ya nɛ́ zuduk sa̧a̧ o wi-ɗafi-sɔ̧ nɛ̀ tɛ́ ha̧ mɔɔ-ɗafi-sɔ̧ wan mɛ́ ko Sa̧a̧  Ɔmi  nɛ̀ tɛ́ de tɛ́ Sɔ̧ nɛ̀ ɗoŋ Jesu Krist. ","Hende nda mə geva kezha nza yɛ kala pelɛ nyi nza mpi hwe mbe ŋa ta ghɛa Sefəa Shala. Kezha nza yɛ kawəvəsəa ka dzeghe Shala nyi kaŋa Shala, kezha dzeghe nda melɛ kala nya ɗe Sefəa Shala, nyi ketenza zeɗehwe nda laka Yɛsə Kriste. ","Ya' wee see äay see äe, hay wee diñ huuli ma tenen, ma boo tiñ Baa no, maga nday mo kol go jar ma Baa sië jag ne hene, de haç faage sië jag ne hen de wore nen äe wer Yeso Krisi. "
1PE.2.6,"Lɛ ki ri kìkaliyɛn ɓi kaàtà lɛ: Ghɛɛna, ǹnɔ̀ŋzii gɔ̀g ìnɛ ɓi ǹtɔn à mɛɛ a Siyon, ì rì m̀ɓɔ̀nɛn, ì ki ɓa gìn i com, fɔɔnnɛ ŋwaànɛ à rì yɔ̀ ɓiì gherɛɛ, àa wog ɓi ǹtoòrìɗ.","I ki hȩn Tayɨɨ ka o̧  debtere  woolı̵́ má nɔ, o̧: “Mí yee 'yɛgɛ tóó 'yɛ́ kaa  Sió̧ŋŋı̵́ . Wu̵ 'yɛgɛ ndam, sɔ́g woo néé mba kɛb á̧ḿ. Nán a 'yɛ́ zó̧ó̧ woo woolı̵́ tée, sȩ́ḿ wú̵ń kɔ́nnɔ né sá̧ḿ.”","Echî aŋ? Obhasi a chorê se, “Ńgyê n kí ki isôk ekpin ifámé mfá ka Sayon mfi í kí fi njû amé. Ń saŋ yê. Ka ochî obhámé, yê nâ a chíŋi ochíŋ. Nne kpe nnyón nnyo á yuŋ ḿbə́ŋé a kî na yê á bhó ko éré.”","Nə pa' a bɑ nthʉ́m ŋwa'nyə gɑ: Yɔ, gɑ̌ wə jap gwɔ' phə pa' Sion gwɔ' shicǐ, gwɔ' mtʉɔdəŋ Mo yə ě yap tʉm tsyə́ nə é a, bɑ sǒ tə́ gɔ sɔ' kú é pɑ́.",Ɓetí káàtà Mèèín wáatɨ́ ɨnè: «Mɨ caá sìn dúhéé nyɔ̧ɔ̧́ mɨ ɓa lóŋnɨ sìn kɨ́ hȩ jù̧ú̧ Sìyôŋ á; nò əhɨ sìn kɨ́ yaà nɨ njɔ̧̀ lòm.»,"A sañ mbe Ñwaâ' Nyúè enáê, “Yu' neè, m ce láè luèr rbuu ndap aè rla' Sayoèn. AÈ co' máè luèr anaè, e boñ neè máè seê. Ñwáè ce e ka' byemi neè ye, aède' rïìtu yi ke koo ñgaèñ ka'.”","Asu te ntilan wadzo na: Yënë, mafudi akòg a Sion, akòg ya abug nda; Anë ntòban, atoa abui mfi; Ndò e mod ayi dò ṅyëbë aangasama ki.","Gar haha ta windo te Ƌèlèwèr Zhiklè: Na haha i tilda kwa mbela'a a Sion. Ndo man a cè nenga'a a ndav, a ngècè hori a di azɓai.","Hərway a ndzafama da Mewindey Kokwoɗ ana hay na, andza neney: nəkafama i pey ŋgwa ma mede da Siyoŋ, i ma wala, hayaha bəzakakay, arka ndaw ana ma pada 'ar aŋga ka ŋga na, a da pamar aha hwaray a dey kakay.","Ee naquiiꞌ ñꞌoomꞌ Tyꞌo̱o̱tsꞌom na teiljeii matsonaꞌ: Quiiꞌ tsjoom Sión maqua̱ⁿya cwii tsjo̱ꞌ na tseixmaⁿnaꞌ tsjo̱ꞌ nquii tsiaⁿtsjo̱ꞌ wꞌaa. Matso Tyꞌo̱o̱tsꞌom: Ja tjeiiꞌa jom cwentaya ndoꞌ jeeⁿ ndyaꞌ jnda cwiluiiñê; Meiⁿꞌñeeⁿcheⁿ tsꞌaⁿ na matseiyuꞌ ñꞌeⁿñê, tijoom xuee nntsꞌaanaꞌ na cweꞌ tsꞌiaaⁿꞌndyo na ñentyjaaꞌ tsꞌom jom.","Hinɔ gii hi bi̧i̧ a Bɛt ɗɛɛrwol du: a sɔ̧ɔ̧nɛ, be gbaak bet za a Siyona, bet gbɔɔl tɛŋkya yɔ be herige gi wɛɛ hin rɔb yɔ daarlɛlɛ. Za̧a̧nyɔ ɗɔbsige seem taag wa̧a̧k nɛ zaŋ.","Vaski bo va məverin adəv ɗerewel na Maŋgəlva. Məpprəma: Nəwelik gərəm na sləma, nəɗiyək ka gərəm məs təkzləmən mogon də gakdaka a Siyon. Ko naway dətafa wil adanən na ɓa.","Dɛbter daŋ: Və́ tə́bà, ŋtìil vìrdo vàal ya tàl kùn bòob ní. Ŋdàŋnəŋ yú̧u̧rì Sioŋ wàaltəŋ wəi. Yír ya pə́ dòrdo fú̧u̧ koo na̧a̧ ri ní sɛ́g dànə̀u kórì pai.","Kàandə, Vɛnɛ́b bàà Núúboòd Gìdńnú: «Sàà mə́ vúŋ bəŋ pɛ̀sə́ bìá, mááù zígǹ bə́ŋyée, kìínmbə̀ bəŋ yíl bə̀ kíin, Siyona bìlú; màn aa zíg tɛ́mì oò bərə, dàà sə́ə́mnúù gá.»","Buri aŋ war ɗû maini nɵa: ""Tili, aga mu tika war Siyon, ahi-fuŋ na koŋni dalam, na mu varaŋ edi, n’a juva gara lai, ni n’a yima li warni ɗa, siyer aga a yimaŋ duk kai zaŋ.""","Car il est dit dans l'Ecriture: ""Voici que je pose en Sion une pierre angulaire, choisie, précieuse, et celui qui met en elle sa confiance ne sera pas confondu.""","Wherefore also it is contained in the scripture, Behold, I lay in Sion a chief corner stone, elect, precious: and he that believeth on him shall not be confounded.","Kay hay ɗota dit di ala: Humgiya, nan tun hay Siyon hiɗiyn ma gef-ziyna, vilekay goyo, jifiy ŋolo, sa ma vi hay namu ma muɗ goy zuloɗi.","Amu da yené ntilan e mimfufube mintilan été na: tame yen, ma bôôn akoʼo ya jua e Siôn été, ntoban a édima, a nyô ase a telé ndi nleme jé e be nye, a ye bo te jôban.","Vur Ɓimutoho a ɓi na: «Ani, i ra ki ɗugur da mizli a Siyoŋ. I ɗugur muwuna le, yo mupuɗaw wãˀ. Mbur mitiɓa le na, anta sa pi mesem ta wãˀ.»","Ngam Deftere wi'i: “Mi jo'ini haa Siyona hayre talkumoore  suɓaande, marnde saman, koo moy nuɗɗini mo semtintaake .”","Ngam Deftere wi'i: “Mi jo'ini haa Siyona hayre talkumoore  suɓaande, marnde saman, koo moy nuɗɗini mo semtintaake .”","Wen Yɔramɔ tɔ̧ɔ̧ so'e nde: «Mi hoka ŋma ta nɛ̀ gɛnɛ-a ɔ ŋgaya ɓɛɛ mi e a̧ nɛ̀ ta-e-mgbii-tua kinii sɛn  Siɔŋ , hegɔ foe beka ba wi nɛ̀ e ta nɛ̀ a̧ na.»","Wen Yɔramɔ tɔ̧ɔ̧ so'e nde: «Mi hoka ŋma ta nɛ̀ gɛnɛ-a ɔ ŋgaya ɓɛɛ mi e a̧ nɛ̀ ta-e-mgbii-tua kinii sɛn  Siɔŋ , hegɔ foe beka ba wi nɛ̀ e ta nɛ̀ a̧ na.»","Kwa nza ŋkɛ ma ke Ghena ta Shala gezete: «Nahe 'ya kentave pelɛ nya nza zləvə te, nya teve 'ya kapelɛa megwekwe mbe Siyon. Katenza hawe te wəndə nya kedɛŋe geva te we.»","Werga aè go de yerge ga: Ndi mañ huuli ma de woren we, Ndi de äo'ge äe patala Siyoñ ma ëaw tiñ no. Je maga haç äil äe we ne hen, ree soçoçre da'n ge gaa so hase."
