livre.chapitre.verset,Bafia,Dii,Ejagham,Ghomala,Vute,Limbum,MKPAMAN_AMVOE_Ewondo,Mofa,Mofu_Gudur,Ngiemboon,Doyayo,Guidar,Peere_Nt&Psalms,Samba_Leko,Du_na_sdik_na_wiini_Alaw,Francais,Anglais,BIBALDA_TA_PELDETTA,Bulu,Guiziga,Fulfulde_Adamaoua,Fulfulde_DC,KALATA_KO_SC_Gbaya,KALATA_KO_DC_Gbaya,Kapsiki_DC,Tupurri
1PE.3.3,"Mɛ̀rɛ̀ŋ min mɛ̀ kɛɛ̀ ɓa mɛrɛ̀ŋ mɛ seeseèrɛ̀n ɓi dan; fɛlɛ yɛ̀ɛ tyòŋ ti ɓaghrɛn, tìcaka rì mɛkpèy mɛ ɓɛ kii rì gol, rì ǹwaà wu syeesyee, ","I mbɔ́g fó̧ó̧ moo nán u̵u̵ ho̧ bi ú sá, kɔ́ ı̵́ yúú zané ku̵u̵ təə máa vu̵ wɔgɔ, kan la' tɔ́g du̵u̵ vu̵, kan sa̧a̧m bó̧' vu̵ á̧ḿ. ","Deê ono obhə́né ó kâ jóe a ri mbi biji noŋ nnyʉ̂ eyimím se á yén oyén, na ḿbáŋé, na ḿfô biji nnyi nná.  ","Tsɔ́ tsə́ mkwiŋ kɑ pɑ̌ pɑ ywə yə pu jɔ a: nəŋthə́ ba' pǎ', tsə́dzə́ tʉɔ gɔl, kɑ nə kwa dzə ŋa' nɑ́ lə. ","Nyààŋ nyínè nɨ kɨ́ kùb pə́ laŋtɨ̧né dùr; hȩ bɨ́rèé ŋgwé nyàŋgáá, nɨ́ɨ́b lééb nyàŋgáá du ɓe gôl lɨ, dùgɨ̀ júúb kàtɨ́b nyàŋgáá. ","Le rboèñ li fa loè ba efa btu ce weèe ce ba', ba bsa', ba bcáè' ce weèe ce suèsi nyor aègho tá beèe a bo yá naè ka'. ","Të enyiṅ dzaan yabò hë e nyanga yayene a nsëṅ: afen esil, abòd minsanga mi mvòt ai abòd biyie; ","Kin tül va kinè man a deɓa genè ɓai, a skwi da'ai guro, a ncèffè gèƋ, a maslaka mbela'a. ","Tek me ləmey vaw kwar hay ka kam na ta bəla dada zlay: 'ar ma tərɗa ha, tek ma wuiya ma gura, ta zana mambay ana hay tsa zlay; ","Juu na cwilatycwiꞌndyoꞌ cantyja ꞌnaⁿꞌyoꞌ tilꞌaꞌyoꞌ cweꞌ ñequio ꞌnaⁿ na cwiwitquiooꞌ chaꞌna cwilaꞌtycwiꞌyoꞌ soonqueⁿꞌyoꞌ, ꞌnaⁿ na tuiinaꞌ ñequio sꞌom cajaⁿ oo liaa na jeeⁿ chjoom. ","Bɔnɛ mɔk an nɛ wɛɛn hinyɔ gi kuuha gii bɛti hi zul haŋki, hi wɔd za wɔ hi gɔn hɛɛlmɔto nɛ hek a muulɛ an kɔ̧ɔ̧tigi hi gbandil bɛti. ","Kədaw kayaŋ wəzaɓan zukum mogon klapaka ɓa, də wətroɗ kikum dit zigeɗ naza sləmokum, zigeɗ na meleŋge dit lukutɗe na sləma, məs məbay sit gawla məs deleɗ net tuwãh ɓa, ","Və́ à̧a̧ símá̧a̧r və́ní fú̧u̧ nə́ŋnì ri pai, mú yúl gú̧u̧rì, ɛn tógna̧ kaŋgertò dórdì, vəŋ làa dúurə̀mtò tárì. ","Ìì sàà si' íí kudǹmbə̀, bɔ̀b oò sɔ̀ɔ̀n kíìn, kə̀ yíl gí' kùlə́ bə̀ bəd teènmbìá, kə̀ kɛ̀ɛ́ŋ ba' nwuukè bə̀ páànmbìá, sínkɔ̀ gɔ̀' sɔ̀ɔ̀nkè bəd vəə̀nmbə̀ sí. ","A zuva ɓa gan na wiiki a juva anene war amur-si kadai kai, maini ayir zi tirɗi zaw wazagai zi gan zi or zaw sapa na juvai nɵa kai. ","Que votre parure ne soit pas celle du dehors: les cheveux tressés avec art, les ornements d'or ou l'ajustement des habits;","Whose adorning let it not be that outward adorning of plaiting the hair, and of wearing of gold, or of putting on of apparel;","Hin ganta vigi li goy jiy tuwgiɗi, hiɗi ɗuŋus ma koti jifiynɗi, jaɓna ma hiɗi oraɗi, sligar ma wilenɗi kaw, ","Nyanga jenan, é boʼo te bo nyô ya atan. Mfenan ési, metabe, bimvônga, bikat bi or, mengômesan me ne tañ anen. ","Anja ɗiya vu kumo, a gi i ɗiya vu ngi vra ta, kaɓa slupa hirnga, ci gwat ngi wuya ngi ɓiri tapasl tapaslay malla juwa zana ngi slimiɗey ta. ",Taa ŋarol mon iwa haa ko gite ngi'ata waato moorɗi caɗɗi malla pawne kaŋŋeeri malla ɓornuce booɗɗe . ,Taa ŋarol mon iwa haa ko gite ngi'ata waato moorɗi caɗɗi malla pawne kaŋŋeeri malla ɓornuce booɗɗe . ,"Ká ɗafa-tɛ k’ɛ́nɛ́ dúk nɛ́ wan mɛ́ zan, tɛ̀ kara-zu, aa kana-lɔr in aa gba de laa na.  ","Ká ɗafa-tɛ k’ɛ́nɛ́ dúk nɛ́ wan mɛ́ zan, tɛ̀ kara-zu, aa kana-lɔr in aa gba de laa na.  ","Zelema yɛ kanza kendeɗe ndeɗe ŋayɛ kwa ntsə, laka ndere shintia ghə nyi dzawe dzawe, wəshi kepesa geva mze kwa tere tere keɗema lekwesa nyi nza zləvə te hɛ ma. ","Grag ge ma de der ge riñ ti äay wo de heer ge klelew boore, de lagge oçoçbe ma de wore debañ wo ma grag see äay go nen faale la tawan, kië wee diñ sen koë wa. "
1PE.3.4,"kìɓan kifog ǹɗɛ̀ŋ wu ɓì ghɛɛ̀sɛɛ kìɓaà rì wɔ wu ri wu wu ri wù nyamɛn ɓi nɗem, wɛɛ ri ǹɗɛ̀ŋ wu wu yin lɛ wu ɗyoŋ, lɛ wu ri ǹɗɛ̀ŋ wu nghay wu wu ri lɛ tɛ̀tɛ̀rɛ̀ɛ̀, wɔ tì lɛ fyòoog, rìkuu ɗìn ɗyɛɛ ri gìn i com ɓi mis mɛ Bɛ̀ll. ","A̧máa zó̧ó̧ víílí i mbaa nán to̧o̧, kan zó̧ó̧ ká̧'a̧dɨ, moo hȩn woo vu̵ lı̵́n né, wu̵ hȩn gbo̧o̧ tíŋ́ Tayɨɨ woolı̵́ á̧ḿ. ","Ono obhə́né, deê ó dʉ̂ ka ḿbə́ŋé. Ono ntʉ́ghi mbi ó bhó kot áfírí, ó bhó kot nchot, ó bhó kpo fə́ne ayép. Nâ ntʉ́ghi ono mbi Obhasi á korá na ḿbə́ŋé-a-ḿbə́ŋé. ","A tsɔ́ tsə́ mkwiŋ pɑ ywə yə a bɑ ǎ tʉmnyə̀ nthʉm tʉm po, bɑ tsə́dzə́ tsyə a tə bì a pɑ́, bɑ zhwenyə byanyə, zhwenyə hwítə̀, tsə́dzə́ tsya a bɑ á ghə dəŋ gwyə́ dzə̌ Si a. ","Ɗú nɨ́ nyààŋ nyínè dù kɨ́ fó̧ɓa sumíì á, nyààŋ du ɓáàŋnɨ ɓáŋhîn ɗàwáá, nyààŋ ɗɨ́m kerɨ́nne duɓa ɓe dɨmɨɨr Mèèín tíí. ","Le rboèñ li ba ba enjep ntee, ba neè rbornïì-ñwáè, ba neè rfúteè enjep ntee. Njáèá rboèñ ca li ke kwe ncoèo ka', a boñ aè bsii Nyúè seê. ","Nyanga dzaan ebòò e dzom esòlò a nnëm, abëṅ-nnëm ya landaman ki, evovoe nsisim; e mod anë ai mfi abui a mis më Zamba. ","Aman a woy va kinè ntila t'hwaƋa'a, a skwi te ndav man a géƌèshè azɓai, a mèzhèɓ nlüɓekwa'a, a gumai. Nasa skwi mbia'a a sam di Zhiklè.","ama ka key na, me ləmey vaw hayna ma kəzla ha da mevel ana, tek ma wuiya na me ŋgəsey kakay ana, da me dzeley 'ar ləfeɗeɗe na, da zozoy ana, na andza tsekeley ana ɗuhwa ha ka slam dey ma Bay ma Bəla ana na, ŋga ha. ","ꞌO calaxmaⁿꞌyoꞌ na tycwiꞌndyoꞌ naquiiꞌ nꞌomꞌyoꞌ, na juu na neiⁿncooꞌndyoꞌ xocantycwiinaꞌ, na nleitquiooꞌ joꞌ laxmaⁿꞌyoꞌ quia na ya nnꞌaⁿndyoꞌ meiⁿ titseiꞌndaaꞌnaꞌ ꞌo ljoꞌ na cwitjomꞌyoꞌ. ",Yɛrɛ bɛtig nɛ yɛgi fu̧u̧z a nɛ kpoos du. Gig bɛtig rɔb yɔ gɔ ha̧tir gɛ. Raakɔ a nɛ wɛɛ dood zulhɔnikyaadɛ hi kpoos saŋktyaadɛ. Hinbɔ lab gii gi hinɗɔbt yɔ daarlɛl a Bɛt muutdu.,"amma say mogon nokum dəsan amakrokum, də maɗulokum mogoni, məs agrak ɓa nan zəga na sləmay aba Maŋgəlva. ","Duur və́ní gá və́ duubà símá̧a̧r di. Símá̧a̧r və́ní bù̧u̧bà, kà̧a̧bà, duur ya kùn míi wəi, yòo ɛn nánì Vannáb nə́n ni. ","Zá aa dá sɔɔ̀n də, sɔ̀ɔ̀nkè aí bə̀ oò vúgà tɛ́m ba, kìínmbə̀ nwul ɔ̀gkeá, bít kə̀ nwul tɛbə̀ bə̀ kíin. Aarə sɔ̀ɔ̀nkè aa dá kuùm zèd kə̀ zèd doó. Aarə tə́ kə̀ pɛ̀sə́ naà gbàákù Vɛnɛ́b númú. ","Amma aga a za ɗa a gan n’amlai warɗi agul, na wiini ɗif n’amlai, a wala zi gan na ɓilka edi kai, na wiini seze zi hangal, zi ɵeɗ, hanɗa a wala n’a tala pɗem gara wuzani arni Alaw. ","mais, parez l'homme caché du cœur, par la pureté incorruptible d'un esprit doux et paisible: telle est la vraie richesse devant Dieu.","But let it be the hidden man of the heart, in that which is not corruptible, even the ornament of a meek and quiet spirit, which is in the sight of God of great price.","May jifiyta vigiya ma li kalaf hay dikgiya, jifiyta ta ɓulakɗita hiɗi dikga ta ŋali hiɗi kiliŋi, kayni mi va ma jifiy ŋolo vok ir Lawna. ","Ve nyanga jenan é boʼo nyô ya nlem nje é solô. Ngômesan é ne te ja ntuk, e nyô ya Nsisim ô ne évôvoé a mvoʼé , e nje é ne tañ anen e mise me Zambe. ","Amma anja ɗiya vu kumo, i ɗiya vu ngi huroˀo, ɗiya vu mahiryi ta wãˀ, misi ti lesl misetette, zuy zuy, i ɗiya vu mupuɗaw haɗa a mihiri ngi Buymisemuŋ. ","Ndikka ŋarol mooɗon iwa diga nder ɓerɗe mooɗon, waato gikku ɗelemŋgu, de'iiŋgu. Kanjum woni pawne ɗe njinnataa, ɗum mari saman masin haa yeeso Allah. ","Ndikka ŋarol mooɗon iwa diga nder ɓerɗe mooɗon, waato gikku ɗelemŋgu, de'iiŋgu. Kanjum woni pawne ɗe njinnataa, ɗum mari saman masin haa yeeso Allah. ","Ɗafa-tɛ k’ɛ́nɛ́ a̧ dúk nɛ́ wan nɛ̀ duk nɛ̀ hu̧sa̧-a̧ kɔ̧ see'nɛ́; nɛ́ ɗafa-tɛ nɛ̀ beka mbɔr na, wan mɛ́ ga̧a̧-see in mɔka-see nɛ̀ duk nɛ́ gasamɔ yí Sɔ̧. ","Ɗafa-tɛ k’ɛ́nɛ́ a̧ dúk nɛ́ wan nɛ̀ duk nɛ̀ hu̧sa̧-a̧ kɔ̧ see'nɛ́; nɛ́ ɗafa-tɛ nɛ̀ beka mbɔr na, wan mɛ́ ga̧a̧-see in mɔka-see nɛ̀ duk nɛ́ gasamɔ yí Sɔ̧. ","Ama zele mə ndeɗe nya kwa wənə, wənə nya kagwedə ba'a nya gweɗakwe ɓetəkə. Nya ya kandeɗe nya nza zləvə te kwa kema ta Shala, kaza sebe te ndeɗea shɛ we. ","Ama wore äay mo hay diñ nen äil äay, mo hay diñ wore maga taw go gaa, de ëiggi ma desaçy tulus, mo hay diñ desaçyn maga nen Baa de ele. "
1PE.3.5,"Fɔlɔɔ nnɛ ɓɛ̀gherɛ̀n ɓɛ ɓɛ̀yiɓ ɓɛ abɛ̀y, ɓɛ dyàɓɛn yaà ì ɓaghà yɛ̀ɛ Bɛ̀ll ɓɛ nti ɓɛ rɛŋɗàg, lɛ ɓɛ nti ɓɛ wokì ɓɛ̀yii ɓaa; ","Wakȩ́ȩ́ zó̧ó̧ 'yɛ́lı̵́ ká tíŋ́ ku̵u̵ baa 'yɛ́ zó̧ó̧ voo Tayɨɨ woolı̵́ máa, vu̵ baa kɔ́ ı̵́ yo̧go̧ du̵u̵lı̵́ na'a; vu̵ kid wə̧ə̧ voo vu̵ tɔ́g á̧ḿ. ","Nâ ekpak akáé ka éməné mba á yúŋi ḿbə́ŋé á kî na Obhasi, á tóŋe ano ábho, á káre biji mbâ arûm ábho. ","Yəŋ bɑ nthi mkwiŋ pa' pɑjwǐ dɔlɔ̌ pyə wap lə mɔktə Si, bɑ ju'nyə mthə́ pap a lə ŋkwiŋ a: ",U̧ á nɨ̀gub jɨ̧ɨ̧́ ɓwâ yi tíí yi səŋkom gíí ɓe Mèín ndɨ́ yi túumkom bɨ́ nyààŋ ŋgábè ɓe jə̧̀ə̧́ ŋgáb ya jəŋkom bɨ́ ŋgwásɨ̀b ŋgábè. ,"A njáèá njïì ce bbyeèñge brara eluâuñgoèñ ce a m láè map mmir mbenduè Nyúè, a m ce duèñshi lap rboèñ. Woweèe a m ce yu'ni neè bduu wap. ","Nala ngò mimfufub mi bininga ya mifidigi Zamba mikarëga bò nyanga okoba, bëbòò bëyom mëwog, ","Gar haha ngwozihi man a civèƋ Zhiklè ta tül va ta hala'a, ta zhor Zhiklè te ndav, a ta fí gèƋ a ma baki ta. ","Ŋgwas a hay zlezle kokwoɗ ahiya, ma pəmawa 'ar ka Bay ma Bəla, a tsənəmatərawa sləmay a zel ata hay, a ləməma vaw na andza ha: ","Ee yolcu na tyomꞌaⁿ na tandyo xuee na tyoluiindye na ljuꞌ nꞌom, maluaaꞌ tyolaꞌxmaⁿna, tyocantyjaaꞌ nꞌomna Tyꞌo̱o̱tsꞌom ndoꞌ tyotueeꞌndyecjena nda̱a̱ sꞌaana. ","Amntɔnɔ, nɛɛd gaatɛ wɔ hi gbaa mɔkilya̧ a Bɛt ge, hi gbaa kɔ̧ɔ̧tig a kpoos du anbɔ be, hi wɛɛ hi tiis zulya̧ a walya̧ dɔŋdi be. ","Vaski bo daga far lahəŋka gil en salala akpaŋganənək zit mogoni, aɗiyənək an məs adaw gaŋ pak aka Maŋgəlva, apprəmənək met zilŋgiti. ","Ka̧a̧tò ya bal və díŋ símá̧a̧r Vannáb fú̧u̧ ri ní, və kóŋ duur ɛn vəní gurɛ̀, bal və bù̧u̧ŋ pu wóo. ","Kə̀ aakíin, nɛ́b kɛ́ɛ̀m  * gìdń bəraa nyàamdoorú, bə̀ zíg tɛ́m boò Vɛnɛ́b naà rə, bə̀ bí' taà yíl boò bəd sɔ̀ɔ̀nkèá, bə̀ ləə vɔ̀ɔ̀m boò bərá. ","Falakai na sɗik na ɗipar n’e biyi tini Alaw ɗa, e zizini siɗi maini hanɗa nɵa, e gidi piɗi maɵagaiɗi. ","C'est ainsi qu'autrefois se paraient les saintes femmes qui espéraient en Dieu, étant soumises à leurs maris.","For after this manner in the old time the holy women also, who trusted in God, adorned themselves, being in subjection unto their own husbands:","Boyn sa peldetna sa ɓa-ɓana sa zam bam Lawna gan-tuwta visi ay ki kayni nala kaw, nisi hot yisi gaa kuɗ jufaysiya, ","Avale te mimfufup mi binga mi nga too Zambe ndi e melu mvus, mi nga jaé, a nsuane bebiene si e be beyôm. ","Naŋ kine, ngwas misi zleˀehey mazluwunam ti Buymisemuŋ na, a njaham hiri le ar Buymisemuŋ ti hina hirnga a mbuŋ zil taŋhaya. ","Bana nii rewɓe senaaɓe ɓooyma laatiniri ko'e maɓɓe ɓe ŋarniiɓe, ɓe njo'ini tammunde maɓɓe haa Allah, ɓe leestaniiɓe worɓe maɓɓe. ","Bana nii rewɓe senaaɓe ɓooyma laatiniri ko'e maɓɓe ɓe ŋarniiɓe, ɓe njo'ini tammunde maɓɓe haa Allah, ɓe leestaniiɓe worɓe maɓɓe. ","O okoo nɛ̀ yuu so Sɔ̧ nɛti ɓeemɛ, e nɛ̀ ta nɛ̀ a̧, ɗafa so tɛ̀ hee mɔ‘i ga, mbo nɛ̀ zu ha̧ o wíì kɔ‘i. ","O okoo nɛ̀ yuu so Sɔ̧ nɛti ɓeemɛ, e nɛ̀ ta nɛ̀ a̧, ɗafa so tɛ̀ hee mɔ‘i ga, mbo nɛ̀ zu ha̧ o wíì kɔ‘i. ",Tsetse se mi nyi kevate ghə te Shala vəashi kapesa geva. Nahe hɛ kehawete nda hawe ke zhilia nci. ,"Diñ dosen, naare maga hay wo le seege ti faage Baa bay ëag äaa, ga hay wo de kañ ëiggi äaara ti Baa, hay wo joñ see äaara de wore, diñ de hoorge sug ti werpiiri äaara wo. "
1PE.3.6,"fɔlɔɔ nnɛ Sara àa nti à wokì Abiraham à ki regi nyi lɛ kan wìì. Sara ànɛn nnɛ ɓì ti dòò yii, di ɓi kìki kirɔɔ kɛ̀ ɓi càrɛn lɛ com kidɛŋ kɛɛ niŋzi mìni nyòò.","Sára ká kid Ibrahí̧í̧ma tɔ́g ı̵́ yo̧go̧, beewu̵ “ı̵́ 'yɛ́lı̵́ míí;” 'ya̧'a̧ yɛ i kɔ́ hȩn du̵u̵ɨ, i gbɔ hȩn fíginí tóó a mban ví kɛb né tée, ví sı̵́ waa Sára woo vu̵ yu̵.","Sara a fonê ntʉ́ghi ekpin njí. Á bhiŋá ndûm owe Abraham se, “Ńsé.” Mfá-mfá, ên ó chəbhe ên abhon í Sara ájoé o kí yimâ ên ono, efup ó ka fon ên na arûm abhə́né.",Dəŋdəŋ pa' Sara a. E lə ju'nyə Abraham bɑ ŋkhe é gɑ Cyəpɔ e; pǒ bɑ pǒ cu' po Abraham pyə pɑjwǐ nə cwə yə pǒ gə nwə pɑpuŋ tə pwɔk sɔmywə a.,"U̧ á Sárà yi jəŋkom Àbɨ̀ràhâm, ŋgə́ a ɓéce ŋgə́ «Kéké», ɗàrò nyí munɨ́b Sárà kíì á, ɓè nyí du ndɨ̀ŋnɨ mîn, nyí a dùcè óknɨ vùù ɗàà ɓwâ kùb mwa̧a̧na nyí íhé.","Sáèra ye ye aè m ce yu'ni neè Abraèhaêm, a ce yoèñ ye ená yïì masaè. Weèe yu boo vi ce weèe aè ka' ce geèe ñgeâe boèñboñ, ke' ce wáp yuu mo' ka'. ","anë Sara angabò Abraham mëwog, aloege nyè na 'Nti'; minë bòn boe ngë miabò mbëṅ tègè mbara na dzom ziṅ yasii mina.","Ara Sara man a fu gèƋ a ma Abraham, a baba na Bi ga. Kinè antanta dalahi nenga'a, aman kin gi skwi man amba, a kin gi zlau azɓai. ","andza ma Sara ma tsənar sləmay a Abraham, a zəla na Ŋgalaka ɗaw, kuray a neney ma təram dem aŋga hiya da hahaya kwar me key ana, kwa mandzara zluwer ma tek ka həɓakwar 'ar. ","Maluaaꞌ tyotseixmaⁿ Sara. Tyotseicanda̱a̱ꞌñê nnom Abraham, ndoꞌ tsoom nnom saaⁿꞌaⁿ Ta.","Mɔkin Saratu dɔglɔ yɔ kɛms Abraham tɔnɛ wɛɛ elig a ɗɛntyɔ. Nɛ gi wook rɔb kol gi tuun hinza gɛ, nɛ wɛɛ Saratu wāāt ma. ","Məɗumon wənat Saratu, təpprəmək ma zilit Abraham, yaŋ təya na Ɗəfdaya nawa. Nokum bo kirtət Saratu kənanaŋ kakaŋka, an munokum tatəɗɗaŋ mogoni, məza əgeslne sən zəga maɓɓan ɓa.","Sara bal kə̧ŋ gurɛ̀, bu̧u̧ŋ pu wóo Abrahami, ká̧ŋnu daŋ yírbògə̀r bəna̧. Yakai tò və́ lùrdo dúulɛ̀, və́ tò̧ dùgdo ɛn dúurì ní, və́ yòo Sara varə́m.","Saratu kɔ̀ mà' kàani, ləə váàn oò Abraham kúnú, bít dɛ̀rə̀ «nɛ̀ná.» Bə́ŋyée, aí kɔ̀ íí Saratu yɛb kɛ́ɛ̀m bərá, dáà íí mà' sɔ̀ɔ̀nkè yàá, də́dǹ mà' ii kə̀ in nə́ŋ̀má síngə́ roó.","Maiɗi Sara te gada pini Abraham, te yikaŋ lai ɓa epingezaɗi, won hlai na ki zi pɗem, ki bindi aŋ aliɗi na falakai, ki hini hunai ktai maa a turliki amai kai.","Ainsi Sara obéissait à Abraham, le traitant de Seigneur; et vous êtes devenues ses filles, si vous faites le bien sans craindre aucune menace.","Even as Sara obeyed Abraham, calling him lord: whose daughters ye are, as long as ye do well, and are not afraid with any amazement.","Ki Sara hum kuɗ Abraham nala, na' yum ala mulanna kaw, wulini nigi muɗi si gurona va'a, la nigi li sle ma ŋaana, la nigi muɗ nari kay va noŋɗi kaw.","Aval ane Sara, nye a nga ve Abraham mewôk a loone nye na, Masa. Mi ne bone bé éyoñe mia bo mvaé a te koone woñ éziñ e minlem été.","Kaɓa Sara micina mi da Abraham, a zilaŋ «buy ɗu.» Da ki ra gam gwat mezle, yo da kum anta pulaka ɓa zluwun a gukum ngaˀa neˀ ta na, naɓa ki tiram ziri naŋ mongosohoy le.","Saraatu waɗi ɗum, o ɗowtani Ibrahiima, o ewni mo jaagorɗo maako. On laati ɓikkoy maako hannde to on mbaɗi mbooɗeeŋga, to on kulaay koo ɗume .","Saraatu waɗi ɗum, o ɗowtani Ibrahiima, o ewni mo jaagorɗo maako. On laati ɓikkoy maako hannde to on mbaɗi mbooɗeeŋga, to on kulaay koo ɗume .","Héé Sara mboo só zu ha̧ Abraham ɓɛɛ sa a̧‘e, gasa wan kɔ̧-a̧ ga, ɛ́nɛ́ kifa dúk nɛ́ o boko-bem kɔ̧-a̧ kinii wen zu dee demɔ, in k’ɛ̀nɛ̀ nɛ́ ee ha̧ kíí ŋma mɔ mɛ́ de'nɛ́ na.","Héé Sara mboo só zu ha̧ Abraham ɓɛɛ sa a̧‘e, gasa wan kɔ̧-a̧ ga, ɛ́nɛ́ kifa dúk nɛ́ o boko-bem kɔ̧-a̧ kinii wen zu dee demɔ, in k’ɛ̀nɛ̀ nɛ́ ee ha̧ kíí ŋma mɔ mɛ́ de'nɛ́ na.","Tsetse se Sara kahawe va Abraham, laka heka ŋkɛ kande sleke ŋkɛ. Nahe yɛ kenza kaŋwalea kwɛa nta fate fate kenza yɛ kamene ganyɛ, kaɗema kasərə mehele ta ŋayɛ kadake va kwete wəsə.","Do Sara, aà yaçaç jag Abraham, ëen ga: Wañ äi no. Hayga nday yañ joñge diñ de ele, nday bay men see äay joñ heçeçne ti mopo wa has lay no, ni nday patala diñ mayre äe."
1PE.3.7,"Fɔlɔɔ nnɛ mìni ɓɛ̀baŋì, ɓì ghɛɛ̀sɛɛ girig lɛ mum bimiɗ a ghɛɓ rì giɓ wiì, à yi lɛ ɓɛ̀yiɓ ɓɛ ri ɓumɓɛ ɓɛ yin ɗi ìtèɗ yɛ̀ɛ ɓɛ̀baŋì; terina ɓɔ rì nyaasɛ̀n lɛ ɓɛ ghɛɛ̀sɛɛ girig kìterì mààgh à cɛɓ bas ɗì mìni, di fɔlɔɔ nnɛ com kidɛŋ kɛ̀ kɛɛ̀ gheŋɗɛn ɓi bɔ̀ŋzɛ̀n yìn.","Ví á̧ḿ, wayée vu̵, i mbaa kan kȩ́ȩ́ víí vu̵ tée, i taa mbaalı̵́ voo ka née né yȩ, i na' vu̵ ú̵, moo víń sú̵g nuŋ hȩn Tayɨɨ a pú̵ ví leená yȩ á̧ḿ, wu̵ vágád káákáá yȩ nɔ. I kɔ́ ı̵́ yo̧go̧, moo hȩn tóó a há' Tayɨɨ moo víí vu̵ kilí sá.","Ên arûm eróŋ, ó məŋe ên sê akáé abhə́né á ká son noŋ ên. Ka obhô mbí, deê ó jóe ên na ábho ka ekpak í Jisos Krayis a wóme, o jighá ên ábho. Echî aŋ? Ábho á kí fon fə́ne ekpin ótúm-ótúm noŋ ên. Deê o yimá ên ekpak ekpin njí kən é jóe sê kpe nne a kí goré Obhasi, ejûm kpe jə́t é bhó gbʉi yê.","Ba wɔ mthə́ pɑjwǐ, po a pɑjwǐ pɔ nə pə̌mtə vɔk, po pɑ ŋkhamtə gɑ pɑjwǐ pɔ́ bɑ pɔ̀ bwa pwǎ; po pɑ́ bvɔk nə msə̀m bəŋ pú nə pa' po a pú nə gɔ sɔ' pəmtə́ kwi gho' vɔk pa' mcʉ́' a, po' o gɑ́ sɔmywə kɑ fa'tə mcwyɛ'nyə mɔ.","Nyí ɓwêcé, ŋgwásɨ̀b, dunáam ɓe gub nyínè, ɨ́dù nyí a ɗə̀ŋhȩ̀ ɨnayâna nɨ̀gwi nɨ nò kùb ɗə̧ə̧́ ɗə̧né á. Jəŋnáam ŋgáb, ɓetí nyər mèè Mèín du nyí nànɨ rɨ, ɗú nyíne ŋgáb kwàɓáà nyər kɨ́ cúk á. Ndɨŋnáam u̧ àm nɨ́m kù tɨ̀ jábɨ nyí mɨ̀yú̧ nyínè noò.","Bduu foñ a ba cu a wap bbyeèñge weèe neè bfee-ñwáè. Woweèe a ba rïìñ ená bbyeèñge a yu yap bwáèni, yu'ni neè woweèe. Woweèe a ba geèe wa'a njobeè' woweèe bsïìp a be koni ryoèñ ce nfeseè ce li loè ese Nyúè njo' yi ntee boèñboñ. Woweèe a ba geèe wa'a faè dïì' yuu mo' yi bo jepsi lap rloo ka'.","Fam fë dzam dëda; nyiṅan a nda alug evovoe, mivaa mininga olugu anë e nyòl enë ntëgan abui, amu mina bësë mibëlë ngab-elig, na maa enyiṅ ngogëlan dzan eza kanga a zen.","Lèmèlèmè kinè bakihai, vanza a sam ta a maya maya. Vaslebarde ta ngwozihi a géƋ man wuƋi va azɓi genè ka ɓai, aman a géƋ man ngwozihi ba ta ndohi n'ndi pombi a nshèffè. Aranta skwi a slaha a ngéƌèshè ntsi ri kinè azɓai.","Kuray zel ana hay, andza ha atsa, ndzama mendzey kwar ana ka masləta ha na na, hayna sərafəmata ka bəle ma vaw ma ŋgwas a kwar hay; ɗəmatar ndaw a vaw, hərway ka da zəmama hahaya me mendzey na, kamasləta ha, ma aza tek ka da tsada metsembeɗ ta ma ɗula mey kwar zlay.","Ndoꞌ mati ꞌo naⁿnom na mꞌaⁿ lcuuꞌyoꞌ, cꞌoomꞌya nꞌomꞌyoꞌ cantyja ꞌnaaⁿna, calaꞌtꞌmaaⁿꞌndyoꞌ joona na ticweꞌntyjo̱ na jnda̱na chaꞌna ꞌo, sa̱a̱ mati ncꞌe juu naya na matseixmaⁿ Tyꞌo̱o̱tsꞌom na ñecwii xjeⁿ mañequiaaⁿ na laxmaⁿna na ticantycwii na cwitaꞌndoꞌna chaꞌxjeⁿ ꞌo. Luaaꞌ calꞌaꞌyoꞌ cha tintseicuꞌnaꞌ na nñeeⁿ ñꞌoom na cwitaⁿꞌyoꞌ nnoom.","Gbunɔ, nɛɛ walɛ wɛ, ɗɔɔtin rɔbtɔnɔ hi nɛɛd nɛ. Mɛɛn a nɛɛd tɛŋkya̧ rı̄ı̄tin hi tɛŋk nɛnɛ gɛ, ɗɔbsinɛhi. Ya̧a̧nɛ, hii be, Bɛt rɔ̀bsihi gaahi za̧a̧tig hi nɛɛ lɛlgbunu, ɗɔbsinɛhi an bɔ hinza gi ans zɔ̧k nɛ gbɔnɔ tuurikɔ a Bɛt ge.","Nokum munokum zel bo, məsoŋ dit gil nokum də wəsinit na tahəŋ də sembe va nokum ɓa, məgekdeketi, vi net bo Maŋgəlva wapsit əkoho, va apsukum, Məgəɗ vaska vi wəzuli nokum adattap ɓa.","Yì̧gə́rɛ̀, və́ pɛ́m guvɛ, ka̧a̧ yòo yír bù̧u̧lə̀ŋnábò, və́ŋ kə̧nəmà̧ kə̧sàŋ dúurì. Və́ lùb vìrvəbà, gàm və́ gàaro yo̧ŋkì ya Vannáb pə́və́ kòmvɛ ní yò, pə́ŋ yíbka̧a̧ pɛ́m. Və́ tò̧mà̧ mú wəi, ɛn də́ə kə bìgtivə́ Vannáb tə̀mə̀r bàanu pai.","Íí nɛ́b vɔ̀ɔ̀m bəd kɔ̀, ìì gàb in aa kɛ́ɛ̀m íí bəd í' rə kúnú. Ìì kìì bə̀ nwɔŋ kúnú, kàandə, bə̀ kə̀ kpɛŋsɛ́l naà, kə̀ aí kíin sé. Ìì mà' kàani, bɔ̀b boò kɔ̀ boò bɔ̀b in tɛdńní bə̀ gɔ̀ŋsə́ bə̀ aa Vɛnɛ́b pii roó. Ìì mà' kàani, bɔ̀b Vɛnɛ́b oò kè' nyɛmsɛ́l íí kúnú.","Maɵagai, tiki nɵa lai, ki simni gaini hangal, gaiɗi falakaiki war ɵeŋ n’arbaɗi marki, ki yimiɗi falakaiki maini wala na gdaŋni abai gara kai nɵa, ki kuliɗi midiɗi amai, buri ɓa nagai lai, e mili bulum zi suŋfa gaiki; kapai wala ktai a ɗala siiwaki kai.","Vous de votre côté, maris, conduisez-vous avec sagesse à l'égard de vos femmes, comme avec des êtres plus faibles, les traitant avec honneur, puisqu'elles sont avec vous héritières de la grâce qui donne la vie; afin que rien n'arrête vos prières.","Likewise, ye husbands, dwell with them according to knowledge, giving honour unto the wife, as unto the weaker vessel, and as being heirs together of the grace of life; that your prayers be not hindered.","Nala kaw nigi jufayna, lakgi ŋali hiɗi boyna vigiya, ki doway ma to bay lopna nala, nigi ma slisi yisi kulo'o, kay nisi kaw tapay yaw vocota vi slugota vi irita hiɗi nigiya, kay va fi tel sidawta vigiɗi.","Avale te fe beyôm, nyiñane benyo beyal, mi yeme na be ne bitétéa bi ne atek. Semaʼane be, amu be ne benyoñe ngab ényiñe ya mvam mia be be. Nde jam éziñ da ye bo te ndeñele mia meyeʼelane menan.","Kum ziley kwana, kanah ya, cifam ati ngwas kumoyo ti wulka kpak ngi vu taŋ hĩhĩy na, ɗuvaka taŋ hirnga, asi taŋ kwana, siifa ngi set, Buymisemuŋ masa vula na, sey a lumam jom ati kum aya. Gam kanah ɓa gwat matika diradibiɗ kum anta.","Onon worɓe boo: Njooɗode bee rewɓe mon, paamotire. Anndite no semmbe maɓɓe yottaaki semmbe mooɗon. Teddine ɓe, ngam kamɓe boo ɓe keɓan hawtaade bee mooɗon ngeendam caahu. Mbaɗe ɗum ngam taa koo ɗume haɗa do'aaje mooɗon .","Onon worɓe boo: Njooɗode bee rewɓe mon, paamotire. Anndite no semmbe maɓɓe yottaaki semmbe mooɗon. Teddine ɓe, ngam kamɓe boo ɓe keɓan hawtaade bee mooɗon ngeendam caahu. Mbaɗe ɗum ngam taa koo ɗume haɗa do'aaje mooɗon .","Kale-a mbɛt, wiwii, ɛ̀nɛ̀ dúk nɛ̀ de-a in o kóò k’ɛ́nɛ́ wen ɛ́nɛ́ iŋa'e okoo nɛ́ bú-kpánà; ɛ̀nɛ̀ tú̧ tɛ-wa, wen wa tɛ́ kpa duka-kpasa nɛ̀ mɔɔ-oi in'nɛ̀ɛ́ mbɛt; ɛ̀nɛ̀ dé hegɔ wen ká ŋma mɔ tɛ́ɛ̀ dor'nɛ́ tɛ̀ kɔfa-sɔ̧ k’ɛ́nɛ́.","Kale-a mbɛt, wiwii, ɛ̀nɛ̀ dúk nɛ̀ de-a in o kóò k’ɛ́nɛ́ wen ɛ́nɛ́ iŋa'e okoo nɛ́ bú-kpánà; ɛ̀nɛ̀ tú̧ tɛ-wa, wen wa tɛ́ kpa duka-kpasa nɛ̀ mɔɔ-oi in'nɛ̀ɛ́ mbɛt; ɛ̀nɛ̀ dé hegɔ wen ká ŋma mɔ tɛ́ɛ̀ dor'nɛ́ tɛ̀ kɔfa-sɔ̧ k’ɛ́nɛ́.","Tsagha shɛnyɛ gɛ zhili, newe mə ghweme te mia ŋayɛ laka nza jikə. Ɗepete mə kaka dewə ŋeli mi. Hawe mə va hɛ, kwa nza ŋkɛ hweŋkwa ya va hɛ kezha kemave mpi nya kaganda nya kese va Shala kala gheyɛ. Mene mə kala nya, yitea ɗema kwete wəsə kafɛa yɛ səkwə ta ŋayɛ.","Nday werpiirin lay, lag wee de naare äay wo de el de kañ ëiggi ti äaara ga aà wo diñ jar maga eegre äaara bay debañ wa, hoor wee sug ti äaara, werga Baa wo ge go fer wee ge tenen de kaçaçra äuy lay. Joñ wee dosen maga ree po mo dig tos ge äayn go wa."
