livre.chapitre.verset,Bafia,Dii,Ejagham,Ghomala,Vute,Limbum,MKPAMAN_AMVOE_Ewondo,Mofa,Mofu_Gudur,Ngiemboon,Doyayo,Guidar,Peere_Nt&Psalms,Samba_Leko,Du_na_sdik_na_wiini_Alaw,Francais,Anglais,BIBALDA_TA_PELDETTA,Bulu,Guiziga,Fulfulde_Adamaoua,Fulfulde_DC,KALATA_KO_SC_Gbaya,KALATA_KO_DC_Gbaya,Kapsiki_DC,Tupurri
1PE.1.1,"Mɛ̀ Pyɛɛri ànɛ ǹɗì ǹkɛ̀nì-fìtom a Yeesus Kiris, ǹkànì ɓumɓɛ Bɛ̀ll à ɓɔ̀ngà, ɓɛ ɓɛ ri a gwèɗ, ɓɔ ɓɛ̀sààtakɛn ɓi ɓìlànà ɓi zi ɓi lɛ rì Pɔŋ, rì Galasi, rì Kapados, rì Azii, rì Bitinii. ","Mí Piɛ́rru̵,  waa  ba'ad Yesu Krístu woo nɔ. Míi ba'ad ví ɗerwəl yɛ, nán Tayɨɨ ka yee ví, kíí mbaa gááná hág Pó̧ŋŋı̵́, kan hág Galáddı̵́ kan hág Kapadósdı̵́ kan hág Aazíilí kan hág Bitiníilí̧ yȩ víw. ","A ri mme, Pita, ka ḿgbán i Jisos Krayis nâ n séŋe nwet nnyí bəre ń túm mbâ eyəné. Ên a ri ane mba Obhasi a sáŋe, ó chəbhe ajéné ka ngun. Ó nyane ên ka ngûm noŋ ane á bée enok, ó kət ên ka ebhat í Pontus na Garasiya na Kapadosiya na Esiya na Bitiniya. ","Myə Pɛtrɔ, gɛ nthəm Yeso Kristo bi mcǐ pɔ pyə wap shwə mtsʉ'mtsʉ' bɑ Ponto, po pyə wap Galata, ba m Kapadokia, ba m Azia, ba m Bitinya, ","Mɨ Piyéèr,  nò  tómé Yésù Krístùù, mɨ ɨ́ tɨin káàtà rè ru. Mɨ tɨinna nùb Mèín yi caré á. Nyí nùb kùb ya juhó̧kɨ́ ti̧í̧, nyí ɨ́ gì dùtèènɨ ɗɔ̀ɔ́b Póòŋ, ɗɔ̀ɔ́b Gàlàtíì, ɗɔ̀ɔ́b Kàpàdóòs, ɗɔ̀ɔ́b Àsíì ɓe ɗɔ̀ɔ́b Bìtìníì no rɨ. ","Ñwaè' ca ce sañ máâ Pitaè ce m yu ñwáè ntuu Jisos Kraêis. M ce sañ neè beèe Nyúè ce a da'se a ba bkïìloè aè ñgoâñ Pontuès, ba Gaèláshaè, ba Kaèpaèdosïìyaè, ba Áshaè ker ba Bïìtinïìyaè. ","Petrus, man apostel Yesus Kristus, matil bëlodo bë zen ya bënë ntòban, a bënë a Efulu Mëyòṅ a Pontus a Kapadosia, a Azia ai a Bitinia; ","Pierre, ndo sak Yèsu Kristi, a sam ndohi Zhiklè man ta ksar ta a kokwar Ponte, Galatie, Cappadoce, Asie, Bithynie, ","Yah Piyer maslaŋ ma Yezu Kriste, i windukuraɓa a ndaw ma gaɗəma na hay, ma pa mey ahiya da 'ar bəla na hay: da Pont, da Galasi, da Kapados, da Azi ta Bitini. ","Maja Pedro na cwiluiindyo̱ apóstol, tsꞌaⁿ na majñom Jesucristo tsꞌiaaⁿ ꞌnaaⁿꞌaⁿ matseiljeiya ñꞌoomwaa na matseicwano̱ⁿya juunaꞌ nda̱a̱ꞌ ꞌo na jnda̱ tꞌoomꞌndyoꞌ, na mꞌaⁿꞌyoꞌ lꞌo̱ndaa Ponto, Galacia, Capadocia, Asia ñꞌeⁿ Bitinia, ","Mii Piyɛr Yeesu Kristu tɔmsɔya, mii bi̧i̧ ɗɛɛrwol yɛrɛ. Mi yaasig dood wɔ hi gi rɔ̀bɛ hi hɛks hi gi a Pɔntus, a Galatiya, a Kapadokiya, a Aaziya, hi a Bitiniya waal du. ","Letərəŋka, Piyer məs dəsan masləŋ na Zezu Krestu desləna, azet ɗii məs Maŋgəlva aweli, məs dətrayaŋ aket dəlvəŋge, a Pontus, a Galatiya, də Kappadokiya gəm Asiya də Bitiniya. ","Míi Piɛri, Yeesu Kiristu tòmtóo, ŋdì̧i̧nà pu dɛrwàl ai və́i yíbtò ya Vannáb tìil vìr ní. Və́ yá̧m dólé yír ɛ́g di, də́ətò yòo Pontu ɛ́g di, də́ətò yòo Galati ɛ́g di, də́ətò Kapadog ɛ́g di, bòobtò də́ə Asi ɛ́g di vəŋ Bitini ri. ","Núúboòraa vúgà máá mə́ Piyɛr,  * Yéésù Krístù gbantumsə̀ naú. Núúboòraa mə́ tə́ bádǹ yée, Vɛnɛ́b nɛ́b aa sààvúŋà, bə̀ kùm kìínmbə̀ sɛ̀ɛ́n bəd kíin, bə̀ saàl bəd Pontus yɛ́b ba, Galatiya yɛ́b ba, Kapadosiya yɛ́b ba, Aziya yɛ́b ba, bít kə̀ Bitiniya yɛ́b bərə bìá. ","Peter, apostel na wiini Yesu Kristu, siɗi zi viri n’edi n’e ɗa aŋ zak, -war Pontus, war Galatia, war Kapadokia, war Asiya, war Bitiniya lai. ","PIERRE apôtre de Jésus-Christ, aux élus, étrangers et dispersés dans le Pont, la Galatie, la Cappadoce, l'Asie et la Bithynie,","Peter, an apostle of Jesus Christ, to the strangers scattered throughout Pontus, Galatia, Cappadocia, Asia, and Bithynia,","Peter, apostolla vi Yesu Kristu, tam sa vilekay-goyna, sa meray goy pulu hay Pontus, hay Galatiya, hay Kapadokiya, hay Asiya, hay Bitiniya kaw, ","Ma Pierre, nlômane Yésus Krist, ma tili mintobane mi bôt mi too ane beyeñ, mmialan e mefôla ya Poñ, Galati, Kapadôs, Azi, a Bitinie. ","I ya Piyer, mislin ngi Yesu Kristu, matuhukum ɗerewol hana da kum mizli, Buymisemuŋ muwunukum, kum micifam i mulakay, mizliɗam hirnga pal pal angi hirwuy Poŋ, Galat, Kapados, Azi waɗ angi hirwuy Bitini. ","Min Simon Piyer, nelaaɗo Yeesu Almasiihu, mi ɗon winndana on, onon suɓaaɓe Allah, laatiiɓe jananɓe saŋkitiiɓe haa lesɗe Pontus e Galaatiya e Kappadosiya e Asiya e Bitiniya. ","Min Simon Piyer, nelaaɗo Yeesu Almasiihu, mi ɗon winndana on, onon suɓaaɓe Allah, laatiiɓe jananɓe saŋkitiiɓe haa lesɗe Pontus e Galaatiya e Kappadosiya e Asiya e Bitiniya. ","Nɛ́ mi Pierre, betom ko Jesu Krist a̧ tom kalata’ɛ ha̧ o bíí nɛ̀ Sɔ̧ hoka nɛ̀ pɛsa si nú Pɔnt, Galatii, Kapados, Azii in Bitinii, ɓɛɛ nɛ̀ ya hi̧i̧ hee o gɛnɛ ga. ","Nɛ́ mi Pierre, betom ko Jesu Krist a̧ tom kalata’ɛ ha̧ o bíí nɛ̀ Sɔ̧ hoka nɛ̀ pɛsa si nú Pɔnt, Galatii, Kapados, Azii in Bitinii, ɓɛɛ nɛ̀ ya hi̧i̧ hee o gɛnɛ ga. ","Se va Piyɛre, nde ghwene ta Yɛsə Kriste, ke mbeli nyi tsehave Shala, nyi kepesleyi geva dzeyi mbe yɛ sla ta hɛɗia Poŋe, mbe Galasi, mbe Kapadose, mbe Azi ba'a mbe Bitini. ","Waçaçre sen mokay yer diñ ndi Piyere, je maga Yeso Kris de äo' mege sië waçaçre ne jar mono, ndi haçn wo ne jar maga Baa hoo ra gom, aà wo de lagge wo go äi sir ma haçaç haçaç wo, do dañgay won no, wo de dus gi wo ti prog Poñ wo de Galad wo de Kapados, wo de Asi wo de Bitini. "
1PE.1.2,"Ɓì ɓaghà ɓɛ̀ɓɔ̀nɛn lɔŋ yɛ̀ɛ Bɛ̀ll Seŋi a lokà kìwòŋzii ɓiɓan, fɔɔnnɛ ɓì ti ɓɛ̀tɛnɛ̀n lɛ Nghay wìì, lɛ ɓi ɓa rì mɛ̀wog ɓi ɓɛg ànɛ yɛ̀ɛ Yeesus Kiris ɓì ki ɓa ɓɛtɛɛ̀ziyɛn ɓi bwaɓ yii yi yi kpagà. Geesɛ̀n, rì fyòoog ɓyɛɛ teghɛn a lɔ̀ŋkin lɛɛ̀gwey.","Ba'á Tayɨɨ yee ví kɔ́ ı̵́ ká mbɔ́g tíŋ́ máa wɔgɔ, tii ví sı̵́ nán woo vu̵ kan yigid woo ú̵, moo i kid bi tɔ́ggɨ, bi tɛ ví kan mɛm Yesu Krístu woo nɔ á̧ḿ. Tayɨɨ a kɔ́d ví zó̧ó̧ nán ɓu̵u̵lı̵́ na'a, a 'yɛ́ ví i mbaa ká̧'a̧dɨ.","Obhasi Ńsé nâ a sáŋe ên ka ejûm nji yê a wóme kən a yîm ên. A sáŋe ên se ka ikom Ebhare Ntʉgantʉ owe, ó ka kpó fon ekpin akôp. A sáŋe ên fə́ne se ó yúk ên Jisos Krayis, a su ên na agyʉ́ŋ amê. Deê Obhasi a tóŋé ên chénchén onobhá-eji obhê, a karé fə́ne chénchén enare.","bɑ shwə pa' mghʉɔ, bɑ wap sa mtsʉ'mtsʉ' bɑ pu lě shi wɔ shyə m pa' Si Tá lə la' jap a, shyə m̀ nə pa' Zhwenyə dɔnyə wɔ, gə gɑ́ po pɑ́ ju'nyə Yeso Kristo, tə mcyə myə zhwɔ' wɔ. A gho' ba hwitə sɔ' nə́ po kwa' vəŋ e!","Càá kùb yi ca nyí kɨ́ á ɗóhîn ɓe ɓwáár Mèín nò du Táà yi ɓwáíkɨ́yaye tíí, nyí ókce nɨ́ ɓe ŋgə́ á, ɓe nyòm Nyéhè noò, àm nyí jə̀ŋ Yésù Krístù, nyí a kwà tɨ́ɨ́r ɓe cwá ŋgə́ ya kú hȩ satɨgà rè á. Mɨ yóóŋ Mèín ŋgə́ nàɓà nyí faám ɓe ju ɗóóŋ.","Nyúè Taèr aè m rïìñ weèe wáá, a ka' ce weèe, yi yú' yi gee weèe aè ba brara, tá weèe bo yu'ni neè Jisos Kraêis, tá Nyúè ñwañshi weèe neè bláá Jisoès. M ce loo máná Nyúè túr ntee boèñboñ neè weèe seê, ker gee tá weèe cu neè rfúteè-ñwáè boèñboñ seê.",Bënë ntòban a etilga Zamba esya abë Mfufub Nsisim asu mëwog ai asu mmiaman mëki me Yesus Kristus. Maa ai mvoè ebòò abë mina etitib.,"man Zhiklè, Bab nga, a mpar ta ara man a hur hala'a te Mèzhèɓ nenga'a, a ta, pi ndav a nenga'a, ta pana a pombaz Yèsu Kristi. Zhiklè da va kinè pombai a gumi kumba!","Ma gaɗəmaya andza na ma Bay ma Bəla Baba me wuɗey ka key andza ha na, ta har ma Mesəfrey Kokwoɗ ana, ma təradata kokwoɗ ahiya, ma ka tsənamar sləmay a Yezu Kriste, ma aza ka da ndzafam mambaz aŋga, ka da pəradata, hayna hahaya ma  Bay'ərlam  ta zozoy ŋga, ka safukurawa haɗadzidzay.",nda̱a̱ꞌ ꞌo na jaachꞌee xuee tjeiiꞌñe Tsotya̱a̱ya Tyꞌo̱o̱tsꞌom ꞌo na laxmaⁿꞌyoꞌ cwentaaⁿꞌaⁿ chaꞌxjeⁿ na seijndaaꞌñê. Cantyja ꞌnaaⁿꞌ Espíritu Santo tqueⁿño̱o̱ⁿ ꞌo na nlaxmaⁿꞌyoꞌ na calacanda̱ꞌyoꞌ jo noom ndoꞌ na nlaxmaⁿꞌyoꞌ na ljuꞌ nꞌomꞌyoꞌ ñequio nioomꞌ Jesucristo. Quiaa Tyꞌo̱o̱tsꞌom na canda̱a̱ꞌya nntoꞌñoomꞌyoꞌ naya na matseixmaaⁿ ñequio na tjaa ñomtiuu cꞌomꞌyoꞌ jo nnoom.,"Baa Bɛt yɔ mɛɛhin sɛw gi dorɔ, herin hi Mɔkilɔ yɔ wɛɛnin dood ɔnɛ an nɛ kɛms Yeesu Kristu tɔnɛ, gii be gi wɛɛ gi gaas kpoos nɛ hi ga̧a̧mɔ. An Bɛt gɛmsilɔ hi boolumi hi gisin tɔɔko tɔɔko.","Kəkpaŋgaŋgək muwelkum vi wənna əŋgla na Maŋgəlva Affən. Əmpəs nan aɗukumko kəsoŋ gən məzəsbanən Zezu Krestu, vi mbel nan dəskoɓ kumən gəni. Mbəlembəle də zam dənzlər sukum.","Vannáb Bàa bənəní sáb laalé nə́n ni, tìil vìrvə́ zɛ. Fú̧u̧ig əní kóró və kə̧no yír əna̧ kə və́ kìi pubà Yeesu Kiristui, mim əní kə sòg dì̧i̧rvə́bà. Vannáb úr ɛ̀m dùg pə́və́bà puur əní, à̧a̧ ta pə́və́bà kà̧a̧bò.","Báá Vɛnɛ́b sààvúŋ iiyà kìínmbə̀ nɛɛ̀n aa í' rú rə kíin. Nwul oò bí' iiyì  * gìdńná, bɔ̀b ìì ləə Yéésù Krístù ra, bít bɔ̀b nyɛ̀lə́m oò, oò nyɛ́' ii kúnú. Vɛnɛ́b oò mà' ii pə̀dkè gbà'á, bít oò pii ii tɛbə̀ gbà'á.","N'Alaw Api a yikiɗisi li, wuzani hlai par, war zi-n’edi aŋ sɗik na wiini Seze, burini ɵinini-gat, gaini yimini fel na wiini Yesu Kristu. A zuva ɓa yum gaini ɵeɗ a sa siki abai a suwa.","choisis  selon la prescience de Dieu le Père, par la sanctification de l'Esprit, pour obéir à la foi et pour avoir part à l'aspersion du sang de Jésus-Christ: à vous grâce et paix de plus en plus.","Elect according to the foreknowledge of God the Father, through sanctification of the Spirit, unto obedience and sprinkling of the blood of Jesus Christ: Grace unto you, and peace, be multiplied.","nisi sa vilekay goyo kuɗ wida vokomta vi Lawna Bumna, kuɗ lita-peldetta vi Ŋusta, tam hum-vunda kuɗ Kristu Yesu, kuɗ busuwna valamu ma porayawa. Slugota hiɗi toyta li tigi ŋol lige.","Mintoban a e feʼe Zambe Esaa, a ntelan étyi ya Nsisime na, be wôʼô Yésus Krist a nyoñe ngabe ya mmiamane metyi mé. Mvam a mvoʼé bi boʼo e be mia abui abui.","Cine ndra Buymisemuŋ muwunukum kaɓa naŋ miɗiya jiviɗ naŋ zleˀe si na, tisi ˀUf Mipal, ɓa ki cinaka mi da Yesu Kristu, yo ɓa pumbus naŋ a bunukum. Anja Buymisemuŋ a gukum mezle, a vulukum zuy haɗa haɗa.","On laati suɓaaɓe ngam Allah Baabiraawo muuyi ɗum diga ɓooyma. Ruuhu maako seni on, haa on ɗowtano Yeesu Almasiihu, haa ƴiiƴam maako laɓɓina on. Mo'ere e salaaman ɗuuɗana on!","On laati suɓaaɓe ngam Allah Baabiraawo muuyi ɗum diga ɓooyma. Ruuhu maako seni on, haa on ɗowtano Yeesu Almasiihu, haa ƴiiƴam maako laɓɓina on. Mo'ere e salaaman ɗuuɗana on!","Ɛ́nɛ́ nɛ́ o bíí nɛ̀ Sɔ̧ Dáà hoka, nyɛm nɛ̀ ɗoŋ ee-zu-mɔ kɔ̧-a̧, nɛ̀ Sa̧a̧  Ɔmi  dee ha̧ war-tɛ‘nɛ́ mɛ́ sa̧ h’ɛ́nɛ́ mɛ́ mbo zu ha̧ Jesu Krist, in ha̧ tɔk tɛ-a mɛ́ fɔr'nɛ́ nɛ̀ sa̧a̧-a̧. Ɛ̀nɛ̀ kpá deemɔ nɛ̀ ta-tɛ in ga̧a̧mɔ nɛ̀ dɔka-a.","Ɛ́nɛ́ nɛ́ o bíí nɛ̀ Sɔ̧ Dáà hoka, nyɛm nɛ̀ ɗoŋ ee-zu-mɔ kɔ̧-a̧, nɛ̀ Sa̧a̧  Ɔmi  dee ha̧ war-tɛ‘nɛ́ mɛ́ sa̧ h’ɛ́nɛ́ mɛ́ mbo zu ha̧ Jesu Krist, in ha̧ tɔk tɛ-a mɛ́ fɔr'nɛ́ nɛ̀ sa̧a̧-a̧. Ɛ̀nɛ̀ kpá deemɔ nɛ̀ ta-tɛ in ga̧a̧mɔ nɛ̀ dɔka-a.","Shala Yita nde tsehave ŋayɛ kala nya zəzəte ŋkɛ kezha nza yɛ kaŋa ŋkɛ, kezha nza yɛ kambeli nyi keveyi geva tekeleke kaŋa ŋkɛ se laka Sefəa ŋkɛ, kezha yɛ nda fete yɛ ke Yɛsə Kriste ba'a kezha zhɛre ŋayɛ mimia ŋkɛ nya keshekeyi geva wɛŋe. Pa zlaɓa ta Shala le kwelɛŋea ŋkɛ nza le gheyɛ kwele kwele.","Baa Pan naa hoo nday le go tañgu pel bol do dage äe, nday diñ ma äe, Nenterse ma bay ëage de ëoä naa maga naa mo yaçaç jag Yeso Kris, maga ci äen mo yog naa go. Daga Baa mo woo nday mo haç jam ne nday debañ debañ."
1PE.1.3,"Rìkem ɗyɛɛ ɓa rì Bɛ̀ll à Seŋi Kan wìs Yeesus Kiris; ɓi coo kipuɓì ǹɗem kii, à faghà ɓìsi cɛɓ ki nyɔn yɛ̀ɛ à ghèmzìghày Yeesus Kiris a ɓìloŋ; fɔlɔɔ a fa ɓìsi dyàɓɛn inɛ ì rì cem rì ǹtyweeyi, ","Ba na' ví Tayɨɨ, Ba' ı̵́ 'yɛ́lı̵́ baa ví Yesu Krístu woo. Wu̵ ha̧a̧ ba ví 'maŋná kan zó̧ó̧ nán gbo̧o̧ woo yȩ, moo aa mbaa ví zá̧a̧d kɔ́ ı̵́ ka nim Yesu Krístu nɔmmé yȩ wɔgɔ á̧ḿ. ","Deê é káre ejík mbâ Obhasi Ńsé, Ńsé Ntûfâm owəré Jisos Krayis. Ka ekpatə́m nsôn eye, a káre êt ekpin efê nji a yimî Jisos a nyə́me ka ekʉ̂. Ńji é yim êt é məŋe sê yê nâ a fonê êt. ","Byanyə nə Si, Tá Cyəpɔ yɔk pɑ Yeso Kristo: A cyə m̀ nə cɔ̌mmtso e ghə pu piŋ dzə wɔk pɑ m nə mɔktə yə a gə mo vɔk a shyə m̀ nə́ nə yam nə vʉ̌ Yeso Kristo. ","Nɨ́m ŋgə̀mná Mèín, ŋgə́ nò du Tá Yésù Krístù nò du Kéké nɨ́mè! Ɓe nyàŋnjɔ̧̀ kàm ŋgéé, ŋgə́ naá nɨ́m mè heé ɓe sə̀mèé ŋgə́ səəmcuhó̧ Yésù Krístù mvókín nɨ̀kwíbí rè, kí á na nɨ́m gíí du yə̀ŋniì ru. ",__Error__,"Ngaṅ ai Zamba esya Nti waan Yesus Kristus ya angabò na, a ṅyian abui ngòl die, midugan byali a vëvëë afidi ai akui-lë sòṅ Yesus Kristus a bëkon, ","Susai a Zhiklè, Bab Bi nga Yèsu Kristi, man nga su te va, man a yeka nga macecèwa'a a nshèffè te nslambaƋkaƋ Yèsu Kristi auda te ndev ndohi m'metsa'a; te nzhèrè te ndav, ","Hayna ma sambəra Bay ma Bəla Baba ma Bay’ərlam a lakwa Yezu Kriste, da ndaw aŋga ma kar da vaw bəza kakay ana na, ka yadandukurawa ba mekelehe, ta ma mbəlawa ma Yezu Kriste da walaŋ ma ndaw ma mətsa na hay, ma lakwa ka ndzafakwa me pey dey na me vəley mendzey ana, ",Catseitꞌmaaⁿꞌñenaꞌ nquii Tyꞌo̱o̱tsꞌom na cwiluiiñê Tsotye Ta Jesucristo cwentaaya. Jom ncꞌe na jeeⁿ wiꞌ tsꞌoom jaa jnda̱ sꞌaaⁿ na cwiluiindyo̱xco̱o̱ ncꞌe na tandoꞌxco Jesucristo. Cantyja ꞌnaaⁿꞌ joꞌ mꞌaaⁿya na cwicantyjaaꞌ nꞌo̱o̱ⁿya na nndaaya na nntando̱o̱ꞌa. ,Yɛwɛ baan Bɛt yɔ gi Waar wɛ Yeesu Kristu Bɛtɔ hi Baatɔ! Anyɔ mɛɛsɛ ya̧a̧r gbɔɔltɔnɔ gi gaawɛ za̧a̧tig sego hi Yeesu Kristu rɛmtigɔ bɔ a wɔrkɛ teesdu an wɛ gbaak mɔkil wɛ a wɛ dag za̧a̧tig faa. ,"Məgəɗ sən soko sən Maŋgəlva, Affən Ɗəfdaya nam Zezu Krestu. Aɗɗak mogon nan azəmə, apsəmək zeŋgille meleketeni, vi asil gən Zezu Krestu sətəki əmta asan madarani. Aknahək makram də zəga nawga an də goŋga. ","Bəŋ lùbnəmà̧ Vannábò, Gɛ̀nbògə̀r bənəní Yeesu Kiristu túnú. Kó ta pə́bənəno dúurì, pə́bənəno yo̧ŋkì pumi, vəŋ Yeesu Kiristu ya sì̧i̧b vool li yò. Wəi kó ri bəŋ sábgənəŋ sí̧i̧tírì bə̀ri. ","  * Báà káŋ̀ Vɛnɛ́b, Báátììkpɛ̀ŋ Yéésù Krístù Bóò ra! Ɛ̀g bé' bə́n búúd tə́ gbàákù, pii bə́n gɔ̀ŋsə́ puuá, kə̀ díímke Yéésù Krístù bə̀ valú. Bə́ŋyée nyí' bə́n tɛ́m tə́ kə̀ tɛ́m zígke aa vàd bə gá roó, ","Kol sini Alaw, Epini Epiɗ-ɗaimu Yesu Kristu, na pin yumni n’abai, a wuumu hehe pra, war ɵiyi-n’amai na wiini Yesu Kristu arbaɗi zi mri par, kapai mu nuvumu biyi na pin ɵeɗ, ","Béni soit Dieu, le Père de Notre Seigneur Jésus-Christ, qui selon sa grande miséricorde nous a régénérés par la résurrection de Jésus-Christ d'entre les morts pour une vivante espérance;","Blessed be the God and Father of our Lord Jesus Christ, which according to his abundant mercy hath begotten us again unto a lively hope by the resurrection of Jesus Christ from the dead,","gi-deɓta tam Lawna bum Bum-Sumuna vaya, Yesu Kristu, nam ma kuɗ lamanda valam ta ŋolda vuɗaya wuli lo, hay dayta-kulota vi Yesu Kristu jar sa mitina pa, kuɗ cubta-sle'ta ta mus iriya, ","Zambe a boʼo ébotan, Esaa Nti wongan Yésus Krist. Amu e beta mvam wé été, a nga bo bia na, bi beta bialé a bi vevea ndi nlem , amu ñwômane Yésus Krist e miñwuane na, ","Hunumukum Buymisemuŋ, Cine ngi Buy ndra Yesu Kristu. Ar pura ˀircece naŋ mihaɗi na, a ya ndra le sar mucuw naŋ ma ti naŋ mislikiɗa Yesu Kristu ti wuzla mumucahay na, ɓa njaha hiri ndra ar gwat mezlehey, naŋ masa vula ndra taŋ na, a muc ta, ","Ngetten Allah, Baabiraawo Jawmiraawo meeɗen Yeesu Almasiihu! O waɗani en enɗam ɗuuɗɗam, o laatini en danyaaɓe hesɓe barka ummitineeki Yeesu Almasiihu diga maayde. Ɗum hebbini ɓerɗe meeɗen bee tammunde gooŋgaare. ","Ngetten Allah, Baabiraawo Jawmiraawo meeɗen Yeesu Almasiihu! O waɗani en enɗam ɗuuɗɗam, o laatini en danyaaɓe hesɓe barka ummitineeki Yeesu Almasiihu diga maayde. Ɗum hebbini ɓerɗe meeɗen bee tammunde gooŋgaare. ","  Toka-de-yoŋgo  a̧ dúk zu Sɔ̧ Dáà ko Gasa Wan k’ɛ́ɛ́ Jesu Krist, wen tɛ̀ gasa deako kɔ̧-a̧, a̧ dee ha̧ wa mɛ́ ko yɛ nɛ̀ mbe-a, h’ɛ́ɛ́ mɛ́ kpa kpasa mɔɔ-e-nɛ-ta, nɛ̀ ɗoŋ kura-ŋgɔn ko Jesu Krist tɛ fio. ","  Toka-de-yoŋgo  a̧ dúk zu Sɔ̧ Dáà ko Gasa Wan k’ɛ́ɛ́ Jesu Krist, wen tɛ̀ gasa deako kɔ̧-a̧, a̧ dee ha̧ wa mɛ́ ko yɛ nɛ̀ mbe-a, h’ɛ́ɛ́ mɛ́ kpa kpasa mɔɔ-e-nɛ-ta, nɛ̀ ɗoŋ kura-ŋgɔn ko Jesu Krist tɛ fio. ","Tsahe ɓəmə Shala nya kaYitenyɛa Yɛsə Kriste, Nde sleke ɓəmə. Ma mbe wəba ta ganyɛa ŋkɛ ne, nahe ŋkɛ keyake ɓəmə kakwa bake zhigə laka same ta Yɛsə kwa kwele le mpi hwa mbelia kwahɛɗi. Tsagha ve ghə nya kakaganda ya va gheɓəmə, ","Naa togoë Baa Pan Wañkluu naa Yeso Kris. Wer dage äe maga aà da naa debañ, aà raw kol naa go tenen tigriñ de maga aà fer bir Yeso Kris le go yoo jar ma de hulin wo mono. Wersen naa de gor ge go de puçygi ga naa da' fen maga naa de gor ge äe yañ. "
1PE.1.4,"ɓisuu mɛwus mɛ mɛ yin lɛ mɛ ɓwɛy, mɛ̀ kɛɛ̀ teɗ tifin nsoò lɛ mɛ womdàg; mɛ̀wus mɛǹ mɛɛ ri mɛ̀ nyamɛn aɗyoo ɓisu wìn, ","Ba dȩ' ví zó̧ó̧ yúú hȩn ka 'yɛ́d ba ví, ka nɔɔ né, ka kɔ́n  ví̧i̧g  né, ka bugu ní, ka dɨ be""ı̵́ yȩlȩ́. ","Ka obhô mbí, e kí chik sê é fôn ekpatə́m ekəp nji Obhasi a kíi ane abhê. A kíi ekəp nji mbâ eyəné ágo ka ósô na yê. Ka ósô, ekəp njí é bhó cha, é bhó bhip, é bhó kpo ayép. ","Pu biŋ dzə wɔk pɑ nə tsə mcʉ' tsyə bi a pɑ̀ a lə pi, kə nə viŋ, kə nə ponyə lə; mcʉ' bɔ bɑ pu lwɔ' bi po thə́ kɛbəŋ. ",__Error__,__Error__,"asu ngab-elig yandaman ki, etoa fë tègè ai atòn, tègè bubi, a banyie a yob asu daan, ","a skwi man nga ngècè te ri Zhiklè man a gedèshè azɓai, a lizhè azɓai, a zi azɓai, ta ɓera kinè te zhiklè te géƌè'a, ","ma da ndzafada zleley na me zey kakay ana; me tsəley mesəney kakay ana, me ŋgəsey tikay ana, me dedəfey kakay ana zleley ana ŋga na kuray ma da zəmam ana na, ma pa ha tek a kwar da 'ərlam, ",Cantyja ꞌnaaⁿꞌ Jesucristo nntsꞌaa Tyꞌo̱o̱tsꞌom na nntoꞌñoomꞌyoꞌ juu na nndaꞌyoꞌ na cwileiwe cañoomꞌluee na ljuꞌ tseixmaⁿnaꞌ na tijoom cwiꞌndaaꞌ meiⁿ xocꞌuaanaꞌ chaꞌna ljaaꞌ. ,"Wɛ wɛɛ wɛ mɛɛ a wɛ dag hinrɔb yɔ Bɛt gbaas doodɔ hiya. Bɛt gbaasɛ rɔɔsɔ gi a bɛtha. Rɔɔsɔ ɗɛ̄ɛ̄ an gi dog gɛ, ɗɛ̄ɛ̄ an gi ha̧tir gɛ, wɛɛ ɗɛ̄ɛ̄ an gi ɓɛ̧ɛ̧r gɛ be. ","Məneken səm zəm vi zəga naw zəm gəla, an məs Maŋgəlva aɗi sit ɗii nani, zəga nan aŋgənna ɓa, haramba arma azan ɓa, awrayɓa, wasan ha faɗə. Maŋgəlva azaɓan a disiŋ na vikum. ","Bəŋ gàanəno pɛ́m Vannáb dàŋnəbənəŋ pə́rì ɛn dúur ya díŋ pu yír əntò ní. Ɛn bee ə ní bùn mai, líin mai, yə́mnə̀ bai, Vannáb dí dùggəŋ pu ɛn bee və́i gógsan ni. ","bít báan kíìn báàn làmkè kiìnmbə̀ kə̀ insɔ̀ɔ̀nkè bəraa Vɛnɛ́b zíg nɛ́b oò bəd kìínmbə̀ valligə̀ kíin doó. Insɔ̀ɔ̀nkè bəraa rə, bə̀ bán yɛɛ̀lǹmbə̀ gá, bə̀ dìg gá, sínkɔ̀ bə̀ bɔ̀' nyɛdkè boò gá. Vɛnɛ́b zíg ii insɔ̀ɔ̀nkè bəraa rə tə́ lɛgə́ poú. ","sin bulum n’a ɓilka edi kai, na gaini didiɓi kai, na jufni a ɓa kai, n’aŋ war gɗam amai war fuŋ-n’Alaw buriki, aŋ wiiki tiki ","pour un héritage incorruptible, sans souillure et inflétrissable, qui vous est réservé dans les cieux,","To an inheritance incorruptible, and undefiled, and that fadeth not away, reserved in heaven for you,","tam vocota ta as buw goyɗi, ta as saŋ goyɗi, ta as yak goyɗi kaw, ta ka ŋayay kulo kigiya hay wuralawna. ","bi nyoñe ngab é ne te ngule ya boé, nge tabe mvin, nge viele. Ngab éte é ne mia mbaʼalane yôb été. ","ɓa i sa lumam gwat mezle Buymisemuŋ miwi di vu vur mizli naŋhay na. I gwat mahiryi ta, a jup ta, wucuɗ naŋ a susuyum ta wãˀ, Buymisemuŋ a wi di vu le weˀ a muŋ ","En ɗon tammo heɓugo ndonŋgu ngu o sigani yimɓe maako haa asama. Ngu nyolataa, ngu wonnataako, ngu ustataako boo. ","En ɗon tammo heɓugo ndonŋgu ngu o sigani yimɓe maako haa asama. Ngu nyolataa, ngu wonnataako, ngu ustataako boo. ","Mɔɔ-oi n’ɛ̀nɛ̀ tɛ́ kpa'i beka mbɔr na, ba ndiŋ na, ɗaŋ na mbɛt; mɔɔ-oi'i pɛm nɛ́ ɛ́nɛ́ yiwese mɛ̀. ","Mɔɔ-oi n’ɛ̀nɛ̀ tɛ́ kpa'i beka mbɔr na, ba ndiŋ na, ɗaŋ na mbɛt; mɔɔ-oi'i pɛm nɛ́ ɛ́nɛ́ yiwese mɛ̀. ","laka neghe wəshi nyi keveyi nda Shala ke mbelia ŋkɛ, wəshi nyi keɗema kaza, nyi ɗema reɗa kadzete, nyi keɗema kazhɛre pa. Shala nde wəmbəyi kaŋa ŋayɛ pelɛ ghweme, ","Wersen naa joñ fruygi ti fen maga Baa hay de yoñge äe ciñ ne jar äen wo ga aà da'n wo de koë doga jobo hoo taabul no mono, diñ fen ma de el maga älagge go gaa, dem gaa, sagge äe taw go gaa lay, Baa yañ de yoñge äe wee ciñ "
1PE.1.5,"mìni ɓɛ ìtèɗ wu Bɛ̀ll wɛɛ̀ ɓèŋɓèŋ lɛ rìgherɛ̀n, à kpaŋ yɛ̀ɛ gòri ìnɛ ì ti jàŋbog lɛ yɛ̀ɛ resɛn ɓi mɛ̀ru mɛ siitòn ì ɓiì rèsɛɛ. ","Tayɨɨ tu̵ ví kan néélȩ́ woo, moo i 'yɛ́ zó̧ó̧ víí biilí. Bá' sí̧'í̧dí tée, báń ho̧ ví hȩn sənné ka mbɔ́g 'yɛ́d ba ví yȩ.","Ka ḿbə́ŋé nnyi o kíi ên na Jisos Krayis, Obhasi na ikom ifê a kí bhabhe ên, ejûm é bhó yim ên ta ebhú é sî nji a kí yim ên ó sém. Esémém njí é kí joé ebhú ngun a mân. ","Pú dwɔ' bi wɔ pyə tʉɔ Si byap shyə m nə piŋnthʉm, nə ywə vɔk yə pu gɔ sɔ' la'tə cwə jʉ̀m a. ",__Error__,"ce weèe yu beèe ce weèe aè byemi, Nyúè aè ce keè'ni aè yi ñger, tá weèe bo koni rluèñ ce li be yááti aèwañ aè nfeè' elúèsimbuèu. ",mina ya babaala a ngul Zamba ai ṅyëbë asu akode ya anë a ngomëzan na lakulëban a abog mvua. ,"a kinè man a géƌ ncè-a-ndav, wuƌi Zhiklè a ɓer kinè a sam m'mbel ndo, man ntila, man a di a gudko va a dai a pats ndikèma skwai.","a kuray, na gədaŋ ma Bay ma Bəla ma wafakwar vaw ta me pey 'ar ana, ma da ndzefey me buwey, ma da ɓey vaw ta pas madakwaydakw anay. ",Ncꞌe na cwilayuꞌya nꞌomꞌyoꞌ ñꞌeⁿ Tyꞌo̱o̱tsꞌom mawañoomꞌm ꞌo ñequio najndeii na matseixmaaⁿ. Nntsꞌaaⁿ na ljoꞌ hasta ncuee na macanda̱ quia na nleitquiooꞌ na nncwjiꞌnꞌmaaⁿñê ꞌo.,"Anyɔ nɛ ɗɔbsig Bɛto, Bɛt gin ook hi tɛŋkɔ a za̧a̧tig nɛ yɔ gɛms gi da̧a̧ an gi zuunig a ɔ̧t yɔ̧ɔ̧sum bɔ gedu gi dɔŋgo.","Sembe na Maŋgəlva dəga wətaf nokum ha gap wə koh adazani, məs məzaɓan naw gil gən pay dələv adagraka.","Və́ pə́ dòrgəŋ fú̧u̧ koo na̧a̧ ri yò, ə ní pɛ́m gù̧u̧ dùggənəvə́ vəŋ na̧a̧ vá̧n əní. Yó̧ŋ ya kúsà̧a̧r dàŋ kúrì ní, yír pɛ́m kə tə̀ dì̧i̧rbà mú ya Vannáb sòrvə́ ní.","Tɛ́mbagké íí bòórú, Vɛnɛ́b kpɛŋsɛ́l tə́ ii taà nwánàá. Vɛnɛ́b dá ii diìn nwáànmbìá, yaà dá wə́ə̀n sɛŋ aa súúke íí dáà yaànà bərə zé. Súúke íí rə, dáà yaànà sɛŋ aa yɛ́b dá dugǹ bəroó.","n’Alaw a na giɗmiki warni spakni, pin yumni, sin kûri n’a ŋa gobi aŋ siŋkasi edi war mefeŋ n’asakal.","à vous que la puissance de Dieu garde par la foi pour le salut, qui est prêt à se manifester au dernier moment.",Who are kept by the power of God through faith unto salvation ready to be revealed in the last time.,"Tigi nigi sa donota vi Lawna ka ŋomgiya, kuɗ vida, tam su'da ta ka goboy kay vul tuwa' goy haraŋi hay liyn ma cawna.",Mia bete ngule Zambe ja baʼale amu mbunan mfaʼa nyian ô ne bebé ya yené éyoñ ja suʼulan. ,"da kum, gidaŋ ngi Buymisemuŋ majiginukum tisi tiɓi kum, ɓa kisa lumam lih migweˀ masa njiko vu angi kiɗa mi ngi hin na. ","On ɗon nuɗɗini mo. Ngam maajum o ɗon ayna on bee baawɗe maako. Nder balɗe ragareeje, o waŋginanan on kisndam ɗam o taaskani on.","On ɗon nuɗɗini mo. Ngam maajum o ɗon ayna on bee baawɗe maako. Nder balɗe ragareeje, o waŋginanan on kisndam ɗam o taaskani on.",Ŋgai ko Sɔ̧ pɛm nɛ́ ɛ́nɛ́ tɛ̀ kɔ̧ɔ̧ɗɔɔwen k’ɛ́nɛ́ wen yuwar-kpasa-a nɛ̀ dúk dɔ̧́ɔ̧́ mɛ́ usi tɛ̀ tɛ́ sɔŋkur ŋgimbi.,Ŋgai ko Sɔ̧ pɛm nɛ́ ɛ́nɛ́ tɛ̀ kɔ̧ɔ̧ɗɔɔwen k’ɛ́nɛ́ wen yuwar-kpasa-a nɛ̀ dúk dɔ̧́ɔ̧́ mɛ́ usi tɛ̀ tɛ́ sɔŋkur ŋgimbi.,ke gheyɛ nyi ya berete ta ŋkɛ laka yɛ kezha mbele nya kenza ɗeke ɗeke kancɛ geva te keɗaŋe ta və.,"maga eegre Baa de koë wee ge wer haçge äil äayn gor wur maga je yaçaç wee gen go jag älagge no, maga go de gragge ma naa nen see äe le go wur naw ma blam taw no."
