livre.chapitre.verset,Bafia,Dii,Ejagham,Ghomala,Vute,Limbum,MKPAMAN_AMVOE_Ewondo,Mofa,Mofu_Gudur,Ngiemboon,Doyayo,Guidar,Peere_Nt&Psalms,Samba_Leko,Du_na_sdik_na_wiini_Alaw,Francais,Anglais,BIBALDA_TA_PELDETTA,Bulu,Guiziga,Fulfulde_Adamaoua,Fulfulde_DC,KALATA_KO_SC_Gbaya,KALATA_KO_DC_Gbaya,Kapsiki_DC,Tupurri
1PE.4.2,"lɛ di fɔɔnnɛ a ghɛɓ yɛ̀ɛ rìkɔ̀n ɗi Bɛ̀ll ɗi ri, ɓi gàɓ ì mɛ̀ru ìnɛ à ghɛ̀ɛ̀sɛɛ tì kìghagsii ɓi ziinɛ, kɛ̀ɛ ghɛɓ ti cɛɓ ki ǹɗem wii wɛɛ̀ kɔ̀nkɔn lɛ a ghɛɓ. ","A dəŋ mbaa mbaalı̵́ ı̵́ Tayɨɨ ka hí̧í̧ máa, bá' ka kéedu̵ hágá yɛlı̵́ yɛ, moo hí̧í̧lí̧ fó̧ó̧ȩ pɛ́lı̵́. ","Deê é róghé mân ka égyé, jeghê ofon ên ekpin ka nsi nnyí ka ekpak Obhasi a wóme, ekpak ane ngun á wóme asík. ","A gɔ pɑ́ po' bvʉ́' myə mtyɛ'dzʉ myə e gɔ piŋ vɔk nthʉm bapnɑ é a, e lə vɔk m̀ nə mghi'nyə pɔmnəŋ, e vɔk m̀ pa' Si shəŋ a. ","Yàrénɨ ɗàrò, jíìb menaye nyí ɗɔ̀bín ndè, dunáam ju hȩ Mèín ɗúré, nyí nɨ hȩ nyí nɨ̀miib ɗúré dùr. ","E gaèpni a yuu bebep, baná e be keèr cu li rcu enjep ñgoèñ na, ce geèe ba buu bbebep ce vi bláá vi ce luèute aè rgeèe ka'. E be cu ce geèe ba yuu ce Nyúè ce koèñ. ","e kan yë na angakë ai enyiṅ osu a nyòl, abim abog aligi ya, së ki fë ai miṅyian mi bod, dzam da a ṅyian Zamba. ","Te deɓa'a, man a zhè t'herkeda dai, a jèjèr ntétékè va na azɓai, aman a nzi a nshèffè, a gi skwi man Zhiklè a woya'a. ","ma da ndza sa me mendzey ana ma zarawa da slaw vaw ana na, andza ma tek me sey ma ndaw ana sakay, amana andza ma Bay ma Bəla me wuɗey ana. ","cha cantyjati xuee na wañoomꞌm nncꞌoom chaꞌxjeⁿ na lꞌue tsꞌom Tyꞌo̱o̱tsꞌom, nchii chaꞌxjeⁿ na queeⁿ tsꞌom seiiꞌ tsꞌaⁿ. ","Yɔ yɛɛl ɓɔryɔ gi tuur a ɔ̧t nɛ wɔ hi zɛ̧rsin waal du gedu, waan gedu anyɔ Bɛt ha̧a̧ge, bɔnɛ waa anyɔ ɗɔkum nɛ ha̧a̧l wɔ ha̧a̧hi. ","Təŋ kakaŋka, də wəmbat abe pay nanziya nokum egge pakə, say kədawaŋ gən va an məs Maŋgəlva aŋgələ, məza də mambray ɓa məza va makrokum adaŋgla ɓa. ","Gù̧u̧ yakai və́ kə̧ŋnəŋ kúsà̧a̧r di yò, və́ kə̧mà̧ kə̧sàŋ ya pùu pu Vannáb ní, və́ kə̧ kə̧sàŋ dumpán ya símá̧a̧r və́ní yá̧a̧ ní pai. ","Sɔ̀d bə́ŋyóo, nɛɛ̀n aa íí dá kuùm zɔ̀ŋə yɛ́b bərə, oò kùm kə̀ nɛɛ̀n aa Vɛnɛ́b í' rə kíin, zá kìínmbə̀ inlɛ'kè vaksə́ bəraa nɛ́b bəd tɛ́mú rə kíin gá. ","Kapai za ɗa pin dirini ɗif kir kai, amma pin diri na wiini Alaw, won hlai n’a na karni war neŋ-si agwi hai. ","pour vivre, pendant le temps qu'il lui reste à passer dans la chair, non plus selon les convoitises des hommes, mais selon la volonté de Dieu.","That he no longer should live the rest of his time in the flesh to the lusts of men, but to the will of God.","Nigi ma poy kuɗ darta vi sliwna loɗi, may kuɗ minda vi Lawna, hay li ma nigi ka hay nagat tani hay sliwna tuwa. ","na, a nyiñ éyoñ a liʼiya minsôn été, saa fe aval ane mbia minkômban ya bôt mi né, ve aval ane nkômbane Zambe ô né. ","ɓa zle wurenna, hin mindir ar siifa kum a ruwuy na, ki gam di i gwat Buymisemuŋ mawuɗ muduba, amma gwat dumvu ngi mbur mawuɗ mata. ","Diga jonta, haa luttuɗum balɗe mooɗon haa duniyaaru, sey on njooɗo nder muuyo Allah, naa nder suunooji neɗɗo. ","Diga jonta, haa luttuɗum balɗe mooɗon haa duniyaaru, sey on njooɗo nder muuyo Allah, naa nder suunooji neɗɗo. ","Ɓɛɛ tɛ́ oi ŋgimbi duka-a k’ɛ́nɛ́ zaŋnu’ɛ, ɛ́nɛ́ beka duk tɛ dee wɔ-mɔɔ-zaŋnu ɓɔna, ɓɛɛ ɛ́nɛ́ tɛ́ de nɛ́ wɔ-mɔ nɛ̀ Sɔ̧ kɔ̧a̧. ","Ɓɛɛ tɛ́ oi ŋgimbi duka-a k’ɛ́nɛ́ zaŋnu’ɛ, ɛ́nɛ́ beka duk tɛ dee wɔ-mɔɔ-zaŋnu ɓɔna, ɓɛɛ ɛ́nɛ́ tɛ́ de nɛ́ wɔ-mɔ nɛ̀ Sɔ̧ kɔ̧a̧. ","Ma se tsetsenya ne, mene mə wəsə nya ɗe Shala mbe nza ta ŋayɛ, mba yɛ kemene zəzə ta geva. ","Tï¡ï¡ wer patala tu, de maga nday yañ tenen ti' ëa, see wee yoo jar doga äil Baa dan no, see wee diñ do ga äil äay dan wa. "
1PE.4.3,"Ɓisuulɛ ɓì roòzìghà rìkɔ̀n ɗi ɓumɓɛ ɓɛ gherɛɛ ɓi Bɛ̀ll yɛ̀ɛ ɓì ghɛghɛ̀ɓkà ɓi kìɓùùsì, ɓì kìkì ɓìɓan ɓi ǹɗem win wɛɛ̀ kɔ̀nkɔ̀n, ɓì nɔnɔ̀ mɛ̀rɔ̀g, ɓì ɗiɗì ɓìɗilàg rìɗi ɗi kiɓe, ɓì ŋwaŋŋwàŋ mɛ̀rɔ̀g, ɓì ki ɓɔɔɓɔgsì ɓìnùn ɓi ɓi ri kìɓan ki ki ɓeɓtɛɛ ki ciɓ. ","Ká ví kɔ́ hȩn kɔ́lı̵́ nánán gaa Tayɨɨ sá voo nɔ. Maa sú̵'ú̵; ká ví kɔ́ dȩdȩ́ȩm, kan hȩn hí̧í̧lí̧ dáń fó̧ó̧ víí, ví kíí doo, ví lá lálı̵́ vó'om, ví zɔ hȩn zɔlı̵́ vó'om, ví sú̵g kɔ́ hȩn ɓı̵́d kan yɛ́g tayɨɨ mbɔ́ggı̵́ voo vu̵. ","Ó fon ên ekpin kpá ka ekpak ane mba á ká məŋé Obhasi á fóna. Eyimím achot akôp, ekpatə́m ekot na achot í ngun, aməm egboóm, ejiím birom énə́mé-énə́me, na atû mma ó kará ên biji ka ajom etóbhóm. ","Po lə bɑ dzə bɑ bvɔk m pa' pɑ tə pɑ pɑ Yudea shəŋ a: Vɔk nə ghap, ghi'nyə, nə pam mlu', dzʉ kʉə ywə, nwə́ kʉə ywə́, mkətwɔk kuso. ","Nyí duɓacií ju hȩ nùb Mèín mɨr ɗə̀ə̀ŋwáá cei, kí ta: ndɨ̀ŋsòó nɨ́ɨ́b ɗàá ku u̧nèé, ju ɓi̧ní, mɨɨr, sunɨ̀b, tɔ̧̀ ɓe jə̧̀ə̧́ mèín nyaŋhɨ́bí duɓa nɨ́ nɨ́m ɓáŋhɨ́nne. ","Nfeè' ce weèe aè m ce geèe buu ce beèe ce a rïìñ Nyúè ka' a ce geèe naè, aè gháá wa'a. Woweèe a ce geèe mnyáâr, a ce geèe yuu ce wap bláá vi ce luèute aè rgeèe. Woweèe a ce no buu vi ce koo woweèe, a ce geèe mñkaè' bghaa, a ce geèe mñkaè' no buu, a ce loo neè mnyúè enjep ñgoèñ na ce Nyúè aè kani ená beèe a fa loo neè vi ka'. ","Abog angalod ya layëan asu e mam bëhaiden babò, a enyiṅ ebamba, bëmvomëgan, bësògò mëyòg; enyiṅ bidi ai mënyu, mëyòg ai olugu bëzamba anë eki. ","Dèma, aman halakai kin nza a nshèffè ara ndohi nte deɓa: kin beza zlawa a ntétékè, zom a ked kinè, kin gu golahwaƋ, kin mboh skwi ambaɓi holhola'a.","Akwa na ɗa ka dəba, ma kawa tek a kwar ana andza ma ndaw  Zuif   ahiya kakay ana hay ma wuɗam ana. Da ma ndzawa kwar da me tsəley so ha, da tek me sey, da mewey kwar, da ma zəmam tek a kwar kambəlaɓa, da me sey zom lamba ha, da ma nəmatar dəba kwar a ’ərlam so na hay me key hwaray ana. ","Tco xuee na ñelꞌaꞌyoꞌ chaꞌxjeⁿ cwilꞌa nnꞌaⁿ na ticꞌom nacje ꞌnaaⁿꞌ Tyꞌo̱o̱tsꞌom, ñelꞌaꞌyoꞌ natia na cwilꞌa naⁿꞌñeeⁿ, tyomꞌaⁿꞌyoꞌ na queeⁿ nꞌomꞌyoꞌ ntꞌomcheⁿ, ñejlaꞌxmaⁿꞌyoꞌ nnꞌaⁿ candyee, tyocwaꞌjndooꞌndyoꞌ ndoꞌ tyoweꞌyoꞌ, ndoꞌ tyolaꞌtꞌmaaⁿꞌndyoꞌ joo na cweꞌ nnꞌaⁿ lꞌa. ","Àmntɔnɔ nɛ fɔk nɛ dood wɔ hi mɛɛ Bɛt gɛ waabil ya̧a̧nɛ nɛ wook nɛ hinha̧a̧l yɔ daarlɛl yɛltɔnɔ, nɛ gaak nɛ muul nɛ an nɛ fɔb ɗɔkum wɔ nɛ kpoos du, nɛ wɔnik nɛ bumɛ, nɛ nak nɛ hin yɛmsbed, nɛ yɔ̧tingo nɛ bum lɛl gāanɛ, nɛ wɛɛ nɛ ɗɔbsig maak ha̧a̧l wɔ hi gi hintɔs. Hin wɔrɔ lab sɛw, nɛ woo riiri ma.","Wəsuwa məs kəsoŋ lahəŋka vanet ɗii məs Yahudiyenɗeŋ ɓa, adaɗɗaŋ va wəŋgla neti mekki. Kəsuwaŋgək adəv mambray də wəsim zəga də wəhala, də mbazla əboykum də wəsmay mbrayen, də wəsaa mbazla diiɗa də wəzaɓ tuya. ","Bal və́ tò̧ kaaro ɛntò ya yíbtò ya gàan Vannáb bíi tò̧ŋ ní, yakai gá màgdo guvɛ. Bal və́ gù̧u̧n fú̧u̧ və́ní pai, bal və́ tò̧ŋ ɛntò ya símá̧a̧r tìi yá̧a̧ pə́və́ ní, və́ zò ya̧a̧ŋ fùm, və́ sù̧u̧ŋ kúsà̧a̧rɛ̀, və́ mól zò kaaŋ fùm, və́ fa̧a̧ dùuŋ ɛn tìŋtìŋtò, ɛn ya Vannáb mər ní. ","Kə̀ aakíin də, kùm íí tá'à sɛŋ zùúm, kə̀ nɛɛ̀n aa nɛ́b aa bàg Vɛnɛ́b síndə, bə̀ tə́ ma'ǹ də kíin. Sɛŋ aarə, íí kùmà labsə̀ bərú, inlɛ'kè vaksə́ bərú, wìdkè rú, in ságǹ vaksə́ bərú, wálke badn bə̀ nyəə̀n bərú, bít kə̀ vɔɔm vaksə́ pɔ̀bm̀bə̀ rú. ","Buri ɓa war mefeŋ n’a vuga ɗa, ki zi diriɗi ɗai n’e siɗi Alaw kai ɗa gara ki piyi war zini maɵara, war suuna, war ciini na gaini sul, war simi na viya n’a suwa pɗemni, war seŋ zi vilimi gaini hûrgi n’azumai wuzani alawai na kadai, war hi-hir. ","C'est bien assez d'avoir fait autrefois la volonté des païens, en vivant dans le désordre, les convoitises, l'ivrognerie, les orgies, les excès de boisson et le culte criminel des idoles.","For the time past of our life may suffice us to have wrought the will of the Gentiles, when we walked in lasciviousness, lusts, excess of wine, revellings, banquetings, and abominable idolatries:","Kay hay liyn ma kalina, nigi ba liyna vigi ŋolo kay li minda vi sa waana, nigi poy hay raw-goyta, hay darta vi sliwna, hay ɦoyta kuɗ dolayna, hay haramda, hay hiwirta, hay girifta vi lawayn ma waana ma mar ci-matta. May kayni asawa yo! ","E ne été na, mi nga nyiñ ayap e nkômbane meyoñ me ne te yeme Zambe été. E ne na: Bijabô, mbia minkômban, nsoʼone bilam, njeman mbia mebôk , mbia bisulane bi ndian a nyuan, nkañane bengunemelan. ","Naŋ kine, gwat, mizli duniyahay mawuɗam gi naŋ na, ki gaka le, muk muduba. Zleˀe, ki gam sulome, ki hĩyãm gwatay, ki wam ti mbaazla, ki zumam fineˀ gidaŋ, ki gam dungur ngi mbaazla haɗa, ki dilkam huruk huruk mukuy ta wãˀ a mbuŋ kulihey. ","Naane on njooɗino nder joonde heefeerɓe, jonta ɗum he'i. On njooɗino nder daakaareeku, suunooji, wuykere, pijirle kalluɗe, on cujidanino labbi karminaaɗi. ","Naane on njooɗino nder joonde heefeerɓe, jonta ɗum he'i. On njooɗino nder daakaareeku, suunooji, wuykere, pijirle kalluɗe, on cujidanino labbi karminaaɗi. ","Mɔ n’ɛ̀nɛ̀ dee so nɛti nyɛma'nɛ́ kaɗi, wen ɛ́nɛ́ duka so de nɛ́ mɔ ko o wi nɛ̀ iŋ Sɔ̧ na: nɛ́ dàlà, ɗaŋ dee wɔ-mɔ, gbɛɛ dɔ̧ɔ̧, dee ɗaŋ saa, nɔ nɛ̀ ŋgamɔ in gasa géé-sɔ̧. ","Mɔ n’ɛ̀nɛ̀ dee so nɛti nyɛma'nɛ́ kaɗi, wen ɛ́nɛ́ duka so de nɛ́ mɔ ko o wi nɛ̀ iŋ Sɔ̧ na: nɛ́ dàlà, ɗaŋ dee wɔ-mɔ, gbɛɛ dɔ̧ɔ̧, dee ɗaŋ saa, nɔ nɛ̀ ŋgamɔ in gasa géé-sɔ̧. ","Kwa nza ŋkɛ ma vəashi ne, wəsə nya zeɗehwe nda ke ka keɗepema Shala yase yɛ kamene, laka nza mbe vale tahe, ɗe ta geva, ghwəyi, ɓerawe, ve nda ghə ke wəshi kesa ba'a hawe va kweci shala, wəsə nya ndiremi kashasha. ","Werga nday ig we le äaa debañ joñ ree maga jar maga bay wo ti jag Baa wa joñ wo. Nday hay da feçeçre de hram, ëig de älagge, taë de yii, ree kol go dug gi dug gi, joñ hragge taë de yii, goñ feçeçre ma hoor see wo, äuy kaçaç we. "
1PE.4.4,"Nni ɓigomìnɛ ɓumɓɛ ɓɛ yin ɓɛgherɛ̀n ɓɛɛ̀ kuukuùghràg yɛ̀ɛ ɓì nɔ̀ɔ̀tii tì ɓi ɓɔ ɓi coo kiɓeɓtàg ki cɛɓ kìn, fɔɔnnɛ ɓɛɛ̀ wɔmwɔm mini. ","Nán gaa Tayɨɨ sá ku̵u̵ ho̧ 'ya̧'a̧ yɛ kíí sú̵g dɔ́ń kan vu̵ ya hȩn vó'om kɔ́lı̵́ ɓı̵́dná yȩlȩ́ né máa, kɔ́ vu̵ la ɓá', vu̵ haa ví. ","Kən mfá-mfá ane mbá mba á ká məŋé Obhasi, é kí man ábho biji nji á ro kpó yen ên ó chə̂m na ábho ka echâk ekpin njí. Ka obhô mbí, a chə́bhe mân á tuk ên. ","A shyə m po'o tə́ wap yɔ a sya wap gɑ́ tə pu a pú nə yɑwə bəmtə́ ŋkhʉ́dʉ́ nə nwə ghap pɑ̀, a pɑ́ po'o wap pɑwə bɔ wɔ. ","Ɗàrò, nùb Mèín mɨr ɗə̀ə̀ŋwáá á bɨ́ gbɨ̀ɨ̀ŋnɨ àm nyíne ŋgáb ducɨ bɨ́ kpáné ju ɓáŋhîn kɨ́ no cúk ɗàcɨ̀wáá, ŋgáb a yà nyí àndɨ̀nɨ. ","Woweèe a ka' yá ená weèe ker ce geèe ku' njáèá buu bbebep ce weèe woweèe aè m ce geèe naè ka', a bááñger, a ce cáp weèe. ","Bakam dò na miatoṅ ki bò a mboan abui ezëzam te, bëngakag mina; ","Aman antanta kin dè a nda tenga'a a kin jèjèr maya tenga'a man ambaɓi azɓai, ta rzl ta a ta derƋe kinè. ","Ka guma neney na a rəzlata zləna, a nəkadama na, ka hwam aha andza taya kamasləta ha 'ar a tsəveɗ ma tsəley so mandzara me wey daw ka vaw ana sakay na, arka na, a tsaɗəmakwar. ","Sa̱a̱ jeꞌ ncꞌe na ticalajomndyoꞌtiꞌyoꞌ ñequio na mawinomꞌnaꞌ natia na cwilꞌa naⁿꞌñeeⁿ, joꞌ matseiñꞌeeⁿꞌñenaꞌ joona ndoꞌ tia ñꞌoom cwilaneiⁿna cantyja ꞌnaⁿꞌyoꞌ. ","Yɛrɛ yɔ hi gbɛn a nɛ taa ɔksig hi hii an nɛ gaa zul nɛ a hinya̧ ha̧a̧l yɔ daarlɛl yɛ̧ltɔnɔ gedu gɛ, kɔmsihi gɛrsɛ, hi wɛɛ hi gin niiko. ","Kakaŋ kana, ɗii məs dəsənən Maŋgəlva ɓa, tahəŋ wəgətaŋ vi kaɗɗanən zəga nan dənɗaŋ ɓa, wədaw net mbrayen də wəsmay net mbrayen, ndəni adaw rokumən vi wənnani. ","Yakai yíbtò ya gàan Vannáb bíi tə̀ro kə̧sàŋ və́ní má̧a̧tinəŋ kə̧sàŋ dumpán vəní bai ní, kìŋgənəvərì, və dúulgənəvə́ zɛ. ","Bə́ŋyée gə́, wál íí mà' invaksə́ kə̀ nɛ́b aa bə̀ bàg Vɛnɛ́b síndə tə́ sé. In aarə kò' bə̀ yíl tə́ kúnú; kə̀ taàbìá, bə̀ tə́ ii taà piìn dúlǹmbìá. ","Tiyana won hlai n’e tili ɓa ki ɗa tipi gaiɗi war sdaɗi na meefeŋ n’e ziŋ ɗa kai, e bindi hiyak, e tiki piɗi e miɗi seŋ na meefeŋ miɗiki lai. ",Ils s'étonnent maintenant que vous ne couriez pas avec eux dans le même débordement de débauches; et ils se répandent en injures.,"Wherein they think it strange that ye run not with them to the same excess of riot, speaking evil of you:","Kay na'ta hay li ma wulini nigi may jaŋ kuɗsi hay hiwirta na'ta loɗi, nisi muɗi ɦuyum', tun caw ŋulgiya kaw. ","Ajô te ba kam amu jé mi nga tyetebe be, te fe fulan a be e mbia mboon été, ","Wurenna, ɓi kum a zuma hirnga le da mizli duniyahaya, asi a puraka na, kum anta jumom ati taŋ ɓa ngi gi sulome mumbak le ta tuwa mata. Joˀ a zukum vurˀe. ",Jonta heefeerɓe ɓe'e ɗon kayɗina ngam on kawtataa bee maɓɓe nder joonde maɓɓe hallunde e pijirle maɓɓe kalluɗe. Ngam man ɓe nasti huɗugo on. ,Jonta heefeerɓe ɓe'e ɗon kayɗina ngam on kawtataa bee maɓɓe nder joonde maɓɓe hallunde e pijirle maɓɓe kalluɗe. Ngam man ɓe nasti huɗugo on. ,"Ɓɛɛ kinii ɗɛɗɛ o wi nɔ‘i gɔna, wen ɛ́nɛ́ duk tɛ̀ dee o ɗaŋmɔ nɔ‘i in wa ɓɔna, nɛ́ hegɔ sa wa da̧‘nɛ́. ","Ɓɛɛ kinii ɗɛɗɛ o wi nɔ‘i gɔna, wen ɛ́nɛ́ duk tɛ̀ dee o ɗaŋmɔ nɔ‘i in wa ɓɔna, nɛ́ hegɔ sa wa da̧‘nɛ́. ","Ma tsetsenya ne, kala meŋele newe ka ɗepema Shala va nya ɗema yɛ kave nda ghə kala hɛ ke dzeghwa kwa ndiremi. Tagha gɛ, kaŋele ŋayɛ hɛ. ","Day ree sen de ngel jar maga bay wo ti jag Baa wam no, wer maga nday bay tay ge de äaara joñ ree ma de älaggen de haçaçn wo wa so mono, wersen aà raw wo äo' ëee ëar wee ge. "
1PE.4.5,Kìɓan kifog ɓɛ ɓàagh gɛ kìɓan ki ɓɛɛ̀ kìki kiǹ ɓi mis mɛ roànɛ à ti jàŋbog lɛ a yɔm̀ lɛ rì ɓum ɓɛ cem rì ɓìloŋ. ,"A̧máa ı̵́ ka mbaa bə́' moo moo sə̧""ȩ́ yúú nán zá̧a̧d voolı̵́ kan ı̵́ nɔm vu̵ yȩ, nán yȩ vú̵ń hí̧i̧du̵ ya̧g yúú ba'ad voo yȩlȩ́ ó̧. ","Kən á rî á sə́ré obhí ábho bhə́t na bhə́t ka ochî Obhasi nnyo a ri ngyím ka etáŋám chénchén nne, kpe a kpóe okpó, kpe a ri mbít. ",Da' gɑ wap gɔ sɔ' ghɔmnwə nə́ bi mo yə e gɔ fyɛ' pɔ mtʉɔ pu a mpfə pɔ a. ,Ɨ́dù ŋgáb kwá tana Mèín nò dukɨ́cɨ nɨ́ kə́sə́k ŋgùnnɨ nùb jáŋ ɓe nɨ̀kwíbí àm níì á ŋgáb ya ndɨŋ u̧. ,Woweèe a be keè laèa yuu kuèu yuu ce woweèe a ce geèe na neè ñwáè ce e tami nyor aè rsa' beèe ce a cu bteèe ker ba beèe ce a kweñger. ,bayi tëbë a nkat abë e nyò atoan tsig ntol bënyiṅ ai bëwu. ,Aman a di sèi ta da njè ma ta auda a sam nenga'a man a slaha a ngi kita ndohi a nshèffè a ndohi m'metsa cèw ba. ,"Amana, ana aza taya na a da ɓadəməra tek ata na ma kəmawa na a ndaw ana ma həla vaw aha tsoy, ma da kadatara sariya ma ndaw ta dey ana hay, ta ndaw ma mətsa na hay. ",Sa̱a̱ ncueꞌntyjo̱ xjeⁿ na nlcaⁿnaꞌ na nñequiana cwenta nnom Nqueⁿ na mꞌaaⁿcꞌeeñê na nncuꞌxeeⁿ nnꞌaⁿ na cwitaꞌndoꞌ ndoꞌ nnꞌaⁿ na jnda̱ tja̱. ,"Yɛrɛ ɔ̧tyɔ Bɛt gɔ gi gbaas dood za̧a̧til wɔ hi wɔrkɛ wɔ dɔgl gedu gi riikri ma. Hii hɛw, hí wad woosya̧ yɔ hi woo a Bɛt muutdu dɔglɔ. ","Amma waŋɗanən an məs adaɗɗaŋ pak aba Maŋgəlva məs dədaw zaɓan zən nawtaw kita, aket ɗii maderet dit mimtiti. ","Ammá̧ və dà ɛ́m dón dí̧i̧rdì muur bee Vannáb nə́n ni, gàm Vannáb màggəŋ fágdì yír lagə́ltò vəŋ vooltò pɛ́m. ","Zá bə̀ dá tù' boò bəd i'ǹ Vɛnɛ́b, nɛ́ŋə̀ aa tə́ si' kudǹ, bɔ̀b nɛ́b galə̀ bəd fágǹmbə̀ kə̀ val bəd tə́ rə númú. ",Nɵa aga e miɗi edi gaini miɗi midini sdaɗi wuzani Alaw n’a dara aziti sariya wiiɗi na karɗi gaiɗi zi mri lai. ,Mais  ils rendront compte à celui qui est prêt à juger les vivants et les morts.,Who shall give account to him that is ready to judge the quick and the dead.,"May nisi ma lak vok nam ma tuwam koti kot kay ka kitata vi sa irina, vi sa mitina kaw. ",a ba ta mia. Ba ye yalan asu nyô a ne nkômane ya tyiʼi bevevee a miñwuane mejô. ,"Amma gwat, taŋ magaka gar na, a sa slufaka a mbuŋ Buymisemuŋ, migweˀ ngi ga kiita da mizli misi ti siifahay ati mumucahaya. ","Ammaa sey ɓe njaabo Allah, taaskiiɗo hiitaago yeeɗɓe e maayɓe. ","Ammaa sey ɓe njaabo Allah, taaskiiɗo hiitaago yeeɗɓe e maayɓe. ",Ɓɛɛ wa tɛ́ ɓa kànà wen-aa ti wan nɛ̀ hɛɗa mɛ́ gɔn kita zu o wi nɛ̀ duk kpasa in o wi nɛ̀ fea. ,Ɓɛɛ wa tɛ́ ɓa kànà wen-aa ti wan nɛ̀ hɛɗa mɛ́ gɔn kita zu o wi nɛ̀ duk kpasa in o wi nɛ̀ fea. ,Ama katezhɛne nda ghena hɛ ke Shala nya ɗeke ɗeke kameha ghwə te mbeli nyi teghweme ba'a nyi kempə mpə. ,Ama de sen äuy aà wo ge wo mbaara yañ keeë ree älagge äaaran go pel Baa maga go de gragge ma cag ree jar ma tenen wo de jar ma de hulin wo mono. 
1PE.4.6,"Kìɓan kiǹ kɛɛ̀ki Syeesyee à Ɓɔlɛ à kalɛ̀ngà girig a ɓìloŋ, a ɓɛ̀roɓɛ ɓɛ ɓaghà ɓɛ̀yɔ̀mɛn ɓi cɛɓ kaa ki mɛmùù lɔŋ yɛ̀ɛ ɓum ɓɛ̀cèm, lɛ di ɓɛɛ ɓa rì ìtèɗ wulɛ ɓɛɛ ghɛɓ yɛ̀ɛ Bɛ̀ll rì ìtèɗ wu Nghay.","Moo woo nɔ nán nɔm ku̵u̵ nuŋ hȩn si̧'i̧ní fó̧ó̧ voolı̵́ kɔ́ ı̵́ nán tóó vu̵ wɔgɔ máa, vu̵ ki moo to̧o̧ 'maŋ á̧ḿ, moo yigid Tayɨɨ woo a pú̵ vu̵ vágád kɔ́ ı̵́ Tayɨɨ ka mbaa kan vágád yȩ wɔgɔ.","Nâ echî á kóe otîp ogyebhá-ḿbə́ŋé á jak mbâ ábho mba á kpo á ji, se ka ekpin í ngun á táŋ ábho noŋ ane chénchén, kən ka ńtʉgântʉ á fôn ekpin noŋ Obhasi.","A lə shyə m̀ po'o tə pú siŋ Cuŋ pɑpuŋ ba m bi mpfə́ pɔ, po'o gɑ pu fyɛ' wap pa' pɔmnəŋ nə bap nɑ́ a, wap vɔk pa' Si shəŋ á nə Zhwenyə.","Àm kɨ́ á kùb yi tanaɓwée nɨ̀kwííb Kìn Nyɔ̧ɔ̧́ ru, àm ŋgwìn Mèín yi ŋgwin ŋgáb, ŋgáb acè jáŋ hȩ nùb lâs, a ndɨ̀ŋ ɗàrò ŋgáb dù ju hȩ Mèín ɗúré, ɓe nyòm Nyéhè Sarɨ́nne.","A mbuèu ce a m feè'shi Nsuñ Mboèñmboñ neè beèe ce a m kweñger, tá woweèe a bo cu aè yú' aèmboè Nyúè ce cu naè. Woweèe a be cu wa'a, ka' a m sa' woweèe aè nfeè' ce woweèe a m ba njep ñgoèñ na, woweèe a kwe aèmboè beèe wááwá a ke kwe naè wa'a.","Asu te bëngayedan tò bëwu mbëmbë foe asu yë na, tò anë bënë ntsigan ntol a nyòl anë bod, bënyiṅ a nsisim anë Zamba.","Ta njè ta ma mbela'a a ndohi man a géƋ mali ta ara ndohi m'metsa èhèmè? A géƌ man ta ngècè kita ara ndohi man ta zhè a nshèffè, a ta nzi a nshèffè te Mèzhèɓ, a nshèffè Zhiklè.","Kavədiya na, kwa a ndaw ma mətsa na hay tekeɗe na, ka tələkadəmatara mey ba ta Mey Hayna Wayna, ma aza, kwa sariya ta na, ma ka hiya ba andza ma ndaw hay da slaw vaw na, ma ndzaya na andza na ma Bay ma Bəla ta har ma Mesəfrey.","Joꞌ chii nda̱a̱ lꞌoo jnda̱ teineiⁿ ñꞌoomꞌ Tyꞌo̱o̱tsꞌom cha chaꞌxjeⁿ jom wanoomꞌm, mati nnda̱a̱ nntaꞌndoꞌna meiiⁿ jnda̱ tuꞌxeⁿndyena chaꞌxjeⁿ cwituꞌxeⁿndye chaꞌtso nnꞌaⁿ.","Hinɔ gii Kristu gi dɔgs wɔrkɛ wɔ Dɔgl Rɔb bɔ hɛw, an Bɛt gbaas muulya̧ dɔgl an dɔgl yɔ gɔ gi gbaas dood sɛw ɗa, mɔkilya̧ gi za̧a̧ an Bɛt Mɔkil yɔ gi za̧a̧til be.","Vini Krestu apel Wən Nenek azet ɗii mimtiti, vi kawtaw kita aket va ɗii də gəɓa ziti, vanet ɗii pakə. Apel sit na, vi əmpəs dəpsit gən sembe nasuwa zam va Maŋgəlva asani.","Vooltò ní təŋ ya ba və kə̧ŋnəŋ kúsà̧a̧r díi, Vannáb fáglèvə mú ya fággəŋ yír pɛ́m ní. Və vò ní, Kiristu ɛ̀m dònlé pə́vəro muur púur bə̀ri, kə və kə̧mà̧ mú ya Vannáb kə̧ŋ ní.","Kə̀ taàbìá, val bəd máá, Krístù bàà bə̀ taà  * Nwɔŋ Puu Sɔ̀ɔ̀nkèá. Val boò aarə, fágə́n Vɛnɛ́b bìá, kìínmbə̀ nɛ́b bəd kóólé, val dá bə̀ kodǹ də kíin. Zá ìì bàà bə̀ Nwɔŋ Puu Sɔ̀ɔ̀nkè rə, bɔ̀b boò kùm kə̀ si' nwulú bìá, kə̀ nɛɛ̀n aa Vɛnɛ́b kùm dú rə kíin.","Labar na pɗem a ɓaka a ɓaka haa siɗi zi mri ɗa, burini hanɗanagai e niviti sariya ɗa pin sdaɗi, miɗi ɗai na doogo ɗa nɵa, war neŋ-si, amma tiyaa ɗa e kiɗi e simni karɗi maini n’Alaw a dara nɵa, war seze.","C'est pour cela que l'Évangile a été aussi annoncé aux morts, afin que, condamnés, il est vrai, selon les hommes dans la chair, ils vivent selon Dieu dans l'esprit.","For for this cause was the gospel preached also to them that are dead, that they might be judged according to men in the flesh, but live according to God in the spirit.","Kuɗ na'ta kayni, labara ma firina kusi tam sa mitina kaw, kay hay li ma nisi fi kitata hay sliwna ki sumun nala fina, nisi ma lak iriya kuɗ Lawna hay Ŋusta may.","Amu ajô te, jaʼane e be miñwuan, mbamba Foé a nga kateban e be be, nde jaʼane bôt ba tyiʼi ajô dap e minsôn été aval ane bôt, ve ba nyiñ ane Zambe a zene ya Nsisim.","Vurˀe, a tilam mi le ti Ɓimezle le da mizli mumucahaya, da ko a gaka taŋ kiita le ar dumvu taŋ, kaɓa magaka da mizli gar na kwana, ˀUf Mipal na, a vula taŋ gidaŋ ɓa a gam gwat Buymisemuŋ mawuɗo.","Kanjum waɗi Almasiihu waazini maayɓe boo kubaruwol ceynoowol, koo to ɓe maayi daliila kiita ka yimɓe fuu kiitorte, ɓe ngeeɗa fodde Allah barka Ruuhu.","Kanjum waɗi Almasiihu waazini maayɓe boo kubaruwol ceynoowol, koo to ɓe maayi daliila kiita ka yimɓe fuu kiitorte, ɓe ngeeɗa fodde Allah barka Ruuhu.","Mɛ̀ nɛ́ mɔ‘i n'aa tɔ̧ɔ̧ nɛ̀ De Mbe Wen ha̧ o wi nɛ̀ fee so mbɛt, wen kita nɛ̀ ba bíí lɛŋ zaŋnu’ɛ baa so wa kaɗi, ɓɛɛ ha̧ wa mɛ́ duk kpasa hee mɔ'ɔ nɛ̀ Sɔ̧ duk ga nɛ̀ ŋgai ko Sa̧a̧  Ɔmi .","Mɛ̀ nɛ́ mɔ‘i n'aa tɔ̧ɔ̧ nɛ̀ De Mbe Wen ha̧ o wi nɛ̀ fee so mbɛt, wen kita nɛ̀ ba bíí lɛŋ zaŋnu’ɛ baa so wa kaɗi, ɓɛɛ ha̧ wa mɛ́ duk kpasa hee mɔ'ɔ nɛ̀ Sɔ̧ duk ga nɛ̀ ŋgai ko Sa̧a̧  Ɔmi .","Vatse gezete nda geva Ghena kwatenca nya ganyɛ ke mbelia kwahɛɗi perə. Nahe ghwə kemehate geva te hɛ kala wəshi nyi menete hɛ, kala mbeli pɛtɛ. Ama tsetsenya, te zlaɓa ta Sefəa Shala ne, wərə hɛ kanza teghweme kala nya nza Shala.","Wersen aà raw sii Waçaçre ma de Coçoçren ne jar ma de hulin wo lay, nen maga Baa mo cag ree äaara do jar ma de hoçoçgesee sugsug wo no lay. AÀ wo sii gi äe ne hara maga Nenterse ma bay ëage mo hay äil äaara, aà mo fer ge wo tenen doga Baa tenen no lay."
