livre.chapitre.verset,Francais,Anglais,BIBALDA_TA_PELDETTA,Bulu,Guiziga,Fulfulde_Adamaoua,Fulfulde_DC,KALATA_KO_SC_Gbaya,KALATA_KO_DC_Gbaya,Kapsiki_DC,Tupurri
JOL.1.17," Les semences ont séché sous leurs mottes ; les greniers sont vides, les magasins tombent en ruines, parce que le blé est dans la confusion.","The seed is rotten under their clods, the garners are laid desolate, the barns are broken down; for the corn is withered.","Jaf ma cuki hay sinen soy goyo, feera hini goy ɦawa'a zaŋ ma lak wana hini goy ɦawa'a, kay alkamaren soy goyo.",Mefese mevoñ me maneya kôt e bibañe bi tyia si. Fôn é ntoo momo! Mengun teke jôm été a mekañ bikôkoé.,"Hilfa gwat mizliga, a ji ngbok ngbok avu ruwuyo, a muˀul, hay ngi dawaya njoŋ njoŋ, dirgwaɗaya i muwahahhay le, asi alkamari anta mata.","Aawre yoori haa ngesa, cigorɗi perwi, beembe ngibbinaama, ngam alkamaari ɗayli. ","Aawre yoori haa ngesa, cigorɗi perwi, beembe ngibbinaama, ngam alkamaari ɗayli. ","O nyɔnɔ lɛŋ fee ɗɔɔ ŋga kora nu; o fara-a-nyɔnɔ ɗaŋa, o dam gbina wen alkamaari bo ɓɔna.","O nyɔnɔ lɛŋ fee ɗɔɔ ŋga kora nu; o fara-a-nyɔnɔ ɗaŋa, o dam gbina wen alkamaari bo ɓɔna.","Nahe wəshi nyi tsawete mbeli keghwelenji mbe hɛɗi. Nahe yɛ tame kenza ghwalɛalɛa, nahe yɛ dɛdimə kenza keŋzla ŋzla, va nya ɗema ha shɛ.","Coore maga aè jo' ra taw wo wo go gesiñ ni. Boolen wo go äil koëe, pulin leë wo go gesiñ lay. Coore ble bay wa so."
JOL.1.18," Comme les bêtes gémissent ! Les troupeaux de boeufs sont effarés, parce qu'ils n'ont point de pâture ; même les troupeaux de brebis pâtissent.","How do the beasts groan! the herds of cattle are perplexed, because they have no pasture; yea, the flocks of sheep are made desolate.","Duwgi farayn ka tiy tige? Farana vi luwayn goyo muɗi bisi, kay hatna may loɗi, fukunayna kaw ka ci lasta.","Vôʼôlaʼan ane betit ba tat! Mimbame biyem mia ndeñ li a li, amu teke fe bidi ya di. toʼo na mintômba, mie fe mia wu.","Cinam ginewey matuwam! Sla taˀ gezleŋ, a ram taˀ dibiɗ lambaˀ: asi li zum ginewey anta. Ko tumuŋ ati ˀaway kwana, ara ngizlam.","Dabbaaji ɗon mbooka. Tokke na'i ɗon ngiilo, ɗi ngalaa durduɗe. Koo tokke dammooji boo ɗon njara bone. ","Dabbaaji ɗon mbooka. Tokke na'i ɗon ngiilo, ɗi ngalaa durduɗe. Koo tokke dammooji boo ɗon njara bone. ",Ɛ̀nɛ̀ zíí gee dɔma-a nɛ o mɔ-dai dɔm; ndai zɔk nɛ bɔnɛ wen wa bó nɛ̀ nyɔŋmɔ ɓɔna; bɔnɛ tika zu o sami mbɛt.,Ɛ̀nɛ̀ zíí gee dɔma-a nɛ o mɔ-dai dɔm; ndai zɔk nɛ bɔnɛ wen wa bó nɛ̀ nyɔŋmɔ ɓɔna; bɔnɛ tika zu o sami mbɛt.,"Fama mə nehwene ta wəshi keseɗa gi! Ndeŋe yandeŋe yɛ sla dzeyi te yayata ŋkwa, va nya ɗema gwəzə mba va hɛ. Pa le timɛti kadene.",Horogren wo nen coocoo ëala! Deren wo go de gayri werga hoçoç bay wa. Fiirin wo de saçaçren wo dra' wo ti bon lay.
JOL.1.19," Je crie vers vous, Yahweh ; car le feu a dévoré les pâturages du désert, la flamme a brûlé tous les arbres des champs.","O  Lord , to thee will I cry: for the fire hath devoured the pastures of the wilderness, and the flame hath burned all the trees of the field.","Nan siwel zawn taŋ naŋu, Ma-Vatɗina, kay kut ŋal liyn ma beɗna hay fuldawa, kay sin-kuta ŋal gu ma hay sinenawa goy kafe.","A Nti ma yône be wo! Nduan ja diʼi biloʼo yʼôzôm, minkabaʼa mi nduan mia diʼi bilé bise ya mefup.","Ya matil mi na ng'avi ka Bumbulvuŋ: vu ara zuma li jigina ginewey a ɓuh, irne vu njilim njilim, ara zuma widis ngir guvahaya cek.","Yaa Jawmiraawo, mi ɗon toro ma, ngam yiite nyaami durduɗe nder ladde, ɗemŋgal yiite wuli leɗɗe ladde fuu. ","Yaa Jawmiraawo, mi ɗon toro ma, ngam yiite nyaami durduɗe nder ladde, ɗemŋgal yiite wuli leɗɗe ladde fuu. ","Mi ai nɛ nú sitɛ‘nɛ́, GASA WAN, wen wee dɔ nɛ zɔ̧ fara nɛ o ndai nyɔŋ mɔ sɛnɛ; leɓe-wee dɔɔ o te zaŋbɛɛ lɛŋ a nu.","Mi ai nɛ nú sitɛ‘nɛ́, GASA WAN, wen wee dɔ nɛ zɔ̧ fara nɛ o ndai nyɔŋ mɔ sɛnɛ; leɓe-wee dɔɔ o te zaŋbɛɛ lɛŋ a nu.","Mahwətə, katsa ŋa lewela 'ya! Kwa nza ŋkɛ katere gwəzə nyi hwa gamba ghwə, katse pɛtɛa wəfe nyi kwamte ghwə.","Manwuri, ndi joñ kuwuy wo mo, werga wuu roë fi ma mbasgan wo go mono. AÀ saw koore ma äil payn wo go lay."
JOL.1.20," Les bêtes sauvages mêmes brament après vous, parce que les courants d'eau sont à sec, et que le feu a dévoré les pâturages du désert.","The beasts of the field cry also unto thee: for the rivers of waters are dried up, and the fire hath devoured the pastures of the wilderness.",Muuriyan ma hay sinen kaw ka siwel taŋu; kay niyn-ɓatna soy goyo. Liyn ma beɗna hay fulda kut ŋalamawa goyo.,"Betite ya fé bebiene fe ba kôñelane nlô wop mfaʼa ô né, amu atôñe mendim e maneya vele. Nduan ja diʼi biloʼo yʼôzôm.","Ko gwat misãmi ngi ɓuhoy kwana, ara mbiɗam hiri ng'avi ka: Mizaway a hisikam le ngbasl ngbasl, yo vu ara zuma li jigina ginewey a ɓuh.","Koo dabbaaji ladde boo ɗon laaha heedi maaɗa, ngam maahoy ɓeeɓi, yiite nyaami durduɗe nder ladde.","Koo dabbaaji ladde boo ɗon laaha heedi maaɗa, ngam maahoy ɓeeɓi, yiite nyaami durduɗe nder ladde.",O saɗi-zaŋbɛɛ zik nɛ tɛ pii tɛ‘nɛ́; foka-yì ɔ̧sa̧ gɔn mgbót-mgbót. Zɔ̧ fara nɛ o ndai nyɔŋ mɔ sɛnɛ bia wee lɛŋ.,O saɗi-zaŋbɛɛ zik nɛ tɛ pii tɛ‘nɛ́; foka-yì ɔ̧sa̧ gɔn mgbót-mgbót. Zɔ̧ fara nɛ o ndai nyɔŋ mɔ sɛnɛ bia wee lɛŋ.,"Pa le wəshi keseɗa nyi hwa gamba kazhɛre geva laka gha, kwa nza ŋkɛ nahe yɛ hələ kehasenji, katere gwəzə nyi hwa gamba ghwə.","Nayre ma mbasga wo de rage na diñ mo ti, werga gloñren oçg wo go äuy, Day wuu roë fi ma mbasgan go äuy lay."
JOL.2.1," Sonnez du cor en Sion, et sonnez de la trompette sur ma sainte montagne ! Que tous les habitants du pays tremblent, car le jour de Yahweh vient, car il est proche !","Blow ye the trumpet in Zion, and sound an alarm in my holy mountain: let all the inhabitants of the land tremble: for the day of the  Lord  cometh, for it is nigh at hand;","Buwgi togolomna hay Siyon, buwgit kulo ŋolo kay hiɗiyta van ta peldetta, a sum sa hay nagatna tuwsi ma visi bat-bat'. Kay buura vi Ma-Vatɗina ka ma'a, kay nam ka goboyo,","Loñane toñe nlak e Sioñ! Yôtaʼane tyiñ e nkôle wom ô nʼétyi! Bôte bese be too si nyô be fôʼôbaʼan! Amu môse Nti wo zu, amu ô ntoo bebé.","Fam tulum a Siyoŋ, wudam deŋ a muwã ɗu  mipal  ! Anja mizli ngi si ruwuyoy gar, a jijikam kirkir: asi hin ngi Bumbulvuŋ ara ndilo gweˀe.","Puufe luwal konu haa Siyona, koole dow hooseere Jawmiraawo seniinde. Yimɓe lesdi fuu ndiwna, ngam nyalaade Jawmiraawo ɓaditake. ","Puufe luwal konu haa Siyona, koole dow hooseere Jawmiraawo seniinde. Yimɓe lesdi fuu ndiwna, ngam nyalaade Jawmiraawo ɓaditake. ","Ɛ̀nɛ̀ dɔ́m zak zu sa̧a̧ kaya  Siɔŋ  mbaŋ nɛ tɛ o bíí; ɛnɛ o bíí nu’ɛ lɛŋ, tɛ‘nɛ́ a̧ nak, wese ko GASA WAN a̧ tɛ‘i, wese'i hɛɗa kaɗi.","Ɛ̀nɛ̀ dɔ́m zak zu sa̧a̧ kaya  Siɔŋ  mbaŋ nɛ tɛ o bíí; ɛnɛ o bíí nu’ɛ lɛŋ, tɛ‘nɛ́ a̧ nak, wese ko GASA WAN a̧ tɛ‘i, wese'i hɛɗa kaɗi.","Vɛ mə tereme pelɛ Siyon, tsa mə lewela pelɛ ghweme nya keveyi geva tekeleke. Bare bare pɛtɛa mbeli nyi te hɛɗi, kwa nza ŋkɛ se yase vecia Mahwətə, takwa takwa ŋkɛ kase.","'Wad wee coçoç ma puçy jar Siyoñ wo go! Ëii wee ti huuli äi ma bay ëag no, 'wad wee ne! Daga jar ma äi sirn äuy mo daë wo, Gahaçyla wur mani Manwurn le de age, aà go de kosge."
JOL.2.2," Jour de ténèbres et d'obscurité, jour de nuages et de sombre nuée ! Comme l'aurore qui s'étend sur les montagnes, un peuple  vient , nombreux et fort, tel qu'il n'y en a jamais eu depuis l'origine, et qu'il n'y en aura pas après lui, jusqu'aux années des âges les plus lointains.","A day of darkness and of gloominess, a day of clouds and of thick darkness, as the morning spread upon the mountains: a great people and a strong; there hath not been ever the like, neither shall be any more after it, even to the years of many generations.","buur ma jufun nil'; buura vi ɗugulla hiɗi liyn ma duk gaana, nam ka co'o, ki liyn ma tun caw cal goy grawtna vul haraŋa valami jew tam hiɗiyn nala. Duwgi jaf-sumun ŋolo, dono'o kaw natige. Nay bay wi sum sa kisi nisi nala tuwa, vok ɗaw kaw nay as a wi sum sara kisi nisi naɗi lay.","Môs ô ne dibi a ékukut môs ô ne nkut ne ziʼili. wo zu ane melenda me tyé e minkôle yôp. Tame yen ane nkane bitandak wo zu, bi too abui a angôndô, éfunan anʼalu e minkôle yôp. Avale jame di e ngenane te tame yené, a ba ye bo te beta yene de.","I hin ngi luvuŋ, luvuŋ titira mihezek hezek, hin ngi gazlavay, gazlavay titira lozoŋ lozoŋ. Keɗ na, mizli sirgiɗim, mizli migidaŋhay, sirit hirnga muwãkaɓa li mawun maga hirnga muwã njahha zlar, ko a puram gwat kanah ɗaˀ ta, yo tumbuŋ kwana anta sa puram kanah mata ndiɗaˀ wãˀ, hã avu dideˀ ngi misin ti wakahay.","Ɗum nyalaade nyiɓre nyiɓɓunde, nde nyalaade duule naarginanɗe. Ummaatoore mawnde semmbiɗnde ɗon sudda kooseeje bana jayŋgol fajiri. Irin ummaatoore nde'e meeɗaay laataago sam, irin maare meetataa laataago haa duuɓi ɓuranɗi daayaago boo. ","Ɗum nyalaade nyiɓre nyiɓɓunde, nde nyalaade duule naarginanɗe. Ummaatoore mawnde semmbiɗnde ɗon sudda kooseeje bana jayŋgol fajiri. Irin ummaatoore nde'e meeɗaay laataago sam, irin maare meetataa laataago haa duuɓi ɓuranɗi daayaago boo. ","Wese'i nɛ wese ɗuka tum, wese tu̧-zan in zɔm kutu. O gii gba-dɔya a̧ tɛ‘i hee mɔ'ɔ nɛ zɛ de nɛnɛ zu o kaya ga; wa ɔ dɔka in wa ɔ ŋgaya. Wi tɛ zɔk pɛrti mɔ hegɔ nɛti na, in wi beka zɔk hegɔ woyo ɓɔna hɔ nɛnɛ tɛ o bezaŋ mɛ ɗoŋ mɛ.","Wese'i nɛ wese ɗuka tum, wese tu̧-zan in zɔm kutu. O gii gba-dɔya a̧ tɛ‘i hee mɔ'ɔ nɛ zɛ de nɛnɛ zu o kaya ga; wa ɔ dɔka in wa ɔ ŋgaya. Wi tɛ zɔk pɛrti mɔ hegɔ nɛti na, in wi beka zɔk hegɔ woyo ɓɔna hɔ nɛnɛ tɛ o bezaŋ mɛ ɗoŋ mɛ.","Nahe ŋkɛ kenza kavecia ŋkwesle ba'a viɗi, kavecia ləmbə ba'a meləkwə ləkwə. Se yase ləmbəa yɛ dzale, nahe hɛ kenza kwele kwele ba'a keberete beretenji, yipə yipə le viɗi nya kedəpə geva kənəa yɛ ghweme. Kegha mbeli kanakɛ wəsə nya kala nyagha we, katezhɛne mbeli kanakɛ ŋkɛ tɛape we.","Wur sen diñ wur suñgu ma ëiligi, aà diñ wur legar wo de saçy. AÀ joñ ge do suñgu maga le' yoo huuli nono. Koëa, jar po ma ngaäa de eegre debañ wo le de age. AÈ hay ko te äaara ti boñ gaa, aè ko ge ra wo pel gaa so lay."
JOL.2.3," Devant lui le feu dévore, et derrière lui la flamme brûle. Le pays est comme un jardin d'Éden devant lui, et derrière lui, c'est un désert dévasté ; rien ne lui échappe.","A fire devoureth before them; and behind them a flame burneth: the land is as the garden of Eden before them, and behind them a desolate wilderness; yea, and nothing shall escape them.","Voksiya kut ka ŋala, bugolsiya sin-kuta ka tileka. Nagat ay jew ki sinen eden nala, may hay buur namna nagat muɗi mi ful ma wiŋŋa, kay va ne' kaw hin kuɗ kut noŋɗi.","Ba ndamane jôm ése ba koone je avalʼane nduan ja diʼi a tyame biôm, e mvuse jap ba liʼi ve si si. Te na be lôté, si é mbe afub Eden, mvuse valé, é ntoo ve biliʼi ya ko woñ: teke jôm é nga famelane be!","Vu ara zuma li a mbuŋ taŋ, yo ti dirba taŋ i irneˀ vu mazlizlira li, hirwuyo naŋ a mbuŋ taŋ kaɓa guva a Eden zleˀe, amma ti dirba taŋ, li a ndir kirɗak kirɗak cay. Ko gwat loŋ malih ava anta.","Yiite nyaamooye ɗon haa yeeso maare, ɗemŋgal yiite ɗon wula haa ɓaawo maare. Hiddeko nde wara, lesdi nanndi bee jarne Adnin. Ɓaawo nde dilli, ndi laati ladde meere, walaa koo ɗume daɗata. ","Yiite nyaamooye ɗon haa yeeso maare, ɗemŋgal yiite ɗon wula haa ɓaawo maare. Hiddeko nde wara, lesdi nanndi bee jarne Adnin. Ɓaawo nde dilli, ndi laati ladde meere, walaa koo ɗume daɗata. ","Wa ɗaŋ nɛ o mɔ ti wa lɛŋ hee wee nɛ bíí zɔ̧'ɛ ga; nɛ̀ ɗoŋ-wa nɛ́ leɓe-wee a̧ ndar mɔ nɛnɛ. Nɛti hɔa-a kɔ-wa, nu duka so nɛ́ de mbɔŋgi hee Fɔ Edɛn ga; ɗoŋ yaka-a kɔ-wa, nu kifa nɛ gee ŋga-gbárà; ŋma mɔ nɛ wa ee duk bo na.","Wa ɗaŋ nɛ o mɔ ti wa lɛŋ hee wee nɛ bíí zɔ̧'ɛ ga; nɛ̀ ɗoŋ-wa nɛ́ leɓe-wee a̧ ndar mɔ nɛnɛ. Nɛti hɔa-a kɔ-wa, nu duka so nɛ́ de mbɔŋgi hee Fɔ Edɛn ga; ɗoŋ yaka-a kɔ-wa, nu kifa nɛ gee ŋga-gbárà; ŋma mɔ nɛ wa ee duk bo na.","Kala ghwə nya ketere ŋkwa ne, kazeme pɛtɛa wəshi hɛ mbe kema ta nci ba'a dɛrɛŋe rɛŋe nza ŋkwa kwa sebe ta nci. Ma tewə hɛ kese ne, kala ntsa ta Ɛdɛn se ŋkwa nya te hɛɗi, ama kwetere wəmbəa nci ne, ɓerama nya dɛrɛŋe rɛŋe ya shɛ. Wəsə shɛ kembele yitea hɛ we.","Wuu ma roë jar pel äaara, wuu ma yaçaçge nen blam äaara lay. Sir se maga hay do pay Eden no no, gwa' ge yañ go diñ puuli ma poëag poëage. Mopo gwa' ge jag äaara ni gaa hase."
JOL.2.4," Son aspect est comme l'aspect des chevaux, et ils courent comme des cavaliers.","The appearance of them is as the appearance of horses; and as horsemen, so shall they run.",Naŋ ɗuwsi kayn nisi ŋray ca ki kulumayn ma sumun ɓe kalamu kay jaŋamu nala.,"O yeʼe jô na nkane bikabela, nge na bewulu bikabela ba sembʼôsu.","A bam vu ati pilisey, a kilam kaɓa mipi mi ti pilisey.","Nde nanndi bee pucci, nde doggan bana pucci ba'eteeɗi ngam konu. ","Nde nanndi bee pucci, nde doggan bana pucci ba'eteeɗi ngam konu. ",Wa ya hee o nyaŋa ga; wa ma yi hee o nyaŋa-biro ga.,Wa ya hee o nyaŋa ga; wa ma yi hee o nyaŋa-biro ga.,"Nahe hɛ kenza kala gədəwəa lɛmə, kahwɛ hɛ kala ka zleɗe gədəwəa lɛmə.",Ndo ko ra aà ëee wo do piiri maga aè de ya' ra ge nono.
JOL.2.5,"  On entend  comme un bruit de chars, qui bondiraient sur les sommets des montagnes !  c'est  comme le bruit de la flamme de feu, qui dévore le chaume ; c'est comme un peuple robuste, rangé en bataille.","Like the noise of chariots on the tops of mountains shall they leap, like the noise of a flame of fire that devoureth the stubble, as a strong people set in battle array.","Naŋ jak humaŋ tisi kayni, suwana visi ki suwana keke-ma-duura, ma ka jaŋ kulo kay yam hiɗiyt nala, ki suwana vi kuta, hay li ma na' ka ŋal hosona hay fulda nala. Ki soje sa donona ka kot tuwsi kay tuɗ vun duura nala.","Ba yôô akôlô nkôle wu a kui wu ôvok wo ye buni na wo wôʼô éduñe bevagoñ bita, nge ntôtane minkabaʼa mi nduan mia diʼi minkôte bilok. Ba zu ane nsamba ô ne ngu, be tele minnoñ asu ya wosan.","A hurumom kaɓa mota ngi vurumoy majiɗam a hirnga muwã, kaɓa hurum ngi vu mandisl ar li wura giziŋ muˀuloŋ, kaɓa mizli migidaŋhay micinjaham le ngi gi vurum.","Bana hoolo mootaaji pucci, non hoolo maare dow geereeje kooseeje. Bana hoolo yiite nyaamanŋge tiitiiho, bana ummaatoore semmbiɗnde taaskaniinde haɓre, non nde wa'i . ","Bana hoolo mootaaji pucci, non hoolo maare dow geereeje kooseeje. Bana hoolo yiite nyaamanŋge tiitiiho, bana ummaatoore semmbiɗnde taaskaniinde haɓre, non nde wa'i . ","Wa kpíɗí nɛ o zu kaya nɛnɛ, ɓɛɛ duk hee wi zii nɛ giti o keekee-biro in hee tuɓa-a ko leɓe-wee nɛ bíí kora zɔ̧'ɛ ga. Wa tɛ hee o ŋga dukbíí nɛ nɛka wen biro ga.","Wa kpíɗí nɛ o zu kaya nɛnɛ, ɓɛɛ duk hee wi zii nɛ giti o keekee-biro in hee tuɓa-a ko leɓe-wee nɛ bíí kora zɔ̧'ɛ ga. Wa tɛ hee o ŋga dukbíí nɛ nɛka wen biro ga.",Kagaka hɛ kala yɛ wəmata gədəwə nyi kehwɛ dzeyi kwa ghəa yɛ ghweme keɗema kala ghwə nya ketse te vegheme. Kase hɛ kala ka sewajɛ nyi berete berete nyi kepate geva yitea mpa.,Ngarge jag äaara do pus durgi maga wo de ëii huuli nono. AÀ car wo poçoç do wuu maga de roë fi nono. AÀ wo do jar maga wo wo ti poçoç nono.
JOL.2.6," Devant lui les peuples tremblent d'effroi, tous les visages pâlissent. ",Before their face the people shall be much pained: all faces shall gather blackness.,Sumun tuwsi visi kisi bat-bat'. Ir sumun ka zoɓ gaa'a.,"Eyoñ ba subu bebé môt ase a ko woñ, woñ wo bo mesu mese ékukut.","Mizli a jijikam ngbaˀ ngbaˀ a mbuŋ taŋ, mihiri taŋhay a mbiɗam ndiryik ndiryik.","Ummaatooje ɗon ndiwna yeeso maare, geese fuu ɗon purɗa. ","Ummaatooje ɗon ndiwna yeeso maare, geese fuu ɗon purɗa. ","Tɛ hɔa-a kɔ-wa, tɛ o dukbíí gbina gbɛlɛsuwɛɛ, ɓɛɛ kíì dee ha̧ sɔnti-wa mɛ kpai.","Tɛ hɔa-a kɔ-wa, tɛ o dukbíí gbina gbɛlɛsuwɛɛ, ɓɛɛ kíì dee ha̧ sɔnti-wa mɛ kpai.","Nakɛma ta mbeli ke hɛ ne, kabare bare mbeli, kazhɛre pɛtɛa yɛ kema tɛarawe rawe.","Jar maga aà wo le de seege ne hara ti caa wo heçeçne go äuy, Ti bii go nen äaara ta'ta' äuy lay."
JOL.2.7," Ils courent comme des héros ; ils escaladent la muraille comme des hommes de guerre ; ils marchent chacun dans leurs sentiers, ils ne confondent pas leurs routes.","They shall run like mighty men; they shall climb the wall like men of war; and they shall march every one on his ways, and they shall not break their ranks:","Nisi tuɗ voksiya ki sum sa tuɗ vun duura nala, nisi pir kay gulmunna ki sum sa tuɗ li duura nala; gigekaw iram cuki vokom hay hagata valam ŋiresl, cal hagata valam goyɗi.","Ba ke wosan ane bezimbi, ba bete mimfin ane bewosan. Môt ase a ke nlô ô tele ôsu vié teke yale fefele ya zene jé.","A kilam kaɓa sojehey, a tuwuɗaka moholoyo, kaɓa migi vurumoy. mbur gar muɗuva dibiɗe le taˀ na, aru si, t'anta ngizlam mbak jiviɗe neˀ le ta.","Nde ɗon yaawa bana honooɓe semmbiɗɓe, nde ɗon wa'o mahi taariiɗi berniiji bana waawɓe konu. Gooto gooto fuu ɗon tokko laawol mum, walaa mo selata sam. ","Nde ɗon yaawa bana honooɓe semmbiɗɓe, nde ɗon wa'o mahi taariiɗi berniiji bana waawɓe konu. Gooto gooto fuu ɗon tokko laawol mum, walaa mo selata sam. ","O gba-dɔya tik biro hee o ŋga-wi ga, wa daŋ garo hee o wi-biro ga, kóó o nde ba nɛ yuwar kɔ‘i; wa a̧r war na.","O gba-dɔya tik biro hee o ŋga-wi ga, wa daŋ garo hee o wi-biro ga, kóó o nde ba nɛ yuwar kɔ‘i; wa a̧r war na.","Kahwɛ hɛ kala ka katsala kɛfi, kadzawa hɛ wəmbəa zli kala ka sewajɛ. Yayata wəndə kadzeghwa tiɗiɗi mbe kema ta ŋkɛ, kaɗema kasame kwa hweŋkwa ta ŋkɛ.","AÀ ëe wo do blumri wo nono, yoor wo go ne kor ti do sode wo nono. Wosela äuy yoo äaara ti faage ma äe day cel go gaè."
JOL.2.8," Ils ne se poussent point les uns les autres, chacun va dans son chemin ; ils se précipitent au travers des traits, et ils ne rompent point  leurs rangs .","Neither shall one thrust another; they shall walk every one in his path: and when they fall upon the sword, they shall not be wounded.","Nisi may tupa tam tuwsi noŋɗi, gigekaw wum mi liyn ma nam coli hayamna, nisi tuɗ tam liyn ma voksina, va ma telsi a ɦur voksiɗin mayɗi.",Be nji tômetan amu môt ase a baʼale nnoñ wé a tôñe zene jé. Ba tulan jôm ése ja tebe be ngame yat a bo be ékolé ôbak; teke jôm é ne ngul ya telé dulu dap.,"Ko mbur mahizigiɗa cala anta, asi mbur gar a sipi jiviɗ naŋ cirre. Ko gwat fuk a mbuŋ taŋ kwana, a cohom kwaŋ kwaŋ, anta zliɗa taŋ hirnga ta wãˀ.","Walaa mo yerɓata goɗɗo, koo moy ɗon tiito yeeso muuɗum. Ɓe ɗon caalo caka kuri, walaa ko darnata ɓe. ","Walaa mo yerɓata goɗɗo, koo moy ɗon tiito yeeso muuɗum. Ɓe ɗon caalo caka kuri, walaa ko darnata ɓe. ",Wa gɔn ti ŋmaa na; kóó o nde ba nɛ yuwar kɔ‘i tan ti. Kɔ-wa nɛ yaka zu mɔ nɛ gɔn ti wa; ŋma mɔ nyɛm mɛ dor wa na.,Wa gɔn ti ŋmaa na; kóó o nde ba nɛ yuwar kɔ‘i tan ti. Kɔ-wa nɛ yaka zu mɔ nɛ gɔn ti wa; ŋma mɔ nyɛm mɛ dor wa na.,"Wəndə shɛ katsəkwə kwete wəndə we, yayata wəndə kadzeghwa tiɗiɗi. Kahwɛ hɛ dzate hwa yɛ have, kaɗema kasame kwa zəɗə.","Je ma daw keçeç bay yoo äaara ni wa. Wosela äuy see pel äe de deele. AÀ yoor wo go ne feçeç wo ti, fen po ma dig rage bay wa hase."
JOL.2.9," Ils se répandent dans la ville, ils courent sur le mur, ils montent dans les maisons ; ils entrent par les fenêtres, comme le voleur.","They shall run to and fro in the city; they shall run upon the wall, they shall climb up upon the houses; they shall enter in at the windows like a thief.","Nisi mer goy hay hoyok-ziyna, jaŋ kulo kay gulmunna, jik kulo kay ziyna, cuk hay ir-ziyna ki sa ma kulla nala.","Ba mialan e tison été, ba mate mimbil e mimfine mekok , ba nyiine menda, be lôte bevundi ane miñwuwup.","A cam a ngiraka walahaya, a kilam ar moholoyo, a cam ngi hayaya, a jiɗam tir fenetirey kaɓa muhuloy.","Ɓe ɗon ukkano berniwol, ɓe ɗon njaawɗa dow mahol, ɓe mba'o dow cuuɗi, ɓe ɗon nastira ɗi gal burɗe maaji bana wuyɓe. ","Ɓe ɗon ukkano berniwol, ɓe ɗon njaawɗa dow mahol, ɓe mba'o dow cuuɗi, ɓe ɗon nastira ɗi gal burɗe maaji bana wuyɓe. ","Kɔ-wa nɛ pɛsa-a dam saaye, ma nɛ yi nɛ o zu ŋgeŋ, daŋ nɛ o tua, ye nɛnɛ nɛ o woi-aa hee o wi-zuzu ga.","Kɔ-wa nɛ pɛsa-a dam saaye, ma nɛ yi nɛ o zu ŋgeŋ, daŋ nɛ o tua, ye nɛnɛ nɛ o woi-aa hee o wi-zuzu ga.","Kahwɛ hɛ kalə kadzembe meleme, kahwɛ hɛ dzeyi te zli, kadzeki yɛ ghɛ hɛ dzawa te yɛ wəfela kala ka ghərəa kɛfi.","AÀ äug gi wo äi leege Jerusalem go, ëid ge wo go ciñ ti kor no, ciñ ti tiñ wo lay. AÀ lag ge wo go ti ywaale do je freñ wo nono."
JOL.2.10," Devant lui la terre tremble, les cieux s'ébranlent, le soleil et la lune s'obscurcissent, les étoiles perdent leur éclat.","The earth shall quake before them; the heavens shall tremble: the sun and the moon shall be dark, and the stars shall withdraw their shining:","Nagat ka wir voksiya, dukalawn geɗiya, fatta hiɗi tilla muɗi jufunu, mislekŋa vul haraŋa valam loɗi.","Si ja fôʼôban éyoñ ba zu bebé, Yôb ebiene fe vʼane jôm ja ye ku, jôp a ngon teke fe faé, ateté da dimili mfaane wop.","Hirwuy a jijik ngbir ngbir a mbuŋ taŋ, muŋ a wus zingit zingit ka ngi ndilawa, pas ati kiya a cam ar luvuŋ, yo wurzlaŋhay a mucaka hiri mbiˀ mbiˀ.","Lesdi dimmbi yeeso maare, asamanji ndiwni, naaŋge e lewru nyiɓɓi, koode boo acci yaynugo . ","Lesdi dimmbi yeeso maare, asamanji ndiwni, naaŋge e lewru nyiɓɓi, koode boo acci yaynugo . ","Ka wa nɛ siti ɓɛɛ nu nak nak ti wa; duk hee yiwese tɛ bin bin ga. Wese ba ɓɔna, o sɔra in nyaŋa-zɛ tok ɓɔna,","Ka wa nɛ siti ɓɛɛ nu nak nak ti wa; duk hee yiwese tɛ bin bin ga. Wese ba ɓɔna, o sɔra in nyaŋa-zɛ tok ɓɔna,","Ma kase hɛ ne, kagaŋkəɗə hɛɗi, kala wəsə nya ɗe ghweme kateɗe. Kanza veci ba'a tere ngərə ngərə, kazhɛne yɛ saseregwa kaɓele we.","Sirn äuy go de daëge do äaara. Ngeel ma ciñ doga se le go de le'ge gesiñ nono. Wur wo de few bay wo tee ngeel go wa so lay, Ger bay wo sagge wa lay."
JOL.2.11," Yahweh fait entendre sa voix à la tête de son armée ; car immense est son camp, car puissant est l'exécuteur de sa parole. Car le jour de Yahweh est grand et très redoutable ; et qui pourrait le soutenir ?",And the  Lord  shall utter his voice before his army: for his camp is very great: for he is strong that executeth his word: for the day of the  Lord  is great and very terrible; and who can abide it?,"Ma-Vatɗin di delem goy kir vok-ma-duura valamu; kay vokŋa valam ka ŋolo, sa nam cuksina nisi dono ŋolo; kay buura vi Ma-Vatɗin nam ŋolo, ɦuyumda kuɗum ŋolo kaw. Col digam ɗawn gige?","Nti a bete tyiñe jé ôsu ya nkane bita wé. Minsamba mia bo mebendé mé mi nʼabui a éko woñ. Yaa, môse Nti ô nʼangôndô, ékowoñ avale môt éziñ a ye bo teke nyiñ.","Bumbulvuŋ, naŋ ara ɓi ˀay kaˀ a muŋ, a mbuŋ soje naŋhaya. Soje naŋhaya taŋ haɗa teˀe: yo migi gwat, naŋ maɓa ɓi naŋ na, naŋ gidaŋ. Hin ngi Bumbulvuŋ i hin madiɗaŋ, a gi zluwun haɗi wãˀa: mbur maɓusa gu ada kwa?","Ngam Jawmiraawo hooli yeeso jama'aare konu muuɗum. Jama'aare maako ɗuuɗnde masin, hiɓɓinooɓe muuyo maako mari baawɗe. Ngam nyalaade Jawmiraawo laatoto mawnde, hulniinde masin. Moy waawata ɓusugo nde ?","Ngam Jawmiraawo hooli yeeso jama'aare konu muuɗum. Jama'aare maako ɗuuɗnde masin, hiɓɓinooɓe muuyo maako mari baawɗe. Ngam nyalaade Jawmiraawo laatoto mawnde, hulniinde masin. Moy waawata ɓusugo nde ?",ɓɛɛ tiger GASA WAN mgbimgbi ti o wi-biro kɔ‘i; o duk wi-biro nɛ zii wen nú-a ɔ dɔka in wa ɔ ŋgaya. Wese ko GASA WAN tɛ duk nɛ ŋga wese nɛ tɛ pi̧ kíì tɛ bíí. Nɛ o'o tɛ kpasi wese'i o?,ɓɛɛ tiger GASA WAN mgbimgbi ti o wi-biro kɔ‘i; o duk wi-biro nɛ zii wen nú-a ɔ dɔka in wa ɔ ŋgaya. Wese ko GASA WAN tɛ duk nɛ ŋga wese nɛ tɛ pi̧ kíì tɛ bíí. Nɛ o'o tɛ kpasi wese'i o?,"Kaŋgezle Mahwətə te kema ta ka sewajɛa ŋkɛ. Nahe ka sewajɛ nyi kefa nda ghena kenza kwele kwele ba'a keberete beretenji. Kaganda ne, nahe vecia Mahwətə kenza dzawe, dzawe fate fate. Wa nde nza kasəwəte ŋkɛ wa?","Manwur de see äe pel sode äen wo. Gahaçyla sode äen wo ngaäa, je äag jag waçaçre äen go de eegre. AÀ joñ wo heçeçne ne jare. Kidolgi, wur mani Manwurn diñ wur ma kluu, aà joñ heçeçne ne jar debañ. Wose kaçaç ge ma ooge pel äe la?"
