livre.chapitre.verset,Francais,Anglais,BIBALDA_TA_PELDETTA,Bulu,Guiziga,Fulfulde_Adamaoua,Fulfulde_DC,KALATA_KO_SC_Gbaya,KALATA_KO_DC_Gbaya,Kapsiki_DC,Tupurri
JOL.1.1," Parole de Yahweh qui fut  adressée  à Joël, fils de Phatuel.",The word of the  Lord  that came to Joel the son of Pethuel.,"Ma-Vatɗina di yoboyn tam Jowel, goora vi Petuwel ala:","Nkobô Nti wu ô nga kui be Yôél, e mone Pétuél.","Bumbulvuŋ miɓa ɓi da Zowel, mangal ngi Petuwel.","Jawmiraawo wolwani Yo'el ɓii Petuwel, wi'i:","Jawmiraawo wolwani Yo'el ɓii Petuwel, wi'i:",Wen nɛ GASA WAN tɔ̧ɔ̧ ha̧ Jɔɛl bem ko Pɛtuɛl nɛ mɔ'ɔ.,Wen nɛ GASA WAN tɔ̧ɔ̧ ha̧ Jɔɛl bem ko Pɛtuɛl nɛ mɔ'ɔ.,"Ghena nya gezete nda Mahwətə ke Zhowɛl, wəzege ta Petəwɛl.",Waçaçre maga Manwur waçaç ne Jowel je ni Petuweln mono.
JOL.1.2," Écoutez ceci, vieillards ; prêtez l'oreille,  vous  tous habitants du pays ! Pareille chose est-elle arrivée de vos jours, ou bien dans les jours de vos pères ?","Hear this, ye old men, and give ear, all ye inhabitants of the land. Hath this been in your days, or even in the days of your fathers?","Humgi dit kayni nigi sa maariyana, jakgi humgiya, nigi sum sa hay nagat kafna, law ta ki kayn nala li kir sumaygi ka li su? Lebo li kirgi nigi ka li su?","Vôʼôlaʼane jame dina, a mia bemvendé be bôt kuʼane melo menane mese a mia bôt mi too Yuda! Ye avale jame di e tameya boban nté mi nyiñeya, nge melu benyô mvam ?","Kum mizli micawwahay, cinam ɗagay, kum mizli ngi si ruwuy Zudahay gar, jikaka slimiɗe. Gwat misi kahana a gi le ɗaˀ mur kumo malla mur dideˀ kumoyo kwa?","Onon ndotti'en, nane ko mbi'anmi! Onon jooɗiiɓe lesdi Yahuuda fuu, keɗite! Irin ɗu'um meeɗi laataago nder nyalɗe mooɗon koo nder nyalɗe kaakiraaɓe mooɗon na? ","Onon ndotti'en, nane ko mbi'anmi! Onon jooɗiiɓe lesdi Yahuuda fuu, keɗite! Irin ɗu'um meeɗi laataago nder nyalɗe mooɗon koo nder nyalɗe kaakiraaɓe mooɗon na? ","Ɛnɛ o  kuti-wi , ɛ̀nɛ̀ zíí wen’ɛ; ɛnɛ o bíí nu Juda lɛŋ, ɛ̀nɛ̀ yéŋ zer'nɛ́. Pɛrti mɔ hegɔ hɔɔ tɛ ŋgimbi k’ɛ́nɛ́, kóó tɛ ŋgimbi ko o zɔmdáa k’ɛ́nɛ́ nɛti kaɗi?","Ɛnɛ o  kuti-wi , ɛ̀nɛ̀ zíí wen’ɛ; ɛnɛ o bíí nu Juda lɛŋ, ɛ̀nɛ̀ yéŋ zer'nɛ́. Pɛrti mɔ hegɔ hɔɔ tɛ ŋgimbi k’ɛ́nɛ́, kóó tɛ ŋgimbi ko o zɔmdáa k’ɛ́nɛ́ nɛti kaɗi?","Gheyɛ mbelia jama, fa mə ghena nya, gheyɛ pɛtɛa ka Zhəwda, ghwene mə sleme. Nahe wəsə nya kala nya kegha kamenete geva te vəa ŋayɛ keɗema te vəa ka shihɛ ŋayɛ na?","Laa wee waçaçre ma kay no, nday jar kluuri no! Co' wee sug äay, nday äuy jar ma äi sir Juda no! Ree ma dosen no kay joñ mbe we ti boñ nen äay, Noga nen paçaçre äay wo yawla?"
JOL.1.3," Faites-en le récit à vos enfants, et vos enfants à leurs enfants, et leurs enfants à une autre génération.","Tell ye your children of it, and let your children tell their children, and their children another generation.","Nigi ma vi labar namna mi gurona vigiya, gurona vigi ma vi labar namna tam guro-misina. guro-misina ma vi labar namna tam jafsi voksi ɗaw.","Kañetaʼane jame te e be bone benan, a bone benane ki e be bone bap a bone bap e be miaé wo tôñe valé!","Slufaka ɓi nah da ziri kumoy, ziri kumoy a sa slufaka da ziri taŋhay, yo taŋ kwana, a sa slufaka da tizer taŋ nga mbuŋ ya.","Ngecce ɗum ɓiɓɓe mooɗon, ɓiɓɓe mooɗon boo ngecca ɗum ɓiɓɓe muuɗum'en. Kamɓe fahin ngecca ɗum yidere warannde ɓaawoɗon. ","Ngecce ɗum ɓiɓɓe mooɗon, ɓiɓɓe mooɗon boo ngecca ɗum ɓiɓɓe muuɗum'en. Kamɓe fahin ngecca ɗum yidere warannde ɓaawoɗon. ","Ɛ̀nɛ̀ tɔ̧́ nyɛrɛ mɔ'ɔ ha̧ o bem k’ɛ́nɛ́, ɓɛɛ o bem k’ɛ́nɛ́ tɔ̧ɔ̧ kɔ‘i ha̧ o bezaŋ-wa, ɓɛɛ o bezaŋ tɔ̧ɔ̧ ha̧ o bezaŋ mɛ ɗoŋ.","Ɛ̀nɛ̀ tɔ̧́ nyɛrɛ mɔ'ɔ ha̧ o bem k’ɛ́nɛ́, ɓɛɛ o bem k’ɛ́nɛ́ tɔ̧ɔ̧ kɔ‘i ha̧ o bezaŋ-wa, ɓɛɛ o bezaŋ tɔ̧ɔ̧ ha̧ o bezaŋ mɛ ɗoŋ.","Ɓela nda mə ghena shɛ ke ŋwalea ŋayɛ, kateɓela nda ŋkɛ hɛ ke ŋwalea nci, kezha ɓela nda ŋkɛ ŋwalea nci ke mbeli nyi keteya kwa sebe ta nci.","Fern wee ne weere äay wo nen maga aà mo fern wo ne weere äaara wo, Day weere äaara mo siin wo ne jar ni äaara wo lay."
JOL.1.4," Ce qu'a laissé le gazam, la sauterelle l'a dévoré ; ce qu'a laissé la sauterelle, le yéleq l'a dévoré ; ce qu'a laissé le yéleq, le chasil l'a dévoré.",That which the palmerworm hath left hath the locust eaten; and that which the locust hath left hath the cankerworm eaten; and that which the cankerworm hath left hath the caterpiller eaten.,"Wa ma hin kuɗ bar ɓok-ɓokona, baar-jeren tumawa, wa ma hin kuɗ baar-jerena, girim-girim tumawa, wa ma hin kuɗ girim-girimna, baar-bobon tumawa.","Jôme nkôñ ô nga lik, étandak é mineya je, a jôm étandak é liʼiya, aselek é diya je; jôm aselek é nga lik, mbaʼa a diya je.","Gwat ngi migam, misi mi ngi mumuyuŋ na, yuk a zuma le tirneˀ, yo misi mi ngi yuko, tuˀuf a zuma le tirneˀ, waɗ misi mi ngi tuˀufo, jaray a zuma le leɗeɗ.","Ko nyaamoowu acci, mbaɓɓattu nyaami ɗum. Ko mbaɓɓattu acci, ngilŋgu maagu nyaami ɗum. Ko ngilŋgu acci, ndo'u nyaami ɗum.","Ko nyaamoowu acci, mbaɓɓattu nyaami ɗum. Ko mbaɓɓattu acci, ngilŋgu maagu nyaami ɗum. Ko ngilŋgu acci, ndo'u nyaami ɗum.","Mɔ nɛ nàá-dɔɔsɔ̧ɔ̧ ea, nàá-wazala nyɔŋa. Mɔ nɛ nàá-wazala ea, nɛ́ gba-dɔya a̧ nyɔŋa; mɔ nɛ gba-dɔya ea, nɛ́ ndondo-gba-dɔya a̧ nyɔŋa yinɛ lɛŋ.","Mɔ nɛ nàá-dɔɔsɔ̧ɔ̧ ea, nàá-wazala nyɔŋa. Mɔ nɛ nàá-wazala ea, nɛ́ gba-dɔya a̧ nyɔŋa; mɔ nɛ gba-dɔya ea, nɛ́ ndondo-gba-dɔya a̧ nyɔŋa yinɛ lɛŋ.","Ma wəshi nyi ketene yitea mɛa yɛ geteɗə te wəve ne, nahe yɛ dzale kezehwe hɛ. Ma nyi ketene yitea mɛa yɛ dzale ne, nahe yɛ zhamaya kezehwe hɛ. Ma nyi ketene yitea mɛa yɛ zhamaya ne, nahe yɛ jagha kezehwe hɛ.","Coore maga gwa' jag degornog ni mono, magalga reen go. Maga gwa' jag magalga ni mono, gejer reen go lay. Maga gwa' jag gejer ni mono, mapoë reen go äuy lay."
JOL.1.5," Réveillez-vous, ivrognes, et pleurez ;  vous  tous, buveurs de vin, lamentez-vous, à cause du vin nouveau ; car il vous est retiré de la bouche.","Awake, ye drunkards, and weep; and howl, all ye drinkers of wine, because of the new wine; for it is cut off from your mouth.","Zliygi kulo'o, nigi sum sa hiwiri kay dolayna, tiygiya. Kay vuɗ gulda-guldana ma li vin ma jibetna hiɗi namna, nigi ma fum loɗi.","Veʼan ayo, mia besoʼo bilam, mi yôn! Mia benyuu bilam, yônane mia bese; mia ye bo teke mfefé woon amu bibuma bi ndiʼi woone momo.","Kum muwam le, puɗkam, tuwam, kum misi mbaazlahay gar, tuwam kaɗam kaɗam, asi kum anta sa lumam mbaazla si mata.","Onon wuykooɓe, pine, mboye! Onon yarooɓe inaboojam, mboye, ngam inaboojam kesam ittaama e kunnduɗe mooɗon! ","Onon wuykooɓe, pine, mboye! Onon yarooɓe inaboojam, mboye, ngam inaboojam kesam ittaama e kunnduɗe mooɗon! ","Ɛ̀nɛ̀ tún, o wi-gbɛ-dɔ̧ɔ̧, ɛ̀nɛ̀ hí̧í̧ kɔ̧a̧; ɛnɛ o wi-nɔ-dɔ̧ɔ̧ lɛŋ, ɛ̀nɛ̀ áí nú‘nɛ́ wen nɛ̀ mbe dɔ̧ɔ̧ bo h’ɛ́nɛ́ mɛ nɔ ɓɔna.","Ɛ̀nɛ̀ tún, o wi-gbɛ-dɔ̧ɔ̧, ɛ̀nɛ̀ hí̧í̧ kɔ̧a̧; ɛnɛ o wi-nɔ-dɔ̧ɔ̧ lɛŋ, ɛ̀nɛ̀ áí nú‘nɛ́ wen nɛ̀ mbe dɔ̧ɔ̧ bo h’ɛ́nɛ́ mɛ nɔ ɓɔna.","Ka ghwəyi ghwəyi, feɗeghe mə ba'a nehwene mə! Gheyɛ pɛtɛa ka sa tɛ, ŋgaɗe mə ghəa ŋayɛ, katezhɛne tɛ mɛnɛfɛ kadzete mɛa ŋayɛ we.","Puçy wee go, nday jar taëge de yii no, laa wee ro! Law wee see äay, nday jar joo yii no! Gahaçyla, aè naa ge yii yañ go wee jage!"
JOL.1.6," Car un peuple est monté sur mon pays, puissant et innombrable ; ses dents sont des dents de lion, et il a des mâchoires de lionne.","For a nation is come up upon my land, strong, and without number, whose teeth are the teeth of a lion, and he hath the cheek teeth of a great lion.","Kay sum sa dono'o coyawa, nisi mok nagata vanawa, nisi dono ŋolo, sa as ŋaɓsiɗi, siysi ki siy zlon nala, Gaŋsi ki gaŋ zlo-tancat nala.","Nkane bitandak ô yianeya si jangan. Bi nʼayok, tekʼalañé, bia jiane jôm ése ane mesôñe me ngbwengbwem nge minkekeʼe mi ngale ngbwengbwem.","Mizli a zlaka hirwuy ɗu le ngi kiɗa vu, taŋ gidaŋ haɗi, yo a slufam ta. Taŋ ti sliŋ kaɓa ngi mobor, mi taŋhayakaɓa ngi madiya moboroy.","Ummaatoore semmbiɗnde, nde walaa limgal, ukkani lesdi am. Nyii'e maare nanndi bee nyii'e barooɗe, ƴakkirɗe maare bana ɗe mbarooga ndewa . ","Ummaatoore semmbiɗnde, nde walaa limgal, ukkani lesdi am. Nyii'e maare nanndi bee nyii'e barooɗe, ƴakkirɗe maare bana ɗe mbarooga ndewa . ","O gii gba-dɔya bi nɛ nu kɔ‘m, wa ɔ ŋgaya, wi nyɛm mɛ tɔr wa na; gba̧a̧-nin-wa nɛ́ nin dila, o goko-wa nɛ́ goko nana dila.","O gii gba-dɔya bi nɛ nu kɔ‘m, wa ɔ ŋgaya, wi nyɛm mɛ tɔr wa na; gba̧a̧-nin-wa nɛ́ nin dila, o goko-wa nɛ́ goko nana dila.","Nahe ləmbəa yɛ dzale kepesleyi geva te hɛɗia n'yɛ. Nahe hɛ kenza keberete beretenji, kaɓelate hɛ mbeli we. Nahe yɛ slene ta nci kenza kala ŋa nivɛrə, nahe yɛ ghweleme ta nci kenza kala ŋa ŋemalea nivɛrə.","Jar po wo de le' Israyel sir mani äi no. AÀ wo de eegre debañ, wo ngaäa debañ lay. Sañ äaara do sañ mingir nono. Way äaara do ma man mingir no lay."
JOL.1.7," Il a dévasté ma vigne, et mis en morceaux mon figuier ; il les a pelés complètement et abattus ; les rameaux sont devenus tout blancs.","He hath laid my vine waste, and barked my fig tree: he hath made it clean bare, and cast it away; the branches thereof are made white.","Nisi ɓulak sinena van ma gulda-guldanawa; gu-gumna vanu nisi kaam iramawa goy ne; ne', hom ɓulokomawa goyo, kaamawa goy gaa'a, hum gulda-guldana ɓoy goy haɓi.","Nkane te ô maneya di mefube mindiʼi miangan, a mane ndamane befigié bangan ne meñ. Ba mane kpwele be, a mane soé be bikôbe biap a liʼi ve bifumulu mintyaé.","A tiram ti guva ngi gudubun ɗu kirɗak kirɗak, a hiryaka guva ngi uruf ɗu liɓasl liɓasl wãˀ, a kurɗoko duba taŋhaya kuruɗ kuruɗ, a paka taŋ haŋ saɓaɓaɓa a ruwuy, mbak mihaŋ taŋhaya babara faw.","Nde wili inabohi am, nde yewi ibbi am, nde ɓolti ki fuu, lice maaki fuu purɗi.","Nde wili inabohi am, nde yewi ibbi am, nde ɓolti ki fuu, lice maaki fuu purɗi.","Wa dee ha̧ fɔ-nyak-dɔ̧ɔ̧ kɔ‘m mɛ kifi geemɔ, wa ɓira o te-mbɔra kɔ‘m a nu sɛ́kɛ́ɗɛ́-sɛ́kɛ́ɗɛ́. Wa ɗaŋa mɔ hús-hús, ɓɛɛ gbaa-er-te fɛŋ buu.","Wa dee ha̧ fɔ-nyak-dɔ̧ɔ̧ kɔ‘m mɛ kifi geemɔ, wa ɓira o te-mbɔra kɔ‘m a nu sɛ́kɛ́ɗɛ́-sɛ́kɛ́ɗɛ́. Wa ɗaŋa mɔ hús-hús, ɓɛɛ gbaa-er-te fɛŋ buu.","Nahe hɛ kezhɛrete yɛ rɛzɛŋea n'yɛ kaɓerama, nahe ŋkɛ kezamte sebe te yɛ dasekwa ta n'yɛ. Nahe hɛ kezehwe hɛ, nahe hɛ kempeɗehwe zlapələa nci ba'a nahe hɛ kezhɛrete yɛ dzeve ta nci tɛzlɛzlɛ.","AÀ älag wo pay tlalum äin go, AÀ caa wo koo hoçoç mani äin go, geëeb wo nen äe go lay. Jag do tlalumn hig wo go äuy lay."
JOL.1.8," Désole-toi comme une vierge revêtue du sac, pour  pleurer  l'époux de sa jeunesse.",Lament like a virgin girded with sackcloth for the husband of her youth.,"Yorgi tuwgiya, ki goot-cat ta darayta cuk sligar-bolla ta'a, kay tiy bana' na ma min sla' wulin nala.",Yônan anʼésoé minga é bili ôlun a yônôk nnôme wé a ndôme luk.,"Hislikam tuwuy, kaɓa zuŋ diili muzuɓ zil le wureˀ, matuwuy vagay ngi zil naŋ, naŋ muzuɓa paɗ ngi diili naŋ.","Onon yimɓe, sey on mboya bana derkeejo debbo ɓorniiɗo limce buhuuje  boyanɗo gorum kowɗo ɗum. ","Onon yimɓe, sey on mboya bana derkeejo debbo ɓorniiɗo limce buhuuje  boyanɗo gorum kowɗo ɗum. ",Ɛ̀nɛ̀ pɛ́ see'nɛ́ hee be-zɔŋa nɛ pi̧i̧ laa-zim-fio hi̧i̧ nɛ fio wii-zɔŋa kɔ̧-a̧ ga.,Ɛ̀nɛ̀ pɛ́ see'nɛ́ hee be-zɔŋa nɛ pi̧i̧ laa-zim-fio hi̧i̧ nɛ fio wii-zɔŋa kɔ̧-a̧ ga.,Ŋgaɗe mə ghə kala makwa nya nza wəsə hwa hwə ve kezha nehwene za makwa nta.,Law see äe do may tigli maga lag taçy oçoçbe go ti äe Ma ra je maga hay go de yaçaçge äe nono.
JOL.1.9," Offrandes et libations ont été retranchées de la maison de Yahweh ; ils sont dans le deuil les prêtres, ministres de Yahweh !","The meat offering and the drink offering is cut off from the house of the  Lord ; the priests, the  Lord's  ministers, mourn.","Slen ma vulda hiɗi slen ma yamam goy tam Lawna may ma hay ziyna valam loɗi; muliyan-sa-ɗifinna sa sun Ma-Vatɗina, nisi ka hay godoora.","Mimveane mi fôn nge mi mi woon mi nji fe beta kui nda Zambe. Ajô te betuni be ne meyeb été, mbe be ne ntelane ya saane Nti.","Hapa ngi vul ati mbaazla ngi puslo, anta sa ram di ng'ar hay ngi Bumbulvuŋ mata. Migi mikuli, mizli ngi slra ngi Bumbulvuŋhoyo, a roko ti tuwuy ngi vagay.",Dokke nyaamdu e dokke dufeteeɗe ngoodaa haa suudu Jawmiraawo. Liman'en jagganooɓe Jawmiraawo ɗon cuno. ,Dokke nyaamdu e dokke dufeteeɗe ngoodaa haa suudu Jawmiraawo. Liman'en jagganooɓe Jawmiraawo ɗon cuno. ,"Aa-zɛzɛ nu in ha̧a̧mɔ kɔ̧ Tua ko GASA WAN bo ɓɔna, ɓɛɛ o wi-ɗafi-sɔ̧ nɛ ya nɛ o wi-de-tom ko GASA WAN hi̧i̧ nɛ fio.","Aa-zɛzɛ nu in ha̧a̧mɔ kɔ̧ Tua ko GASA WAN bo ɓɔna, ɓɛɛ o wi-ɗafi-sɔ̧ nɛ ya nɛ o wi-de-tom ko GASA WAN hi̧i̧ nɛ fio.","Kezhɛne mbeli kafəke ha ba'a tɛ kadzembe ghɛa Shala we. Vatse nza ka dzeghe Shala mbe nehwene, ghenci nyi kaka mene slene ta Mahwətə.",Jobo bay age de feçeçre haçge noga de yii ma sii jag äil tiñ mani Manwurn wa so. Jar sië jag maga wo de joñ peele ne Manwur wo go nen lawge.
JOL.1.10," Les champs sont ravagés, le sol est dans le deuil ; car le blé est détruit, le vin nouveau est dans la confusion, l'huile languit.","The field is wasted, the land mourneth; for the corn is wasted: the new wine is dried up, the oil languisheth.","Sle ma hay sinen tiy goy kafe, yam nagat hini goy ɦawa'a kay alkamaren vati goy kafe. vin ma jibetna may loɗi, mula soy goyo.","Mefup me maneya diban, si ébien é nyoñeya ôlun été. Te ke fe fôn, teke fe mendime ya ébuma ndik, teke fe atoé mbon ô ne mfefé.","Guvahaya, i mumusukuɗohoy le tir tir, hirwuy a ro ti tuwuy ngi vagay. Alkamari i mitirnaˀa le, mbaazla dedeɗeke anta mata, zuŋ mal muɗuco wureˀ anta ɗek mata.","Gese mbonni, lesdi ɗon suno, alkamaari natti, inaboojam kesam e nebbam kesam boo jinni. ","Gese mbonni, lesdi ɗon suno, alkamaari natti, inaboojam kesam e nebbam kesam boo jinni. ","Wa ɗaŋa o fɔ lɛŋ, nù hí̧í̧ nɛ́ fio. Wa ɗaŋa alkamaari, mbe dɔ̧ɔ̧ bo ɓɔna, mbe nɔ bo ɓɔna mbɛt.","Wa ɗaŋa o fɔ lɛŋ, nù hí̧í̧ nɛ́ fio. Wa ɗaŋa alkamaari, mbe dɔ̧ɔ̧ bo ɓɔna, mbe nɔ bo ɓɔna mbɛt.","Nahe yɛ wəve kebezemte geva, nahe hɛɗi kenza helaŋe helaŋe. Nahe ha kebezemte geva, nahe tɛ mɛnɛfɛ kekiɗi ba'a nahe n'yi nya lɛnɛa kehase.","Payren älag wo go, sirn go nen lawge. Coore bay wa, coore blen hig go. Yii ma defayn taw go, noo dra' caa wer go lay."
JOL.1.11," Soyez confus, laboureurs, lamentez-vous, vignerons, à cause du froment et de l'orge ; car la moisson des champs est anéantie.","Be ye ashamed, O ye husbandmen; howl, O ye vinedressers, for the wheat and for the barley; because the harvest of the field is perished.","Sum sa zum sinena sutaysi toya, sa pi gulda-guldana ka yor kay fu-alkamarena, hiɗi fu-orgena, kay sa fi a feɗ va hay sinen loɗi.","Bebé mefup be kuya avem Bebé mefube mindik ba yôn amu ateʼe nlem é biya be. Avute fôn a nlisi bi maneya, a bidi bise ba kôan bi ntoo momo.","Kum muhuvoy, gam dəh dəh lambaˀ, kum muhuva gudubunoy, tuwam irslik irslik, vur ɓi ngi daw alkamari ati daw giziŋ kumoyo: gwat ngi migam gar a hiryi le.","Onon remooɓe, cemte! Onon remooɓe inabooje, mboye! Sa'iiruuri e alkamaari e ƴaamle gese fuu mbonni. ","Onon remooɓe, cemte! Onon remooɓe inabooje, mboye! Sa'iiruuri e alkamaari e ƴaamle gese fuu mbonni. ","Ɛ̀nɛ̀ yá nɛ ɗaŋsee, ɛnɛ o wi-wa-fɔ, ɛ̀nɛ̀ áí nú‘nɛ́ o wi-gun-waya-te wen zu alkamaari in be-fon. Nyɔnɔ sɛn kpɛɛfɔ ɗaŋa lɛŋ.","Ɛ̀nɛ̀ yá nɛ ɗaŋsee, ɛnɛ o wi-wa-fɔ, ɛ̀nɛ̀ áí nú‘nɛ́ o wi-gun-waya-te wen zu alkamaari in be-fon. Nyɔnɔ sɛn kpɛɛfɔ ɗaŋa lɛŋ.","Nahe ka wəza kenza keyirə yirə, kaŋələvə ka mene slene mbe wəvea rɛzɛŋe. Nahe sebe keza te ha ba'a megi, rayɛ sebe te wəshi nyi kese te wəve.","Jar jeegen gay wo go, jar peë tlalum wo go nen lawge lay, Wer coore blen wo de orje no, Werga jobo wee mopo le do äil pay gaa hase."
JOL.1.12," La vigne est dans la confusion, et les figuiers languissent ; le grenadier, et aussi le palmier et le pommier, tous les arbres des champs sont desséchés ; la joie s'est  retirée  confuse,  loin  des enfants des hommes.","The vine is dried up, and the fig tree languisheth; the pomegranate tree, the palm tree also, and the apple tree, even all the trees of the field, are withered: because joy is withered away from the sons of men.","Gulda-guldan soy goyo, gu-gumna humam liwekiya, gu-grenadinna, gu-gomona, gu-pomiyena, hiɗi gu ma hay sinen kaf humam soy goyo. Firit ta jar sumuna sleɗay goy kafe.","Ndiʼi woon ô maneya kôt befigié ki be maneya joʼolan, bilé bia wum bibuma: begrenadié, bedatié a bepômié be maneya wulan. Avak ese e maneya e bôt été.","Gudubun a muˀul le, uruf a guvuˀ le, widis  grenade  , Babazla waɗ widis  pomoy  , na zle widis ngi zum ngir guvahay gar, a muˀulom le. Mumul a kiɗ mi le avu mizli.","Inabohi yoori, ibbi ɗayli, rummaanoohi e dibinoohi e lekki dimanki ɓiɓɓe belɗe e leɗɗe haa ngesa fuu njoori. Nonnon, ko seynata ɓiɓɓe Aadama, ɗayli. ","Inabohi yoori, ibbi ɗayli, rummaanoohi e dibinoohi e lekki dimanki ɓiɓɓe belɗe e leɗɗe haa ngesa fuu njoori. Nonnon, ko seynata ɓiɓɓe Aadama, ɗayli. ","Nyak-dɔ̧ɔ̧ kora lɛŋ, do te-mbɔra ɗaŋa ai a nu, kóɓò, ndɛŋgɛ, ndìà, o te kpɛɛfɔ lɛŋ kora; desee bo mgbara bíí ɓɔna.","Nyak-dɔ̧ɔ̧ kora lɛŋ, do te-mbɔra ɗaŋa ai a nu, kóɓò, ndɛŋgɛ, ndìà, o te kpɛɛfɔ lɛŋ kora; desee bo mgbara bíí ɓɔna.","Nahe yɛ rɛzɛŋe keghwelenji, nahe yɛ dasekwa ketiwɛɗinji. Nahe yɛ kwakweme, yɛ peha, yɛ maŋgwerə, pɛtɛa wəfe nyi keya keghwelenji. Nahe zlama kekiɗinyɛ hwa mbeli.","Tlalumn lwaë go, koo hoçoçn hig go lay. Koo grenadiyen hig go do gomon wo de koo pomiyen no lay. Koore ma äil payren hig wo go äuy. Fruygi bay äil je tabay po wa so."
JOL.1.13," Prêtres, ceignez-vous et poussez des plaintes ; lamentez-vous, ministres de l'autel ! Venez, passez la nuit  vêtus  du sac, ministres de mon Dieu ; car l'offrande et la libation sont retenues  loin  de la maison de votre Dieu.","Gird yourselves, and lament, ye priests: howl, ye ministers of the altar: come, lie all night in sackcloth, ye ministers of my God: for the meat offering and the drink offering is withholden from the house of your God.","Nigi muliyan-sa-ɗifinna, jungi furgiya, tiygiya, Yorgi tuwgiya, nigi sa li lop kulo kay giwin-ma-ɗifinna, nigiyaya cukgi sligar-bolla tigiya kay ti do'olla, burgi gaa hiɗi namu, nigi sa sunda vi Lawna vanu. Kay vulda hiɗi niyn ma yamam goy vok Ma-Vatɗina may hay ziyna valam loɗi yo!","A mia betuni, jaane minkuta a tabane meyeb été! Yônan, mia mia bo ésaé ataʼa metunaʼa! Zaʼan a lôtan alu mi beʼe minkuta, mia mia bo Zambe wom ésaé! Amu mimveane mi fôn, nge mi mi woon mi nji fe beta vebane nda Zambe.","Kum masayay, kam zana ngi vagay, tuwam kaɗam kaɗam, kum migi slra ngir li gi mikulihey, tuwam ˀirslik ˀirslik. Migi slra ngi Buymisemuŋ ndrahay, soko, hinam ti zana ngi vagay ɓaˀ ɓaˀ avu vu, hapa ngi vul ati mbaazla ngi pusl, anta ram di ar hay ngi Buymisemuŋ kumo mata.","Kadde limce buhuuje, mboye, onon liman'en! Uume, onon jaggiiɓe haa hirsirde Jawmiraawo! Ngare, mbaale nder mettamɓeram, onon jagganooɓe Allah am! Ngam dokke nyaamdu e dokke dufeteeɗe ngoodaa haa suudu Allah mooɗon. ","Kadde limce buhuuje, mboye, onon liman'en! Uume, onon jaggiiɓe haa hirsirde Jawmiraawo! Ngare, mbaale nder mettamɓeram, onon jagganooɓe Allah am! Ngam dokke nyaamdu e dokke dufeteeɗe ngoodaa haa suudu Allah mooɗon. ","O wi-ɗafi-sɔ̧, ɛ̀nɛ̀ pí̧ laa-zim-fio, ɛ̀nɛ̀ hí̧í̧ fio; o wi-de-tom zu fara-dɔ-kpoo-sɔ̧, ɛ̀nɛ̀ áí nú‘nɛ́. Ɛnɛ, o wi-de-tom ko Sɔ̧ kɔ‘m, ɛ̀nɛ̀ gáɓí tɛ‘nɛ́ nɛ bufu duk nɛnɛ mɔ sa̧, wen ha̧a̧mɔ in aa-zɛzɛ bo kɔ̧ Tua ko Sɔ̧ k’ɛ́nɛ́ ɓɔna.","O wi-ɗafi-sɔ̧, ɛ̀nɛ̀ pí̧ laa-zim-fio, ɛ̀nɛ̀ hí̧í̧ fio; o wi-de-tom zu fara-dɔ-kpoo-sɔ̧, ɛ̀nɛ̀ áí nú‘nɛ́. Ɛnɛ, o wi-de-tom ko Sɔ̧ kɔ‘m, ɛ̀nɛ̀ gáɓí tɛ‘nɛ́ nɛ bufu duk nɛnɛ mɔ sa̧, wen ha̧a̧mɔ in aa-zɛzɛ bo kɔ̧ Tua ko Sɔ̧ k’ɛ́nɛ́ ɓɔna.","Gheyɛ ka dzeghe Shala, hwepe mə wəsə hwa hwə ba'a ŋgaɗe mə ghə. Gheyɛ ka mene slene te reghwetɛ, tsa mə lewela. Gheyɛ ka mene slene ta Shala ta ɓəmə, nza mə le wəsə hwa hwə kahɛ, va nya zhɛnema mbeli kafə wəshi ba'a tɛ kase kadzembe ghɛa Shala.","Nday jar sië jag no, lag wee taçy oçoçbe ti äay day law wee! Law wee, nday jar joñ peele ti ngeel sië jag no! AÀ wee le, day na wee de taçy oçoçbe see, nday jar joñ peele ne Baa äi no! Gahaçyla, feçeçre haçge wo de yii ma sii jag bay wo äil tiñ mani Baa äayn wa so."
JOL.1.14," Publiez un jeûne, convoquez une assemblée ; réunissez les anciens, tous ceux qui habitent le pays, dans la maison de Yahweh, votre Dieu,","Sanctify ye a fast, call a solemn assembly, gather the elders and all the inhabitants of the land into the house of the  Lord  your God, and cry unto the  Lord ,","Yigi tuwgi noŋ kaf, ligi laata, tokgi sum sa maariyana, sum sa hay nagat noŋ kaf, toksi hay ziyna vi Ma-Vatɗina Lawna vigiya, tiygi tam Ma-Vatɗina.","Bendaʼan éyoñe ntyiane bidi, a bañete bôt be sulan; sulaʼane bemvendé be bôt a jama bôte mboʼo ase e nda Nti, e Zambe wongan, yeʼelaʼane nye.","Gam dalyam ɓa ki tiram pal, tilam mi ngi gi cikil mipal, kusoko mizli micawwahaya, waɗ mizli ngi si ruwuyo gar, ng'ar hay ngi Bumbulvuŋ, Buymisemuŋ kum, yo tilam mi ng'avu Bumbulvuŋ.","Taaskane suumaye, ewne yimɓe ngam ɓe mooɓo, mooɓte ndotti'en e jooɗiiɓe nder lesdi fuu haa suudu Allah Jawmiraawo mooɗon, ngookane mo!","Taaskane suumaye, ewne yimɓe ngam ɓe mooɓo, mooɓte ndotti'en e jooɗiiɓe nder lesdi fuu haa suudu Allah Jawmiraawo mooɗon, ngookane mo!","Ɛ̀nɛ̀ hé mbéá wen zima yi, ɛ̀nɛ̀ sá sara mɔi̧a-a wen gasa Sɔ̧, ɛ̀nɛ̀ mɔ́í̧ o  kuti-wi  in o bíí nu’ɛ lɛŋ si kɔ̧ Tua ko Sɔ̧ k’ɛ́nɛ́, ɓɛɛ ɛ̀nɛ̀ áí nú sitɛ GASA WAN Sɔ̧ k’ɛ́nɛ́.","Ɛ̀nɛ̀ hé mbéá wen zima yi, ɛ̀nɛ̀ sá sara mɔi̧a-a wen gasa Sɔ̧, ɛ̀nɛ̀ mɔ́í̧ o  kuti-wi  in o bíí nu’ɛ lɛŋ si kɔ̧ Tua ko Sɔ̧ k’ɛ́nɛ́, ɓɛɛ ɛ̀nɛ̀ áí nú sitɛ GASA WAN Sɔ̧ k’ɛ́nɛ́.","Gezete mə vəa kemene səwəmayɛ, zlapete mə tsene nya wəba, tsenete mə mbelia jama ba'a pɛtɛa mbeli nyi te hɛɗi mbe ghɛa Shala Mahwətə ta ɓəmə, tsa nda mə lewela ke Mahwətə.","Tay wee le go sagsag ma heçeç bii! 'Waa wee äay äe wo go ne jar äuy. Tay wee jar kluuri wo de jar ma äil sirn wo le äuy äil tiñ mani Manwuri, Baa äay no, Day ni nday ëe wee Manwuri, maga aà mo caa war äay le!"
JOL.1.15," et criez à Yahweh : "" Ah ! quel jour !... "" Car le jour de Yahweh est proche ! Il vient comme un ravage, de la part du Tout-Puissant !","Alas for the day! for the day of the  Lord  is at hand, and as a destruction from the Almighty shall it come.",Hih! Buurta ta ɦuyumda kuɗa'ta ka co goboyo. Co ɗawn ti buurta vi Ma-Vatɗina. Nam ma co'o ki ma gaŋeraŋ-petna ɓulak slen goy nala.,"Angônda môs wo zu, môs ayaa Nti! Baa njañ be ne nsamba Zambe a ne ngul ése a tyiʼiya nalé.","Kayya! Hin nah na! Hin ngi Bumbulvuŋ a ndilo le, i hin ngi hirya gwat, Buymisemuŋ mupulo jiviɗ naŋ.",Nyalaade Jawmiraawo ɓaditake! Nde waran diga Allah Baawɗo bana halkere. Kayto nyalaade nde'e ! ,Nyalaade Jawmiraawo ɓaditake! Nde waran diga Allah Baawɗo bana halkere. Kayto nyalaade nde'e ! ,"Wese ko GASA WAN hɛɗa kaɗi, wese nɛ Wan nɛ a̧a̧ nɛ ŋgayamɔ lɛŋ tɛ ba ɗaŋamɔ tɛnɛ. Oee ɗaŋ wese kíì wa!","Wese ko GASA WAN hɛɗa kaɗi, wese nɛ Wan nɛ a̧a̧ nɛ ŋgayamɔ lɛŋ tɛ ba ɗaŋamɔ tɛnɛ. Oee ɗaŋ wese kíì wa!","Amaga, takwa takwa veci nya dzawe kase, vecia Mahwətə gɛ wa! Se yase ŋkɛ kala ndiremi nya keza wəshi pɛtɛ, nya ghweneke Shala nde berete.",Sen na diñ wur ma eç no la! Sen na werga wur mani Manwurn go mañ. AÀ le de age de bage poçoç mani je ma de eegren äuy no.
JOL.1.16," La nourriture n'a-t-elle pas été retranchée sous nos yeux, ainsi que la joie et l'allégresse, de la maison de notre Dieu ?","Is not the meat cut off before our eyes, yea, joy and gladness from the house of our God?",Tina nay may fum loɗinge. Firita hiɗi ciriy ma digi-digina may hay ziyna vi Ma-Vatɗin loɗinge.,"Bidi biangan bia jañ mise mangan été, mefôn a mevak bi se ke fe bebé a ndaa Zambe wongan.","Gwat ngi zum mikiɗ mi, yo ar hay ngi Bumbulvuŋ, mumul ati jiɗa mececẽleŋ anta mata na, a gi a mihiri ndra ta kwa?","Nyaamdu halki yeeso meeɗen, seyo e gimi njinni nder suudu Allah meeɗen. ","Nyaamdu halki yeeso meeɗen, seyo e gimi njinni nder suudu Allah meeɗen. ",Bo nɛ nyɔŋmɔ ɓana nɛ yí yɛ na nde? Bo nɛ tortɛ in nyɛŋɛ kaɗa kɔ̧ Tua ko GASA WAN nɛ yi yɛ mbɛt na nde?,Bo nɛ nyɔŋmɔ ɓana nɛ yí yɛ na nde? Bo nɛ tortɛ in nyɛŋɛ kaɗa kɔ̧ Tua ko GASA WAN nɛ yi yɛ mbɛt na nde?,"Nahe wəsə kezeme ta ɓəmə keza kwa ntsə ta ɓəmə, nahe zlama ba'a farefa keshave mbe ghɛa Shala ta ɓəmə.",Naa bay ko reege de nen na wa so. Äil tiñ mani Baa naa dra' fruygi wo de feg caa wo wer go lay.
