livre.chapitre.verset,Francais,Anglais,BIBALDA_TA_PELDETTA,Bulu,Guiziga,Fulfulde_Adamaoua,Fulfulde_DC,KALATA_KO_SC_Gbaya,KALATA_KO_DC_Gbaya,Kapsiki_DC,Tupurri
JOS.12.8," dans la montagne, dans le bas pays, sur les coteaux, dans le désert et dans le Négeb: pays des Héthéens, des Amorrhéens, des Chananéens, des Phérézéens, des Hévéens et des Jébuséens. ","In the mountains, and in the valleys, and in the plains, and in the springs, and in the wilderness, and in the south country; the Hittites, the Amorites, and the Canaanites, the Perizzites, the Hivites, and the Jebusites:","hay hiɗiyta, hay liyn ma beɗna, hay lokŋa, kay hiɗiyna, hay fulda, hay Negeb kaw, nagata vi sum sa Hititna, sa Amoriyana, sa Kanaaniyana, sa Feresiyena, sa Heviyena hiɗi sa Yebusiyena.","Si minkô, njeʼese Araba a bone minkô, nkôte si a Négéb: si Beétieñ, Beamorééñ, Bekananééñ, Beférizieñ, Beévieñ a Beyébuzieñ:","Hirwuy tayna i: hirwuy vay muwãhay, ngir mukutukoy, ngi Arapay, ngir li mukutukoy, ngi wuzlaɓuh mikirɗak kirɗakay waɗ mikini tir vay ruwuyoy. Hanayna vuna gar na, i hirwuy ngi Hitihey, ngi Amorihey, ngi Kanaˀanay, ngi Perizihey, ngi Hivihey waɗ ngi Zebusihey. ","waato lesdi kooseeje e lesdi towndiije haa hiirnaaŋge, waadiwol Urdun bee towndiije mum e gaaruuji fuunaaŋge, non boo ladde hamaadaare e Lesdi Fombina. Naane Heti'en e Amoori'en e Kanaani'en e Perezzi'en e Hewi'en e Yebusi'en njooɗino ton. ","waato lesdi kooseeje e lesdi towndiije haa hiirnaaŋge, waadiwol Urdun bee towndiije mum e gaaruuji fuunaaŋge, non boo ladde hamaadaare e Lesdi Fombina. Naane Heti'en e Amoori'en e Kanaani'en e Perezzi'en e Hewi'en e Yebusi'en njooɗino ton. ","O nú nɔ‘i duka nɛ́ zu kaya in hira-nù, ká̧ zaŋ Jurdɛn, ká̧ naŋ kaya, in ŋga-gbárà nɛ war ɗɔɔ. O nú nɔ‘i duka so nɛ nù ko o be Hit, o be Amɔr, o be Kanaŋ, o be Periz, o be Hiv in o be Jebus. ","O nú nɔ‘i duka nɛ́ zu kaya in hira-nù, ká̧ zaŋ Jurdɛn, ká̧ naŋ kaya, in ŋga-gbárà nɛ war ɗɔɔ. O nú nɔ‘i duka so nɛ nù ko o be Hit, o be Amɔr, o be Kanaŋ, o be Periz, o be Hiv in o be Jebus. ","Ma hwa ghweme, kwake te ŋwela, mbe Araba, sawa vare yɛ wəmbə, te ɓerama ba'a hɛɗia Nɛgɛv ne, hɛɗia ka Hɛt, ka Amor, ka Kanan, ka Pɛrɛs, ka Hava ba'a ka Zhɛbəs. ","Sir sen hay diñ ma ti huuli wo, ma äil Sefela no, ma äil Araba no, ma ti ngeel ma de solgen wo, ma äil puulin wo de ma ti Negef no, sir maga jar Hitid wo, jar Amorid wo, jar Kanaan wo, jar Feresid wo, jar Hifid wo de jar Yebusid hay wo ni mono."
JOS.12.9," Ce sont: le roi de Jéricho, un; le roi d'Haï, près de Béthel, un; ","The king of Jericho, one; the king of Ai, which is beside Beth–el, one;","Mulla vi Yeriko, mulla vi Ay hay galla vi Betel, ","Njô bôt ya Yérikô wua, njô bôte ya Ayi mfaʼa ya Bétél wua; ","Buy tayna, Israyeley mikiɗaka taŋ na, i buy ngir walahayay ani: buy Zeriko, buy Ay, walahay migweˀ avu Betel, ","Isra'iila'en njaali laamiiɓe berniiji ɗi'i: Yeriko, Ayu baŋnge Baytila, ","Isra'iila'en njaali laamiiɓe berniiji ɗi'i: Yeriko, Ayu baŋnge Baytila, ","O wannu nɛ biro baa nɛ́ mɔɔ nɔ'ɔ: wannu Jeriko in wannu Ai ká̧ Bɛtɛl, ","O wannu nɛ biro baa nɛ́ mɔɔ nɔ'ɔ: wannu Jeriko in wannu Ai ká̧ Bɛtɛl, ","Ma ka meghe nyi hərəte hɛ mbeli ne, wa nyi hɛɗia nci nyi: Zhɛriko, Ay nya takwa yitea Bɛtɛl, ","Wañre sen hay wo diñ wañ Jeriko, wañ Ayi ti jeñ Betel mono. "
JOS.12.10," le roi de Jérusalem, un; ","The king of Jerusalem, one; the king of Hebron, one;","mulla vi Yerusalem, mulla vi Hebron, ","njô bôte ya Yérusalém wua, nyô ya Ebroñ wua, ","Zeruzalem, Hebroŋ, ","Urusaliima, Heburuun, ","Urusaliima, Heburuun, ","wannu Jerusalɛm, wannu Hebrɔŋ, ","wannu Jerusalɛm, wannu Hebrɔŋ, ","Zhɛrəzalɛm, Hɛbron, ","Wañ Jerusalem, wañ Hebroñ, "
JOS.12.11," le roi d'Hébron, un; le roi de Jérimoth, un; ","The king of Jarmuth, one; the king of Lachish, one;","mulla vi Yarmut, mulla vi Lakis; ","njô bôte ya Yarmut wua, nyô ya Lakis wua; ","Yarmut, Lakis, ","Yarmut, Lakis, ","Yarmut, Lakis, ","wannu Yarmut in wannu Lakis, ","wannu Yarmut in wannu Lakis, ","Yarməwt, Lakish, ","Wañ Yarmad, wañ Lakis, "
JOS.12.12," le roi de Lachis, un; le roi d'Eglon, un; ","The king of Eglon, one; the king of Gezer, one;","mulla vi Eglon; mulla vi Gezer, ","njô bôte ya Egloñ wua, nyô ya Gézér wua; ","Egloŋ, Gezer, ","Egilon, Gezer, ","Egilon, Gezer, ","wannu Eglɔŋ in wannu Gezɛr, ","wannu Eglɔŋ in wannu Gezɛr, ","Ɛglon, Gɛzɛr, ","Wañ Eglon, wañ Geser, "
JOS.12.13," le roi de Gazer, un; le roi de Dabir, un; ","The king of Debir, one; the king of Geder, one;","mulla vi Debir, mulla vi Geder; ","njô bôte ya Debir wua, nyô ya Géder wua; ","Debir, Geder, ","Debir, Geder, ","Debir, Geder, ","wannu Debir in wannu Gedɛr, ","wannu Debir in wannu Gedɛr, ","Debir, Gɛdɛr, ","Wañ Debir, wañ Geder, "
JOS.12.14," le roi de Gader, un; le roi de Herma, un; ","The king of Hormah, one; the king of Arad, one;","mulla vi Horma, mulla vi Arad; ",njô bôte ya Orma wua; nyô ya Arad wua; ,"Horma, Arat, ","Horma, Arat, ","Horma, Arat, ","wannu Ɔrma in wannu Arad, ","wannu Ɔrma in wannu Arad, ","Horma, Arad, ","Wañ Horma, wañ Arod, "
JOS.12.15," le roi d'Héred, un; le roi de Lebna, un; ","The king of Libnah, one; the king of Adullam, one;","mulla vi Libna, mulla vi Adullam, ",njô bôte ya Libna wua; nyô ya Adulam wua; ,"Libna, Adulam, ","Libna, Adullam, ","Libna, Adullam, ","wannu Libna in wannu Adulam, ","wannu Libna in wannu Adulam, ","Libna, Adəwlam, ","Wañ Libna, wañ Adulam, "
JOS.12.16," le roi d'Odollam, un; le roi de Macéda, un; le roi de Béthel, un; ","The king of Makkedah, one; the king of Beth–el, one;","mulla vi Makkeda, mulla vi Betel, ","njô bôte ya Makéda wua, nyô ya Bétél wua; ","Makeda, Betel, ","Makkeda, Baytila, ","Makkeda, Baytila, ","wannu Makeda in wannu Bɛtɛl, ","wannu Makeda in wannu Bɛtɛl, ","Makɛda, Bɛtɛl, ","Wañ Makeda, wañ Betel, "
JOS.12.17," le roi de Taphna,un; le roi d'Opher, un; ","The king of Tappuah, one; the king of Hepher, one;","mulla vi Tappuwa, mulla vi Hefer; ","njô bôte ya Tapua wua, nyô ya Efer wua; ","Tapuwa, Hefer, ","Tappuha, Hefer, ","Tappuha, Hefer, ","wannu Tapua in wannu Hefɛr, ","wannu Tapua in wannu Hefɛr, ","Tapəwa, Hɛfɛr, ","Wañ Tapuwa, wañ Hefer, "
JOS.12.18," le roi d'Aphec, un; le roi de Lasaron, un; ","The king of Aphek, one; the king of Lasharon, one;","mulla vi Afek, mulla vi Laskaron, ","njô bôte ya Afék wua, nyô ya Lasaron wua; ","Afek, Saroŋ, ","Afek nder Saron, ","Afek nder Saron, ","wannu Afɛk in wannu Lasarɔŋ, ","wannu Afɛk in wannu Lasarɔŋ, ","Afɛk, Saron, ","Wañ Afeg, wañ Lasaron, "
JOS.12.19," le roi de Madon, un; le roi d'Asor, un; ","The king of Madon, one; the king of Hazor, one;","mulla vi Madon, mulla vi Hatsor, ","njô bôte ya Madon wua, nyô ya Asor wua; ","Buy Madoŋ, buy Hasor, ","Hacoor, ","Hacoor, ","wannu Madɔŋ in wannu Asɔr, ","wannu Madɔŋ in wannu Asɔr, ","Madon, Hasor, ","Wañ Madon, wañ Hatsor, "
JOS.12.20," le roi de Séméron, un; le roi d'Achsaph, un; ","The king of Shimron–meron, one; the king of Achshaph, one;","mulla vi Simron-Meron, mulla vi Aksaf, ","njô bôte ya Simron-Méron wua, nyô ya Akaf wua; ","Simroŋ-Meroŋ, Akesaf, ","Simiyon, Meeron, Akisaf, ","Simiyon, Meeron, Akisaf, ","wannu Simrɔŋ-Mɛrɔŋ in wannu Aksaf, ","wannu Simrɔŋ-Mɛrɔŋ in wannu Aksaf, ","Shimron-Meron, Akeshaf, ","Wañ Simron-Meron, wañ Aksaf, "
JOS.12.21," le roi de Thanac, un; le roi de Mageddo, un; ","The king of Taanach, one; the king of Megiddo, one;","mulla vi Taanak, mulla vi Megiddo; ",njô bôte ya Tanak wua nyô ya Mégidô wua; ,"Taˀanak, Megido, ","Ta'anak, Megiddo, ","Ta'anak, Megiddo, ","wannu Tanak in wannu Mɛgido, ","wannu Tanak in wannu Mɛgido, ","Ta'anak, Mɛgido, ","Wañ Taanag, wañ Megido, "
JOS.12.22," le roi de Cadès, un; le roi de Jachanan, au Carmel, un; ","The king of Kedesh, one; the king of Jokneam of Carmel, one;","mulla vi Kedes, mulla vi Yokneyam hay Karmel; ",njô bôte ya Kédék wua nyô ya Yôknam mfaʼa ya Karmel wua; ,"Kedes, Yokneˀam ngi ruwuy Karmel, ","Keedes, Yokne'am haa hooseere Karmel, ","Keedes, Yokne'am haa hooseere Karmel, ","wannu Kɛdɛs in wannu Yoknɛam sɛn Karmɛl, ","wannu Kɛdɛs in wannu Yoknɛam sɛn Karmɛl, ","Kɛdɛsh, Yoknɛyam pelɛ Karmɛl, ","Wañ Kedes, wañ Yokneyam wo ti huuli ma Karmel mono, "
JOS.12.23," le roi de Dor, sur les hauteurs de Dor, un; le roi de Gojim, à Galgal, un; le roi de Thersa, un. ","The king of Dor in the coast of Dor, one; the king of the nations of Gilgal, one;","mul kep hay Dor, hay galla vi Dor, mul kep hay Goyim, goboy hiɗi Gilgal; ","njô bôte ya Dor e mefôla mesi ya Dor wua, nyô ya Gôyim bebé Gilgal wua; ","Dor a ˀAyzaw, Goyim ngi Galile, ","Door haa Nafot Door, Goyim nder Galiili, ","Door haa Nafot Door, Goyim nder Galiili, ",wannu Dɔr sɛn zu kaya Dɔr in wannu Goyim sɛn ká̧ Gilgal ká bá nɛ̀ ,wannu Dɔr sɛn zu kaya Dɔr in wannu Goyim sɛn ká̧ Gilgal ká bá nɛ̀ ,"Dor pelɛ wəmbə, Goyim nya mbe Galilɛ ","Wañ Dor wo ti prog ma Dor mono, wañ Goyim ti jeñ Gilgal mono. "
JOS.12.24," En tout, trente et un rois.","The king of Tirzah, one: all the kings thirty and one.",mulla vi Tirsa. Tapta vi muliyan noŋ pet dok-ɦidi yam kep.,njô bôte ya Tirsa wua; bese be mbe bejô bôte mewôm mela a wua.,"waɗ buy Tirsa. Taŋ jom gara, buyoy kukur makir ngaŋ kaˀa.",Tirsa. Limgal laamiiɓe man fuu: cappanɗe tato e ngo'o.,Tirsa. Limgal laamiiɓe man fuu: cappanɗe tato e ngo'o.,wannu Tirsa. Wa lɛŋ nɛ́ wannu ɓu-taar-zua-kpɔk.,wannu Tirsa. Wa lɛŋ nɛ́ wannu ɓu-taar-zua-kpɔk.,"ba'a Tirsa. Pɛtɛa nci ne, ka meghe mahekenemsə kwetɛŋeghəmbe.",Wañ Tirsa. A wo äuy wañre do swa' ti boñ.
JOS.13.1," Josué était vieux, avancé en âge; Yahweh lui dit: «Tu es devenu vieux, tu es avancé en âge, et il reste encore un très grand pays à conquérir. ","Now Joshua was old and stricken in years; and the  Lord  said unto him, Thou art old and stricken in years, and there remaineth yet very much land to be possessed.","Yosuwa muɗi maari, busata valam kali ŋolo. Nala Ma-Vatɗina di talam ala: Wulini naŋ muɗi maari, busata vaŋ kali ŋolo, nagata ta hini vokaŋ kay naŋ sla'ta ka ŋol tuwa. ","Eyoñe te Yasua a ntoo nnôm amu abui mimbu, Nti a nga jô nye na: Ô ntoo nnôm, a si ja yiane nyoñeban é ngenan étua anen. ","Zozuwe a gi gal le haɗa wãˀ, dar Bumbulvuŋ a ɓaŋ: «Ani ki gi gal le haɗa, vi a gi le mbeˀ mbeˀe, na hirwuy ngi tiɓi ngi tiɓi na, a ndiram le haɗa aruŋ. ","Nde Yosuwa naywi masin, Jawmiraawo wi'i mo: “A ndottidi, duuɓi ma ɗuuɗi, ammaa lutti lesdi ɗuuɗndi ndi on nyaamaay tawon: ","Nde Yosuwa naywi masin, Jawmiraawo wi'i mo: “A ndottidi, duuɓi ma ɗuuɗi, ammaa lutti lesdi ɗuuɗndi ndi on nyaamaay tawon: ","Josue sɔka kaɗi in pɛ-a dɔka kaɗi mbɛt, ɓɛɛ GASA WAN tɔ̧ ha̧ a̧: «Mɛ sɔka kaɗi in pɛ-mɛ dɔka kaɗi mbɛt; ɓɛɛ oi nù nɛ ɓɔna wen baa-a ɔ gasa. ","Josue sɔka kaɗi in pɛ-a dɔka kaɗi mbɛt, ɓɛɛ GASA WAN tɔ̧ ha̧ a̧: «Mɛ sɔka kaɗi in pɛ-mɛ dɔka kaɗi mbɛt; ɓɛɛ oi nù nɛ ɓɔna wen baa-a ɔ gasa. ","Ma kwa halenyɛ Zhozəwɛ ne, ma ke Mahwətə shɛ: «Nahe na kehale, kwele kwele va ta ŋa, ma hɛɗi nya ketene kanehe na ne, kwele kwele ŋkɛ. ","Josuwe taw taçaçbe go debañ kiñgi äe joñ go pur lay. Manwur kal riñgi äe ga no: Ndo taw taçaçbe go, kiñgi äo joñ go pur lay. Sir maga nen yaçaçge gwa' kluu debañ. "
JOS.13.2," Voici le pays qui reste: tous les districts des Philistins et tout le territoire des Gessuriens, ","This is the land that yet remaineth: all the borders of the Philistines, and all Geshuri,",Kayni mi nagana ma hinina: Nagata vi sa Filistina hiɗi sa Gesuriyena kaf; ,Ngabe si é liʼiya nje nyô: mefôla mese Befilisteñ be too; si Begézurieñ ése ,Hirwuy mindiramay vuna t'anihĩ: hirwuy ngi Filistihey ati hirwuy ngi Gesurihey gar. ,"Lesdi Filisti'en e lesdi Gesuri'en fuu, ","Lesdi Filisti'en e lesdi Gesuri'en fuu, ","O oi nù nɛ ɓɔna nɛ́ mɔɔ nɔ'ɔ: nù ko o be Filistii, nu ko o be Gɛsur, ","O oi nù nɛ ɓɔna nɛ́ mɔɔ nɔ'ɔ: nù ko o be Filistii, nu ko o be Gɛsur, ","Wa nyi hɛɗi nyi ketene nyi: Pɛtɛ hɛɗia ka Filisti, pɛtɛ ŋa ka Gɛshəwr, ","AÀ gwa' mono diñ sir mani jar Filisteçeç wo äuy, sir mani jar Gesurid wo äuy, "
JOS.13.3," depuis le Schichor qui coule à l'orient de l'Egypte, jusqu'à la frontière d'Accaron vers le nord, contrée qui doit être réputée Chananéenne; les cinq princes des Philistins, celui de Gaza, celui d'Azoth, celui d'Ascalon, celui de Geth et celui d'Accaron; ","From Sihor, which is before Egypt, even unto the borders of Ekron northward, which is counted to the Canaanite: five lords of the Philistines; the Gazites, and the Ashdothites, the Eshkalonites, the Gittites, and the Ekronites; also the Avites:","Tun caw tam Sihor ma ka riŋ goy vok Egipte pa ta-ta tam jaara vi Ekron hay gal ma gaana, gal liyna vi sa Kanaaniyana, ma ka hay ɓam sa yerimana sa vaslna vi sa Filistina, ma hay gal Gaza, ma hay gal Asdod, ma hay gal Askalon, ma hay gal Gad hiɗi Ekron, ma hay ɓam sa Aviyena; ","ataté ôsôé Sior wo lôt Ejipte ôsu a kui nné Ekroñ mfaʼa ya akôé, éfuse si ja yiane wôk a Bekananééñ, ve bejô bôt betane ya Befilisteñ mbe be too été: nyô ya Gaza, nyô ya Asdôd, nyô ya Askalôn, nyô ya Gat a nyô ya Ekroñ; Beévieñ fe be too été. ","A zlo zle a Sihor misek duba cakay ati Ezipte, hã sesẽŋ angi hirwuy Ekroŋ tir vay muŋ naŋ, li tayna gar na, taŋ kaɓa i hirwuy Kanaˀanay. Buy Filistihey ada zlum asi ruwuy tayna: buy ngi ruwuy Gaza, ngi Asdot, ngi Askaloŋ, ngi Gat, ngi Ekroŋ waɗ ngi Avihey. ","non boo lesdi Awwi'en gal fombina, diga maayo Sihor tiitotirŋgo bee Misra haa yotti keerol Ekuruun wakeere woyla, waato ko limete nder maral Kanaani'en. Laamiiɓe Filisti'en njowo ɗonno njooɗi haa Gaaza e Asdod e Askalon e Gaat e Ekuruun. ","non boo lesdi Awwi'en gal fombina, diga maayo Sihor tiitotirŋgo bee Misra haa yotti keerol Ekuruun wakeere woyla, waato ko limete nder maral Kanaani'en. Laamiiɓe Filisti'en njowo ɗonno njooɗi haa Gaaza e Asdod e Askalon e Gaat e Ekuruun. ","ká bá nɛ̀ nù ko o be Av. Nu'i ku̧u̧naŋ-a nɛ be yì nɛ‘i sa'e Sihɔr nɛ ndaɗa in Egiptɛ hɔ nɛnɛ tɛ  gbisi  Ekrɔŋ nɛ war ká̧-zan-mɛ́-ŋgɔn, nɛ wa zɔk hee nù ko Kanaŋ ga. O be-wan Filistii mɔɔrɔ: nɛ́ wannu Gaza, wannu Asdod, wannu Askelɔŋ, wannu Gat, in wannu Ekrɔŋ. ","ká bá nɛ̀ nù ko o be Av. Nu'i ku̧u̧naŋ-a nɛ be yì nɛ‘i sa'e Sihɔr nɛ ndaɗa in Egiptɛ hɔ nɛnɛ tɛ  gbisi  Ekrɔŋ nɛ war ká̧-zan-mɛ́-ŋgɔn, nɛ wa zɔk hee nù ko Kanaŋ ga. O be-wan Filistii mɔɔrɔ: nɛ́ wannu Gaza, wannu Asdod, wannu Askelɔŋ, wannu Gat, in wannu Ekrɔŋ. ","geze ta ŋkɛ, ghala se kwa hələa Shihor nya kwa ghala ta Ɛzhipte hwa'a te hɛɗia Ɛkron, laka bela kwa gwela nya ɓelahwe mbeli hwa ŋkwa nya sleke ka Kanan. Tagha nzanji mbeli nyi te ghəa ka Filisti mcɛfe, ghenci ka sleke Gaza, Asdod, Askalon, Gat ba'a Ɛkron, tsagha hɛɗia ka Ava ","mañ le jag Sihor maga le jag feele Ejipte ka' haçaç wo go ti hagu de Ekroñ nen äañ gloñhwede no kay ga diñ sir ma jar Kanaan wo, sir se maga wañre ma dwee mani jar Filisteçeç wo de lagge ni mono: wañre sen wo diñ ma Gasa no, ma Asdod no, ma Askaloñ, ma Gadn wo de ma Ekroñ. Sir mani jar Afiyeçeç wo gwa' lay. "
JOS.13.4," les Hévéens au midi; tout le pays des Chananéens, et Maara qui est aux Sidoniens, jusqu'à Aphec, jusqu'à la frontière des Amorrhéens; le pays des Gébalites, ","From the south, all the land of the Canaanites, and Mearah that is beside the Sidonians, unto Aphek, to the borders of the Amorites:","hay gal ma kayamna, nagata vi sa Kanaaniyan kaf, hiɗi Meyara, ta ka hay ɓam sa Sidonna ta-ta hay Afek, ta-ta hay jaara vi sa Amoriyana; ","Mfaʼa ya nké: si ése Bekananééñ be bili a Méara a ne si Besidônieñ, a kui Afék a nné Beamorééñ; ","Zle tir vay ruwuyo i hirwuy Kanaˀanay gar ati Ara, hirwuy ngi Sidoŋhoy, hã sesẽŋ a Afek, sesẽŋ ar maakway ngi Amorihey. ",Lutti lesdi Kanaani'en fuu diga Ara nder maral Sidoni'en haa yotti Afek haa keerol Amoori'en. ,Lutti lesdi Kanaani'en fuu diga Ara nder maral Sidoni'en haa yotti Afek haa keerol Amoori'en. ,Oi nù nɛ ɓɔna nɛ war ɗɔɔ wen baa-a mbɛt nɛ nù ko o be Kanaŋ lɛŋ in Meara nɛ duk nɛ́ ko o be Sidɔŋ hɔ Afɛka hɔ nɛnɛ tɛ  gbisi  ko o be Amɔr; ,Oi nù nɛ ɓɔna nɛ war ɗɔɔ wen baa-a mbɛt nɛ nù ko o be Kanaŋ lɛŋ in Meara nɛ duk nɛ́ ko o be Sidɔŋ hɔ Afɛka hɔ nɛnɛ tɛ  gbisi  ko o be Amɔr; ,"nya laka bela kwa zeme. Nda mbeli kazehwe pɛtɛa hɛɗia Kanan, se mbe Ara, nya kaŋa ka Sidon hwa'a mbe Afɛk, kwa ghala ta ka Amor, ","Wo nen äañ waçyban no kay mono, gwa' diñ sir mani jar Kanaan wo äuy, diñ äi leege Meara maga diñ sir ma jar Sidoñ wo mono, diñ sir maga mañ le de Afeg haçaç wo go ti hagu de jar Amorid wo mono. "
JOS.13.5," et tout le Liban vers le soleil levant, depuis Baal-Gad au pied du mont Hermon jusqu'à l'entrée de Hamath; ","And the land of the Giblites, and all Lebanon, toward the sunrising, from Baal–gad under mount Hermon unto the entering into Hamath.","nagata vi sa Gibliyena, Libaŋ kaf hay liy ma fatta dayna, tun caw ay tam Baal-Gad gaa sem hiɗiyta Hermon pa, ta-ta kal hay Hamat. ","si Begibilieñ, a Libañ ase mfaʼa jôp da tôô, ataté Bal-Gad a ne nkôle Ermone si, a kui anyiine Amat; ","Yo hirwuy Gebal ati hirwuy Libaŋ vay si pas ngi miprik naŋ, a zlo zle a Baˀal-Gat, a sarmuwã Hermoŋ, hã sesẽŋ a Lebo-Hamat. ","Non boo lesdi Gibili'en, waato Libanon wakeere fuunaaŋge fuu, diga Ba'al-Gada les Hermoon haa yotti nastirde Hamat. ","Non boo lesdi Gibili'en, waato Libanon wakeere fuunaaŋge fuu, diga Ba'al-Gada les Hermoon haa yotti nastirde Hamat. ","sɛka nù ko o be Gebal gu nɛ Libaŋ nɛ oi-aa nɛ war daŋa-wese, ku̧u̧naŋ-a nɛ Bal-Gat ká̧ naŋ kaya Hɛrmɔŋ hɔ nɛnɛ tɛ nú Lebo-Hamat. ","sɛka nù ko o be Gebal gu nɛ Libaŋ nɛ oi-aa nɛ war daŋa-wese, ku̧u̧naŋ-a nɛ Bal-Gat ká̧ naŋ kaya Hɛrmɔŋ hɔ nɛnɛ tɛ nú Lebo-Hamat. ","tsagha hɛɗia Gɛbal, pɛtɛ ŋa Liban nya laka nya same veci kwa yitea Ba'al-Gad, yitea seɗa ta ghweme ta Hɛrmon hwa'a kwa Lebo-Hamat, ","Gwa' pa mono diñ sir mani jar Gibliyeçeç wo, sir ma Libañ ma nen wur bo toñ äuy tï¡ï¡ le Baal-Gad le äaale Hermoñ haçaç le' wo go jag feele Hamade. "
JOS.13.6," tous les habitants de la montagne, depuis le Liban jusqu'aux eaux de Maséréphoth, savoir tous les Sidoniens: je les chasserai de devant les enfants d'Israël. Seulement partage par le sort ces pays en héritage à Israël, comme je l'ai commandé. ","All the inhabitants of the hill country from Lebanon unto Misrephoth–maim, and all the Sidonians, them will I drive out from before the children of Israel: only divide thou it by lot unto the Israelites for an inheritance, as I have commanded thee.","Sum sa li ziy kulo kay hiɗiyt kaf, fokay hay Libaŋ pa ta-ta hay Misrefot-Mayim, sum sa Sidonna kaf. Nan ma digiɗsi vok sa Israyella. Nam cani naŋ ma vulum voco kaf mi sa Israyella hiɗi ŋaɓta kuɗ ɦayta ki nan vul hagat taŋ nala, ","bôte bese be too minkô, ataté Libañ a kui Misrefôt-Mayim, Besidônieñ bese, ma ye wôlé mesi map asu bone bʼIsraél. Ve wo ye ve Israél mesi mete mese ane ngap a mboon asimba avale me nga bendé wo. ","Mizli ngi hirwuy vay muwãhay gar, zle a Libaŋ, hã sesẽŋ a Misrefot-Mayim, hirwuy ngi mizli Sidoŋhoy gar. I ya vuna masa tiɓa taŋ ti haŋ ɗu a mbuŋ Israyele. Mindir ngi ɗike, sey i wuɗuk naŋ da Israyeley ti gi ceregezleŋ tewle, kaɓa ya muɓuw di ɗaˀ le tuwa. ","Kanjum woni lesdi Sidoni'en jooɗiiɓe nder kooseeje hakkunde Libanon e Misrefot-Mayim. Min bee hoore am mi riiwan ummaatooje ɗe'e fuu yeeso Isra'iila'en. Ammaa an, sey a senndana ndi Isra'iila'en bee waɗugo kur'u, bana mi umri ma . ","Kanjum woni lesdi Sidoni'en jooɗiiɓe nder kooseeje hakkunde Libanon e Misrefot-Mayim. Min bee hoore am mi riiwan ummaatooje ɗe'e fuu yeeso Isra'iila'en. Ammaa an, sey a senndana ndi Isra'iila'en bee waɗugo kur'u, bana mi umri ma . ","Wi tɛ ba nù ko o wi-ɔ-mgbara kaya mbɛt, ku̧u̧naŋ-a nɛ Libaŋ hɔ Misrefot-Maim in nù ko o be Sidɔŋ lɛŋ; nɛ́ mi a̧ tɛ ndak wa yinɛ ti o be  Israɛl . Kɔ-mɛ, mɛ̀ pí̧ tani kɛ̧ nɛ nù ha̧ o be  Israɛl  kànà hee mɔ'ɔ n'am tɔ̧ɔ̧ so ha̧ mɛ ga ɓɛɛ.  ","Wi tɛ ba nù ko o wi-ɔ-mgbara kaya mbɛt, ku̧u̧naŋ-a nɛ Libaŋ hɔ Misrefot-Maim in nù ko o be Sidɔŋ lɛŋ; nɛ́ mi a̧ tɛ ndak wa yinɛ ti o be  Israɛl . Kɔ-mɛ, mɛ̀ pí̧ tani kɛ̧ nɛ nù ha̧ o be  Israɛl  kànà hee mɔ'ɔ n'am tɔ̧ɔ̧ so ha̧ mɛ ga ɓɛɛ.  ","pɛtɛa hɛɗi nya pelɛ ghweme se te Liban hwa'a va Misrefot-Mayim, pɛtɛ ŋa ka Sidon. Ma kahende geva ka Israyɛl kadzate mbe kema ne, kaŋka hɛ 'ya te kema ta nci. Ama gha ne, nehave nda bela ta hɛɗi nyi laka sla kwasheghediɗi ke ka Israyɛl kala nya gezave ŋa 'ya. ","Diñ jar ma ciñ ti huuli wo äuy ga tï¡ï¡ wo le Libañ ka' haçaç wo go Misrefot-Mayim mono, diñ jar Sidoñ wo äuy lay. Sir sen wo mo äuy no, ndi nii gi jar ma äil äaaran wo yañ go day ndi haç ge sir sen yañ go ne jar Israyel wo. Ane, ma äo Josuwe mono, äes sirn go ne jar Israyel wo, naa waçywaàale go ti äe do maga ndi hay waçaç ne ndo nono. "
JOS.13.7, Et maintenant répartis ce pays en héritage aux neuf tribus et à la demi-tribu de Manassé.» ,"Now therefore divide this land for an inheritance unto the nine tribes, and the half tribe of Manasseh,","Wulin kayni naŋ ma ɓuraw nagat na'ta, kay vula' voco'o mi jaf ma zleeŋena hiɗi gal-jafna vi Manase.",A a ntoo ve kabe si nyô éyoñe ji a ve je ane ngap e be meyoñ ébu a éfas ayoñ Manasé.,"Wurenna so na, wuɗuka hirwuy tayna da sukwi Israyel mitaˀ taˀ ngoltir na, ɓa a ndir da taŋ, waɗ da reta ngi sukwi ngi Manase.»","Senndu ndi jonta, ngam haa le'i joweenayi e reeta lenyol Manassa keɓa maral maaji.”","Senndu ndi jonta, ngam haa le'i joweenayi e reeta lenyol Manassa keɓa maral maaji.”","Kinii, mɛ̀ kɛ̧́ nù'ɛ ha̧ duk nɛ̀ mɔɔ-oi ko o zuduk be  Israɛl  mɔɔrɔ-ɗoŋ-naar in reeta zuduk ko Manase.»","Kinii, mɛ̀ kɛ̧́ nù'ɛ ha̧ duk nɛ̀ mɔɔ-oi ko o zuduk be  Israɛl  mɔɔrɔ-ɗoŋ-naar in reeta zuduk ko Manase.»",Nehete nda hɛɗia shɛ tsetsenya kawəsə kezeme ghɛ ke hwelefefi mesli ba'a kwa bake ta bela ta mbelia Manasɛ.»,"Patalam no, car äil sir mo ti' go ti äï¡ï¡ni jar Israyel ma kaawa'n wo de nus jar ma ti äï¡ï¡ni mani Manase ma lan wo lay."
JOS.13.8," Avec l'autre moitié, les Rubénites et les Gadites ont reçu leur héritage, que Moïse leur a donné de l'autre côté du Jourdain, à l'orient, comme le leur a donné Moïse, serviteur de Yahweh: ","With whom the Reubenites and the Gadites have received their inheritance, which Moses gave them, beyond Jordan eastward, even as Moses the servant of the  Lord  gave them;","Gal jaf hena (vi Manase), jafna vi Ruben hiɗi jafna vi Gad, vocota visi fiya, ki Musus vulsit goy hay gal hena vi Yordan nala, hay gal ma kuɗuwna, kayni ŋray ca ki Musus ma sunda vi Ma-Vatɗina vul hagat nala. ","Bone be Ruben, ba be Gad a éfas ayoñ Manasé be nga nyoñe ngabe jap, nyô Môze a nga ve be Yordan yat mfaʼa jôp da tôô; a avalʼane Môze, mbo ésaé Nti, a nga ve be je: ","Sukwi ngi Ruben ati ngi Gat waɗ reta ngi sukwi ngi Manase mudumbuŋ na, a lumam nga taŋ le avu Moyis muvula taŋ di a dubazaw Zurdeŋ, tisi pas ngi miprik. A lumaka kaɓa Moyis, gawla ngi Bumbulvuŋ muvula taŋ di. ","Reeta lenyol Manassa feere e le'i Ruben e Gada keɓno maral muuɗum'en ngal Muusa, jaggiiɗo Jawmiraawo hokkuno ɓe gaɗa Urdun gal fuunaaŋge , ","Reeta lenyol Manassa feere e le'i Ruben e Gada keɓno maral muuɗum'en ngal Muusa, jaggiiɗo Jawmiraawo hokkuno ɓe gaɗa Urdun gal fuunaaŋge , ","Ɓɛɛ nɛ ko ɓii reeta zuduk ko Manase, wa in zuduk ko Rubɛn in ko Gad, wa a̧a̧ so kɔ-wa nɛ mɔɔ-oi nɛ Moisɛ wi-de-tom ko GASA WAN ha̧a̧ so ha̧ wa nɛ war kur Jurdɛn ɓi, si war daŋa-wese kaɗi.  ","Ɓɛɛ nɛ ko ɓii reeta zuduk ko Manase, wa in zuduk ko Rubɛn in ko Gad, wa a̧a̧ so kɔ-wa nɛ mɔɔ-oi nɛ Moisɛ wi-de-tom ko GASA WAN ha̧a̧ so ha̧ wa nɛ war kur Jurdɛn ɓi, si war daŋa-wese kaɗi.  ","Nahe hwelefefia Rəbɛn, Gad ba'a kwete kwa bake ta bela ta Manasɛ kekemave ŋa nci hɛɗi nyi ndeke nda Moyize, nde mene slene ta Mahwətə ke hɛ pelɛ kema ta Zhəwrdɛŋe laka same ta veci, ",Nus jar ma ti äï¡ï¡ni mani Manasen wo de äï¡ï¡ni mani Ruben wo de Gad hay da' wo tway ma äaaran le go faale Jurdeçeç nen wur bo toñ no. Hay haç sir sen ne hara diñ Moyis je peele Manwur no. 
