livre.chapitre.verset,Francais,Anglais,BIBALDA_TA_PELDETTA,Bulu,Guiziga,Fulfulde_Adamaoua,Fulfulde_DC,KALATA_KO_SC_Gbaya,KALATA_KO_DC_Gbaya,Kapsiki_DC,Tupurri
JOS.7.13," Lève-toi, sanctifie le peuple et dis-leur: Sanctifiez-vous pour demain; car ainsi parle Yahweh, le Dieu d'Israël: Il y a un anathème au milieu de toi, Israël; tu ne pourras point tenir devant tes ennemis, jusqu'à ce que vous ayez ôté l'anathème du milieu de vous. ","Up, sanctify the people, and say, Sanctify yourselves against to morrow: for thus saith the  Lord  God of Israel, There is an accursed thing in the midst of thee, O Israel: thou canst not stand before thine enemies, until ye take away the accursed thing from among you.","Fokaŋ kulo'o, laŋ sumun goy peldete: Naŋ ma disi ala nisi ma li tuwsi goy peldete kay fatta grawta. Kay Ma-Vatɗina ka di ala: Slen ma telayna ka jargiya, nigi sa Israyella, nigi as col kulo vok sa gawt kiginɗi, la slen ma telayna jargiya nigi may ɓulakam goyɗi. ","Kôlôʼô si, a tun ayoñ. Wo ye jô bôte na: Tunane miabebien asu ya akiti, amu avale di nde Nti, Nyô a ne Zambe ya Israél a jô na: Jôm ja yiane jañ é ne ézezañ jôé, a Israél! Ajô te ô se ngule ya tebe asu besiñ bôé, nté mi ngenan te vaa jôm ja yiane jañ é ne ézezañ jenan. ","Zozuwe, slikiɗ wurenna, zuɓa hiryi ngi mizli avra. Ɓa taŋ na: ‹Bumbulvuŋ Buymisemuŋ ngi Israyel a ɓukum, ɓa ki zuɓaka hiryi kumoy avra ngi tiprike. Israyeley, gwat mitika le, i ngi zuɓ zleˀe ta ada a wuzla kumo. Vurˀe, kum anta sa cicam a mbuŋ mesene kumoyo zlak gu ta. Gwat mitika na, sey da kum mubam di le avra ti wuzla kumo far.› ","Umma, sen ummaatoore, wi' ɓe: Cene ko'e mon ngam jaŋngo. Ndaa nii Jawmiraawo, Allah Isra'iila wi'i: Hakke haram ɗon caka mooɗon, onon Isra'iila'en. On ndartantaako konne'en mooɗon, sonaa to on itti hakke maajum. ","Umma, sen ummaatoore, wi' ɓe: Cene ko'e mon ngam jaŋngo. Ndaa nii Jawmiraawo, Allah Isra'iila wi'i: Hakke haram ɗon caka mooɗon, onon Isra'iila'en. On ndartantaako konne'en mooɗon, sonaa to on itti hakke maajum. ","Mɛ̀ kúr, mɛ̀  ɗáfí  war-tɛ dukbíí. Mɛ̀ tɔ̧: ‹Ɛ̀nɛ̀  ɗáfí  war-tɛ‘nɛ́ wen sa̧a̧mɔ. Tɔ̧ɔ̧-wen ko GASA WAN Sɔ̧ ko  Israɛl  nɛ́ mɔ'ɔ: o be  Israɛl , mɔɔ-fom a̧a̧ mgbara'nɛ́. Ɛnɛ beka yor ti o wisɛn k’ɛ́nɛ́ na hɔ ŋgimbi n’ɛnɛ baa mɔɔ-fom nɛ a̧a̧ mgbara'nɛ́ yinɛ.› ","Mɛ̀ kúr, mɛ̀  ɗáfí  war-tɛ dukbíí. Mɛ̀ tɔ̧: ‹Ɛ̀nɛ̀  ɗáfí  war-tɛ‘nɛ́ wen sa̧a̧mɔ. Tɔ̧ɔ̧-wen ko GASA WAN Sɔ̧ ko  Israɛl  nɛ́ mɔ'ɔ: o be  Israɛl , mɔɔ-fom a̧a̧ mgbara'nɛ́. Ɛnɛ beka yor ti o wisɛn k’ɛ́nɛ́ na hɔ ŋgimbi n’ɛnɛ baa mɔɔ-fom nɛ a̧a̧ mgbara'nɛ́ yinɛ.› ","Sate te ŋkwa, yaɓemte mbeli wɛŋe. Ma pa na sha hɛ: Yaɓemte mə ghəa ŋayɛ kezha hendɛ, kwa nza ŋkɛ ma ke Shala Mahwətə ta Israyɛl: Katezhɛne yɛ kaghereŋe kwa kema ta ka jaga ta ŋayɛ keɗema yɛ kekelemte wəsə nya fɛake ŋayɛ 'ya yite hwa gheyɛ we. ","Ur go ciñ, façaç ngaäan go! Wii ra ga aà mo façaç wo see äaara go ma toñ gahaçyla Manwuri, Baa mani Israyel gano: Fen ëag yañ ti yoo äay, nday jar Israyel no! Hayga nday naa fen ëag sen go ti yoo äay gaa no, nday kaçaç ma lagge ngiñ pel jar hee äayn wo gaè. "
JOS.7.14," Vous vous approcherez le matin selon vos tribus, et la tribu que Yahweh aura saisie s'approchera par familles, et la famille que Yahweh aura saisie s'approchera par maisons, et la maison que Yahweh aura saisie s'approchera par têtes. ","In the morning therefore ye shall be brought according to your tribes: and it shall be, that the tribe which the  Lord  taketh shall come according to the families thereof; and the family which the  Lord  shall take shall come by households; and the household which the  Lord  shall take shall come man by man.","Nigi ma co tani hay graw culumta, kuɗ jafna jafna, jafna ma Ma-Vatɗina vilekemawana ma jik vokanu kuɗ vuɗna vuɗna. Vuɗna ma Ma-Vatɗina vilekemawana ma co kuɗ ziyna ziyna, ziyna ma Ma-Vatɗina vilekemawana ma co kuɗ bum-ziyna bum-ziyna. ","Mametyé, meyoñ mese awôm a mebaé ma ye subu bebé; wôna ayoñ Nti a ye liti ônyu da ye subu avalʼane mebume mé me né a abume bôt Nti a ye liti ônyu, da ye subu avalʼane menda me bôte mé me né, a nda bôt Nti a ye liti ônyu ja ye subu avalʼane betebʼôsu yʼété be né. ","Ti miprike, kisa soko bigaka vu kum a mbuŋ ɗu, vur sukwi vur sukwi. Sukwi misi Bumbulvuŋ misik haŋ le ava na, kisa soko, vur muy vur muy. Muy misi Bumbulvuŋ misik haŋ le ava na, kisa soko, vur hay vur hay, yo hay misikam haŋ le ava na, kisa soko, purla purla gar. ","Jaŋngo fajiri on ɓadito fodde le'i mon. Lenyol ngol Jawmiraawo naŋngata ɗum, ɓadito fodde geɓe maagol. Yeɓre nde Jawmiraawo naŋngata ɗum, ɓadito fodde ci'e  maare. Saare nde Jawmiraawo naŋngata ɗum, ɓadito fodde worɓe maare. ","Jaŋngo fajiri on ɓadito fodde le'i mon. Lenyol ngol Jawmiraawo naŋngata ɗum, ɓadito fodde geɓe maagol. Yeɓre nde Jawmiraawo naŋngata ɗum, ɓadito fodde ci'e  maare. Saare nde Jawmiraawo naŋngata ɗum, ɓadito fodde worɓe maare. ","Sa̧a̧mɔ mɛ tutuyɛ, ɛnɛ tɛ nɛk nɛ̀ zuduk zuduk, ɓɛɛ zuduk nɛ GASA WAN tɛ usi nɛ tani, tɛ nɛk nɛ̀ nú-gara; ɓɛɛ nú-gara nɛ GASA WAN tɛ usi tɛ nɛk nɛ̀ nutua; ɓɛɛ nutua nɛ GASA WAN tɛ usi tɛ nɛk nɛ̀ bíí kpɔk kpɔk. ","Sa̧a̧mɔ mɛ tutuyɛ, ɛnɛ tɛ nɛk nɛ̀ zuduk zuduk, ɓɛɛ zuduk nɛ GASA WAN tɛ usi nɛ tani, tɛ nɛk nɛ̀ nú-gara; ɓɛɛ nú-gara nɛ GASA WAN tɛ usi tɛ nɛk nɛ̀ nutua; ɓɛɛ nutua nɛ GASA WAN tɛ usi tɛ nɛk nɛ̀ bíí kpɔk kpɔk. ","Hendɛ masheke ne, katehende geva yɛ kase keyita keyita, ma yita nya ncɛte Mahwətə ne, kahende geva ŋkɛ kepelə kepelə kase, ma ghɛ nya ncɛte Mahwətə, kahende geva ŋkɛ kewəndə kewəndə kase. ","Toñ de jag toñ mono, lag wee le go ti äï¡ï¡ni ta' ta'a. Äï¡ï¡ni maga Manwur wii do we ti sen no, lag ge wo yañ le go ti wer moorebe ta' ta'a. Moobe maga Manwur wii do we ti sen no, lag ge wo yañ le go ti feele ta' ta'a. Feele maga Manwur wii do we ti sen no, lag ge wo yañ le go ti jag tiñ ka' ka'a. "
JOS.7.15," Celui qui sera saisi comme atteint par l'anathème sera consumé par le feu, lui et tout ce qui lui appartient, parce qu'il transgresse l'alliance de Yahweh et commet une infamie en Israël.» ","And it shall be, that he that is taken with the accursed thing shall be burnt with fire, he and all that he hath: because he hath transgressed the covenant of the  Lord , and because he hath wrought folly in Israel.","Sa ma ŋaɓta nigawa kalam ala li va ma telayn mi namu ni, sa namna ma gum hay kuta, namu hiɗi sa falamna noŋ kafe, kay nam ɓulak bonota hiɗi Ma-Vatɗina, kay nam li law ma telayna hay Israyel.","A ye bo na, nyô a ye beʼe ayeme ya jôm ja yiane jañ a ye diʼiban nduan, émien a jôm ése a bili: amu a tyameya élate Nti, a a boya jam é ne ôson a ôsame Israél été.","Mbur misikam haŋ le ava, muzuɓa gwat mitika na i naŋ na, a sa zlizliraka zlizlir zlizlir, jom ati gwat naŋhay gar. Asi mike na, a ngila ɓi ngi jumoˀay ngi Bumbulvuŋ le, yo ma na, a gi gwat mukuyta wãˀ le asi ruwuy Israyele.»","Naŋngeteeɗo ngam hakke haram, ngule mo bee yiite, kaŋko e ko o mari fuu, ngam o fiisti alkawal Jawmiraawo, o waɗi nyidduɗum nder Isra'iila.”","Naŋngeteeɗo ngam hakke haram, ngule mo bee yiite, kaŋko e ko o mari fuu, ngam o fiisti alkawal Jawmiraawo, o waɗi nyidduɗum nder Isra'iila.”","Wi-de-mɔɔ-fom nɛ tani tɛ ba, wì dɔ́ a̧ yí wee in o mɔ kɔ̧-a̧ lɛŋ, wen a̧ gbina  nɔɔ-tɔk  ko GASA WAN, a̧ foo búù pi̧ zu  Israɛl .»","Wi-de-mɔɔ-fom nɛ tani tɛ ba, wì dɔ́ a̧ yí wee in o mɔ kɔ̧-a̧ lɛŋ, wen a̧ gbina  nɔɔ-tɔk  ko GASA WAN, a̧ foo búù pi̧ zu  Israɛl .»","Ma wəndə nya ncɛte geva wəshi nyi fɛake ŋkwa Shala yite ve ne, katetere ŋkɛ mbeli le ghwə, gheŋkɛ ba'a pɛtɛa wəshia ŋkɛ: kwa nza ŋkɛ nahe ŋkɛ kepelemte ghena nya tsahwe Mahwətə le mbeli ba'a kekeleke wəsə kwa ndiremi kadzete ka Israyɛl.»","Je tiñ maga ree ëag sen la naa nen we see äe no, aè roën ge go de feçeçre mani äen wo äuy. AÀ hoo sug ti tayge jag mani Manwurn gaa, aà joñ yo go yoo jar Israyel wo."
JOS.7.16," Le lendemain, Josué se leva de bon matin et fit approcher Israël selon ses tribus, et la tribu de Juda fut saisie. ","So Joshua rose up early in the morning, and brought Israel by their tribes; and the tribe of Judah was taken:","Yosuwa fok kulo graw culum culum, nam jik sa Israyel vokomu kuɗ jafna visiya visiya. Ŋaɓta nig kay jafna vi Yuda. ","Nalé Yasua a nga kôlô si ndibe tyé, a bo na Israél a subu nye bebé avalʼane meyoñ mé me né. Ane ayoñe Yuda e nga litiban ônyu. ","Zozuwe a slikiɗ ngi miprik prike, a ɓa sukwi Israyele gar, ɓa a kiroho ng'avaŋ, vur sukwi vur sukwi. A sikam haŋ avu sukwi ngi Zuda. ","Yosuwa dawi cub. O ɓadini Isra'iila'en fodde le'i muuɗum'en, lenyol Yahuuda naŋngaama. ","Yosuwa dawi cub. O ɓadini Isra'iila'en fodde le'i muuɗum'en, lenyol Yahuuda naŋngaama. ","Nɛ mɔ'ɔ nɛ Josue kura mɛ tutuyɛ sut; a̧ mɔi̧a o be  Israɛl  a nɛ̀ zuduk, ɓɛɛ tani ba zuduk ko Juda. ","Nɛ mɔ'ɔ nɛ Josue kura mɛ tutuyɛ sut; a̧ mɔi̧a o be  Israɛl  a nɛ̀ zuduk, ɓɛɛ tani ba zuduk ko Juda. ","Masheke masheke ne, pa Zhozəwɛ sate ba'a hendeke ka Israyɛl keyita keyita. Pa yita ta Zhəwda ntave geva. ","Josuwe raw urgi go ciñ de toñ mbuhu, lag jar Israyel wo le go pel äe ti äï¡ï¡ni ta' ta'a. Do raw le'ge ti äï¡ï¡ni mani Juda no. "
JOS.7.17," Il fit approcher les familles de Juda, et la famille de Zaré fut saisie. Il fit approcher la famille de Zaré par maisons, et Zabdi fut saisi. ",And he brought the family of Judah; and he took the family of the Zarhites: and he brought the family of the Zarhites man by man; and Zabdi was taken:,"Nam jik jafna vi Yuda vokomu, ŋaɓta nig kay vuɗna vi Zerak, nam mar vuɗna vi Zerak vokomu, kuɗ bum-ziyna bum-ziyna Ŋaɓta nig kay Zabdi. ","Nde a nga loone mebum me bôt ya Yuda, ane di Zéra e nga litiban ônyu. A nga loon abume bôte Zéra avalʼane betebʼôsu bap be né, ane Zabdi a nga litiban ônyu. ","A kirohoko sukwi ngi Zuda, a sikam haŋ avu muy ngi Zerahay. A kirohoko muy ngi Zeraˀahaya purla purla, a sikam haŋ avu hay ngi Zaɓdi. ","O ɓadini geɓe nder lenyol Yahuuda, yeɓre Zara naŋngaama. O ɓadini yeɓre Zara fodde ci'e maare, saare Zabdi naŋngaama. ","O ɓadini geɓe nder lenyol Yahuuda, yeɓre Zara naŋngaama. O ɓadini yeɓre Zara fodde ci'e maare, saare Zabdi naŋngaama. ","A̧ saa o bíí tɛ o nú-gara ko Juda pii ti, ɓɛɛ tani ba nú-gara ko o be Zera. A̧ saa o bíí nú-gara ko Zera pii ti, ɓɛɛ tani ba nɛ nutua ko Zabdi. ","A̧ saa o bíí tɛ o nú-gara ko Juda pii ti, ɓɛɛ tani ba nú-gara ko o be Zera. A̧ saa o bíí nú-gara ko Zera pii ti, ɓɛɛ tani ba nɛ nutua ko Zabdi. ","Pa ŋkɛ hendeke yita ta Zhəwda kepelə kepelə, pa peləa Zɛra ntave geva. Pa ŋkɛ hendeke peləa Zɛra keghɛ keghɛ, pa ghɛa Zabdi ntave geva. ","Se lag äï¡ï¡ni mani Judan le go ti moorebe ta' ta'a. Do raw le'ge ti moobe mani Serag no. Moobe mani Serag lag le go ti feele ta' ta'a, do raw le'ge ti feele mani Sabdi no. "
JOS.7.18," Il fit approcher la maison de Zabdi par têtes, et Achan, fils de Charmi, fils de Zabdi, fils de Zaré, de la tribu de Juda, fut saisi. ","And he brought his household man by man; and Achan, the son of Carmi, the son of Zabdi, the son of Zerah, of the tribe of Judah, was taken.","Nam jik sumay ziyn vokomu. Ki kayn nala ŋaɓta nig kay Akan, goora vi Karmi, goora vi Zabdi, goora vi Zerak, hay jafna vi Yuda.","A nga loone minlô ya nda bôte Zabdi, nde Akan, mona Karmi, ndaé Zabdi, ndile Zéra ya ayoñ Yuda a nga litiban ônyu.","A dirba nah, a kirohoko hay ngi Zaɓdi, mbur gar a kiroho ng'avaŋ. A sikam haŋ avu Akan, mangal ngi Karmi, dideˀ ngi Zaɓdi vuna, yo i dideˀ ngi popurok ngi Zera, sukwi ngi Zuda. ","O ɓadini worɓe saare Zabdi, Akan ɓii Karmi ɓii Zabdi ɓii Zeraha nder lenyol Yahuuda naŋngaama. ","O ɓadini worɓe saare Zabdi, Akan ɓii Karmi ɓii Zabdi ɓii Zeraha nder lenyol Yahuuda naŋngaama. ","A̧ saa o bíí nutua ko Zabdi kpɔk kpɔk pii ti, ɓɛɛ tani ba nɛ Akaŋ, bem ko Karmi, be-koo Zabdi, nú-gara ko Zera, zuduk ko Juda. ","A̧ saa o bíí nutua ko Zabdi kpɔk kpɔk pii ti, ɓɛɛ tani ba nɛ Akaŋ, bem ko Karmi, be-koo Zabdi, nú-gara ko Zera, zuduk ko Juda. ","Pa ŋkɛ hendeke zhili nyi ki ghɛa shɛ kewəndə kewəndə, pa Akan, wəzege ta Karmi, wəzege ta Zabdi, wəzege ta Zɛra, kwa yita ta Zhəwda ntave geva. ","Feele mani Sabdi lag le go ti jag tiñ ka' ka'a, do raw le'ge ti Akan je ni Karmi moo Sabdi, didi Serag ti äï¡ï¡ni mani Juda no."
JOS.7.19," Josué dit à Achan: «Mon fils, donne gloire, je te prie, à Yahweh, le Dieu d'Israël, et rends-lui hommage. Avoue-moi ce que tu as fait, ne me le cache point.» ","And Joshua said unto Achan, My son, give, I pray thee, glory to the  Lord  God of Israel, and make confession unto him; and tell me now what thou hast done; hide it not from me.","Yosuwa di tam Akan: Goora vanu, vulaŋ suburta tam Ma-Vatɗina, Lawna vi Israyel, tiyaŋgi selemu; dan goyo kay va ma naŋ lumna, ŋayanɗi. ","Ajô te Yasua a nga sili Akan na: A mone wom, vaʼa Nti duma a akéva. Nyô a ne Zambe ya Israél; nalé fe na kate ma jam ô nga bo a te solé ma de! ","Zozuwe a ɓa Akan tuwa: «Mangal ɗu, vula dudok da Bumbulvuŋ, Buymisemuŋ ngi Israyele, yo hunumaŋ. Gwat ka miga na, bigiy di, anja ki ɗum gwat avu ya ta.» ","Yosuwa wi'i Akan: “Ɓiŋngel am, hul Jawmiraawo, Allah Isra'iila, wolwu gooŋga, yeccam ko mbaɗɗa, taa suuɗam koo ɗume.” ","Yosuwa wi'i Akan: “Ɓiŋngel am, hul Jawmiraawo, Allah Isra'iila, wolwu gooŋga, yeccam ko mbaɗɗa, taa suuɗam koo ɗume.” ","Josue tɔ̧ɔ̧ ha̧ Akaŋ: «Bem kɔ‘m, mɛ̀ gásí GASA WAN Sɔ̧ ko  Israɛl , mɛ̀ tɔ̧́ kpasawen ti a̧, mɛ̀ tɔ̧́ mɔ nɛ mɛ dea ha̧‘m, ká mɛ́ hu̧si nɛ‘m na.»","Josue tɔ̧ɔ̧ ha̧ Akaŋ: «Bem kɔ‘m, mɛ̀ gásí GASA WAN Sɔ̧ ko  Israɛl , mɛ̀ tɔ̧́ kpasawen ti a̧, mɛ̀ tɔ̧́ mɔ nɛ mɛ dea ha̧‘m, ká mɛ́ hu̧si nɛ‘m na.»","Ma ke Zhozəwɛ sha Akan: «Wəzege ta ɗa, vate zləvə te Mahwətə, Shala ta ka Israyɛl, gheŋkɛ nde ve nda zləvə ke ghəa ŋkɛ. Ncɛte wəsə nya menete na, ntikəma wəsə na va 'ya ma.» ","Josuwe day wii Akan gano: Weel äi, joñ mbo ga Manwuri, Baa mani Israyel mo da' togoëge ëa la. Dom mbo ne ëa la! Sii mbo fen maga ndo joñn go me ëegere, yoñn do äi wa. "
JOS.7.20," Achan répondit à Josué et dit: «C'est la vérité; c'est moi qui ai péché contre Yahweh, le Dieu d'Israël; voici ce que j'ai fait: ","And Achan answered Joshua, and said, Indeed I have sinned against the  Lord  God of Israel, and thus and thus have I done:","Akan hot dit tam Yosuwa ala: Gasiya, li suluk kat Ma-Vatɗina Lawna vi Israyel kayn mi nanu. Nan min ɗekgi goy haraŋi kay slen ma nan lumna: ","Nde Akan a nga yalane Yasua na: E ne foʼo bebela na ma me boya nsem e mise me Nti, Zambe ya Israél. Jam ese me nga bo nde di: ","Akana kwana a mbiɗa da Zozuwe: «Naŋ kaslsla gisiŋ gwat naŋ, migi mungra avu Bumbulvuŋ Buymisemuŋ ngi Israyel i yaha. Ya miga na, jiviɗ nah a cuh anihĩ: ","Akan jaabi: “Gooŋga, mi waɗi hakke dow Jawmiraawo, Allah Isra'iila. Ndaa ko mbaɗmi: ","Akan jaabi: “Gooŋga, mi waɗi hakke dow Jawmiraawo, Allah Isra'iila. Ndaa ko mbaɗmi: ","Akaŋ kifa nú ha̧ Josue: «Nɛ́ kpasawen, mɛ̀ nɛ́ mi a̧ dee ɗaŋmɔ in GASA WAN Sɔ̧ ko  Israɛl . Mɔ n'am dea nɛ́ mɔ'ɔ: ","Akaŋ kifa nú ha̧ Josue: «Nɛ́ kpasawen, mɛ̀ nɛ́ mi a̧ dee ɗaŋmɔ in GASA WAN Sɔ̧ ko  Israɛl . Mɔ n'am dea nɛ́ mɔ'ɔ: ","Ma ke Akan zhɛnete nda ke Zhozəwɛ: «Kaganda ne, 'ya nde menete nda fete ke Shala Mahwətə ta ka Israyɛl. Wa nya wəsə nya menete 'ya nya: ","AÀ kal ferge ne Josuwe gano: Kidolgi, joñ älagge see Manwuri, Baa mani Israyeln na diñ ndi mbi. Fen maga ndi joñ geëer diñ ma kay no: "
JOS.7.21," J'ai vu parmi les dépouilles un beau manteau de Sennaar, deux cents sicles d'argent, et un lingot d'or du poids de cinquante sicles; je les ai convoités et je les ai pris; ils sont cachés dans la terre au milieu de ma tente, et l'argent est dessous.» ","When I saw among the spoils a goodly Babylonish garment, and two hundred shekels of silver, and a wedge of gold of fifty shekels weight, then I coveted them, and took them; and, behold, they are hid in the earth in the midst of my tent, and the silver under it.","Jar sle ma tum ɓuraŋŋa, iran cuk kay sligar-tuwna vi Sineyar  mara kep jifiyam suwiya, hiɗi gurjuta ir sikel* kis-ma', hiɗi or ma mokayna kep ma nekka valamu ir sikel* dok-vasl, dikan daramu, nala nan yawamu; wulini nam ka piy kan gaa kuɗ nagata, way guɗukŋa, gurjut ka piy gaa kuɗum may. ","me nga yen, e biôm ya nsa été, étua mbamba alôʼô ya Sinéar nalé besikel be argent mintete mibaé a beta ébabe or adit tañ besikel mewôm metan; ane me nga nyamete bie a nyoñe bie; biôm bite bi ne nda éndelé jam, nsolan si été, argent nye a ne mfaʼa ya si. ","A wuzla zlili ngi mesene ndrahay na, yi pur zana mezle ngi Mezopotami, kuy naŋ a zli ta wãˀ, yo suloy ngi ɓiri bara skat cuw, waɗ ɓiri tapasl tapaslreta kilo, may taŋ a jiy haɗa teˀe, joˀ yi hila taŋ. T'ani ɗum a ruwuy, a hur guɗuk ɗu, yo dala naŋ da kulaˀ aseˀeŋ.»","Nder keɓal konu ngi'mi alkibbaare woonde iwnde haa Sine'ar e ceede cardi teemeɗɗe ɗiɗi e tayre kaŋŋeeri nde teddeeŋga mum woni baakin reeta kilo. Suuno waɗi yam, mi hooci ɗum. Mi iri alkibbaare man nder lesdi haa caka laymaaru am, cardi boo haa les maare.”","Nder keɓal konu ngi'mi alkibbaare woonde iwnde haa Sine'ar e ceede cardi teemeɗɗe ɗiɗi e tayre kaŋŋeeri nde teddeeŋga mum woni baakin reeta kilo. Suuno waɗi yam, mi hooci ɗum. Mi iri alkibbaare man nder lesdi haa caka laymaaru am, cardi boo haa les maare.”","mi zɔka ŋma laa, wan mɛ nú Sinɛar nɛ dee nyɛmna sɛn mgbara mɔɔ-oi-biro, kɔya bu-mbɔi gɔmŋmaa-yiitoo in lɔr tɛ reeta kilo. Wɔ-a gbɛa'm ɓɛɛ mi kai. Mi hu̧sa̧ mɔɔ nɔ‘i lɛŋ ɗɔɔ nù sɛn kɔ̧ tua kɔ‘m, ɓɛɛ bu-mbɔi a̧a̧ nɛ ɗɔɔ-aa mɛ.»","mi zɔka ŋma laa, wan mɛ nú Sinɛar nɛ dee nyɛmna sɛn mgbara mɔɔ-oi-biro, kɔya bu-mbɔi gɔmŋmaa-yiitoo in lɔr tɛ reeta kilo. Wɔ-a gbɛa'm ɓɛɛ mi kai. Mi hu̧sa̧ mɔɔ nɔ‘i lɛŋ ɗɔɔ nù sɛn kɔ̧ tua kɔ‘m, ɓɛɛ bu-mbɔi a̧a̧ nɛ ɗɔɔ-aa mɛ.»","Pa 'ya nakɛ karalame nya ganyɛ nya kese te hɛɗia Mɛzopotami, dəɓərəa mze kwa tɛawetɛa gwəmsə bake ba'a mze kwa tere tere gare kwa bake ta bela ta kiləwə hwa wəshia shɛhɛ. Pa 'mawe zhɛte ɗa yitea hɛ ba'a pa 'ya fəte hɛ. Kwa hɛɗi leyi hɛ 'ya mbe cɛa ɗa, kwa zeweve ta nci mze kwa tɛawetɛa.»","Nen äi ba oçoçbe po yoo kaçaçra ni ga wore äe da' gahaçy gaa, ga aè joñn le äil sir Sineyar mono, de solay boo ni kiskis äog de boo biñni po poçoçre äe nen klew do naa ti boñ lay. Nen äi sag ti äaara day ndi hoo ra. AÀ wo patala de yoñre gesiñ nen sir tiñma ni äi, solay wo wer taw. "
JOS.7.22," Josué envoya des messagers qui coururent à la tente, et voici, les objets étaient cachés dans la tente d'Achan, et l'argent était dessous. ","So Joshua sent messengers, and they ran unto the tent; and, behold, it was hid in his tent, and the silver under it.","Yosuwa cuk sumun jaŋi hay guɗukŋa valamu. Nam ka ŋayay hay guɗukŋa valam gasiya, gurjut ka piy gaa kuɗumu may. ","Nde Yasua a nga lôme bôte mbil nda éndelé. A be nga koone foʼo bi ntoo mbamba nsolan nda éndelé Akan été, argent a too mfaʼa ya si. ","Zozuwe a slin mizli, a kilam ng'ar guɗuk ngi Akan tuwa. A ra lumaka zana naŋ da ɗum a hur guɗuk naŋ tuwa gisiŋ, waɗ dala kulaˀ aseˀeŋ. ","Yosuwa neli woɗɓe, ɓe ndoggani laymaaru man. Ndaa ɓe tawi alkibbaare ɗon iri nder laymaaru e cardi boo les maare. ","Yosuwa neli woɗɓe, ɓe ndoggani laymaaru man. Ndaa ɓe tawi alkibbaare ɗon iri nder laymaaru e cardi boo les maare. ","Josue toma o bíí, ɓɛɛ wa ma yì nɛnɛ hɔ kɔ̧ tua ko Akaŋ; wa nɛɛ kpa gasa laa n'aa hu̧sa̧, nɛ̀ bu-mbɔi a̧a̧ ɗɔɔ-aa'i kɔ̧ tua kɔ̧-a̧. ","Josue toma o bíí, ɓɛɛ wa ma yì nɛnɛ hɔ kɔ̧ tua ko Akaŋ; wa nɛɛ kpa gasa laa n'aa hu̧sa̧, nɛ̀ bu-mbɔi a̧a̧ ɗɔɔ-aa'i kɔ̧ tua kɔ̧-a̧. ","Pa Zhozəwɛ ghwenakɛ mbeli le hwɛ kalə kadzeki ghɛ. Kaganda shɛ ntikəyi hɛ ŋkɛ, le mze kwa tɛawetɛa kwayite. ","Josuwe kal laa jar deparday tiñma no, saara wo da' feçeçren de yoñre dosen no cwaçy no, solayn wo were. "
JOS.7.23," Les ayant pris du milieu de la tente, ils les apportèrent à Josué et à tous les enfants d'Israël, et les déposèrent devant Yahweh. ","And they took them out of the midst of the tent, and brought them unto Joshua, and unto all the children of Israel, and laid them out before the  Lord .","Nisi patamay kulo hay guɗukŋa pa, maram tam Yosuwa hiɗi sa Israyella kafe, nisi kom gaa vok Ma-Vatɗina.",Ane be nga vaa bie nda éndelé a zuu bie be Yasua a Israél ase a bôé bie asu be Nti.,"Mizli a hilaka gwataya ti hur guɗuko, a ram taŋ da Zozuwe waɗ da Israyeleye gar. A paka taŋ a mbuŋ Bumbulvuŋ.","Ɓe koo'i ɗum, ɓe ngaddi ɗum haa Yosuwa e Isra'iila'en fuu, ɓe ndufi ɗum yeeso Jawmiraawo. ","Ɓe koo'i ɗum, ɓe ngaddi ɗum haa Yosuwa e Isra'iila'en fuu, ɓe ndufi ɗum yeeso Jawmiraawo. ",Wa kaia mɔɔ nɔ‘i lɛŋ tɛnɛ ti Josue in o be  Israɛl . Wa kaia a nù ti GASA WAN. ,Wa kaia mɔɔ nɔ‘i lɛŋ tɛnɛ ti Josue in o be  Israɛl . Wa kaia a nù ti GASA WAN. ,Pa hɛ kelakame hɛ ba'a fəke nda hɛ ke Zhozəwɛ ba'a ka Israyɛl. Pa hɛ beteyi hɛ te kema ta Mahwətə. ,Saara hoo ra le go äuy a wo de äaara ne Josuwe wo de jar Israyel wo äuy. Saara raw co' rage pel Manwur ka'a.
JOS.7.24," Josué et tout Israël avec lui prirent Achan, fils de Zaré, l'argent, le manteau, le lingot d'or, les fils et les filles d'Achan, ses boeufs, ses ânes, ses brebis, sa tente et tout ce qui lui appartenait, et il les firent monter dans la vallée d'Achor. ","And Joshua, and all Israel with him, took Achan the son of Zerah, and the silver, and the garment, and the wedge of gold, and his sons, and his daughters, and his oxen, and his asses, and his sheep, and his tent, and all that he had: and they brought them unto the valley of Achor.","Yosuwa vi Akan goora vi Zerak, nam yaw sligar-tuwna, hiɗi or ma mokayna, gurona vi Akan, sa jufayna hiɗi sa boyna, luwayna, kurona, fukunayna, guɗukŋa valamu hiɗi slena valam kaf. Sumun sa Israyel kaf tap hiɗi Yosuwa, nisi kalam hay lokŋa vi Akor. ","Wôna Yasua a nga nyoñe Akan, mona Zéra, nalé fe argent, alôʼô a ébabe or, bobefame bé, bobebinga bé, a benyaʼa bé, bijakase bié, mone mbame wé, nda éndelé jé a jôm ése é mbe énjé. Israél ase a nga fulan a Yasua, ane be nga kee be mbiʼili Akor. ","Akan, mangal ngi Zera, dala, zana, ɓiri tapasl tapasl reta kilo tuwa, ziri naŋ mizilehey ati mongosohoy, gusoŋ naŋ, zungu naŋ, ˀaway ati tumuŋ naŋhay, guɗuk naŋ waɗ gwat naŋ misi ti naŋ gar na, Zozuwe a hila taŋ. Israyeley gar jom ng'avaŋ, a ram ti taŋ ng'ar sozo ngi Akor. ","Yosuwa e Isra'iila'en fuu koo'i Akan Jerahaajo e cardi e alkibbaare e tayre kaŋŋeeri e ɓiɓɓe maako e worɓe e rewɓe e na'i maako e bamɗe maako e dammooji maako e laymaaru maako e ko o mari fuu, ɓe njahri ɗum nder waadiwol Akor . ","Yosuwa e Isra'iila'en fuu koo'i Akan Jerahaajo e cardi e alkibbaare e tayre kaŋŋeeri e ɓiɓɓe maako e worɓe e rewɓe e na'i maako e bamɗe maako e dammooji maako e laymaaru maako e ko o mari fuu, ɓe njahri ɗum nder waadiwol Akor . ","Josue in o be  Israɛl  lɛŋ mgbɔɔ Akaŋ bem ko Zera in o bem kɔ̧-a̧ mɛ wiwii-a in be-okoo-a, o ndai, o tuifuu ká bá nɛ̀ geɗek mɔ-dai kɔ̧-a̧ si kɔ̧ ɗɔŋgɔ Akɔr. Wa kaia bu-mbɔi kɔ̧-a̧, de gasa laa kɔ̧-a̧, tua-laa kɔ̧-a̧ in o mɔ kɔ̧-a̧ lɛŋ si hi̧i̧ mbɛt. ","Josue in o be  Israɛl  lɛŋ mgbɔɔ Akaŋ bem ko Zera in o bem kɔ̧-a̧ mɛ wiwii-a in be-okoo-a, o ndai, o tuifuu ká bá nɛ̀ geɗek mɔ-dai kɔ̧-a̧ si kɔ̧ ɗɔŋgɔ Akɔr. Wa kaia bu-mbɔi kɔ̧-a̧, de gasa laa kɔ̧-a̧, tua-laa kɔ̧-a̧ in o mɔ kɔ̧-a̧ lɛŋ si hi̧i̧ mbɛt. ","Pa Zhozəwɛ kelete Akan, wəzege ta Zɛra le mze kwa tɛawetɛa, karalame, mze kwa tere tere nya kakwa bake ta kiləwə ba'a ŋwalea ŋkɛ, yɛ sla ta ŋkɛ, kwara lɛməa ŋkɛ, wəshi keseɗa ta ŋkɛ nyi ɓɛhwɛ ɓɛhwɛ, cɛ lekwesa ta ŋkɛ ba'a pɛtɛa wəshia ŋkɛ. Pa pɛtɛa ka Israyɛl fəghe hɛ dzawa zlərəa Akor. ","Josuwe kal hoo Akan je ni Serag de solay no, de oçoçbe no, de boo biñni no, de weere äen wo de mayre äen wo, de dere äen wo de gerheçeç äen wo de fiiri äen wo, tiñ mani äen de feçeçre äen wo äuy. Jar Israyel tay wo see äaara de Josuwe äuy kañ wo ra wo äil log ma Akor no. "
