livre.chapitre.verset,Francais,Anglais,BIBALDA_TA_PELDETTA,Bulu,Guiziga,Fulfulde_Adamaoua,Fulfulde_DC,KALATA_KO_SC_Gbaya,KALATA_KO_DC_Gbaya,Kapsiki_DC,Tupurri
JOS.19.22," La frontière touchait à Thabor, à Séhésima et à Beth-Samès, et aboutissait au Jourdain: seize villes et leurs villages. ","And the coast reacheth to Tabor, and Shahazimah, and Beth–shemesh; and the outgoings of their border were at Jordan: sixteen cities with their villages.","nam co kat Tabor, kat Sahatsima, tam Bet-Semes, dab goy kat Yordan; hoyok-ziy ma ŋulona doogo yam karkiya hiɗi hoyok-ziy guray ma kuɗumna. ","Nné ate a nga nnambe fe Tabor a Kaasima, a Bétsemék, a ke vame Yordan: bitison awôm a bisaman a minlame miap. ","Maakway aru meh meh avu Tabor, Kasayim, Bet-Semes waɗ ara kiɗ mi a mi mizaw Zurdeŋ. Jom gar na, walahay madiɗahay anga kuruˀ nga merkeɗe, jom ti prok taŋhaya wãˀ wãˀ. ","Keerol maɓɓe meemi boo Taboora e Sakasuuma e Bayti-Semes, ngol haaɗi haa maayo Urdun, ɗum berniiji sappo e joweego bee gure maaji. ","Keerol maɓɓe meemi boo Taboora e Sakasuuma e Bayti-Semes, ngol haaɗi haa maayo Urdun, ɗum berniiji sappo e joweego bee gure maaji. ","Gbìsì  kɔ-wa hɔɔ Tabɔr, Sahasima in Bɛt-Sɛmɛs, tik nɛnɛ Jurdɛn: nɛ́ o gasa ye ɓu-zua-mɔɔrɔ-ɗoŋ-kpɔk in o geɗek-a. ","Gbìsì  kɔ-wa hɔɔ Tabɔr, Sahasima in Bɛt-Sɛmɛs, tik nɛnɛ Jurdɛn: nɛ́ o gasa ye ɓu-zua-mɔɔrɔ-ɗoŋ-kpɔk in o geɗek-a. ","Kakwaɗe Tabor, Shasayim nde, kantsehe nde hwa'a kwa Zhəwrdɛŋe. Meŋe ŋkwaŋeghəmbe meleme nyi jama jama le nyi ɓɛhwɛ ɓɛhwɛ nyi dzeyi yitea hɛ. ","Hagun hee Tahor, hee Sahatsima, hee Bet-Semes day wo go kañ ti ne Jurdeçeç. Tay äuy äi leege hwal ti hiira' de sir ma ti äaaran wo. "
JOS.19.23," Tel fut l'héritage de la tribu des fils d'Issachar, selon leurs familles: les villes et leurs villages. ","This is the inheritance of the tribe of the children of Issachar according to their families, the cities and their villages.","Kayni ti vocota vi jafna vi Isakar, kuɗ vuɗna visiya visiya, hoyok-ziy namna ma ŋulona lakŋi hiɗi hoyok-ziy guray ma kuɗumna.","Ngabe bone bʼIsakar be nga nyoñ nje le, avalʼane mebume map me né, bitison bite a minlame miap.","Hana i hirwuy muvulaka da sukwi ngi Isakar, vur muyo vur muyo, walahay madiɗa tayna jom ti prok taŋhaya wãˀwãˀ.","Kanjum woni geɗal lenyol Issakar bee geɓe maagol, berniiji ɗi'i bee gure maaji.","Kanjum woni geɗal lenyol Issakar bee geɓe maagol, berniiji ɗi'i bee gure maaji.",Mɔɔ-oi ko o bezaŋ Isakar nyɛm nɛ ɗoŋ o nú-gara kɔ-wa nɛ́ o ye nɔ‘i in o geɗek-a.,Mɔɔ-oi ko o bezaŋ Isakar nyɛm nɛ ɗoŋ o nú-gara kɔ-wa nɛ́ o ye nɔ‘i in o geɗek-a.,"Tsetse ŋa hwelefe ta Isakar hɛɗi kezeme ghɛ kala nza ta peləa nci, meleme nyi jama jama le nyi ɓɛhwɛ ɓɛhwɛ nyi dzeyi yitea hɛ.","Äi leege sen wo de sir ma ti äaaran wo mo äuy na diñ tway mani jar ma ti äï¡ï¡ni mani Isakarn wo, go de ngaäge ti moobe ta' ta'a."
JOS.19.24," La cinquième part échut par le sort à la tribu des fils d'Aser, selon leurs familles. ",And the fifth lot came out for the tribe of the children of Asher according to their families.,Ŋaɓta kuɗ ɦayta ta sem vaslta vul nagata mi jafna vi gurona vi Aser kuɗ vuɗna visiya visiya. ,"Ngabe tane é nga kôlô é mbe nyô bone bʼAzér, avalʼane mebume map me né. ",Ceregezleŋ muzlum naŋ a diɗ ar sukwi ngi Aser. A vulaka taŋ hirwuyo vur muyo vur muyo. ,Kur'u njowaɓu waŋgini geɗal lenyol Aser bee geɓe maagol. ,Kur'u njowaɓu waŋgini geɗal lenyol Aser bee geɓe maagol. ,"War mɔɔrɔ-a, tani baa nù ha̧ zuduk ko o bezaŋ Asɛr nyɛm nɛ ɗoŋ o nú-gara kɔ-wa. ","War mɔɔrɔ-a, tani baa nù ha̧ zuduk ko o bezaŋ Asɛr nyɛm nɛ ɗoŋ o nú-gara kɔ-wa. ","Kwa mcɛfe ta bela nya kentave nda geva laka kwasheghediɗi ne, ŋa hwelefe ta ŋwalea Asɛr, kala nza ta peləa nci. ","AÈ naa waçywaàale ma de dween se le' ti äï¡ï¡ni mani Aser no, go de ngaäge ti moobe ta' ta'a. "
JOS.19.25," Leur frontière était Halcath, Chali, ","And their border was Helkath, and Hali, and Beten, and Achshaph,","jar nagata visi kayni ti Helkat, Hali, Beten, Aksaf; ","Nné wop a mbe Elkat, Ali, Bétén, Aksaf; ","Maakway taŋ a bi ti hirwuy Helkat, Hali, Beteŋ, Akesaf, ",Keerol maɓɓe hawti Helkat e Hali e Beten e Akisaf ,Keerol maɓɓe hawti Helkat e Hali e Beten e Akisaf ,"O ye nɔ'ɔ duka tɛ nù kɔ-wa: Hɛlkat, Hali, Betɛn, Aksaf, ","O ye nɔ'ɔ duka tɛ nù kɔ-wa: Hɛlkat, Hali, Betɛn, Aksaf, ","Ma ghala ta nci ne, Hɛlkat, Hali, Bɛtɛn, Akeshaf, ","Hagu äaaran mañ le de Helkad, de Hali, de Beten wo de Aksaf, "
JOS.19.26," Béten, Axaph, Elmélech, Amaad et Messal; elle touchait, vers l'occident, au Carmel et à Sihor-Labanath; puis elle tournait vers Beth-Dagon, ","And Alammelech, and Amad, and Mishal; and reacheth to Carmel westward, and to Shihor–libnath;","Alamalek, Amiyad hiɗi Mikeyal, nam co kat gal ma vulatina, kat Karmel hiɗi Sihor-Libnat; ","Alamélék, Amead a Mikal, akekui mfaʼa jôp da dim, nkôle Karmél a Sior-Libnat; ","Alamelek, Amat waɗ Mikal. Tisi pas ngi pastaˀa, maakway aru ngbasl avu muwã Karmel waɗ sipeˀe Sihor-Lipnat. ",e Allammelek e Am'ada e Miseyal. Haa hiirnaaŋge ngol yotti hooseere Karmel e Sihor-Libnat. ,e Allammelek e Am'ada e Miseyal. Haa hiirnaaŋge ngol yotti hooseere Karmel e Sihor-Libnat. ,"Alamɛk, Amead in Miseal.  Gbìsì  nɛɛ fo kaya Karmɛl nɛ war yee-wese in Sihɔr-Libnat. ","Alamɛk, Amead in Miseal.  Gbìsì  nɛɛ fo kaya Karmɛl nɛ war yee-wese in Sihɔr-Libnat. ","Alamɛlɛk, Amad ba'a Mishal. Kakwaɗe Karmɛl nde laka ŋkwa kapəkwə ta veci ba'a Shihor-Libnat. ","de Alameleg, de Amead wo de Miseyal. Se le' go ti huuli Karmel nen wur bo law, le' go jag pyew Sihor-Libnad. "
JOS.19.27," touchait Zabulon et la vallée de Jephtahel, au nord de Beth-Emec et de Néhiel, et aboutissait à Caboul, ","And turneth toward the sunrising to Beth–dagon, and reacheth to Zebulun, and to the valley of Iphtah–el toward the north side of Beth–emek, and Neiel, and goeth out to Cabul on the left hand,","bugolda, nam jik hay gal ma fatta dayna, hay Bet-Dagon, jik kat Zabulon hiɗi lokŋa vi Yifta-El hay gal gaa'a vi Bet-Emek hiɗi Neyel, co ta-ta kat Kabul hay gal gulu, ","A kôñelan mfaʼa jôp da tôô e Bét-Dagon; a nnambe Zabuloñ, a mbiʼili Yifta-El e Bét-Emék a Négél akôé, a ke vame Kabul e mbo ngal. ","Tisi pas ngi miprike, maakway a gun kini ngir ti Bet-Dagoŋ, meh meh avu hirwuy Zabuloŋ waɗ avu hurjijiŋ ngi Ifta-El. Akẽh na, a bi kini tir vay muŋ ngi Bet-Emek ati Neˀiyel, a muruɗ kini tir vay ngi Kabul, ","Haa wakeere feere ngol yehi fuunaaŋge haa Bayti-Daagon, ngol yotti Zabulon e waadiwol Yiftah-El haa woyla Bayti-Emek e Ne'iyel. Ngol dilli gal woyla Kabul ","Haa wakeere feere ngol yehi fuunaaŋge haa Bayti-Daagon, ngol yotti Zabulon e waadiwol Yiftah-El haa woyla Bayti-Emek e Ne'iyel. Ngol dilli gal woyla Kabul ","Gbìsì  zika si daŋa-wese si Bɛt-Dagɔŋ tan nɛ Zabulɔŋ in ɗɔŋgɔ Yifta-Ɛl nɛ ká̧-zan-mɛ́-ŋgɔn ha̧ Bɛt-Emɛk in Nɛiɛl, nɛ́ɛ̀ haɗi sɛn Kabul nɛ war gale. ","Gbìsì  zika si daŋa-wese si Bɛt-Dagɔŋ tan nɛ Zabulɔŋ in ɗɔŋgɔ Yifta-Ɛl nɛ ká̧-zan-mɛ́-ŋgɔn ha̧ Bɛt-Emɛk in Nɛiɛl, nɛ́ɛ̀ haɗi sɛn Kabul nɛ war gale. ","Zhɛne ne, kazhɛre geva nde laka bela ta ŋkwa kesame ta veci yitea Bɛt-Dagon, kazhigə nde vare Zabəlon ba'a zlərəa Ifta-Ɛl, laka bela kwa gwela ta Bɛt-Ɛmɛk ba'a Nɛyɛl, kajive nde laka kwa gwela ta Kabəwl, ","Se kii go Bet-Dagon nen wur bo toñ no kay, hee go ti jag sir ma Sabuloñ wo de log ma Yifta-El go äañ gloñhwede Bet-Emeg wo de Neyele no kay no. Se le' go Kabul go nen äañ gur no kay no. "
JOS.19.28," à gauche, et à Abran, Rohob, Hamon, et Cana, jusqu'à Sidon la Grande; ","And Hebron, and Rehob, and Hammon, and Kanah, even unto great Zidon;","lo, kat Ebron, Rehob, Hamon hiɗi Kana ta-ta kat Sidon ta ŋolda. ","A mfaʼa ya Ebroñ, Reôd, Amon a Kana, akekui e beta Sidoñ. ","ngir ti Abdoŋ, Rehop, Hamoŋ ati Kana, waɗ ara kiɗ mi a Sidoŋ, walahay madiɗaŋ. ","e Abdon e Rehob e Hammon e Kana, haa yotti Sidon berniwol maŋngol. ","e Abdon e Rehob e Hammon e Kana, haa yotti Sidon berniwol maŋngol. ","Gbìsì  yaka woyo si Hebrɔŋ, Rehob, Hamɔŋ in Kana hɔ nɛnɛ Gasa-Sidɔŋ. ","Gbìsì  yaka woyo si Hebrɔŋ, Rehob, Hamɔŋ in Kana hɔ nɛnɛ Gasa-Sidɔŋ. ","laka Abdon, Rehob, Hamon ba'a Kana, kantsehe nde hwa'a mbe Sidon, meleme nya wəba. ","Se le' go nen Ebron, le' go Rehob, go Hamon, go Kana, haçaç le' wo go Sidoñ äi leege ma kluu no. "
JOS.19.29," la frontière tournait ensuite vers Ramath jusqu'à la ville forte de Tyr et la frontière tournait vers Hosa, pour aboutir à la mer, près du district d'Achziba; ","And then the coast turneth to Ramah, and to the strong city Tyre; and the coast turneth to Hosah; and the outgoings thereof are at the sea from the coast to Achzib:","Bugolda jaara jik gal Rama ta-ta hay hoyok-ziy ma donona vi Tirus, hay gal Hosa, kay co goy kat niy-lum ma ŋolla, hay galla vi Akzib. ","A kôñelan mfaʼa ya Rama, a kui tison ôlem ba loone Tir, a mfaʼa ya Osa, a suʼulane vam e mañ, éyoñe te a lôteya ngoto Akzib. ","A mbiɗi gunno ngir ti Rama waɗ ng'ar matura ngi Tir muguno ti mohol. Akẽh na, a jik jik ngir ti Hosa, ng'ar mubuliy Mediterane, ara kiɗ mi a Mahalep, Aksip, ","Nden keerol wayliti, yehi Rama e berniwol Tirus. Ton ngol wayliti fahin, ngol yehi Hosa, ngol haaɗi haa Mbeela. Woodi boo berniiji ɗi'i nder keerol man: Mahaleeba e Akizib ","Nden keerol wayliti, yehi Rama e berniwol Tirus. Ton ngol wayliti fahin, ngol yehi Hosa, ngol haaɗi haa Mbeela. Woodi boo berniiji ɗi'i nder keerol man: Mahaleeba e Akizib ","Gbìsì  zika woyo si war Rama hɔ tɛ ŋgárá Tir, ɓɛɛ zik si Hosa, haɗi nɛnɛ nú gba Tɔp, tɛ nù ko Akzib. ","Gbìsì  zika woyo si war Rama hɔ tɛ ŋgárá Tir, ɓɛɛ zik si Hosa, haɗi nɛnɛ nú gba Tɔp, tɛ nù ko Akzib. ","Tagha gɛ, kazhɛre geva ŋkɛ laka Rama ba'a ŋkwa nya berete nya te hɛɗia Tir, kajive nde laka Hosa kezha miɗi kwa ndərəa Mɛditɛranɛ dzawa laka Mahalɛb, Akzib, ","Hagun kii go nen Rama haçaç le' wo go Tir äi leege ma de eegre no, kii go Hosa, hee wo äil ngeel ma Aksib no, day le' wo go jag maarog ma kluu no. "
JOS.19.30," de plus: Amma, Aphec et Rohob: vingt-deux villes et leurs villages. ","Ummah also, and Aphek, and Rehob: twenty and two cities with their villages.","Hegena lo, Umma, Afek, Rehob, hoyok-ziy ŋulon dok-ma' yam ma' hiɗi hoyok-ziy ma gurayna. ","Uma, Afék a Rehôb be too fe été; bitisone mewôm mebaé a bibaé a minlame miap. ","Um, Afek waɗ Rehop. Jom gar na, walahay madiɗahay kukur cuw nga cuw, jom ti prok taŋhaya wãˀ wãˀ ma. ","e Umma e Afek e Rehob, ɗum fuu ɗum berniiji noogas e ɗiɗi bee gure maaji. ","e Umma e Afek e Rehob, ɗum fuu ɗum berniiji noogas e ɗiɗi bee gure maaji. ","O ye Uma, Afɛk in Rehob a̧a̧ tɛ nù‘i mbɛt. O gasa ye lɛŋ dee ɓu-yiitoo-zua-yiitoo in o geɗek-a. ","O ye Uma, Afɛk in Rehob a̧a̧ tɛ nù‘i mbɛt. O gasa ye lɛŋ dee ɓu-yiitoo-zua-yiitoo in o geɗek-a. ","Əwm, Afɛk le Rehob, bakemsə bakeghəmbe meleme nyi jama le nyi ɓɛhwɛ te hɛɗia shɛ pɛtɛ. ","Äi leege ma tigriñ hay wo ni pa mono, diñ Uma, Afeg wo de Rehob. Äi leege äaaran wo do äog ti äog de sir ma ti äaaran wo. "
JOS.19.31, -- Tel fut l'héritage de la tribu des fils d'Aser. Selon leurs familles: ces villes et leurs villages. ,"This is the inheritance of the tribe of the children of Asher according to their families, these cities with their villages.","Kayni ti vocota vi jafna vi gurona vi Aser, kuɗ vuɗna visiya visiya, hoyok-ziy ŋulo namna lakŋi hiɗi naga guray ma kuɗumna.","Ngabe si bone bʼAzér nje le, avalʼane mebume map me né: bitisone bite a minlame miap.","Hana i hirwuy muvulaka da sukwi ngi Aser, vur muyo vur muyo, i walahay tayna jom ti prok taŋhaya wãˀ wãˀ.","Kanjum woni geɗal lenyol Aser bee geɓe maagol, berniiji ɗi'i bee gure maaji.","Kanjum woni geɗal lenyol Aser bee geɓe maagol, berniiji ɗi'i bee gure maaji.",Mɔɔ-oi ko zuduk ko o bezaŋ Asɛr nyɛm nɛ ɗoŋ o nú-gara kɔ-wa nɛ́ o ye nɔ‘i in o geɗek-a.,Mɔɔ-oi ko zuduk ko o bezaŋ Asɛr nyɛm nɛ ɗoŋ o nú-gara kɔ-wa nɛ́ o ye nɔ‘i in o geɗek-a.,"Tsetse ŋa hwelefe ta ŋwalea Asɛr ŋkwa kezeme ghɛ kala yita ta nci, meleme nyi jama le nyi ɓɛhwɛ.","Äi leege sen wo de sir ma ti äaara wo mo äuy diñ tway mani jar ma ti äï¡ï¡ni mani Asern wo, go de ngaäge ti moobe ta' ta'a."
JOS.19.32," La sixième part échut par le sort aux fils de Nephthali, selon leurs familles. ","The sixth lot came out to the children of Naphtali, even for the children of Naphtali according to their families.","Ŋaɓta kuɗ ɦayta ta sem karkiyata vul nagat mi jafna vi Neftali, kuɗ vuɗna visiya visiya. ","Ngabe saman é nga kôlô é mbe nyô bone be Néftali, avalʼane mebume map me né. ",Ceregezleŋ mimerkeɗ naŋ a diɗ ar sukwi ngi Neftali. A vulaka taŋ hirwuyo vur muyo vur muyo. ,Kur'u njoweego'oowu waŋgini geɗal lenyol Neftali bee geɓe maagol. ,Kur'u njoweego'oowu waŋgini geɗal lenyol Neftali bee geɓe maagol. ,"War mɔɔrɔ-ɗoŋ-kpɔk-a, tani baa nù ha̧ o bezaŋ Nɛftalii nyɛm nɛ ɗoŋ o nú-gara kɔ-wa. ","War mɔɔrɔ-ɗoŋ-kpɔk-a, tani baa nù ha̧ o bezaŋ Nɛftalii nyɛm nɛ ɗoŋ o nú-gara kɔ-wa. ","Kwa ŋkwaŋe ta ŋkwa nya, kentave nda geva le kwasheghediɗi ke ŋwalea Nɛftali kala yita ta nci. ","AÈ naa waçywaàale ma de hiira'n se le' ti wer mani Neftali no, go de ngaäge ti moobe ta' ta'a. "
JOS.19.33," Leur frontière allait depuis Héleph, à partir du chêne qui est à Saananim, vers Adami-Néceb et Jebnaël, jusqu'à Lécum, et elle aboutissait au Jourdain; ","And their coast was from Heleph, from Allon to Zaanannim, and Adami Nekeb, and Jabneel, unto Lakum; and the outgoings thereof were at Jordan:","Jaara visiya fokay hay Helef pa, hay Elon pa, jik hay Saananim, Adami-Nekeb hiɗi Yabneel, ta-ta hay Lakkum, co goy kel Yordan. ","Nné wop a nga taté Eléf, Elôn, a lôté e Taananim, Adami-Nékéb a Yabnil, a kui Lakum, a ke vame Yordan. ","Maakway ngi hirwuy taŋ tir vay ruwuyo, a zli zle a Halef, waɗ zle avu widis madida ngi Saˀananim. A cuh bal ti Adami-Nekep, waɗ a Yaɓneyel, hã sesẽŋ a Lakum, waɗ ara kiɗ mi a mizaw Zurdeŋ. ","Keerol maɓɓe fuɗɗi haa Helef, yehi haa lekki makki haa Sa'ananim, nden ngol yehi haa Adami-Nekeb e Yabneyel e Lakkum, ngol haaɗi haa maayo Urdun. ","Keerol maɓɓe fuɗɗi haa Helef, yehi haa lekki makki haa Sa'ananim, nden ngol yehi haa Adami-Nekeb e Yabneyel e Lakkum, ngol haaɗi haa maayo Urdun. ","Gbìsì  kɔ-wa ku̧u̧naŋ sɛn Helɛf, hɔ tɛ gasa te  sɛn Sananim, tik Adamin-Nekɛb, Yabnɛl hɔ Lakum haɗi sɛn nú Jurdɛn. ","Gbìsì  kɔ-wa ku̧u̧naŋ sɛn Helɛf, hɔ tɛ gasa te  sɛn Sananim, tik Adamin-Nekɛb, Yabnɛl hɔ Lakum haɗi sɛn nú Jurdɛn. ","Ghala ta nci ne, kaslə mbe Hɛlɛf, se yitea kwete wəfe nya wəba nya mbe Sa'ananim kadzeyi laka, Adami-Nɛkɛb le Yabnɛyɛl, hwa'a kwa Lakəwm, ba'a kazhigə kwa Zhəwrdɛŋe. ","Hagu äaaran ur le Helef wo de Elon, hee le Saananim, le Adami-Nekeb wo de Yabneyel haçaç le' wo go Lakum wo go kañ ti ne Jurdeçeç. "
JOS.19.34," la frontière tournait vers l'occident à Azanoth-Thabor, et de là aboutissait à Hucuca; elle touchait à Zabulon au midi, à Aser à l'occident, et à Juda, près du Jourdain, vers le soleil levant. ","And then the coast turneth westward to Aznoth–tabor, and goeth out from thence to Hukkok, and reacheth to Zebulun on the south side, and reacheth to Asher on the west side, and to Judah upon Jordan toward the sunrising.","Nam jik hay gal ma vulatina hay Aznot-Tabor, ɗawayn pa co goy hay Hukok; nam jik kat Zabulon hay gal ma kayamna, hay Aser hay gal ma vulatina hiɗi kat Yuda; Yordan ka hay gal ma fatta dayna. ","A tyiñelan e jôp da dim, Aznôt-Tabor, a kôlô valé a kui Ukôt; a nga nnambe Zabuloñ mfaʼa ya nké, Azér, mfaʼa jôp da dim a Yuda; Yordan a mbe mfaʼa jôp da tôô. ","Tisi pas ngi pastaˀa, maakway a gun gunno ngir ti Azinot -Tabor, aru ti kẽh ngbasl a Hukok, tir vay ruwuyo, naŋ meh meh avu hirwuy Zabuloŋ, waɗ hirwuy Aser tisi pas ngi pastaˀ naŋ. Tisi pas ngi miprike, maakwaya ti Yehuda a mizaw Zurdeŋ. ","Haa wakeere feere ngol yehi hiirnaaŋge haa Asnot-Taboora. Nden ngol yehi haa Hukoka. Haa fombina ngol yotti Zabulon, haa hiirnaaŋge boo Aser. Haa fuunaaŋge ngol yotti Yahuuda haa maayo Urdun. ","Haa wakeere feere ngol yehi hiirnaaŋge haa Asnot-Taboora. Nden ngol yehi haa Hukoka. Haa fombina ngol yotti Zabulon, haa hiirnaaŋge boo Aser. Haa fuunaaŋge ngol yotti Yahuuda haa maayo Urdun. ","Gbìsì  ɓira si war yee-wese si Azanot-Tabɔr ɓɛɛ nɛ́ si Ukɔt hɔ nɛnɛ nú Zabulɔŋ nɛ war ká̧-zan-mɛ́-ɗɔɔ, e nú Asɛr nɛ war yee-wese ká bá nɛ̀ Juda,  e Jurdɛn nɛ war daŋa-wese. ","Gbìsì  ɓira si war yee-wese si Azanot-Tabɔr ɓɛɛ nɛ́ si Ukɔt hɔ nɛnɛ nú Zabulɔŋ nɛ war ká̧-zan-mɛ́-ɗɔɔ, e nú Asɛr nɛ war yee-wese ká bá nɛ̀ Juda,  e Jurdɛn nɛ war daŋa-wese. ","Kazhɛre geva ŋkɛ laka bela nya pəkwə veci kwa sha Aznot-Tabor, kajive nde laka Hokəwk, kajive laka hɛɗia Zabəlon nya laka bela kwa zeme, zhɛne, ŋa Asɛr nya laka ŋkwa kepəkwə ta veci. Ma laka bela kesame ta veci ne, Zhəwrdɛŋe ya kwa ghala. ","Se kii go Asnot-Tabor nen wur bo law no kay, day ur le ni ka' le' wo go Hukog. Se le' go nen äañ waçyban ti hagu de Sabuloñ go nen wur bo law go ti hagu de Aser wo de Juda. Jurdeçeç hay diñ hagu äaaran ma nen wur botoñn tu. "
JOS.19.35," Les villes fortes étaient: Assédim, Ser, Emath, Reccath, Cénéreth, ","And the fenced cities are Ziddim, Zer, and Hammath, Rakkath, and Chinnereth,","Hoyok-ziy ma donon kayni: Siddim, Ser, Hamat, Rakat, Kinneret; ","Bitison bi ne mbômaʼan a alem bi mbe na: Sidim, Zér, Amat, Rakat, Kinérét; ","Walahayay muguno hirnga taŋhaya le ti mohol ani: Sidim, Ser, Hamat, Rakat, Kineret, ",Berniiji maɓɓe cemmbiɗɗi ngoni: Ciddim e Ceer e Hammat e Rakkat e Kinneret ,Berniiji maɓɓe cemmbiɗɗi ngoni: Ciddim e Ceer e Hammat e Rakkat e Kinneret ,"O ŋga ye duka nɛ́ Sidim, Ser, Hamat, Rakat, Kinɛrɛt, ","O ŋga ye duka nɛ́ Sidim, Ser, Hamat, Rakat, Kinɛrɛt, ","Ma meleme nyi berete berete ne, Sidim, Sɛr, Hamat, Rakat, Kinɛrɛt, ","Äi leege äaara ma de eegren hay wo diñ Sidim, Ser, Hamad, Rakad wo de Kinered, "
JOS.19.36," Edéma, Arama, Asor, ","And Adamah, and Ramah, and Hazor,","Adama, Rama, Hatsor; ","Adama, Rama, Asor; ","Adama, Rama, Hasor, ",e Adama e Rama e Hacoor ,e Adama e Rama e Hacoor ,"Adama, Rama, Hasɔr, ","Adama, Rama, Hasɔr, ","Adam, Rama, Hasor, ","Adama, Rama wo de Hatsor, "
JOS.19.37," Cédès, Edraï, En-Hasor, ","And Kedesh, and Edrei, and En–hazor,","Kedes, Edrey, En-Hatsor; ","Kédés, Edré, En-Asor. ","Kedes, Edreyi, En-Hasor, ",e Keedes e Edirey e En-Hacoor ,e Keedes e Edirey e En-Hacoor ,"Kɛdɛs, Edrɛi, Ɛn-Hasɔr, ","Kɛdɛs, Edrɛi, Ɛn-Hasɔr, ","Kɛdɛsh, Ɛdrɛyi, Ɛn-Hasor, ","Kedes, Edrey wo de En-Hatsor "
JOS.19.38," Jéron, Magdalel, Horem, Beth-Anath et Beth-Samès: dix-neuf villes et leurs villages. ","And Iron, and Migdal–el, Horem, and Beth–anath, and Beth–shemesh; nineteen cities with their villages.","Yireyon, Mikdal-El, Horem, Bet-Anat hiɗi Bet-Semes; hoyok-ziy ŋulona doogo yam zleeŋe hiɗi hoyok-ziy guray ma kuɗumna. ","Yireôn, Migdal-El, Orém, Bét-Anat a Bétsemék: bitison awôm a ébu a minlame miap. ","Iroŋ, Migdal-El, Horem, Bet-Anat waɗ Bet-Semek. Jom gar na, walahay madiɗahay kuruˀ nga ngoltir, jom ti prok taŋhaya wãˀ wãˀ ma. ","e Yiron e Migdaliila e Horem e Bayti-Anat e Bayti-Semes, ɗum berniiji sappo e joweenayi bee gure maaji. ","e Yiron e Migdaliila e Horem e Bayti-Anat e Bayti-Semes, ɗum berniiji sappo e joweenayi bee gure maaji. ","Yirɛɔŋ, Migadal-Ɛl, Horɛm, Bɛt-Anat in Bɛt-Sɛmɛs: nɛ́ o gasa ye ɓu-zua-mɔɔrɔ-ɗoŋ-naar in o geɗek-a. ","Yirɛɔŋ, Migadal-Ɛl, Horɛm, Bɛt-Anat in Bɛt-Sɛmɛs: nɛ́ o gasa ye ɓu-zua-mɔɔrɔ-ɗoŋ-naar in o geɗek-a. ","Iron, Migdal-Ɛl, Horɛm, Bɛt-Anat ba'a Bɛt-Shɛmɛsh. Meŋe meslighəmbe meleme nyi jama jama le nyi ɓɛhwɛ ɓɛhwɛ nyi dzeyi yitea hɛ. ","Yireon, Migdal-El, Horem, Bet-Anad wo de Bet-Semes. Tay äuy äi leege hwal ti kawa' de sir ma ti äaaran wo. "
JOS.19.39," Tel fut l'héritage de la tribu des fils de Nephthali, selon leurs familles: les villes et leurs villages. ","This is the inheritance of the tribe of the children of Naphtali according to their families, the cities and their villages.","Kayni ti vocota vi jafna vi gurona vi Neftali, kuɗ vuɗna visiya visiya, hoyok-ziy namna lakŋi hiɗi hoyok-ziy guray ma kuɗumna.","Ngabe si bone be Néftali be nga nyoñ nje le, avalʼane mebume map me né, bitison bite a minlame miap.","Hana i hirwuy muvulaka da sukwi ngi Neftali, vur muyo vur muyo, i walahay tayna jom ti prok taŋhaya wãˀ wãˀ.","Kanjum woni geɗal lenyol Neftali bee geɓe maagol, berniiji ɗi'i bee gure maaji.","Kanjum woni geɗal lenyol Neftali bee geɓe maagol, berniiji ɗi'i bee gure maaji.",Mɔɔ-oi ko o bezaŋ Nɛftalii nyɛm nɛ ɗoŋ o nú-gara kɔ-wa nɛ́ gasa ye nɔ‘i in o geɗek-a.,Mɔɔ-oi ko o bezaŋ Nɛftalii nyɛm nɛ ɗoŋ o nú-gara kɔ-wa nɛ́ gasa ye nɔ‘i in o geɗek-a.,"Tsetse ŋa ŋwalea Nɛftali hɛɗi, kala nza ta peləa nci, meleme nyi jama jama le nyi ɓɛhwɛ ɓɛhwɛ nyi dzeyi yitea hɛ.","Äi leege sen wo de sir ma ti äaaran wo mo äuy na diñ tway mani jar ma ti äï¡ï¡ni mani Neftalin wo, go de ngaäge ti moobe ta' ta'a."
JOS.19.40," La septième part échut par le sort à la tribu des fils de Dan, selon leurs familles. ",And the seventh lot came out for the tribe of the children of Dan according to their families.,Ŋaɓta kuɗ ɦayta ta sem siɗiyata vul nagat mi jafna vi gurona vi Dan kuɗ vuɗna visiya visiya. ,"Ngabe zamgbwale é nga kôlô é mbe nyô bone be Dañ, avalʼane mebume map me né. ",Ceregezleŋ mitarnaˀ naŋ a diɗ ar sukwi ngi Daŋ. A vulaka taŋ hirwuyo vur muyo vur muyo. ,Kur'u njoweeɗiɗaɓu waŋgini geɗal lenyol Dan bee geɓe maagol. ,Kur'u njoweeɗiɗaɓu waŋgini geɗal lenyol Dan bee geɓe maagol. ,"War mɔɔrɔ-ɗoŋ-yiitoo-aa, tani baa nù ha̧ zuduk ko o bezaŋ Dan nyɛm nɛ ɗoŋ o nú-gara kɔ-wa. ","War mɔɔrɔ-ɗoŋ-yiitoo-aa, tani baa nù ha̧ zuduk ko o bezaŋ Dan nyɛm nɛ ɗoŋ o nú-gara kɔ-wa. ","Kwa mberefaŋe ta bela nya ntave nda mbeli laka kwasheghediɗi ne, ŋa hwelefe ta Dan kala nza ta peləa nci. ","AÈ naa waçywaàale ma de renamn, se le' ti äï¡ï¡ni mani Dañ no, go de ngaäge ti moobe ta' ta'a. "
JOS.19.41," La frontière de leur héritage comprenait Saraa, Esthaol, Hir-Sémès, ","And the coast of their inheritance was Zorah, and Eshtaol, and Ir–shemesh,","Vun-nagata visi ka hay Soreya, Estahol, Ir-Semes: ","Nné wop a mbe: Sôréa, Ektaol, Ir-Semék; ","Maakway ngi hirwuy taŋhaya i walahayay ani: Sora, Esetaˀol, Ir-Semes, ",Ndaa ko laati geɗal maɓɓe haa lesdi: Cor'a e Estawol e Ir-Semes ,Ndaa ko laati geɗal maɓɓe haa lesdi: Cor'a e Estawol e Ir-Semes ,"Gbìsí-nu  kɔ-wa duka nɛ́ Sorea, Ɛstaɔl, Ir-Sɛmɛs, ","Gbìsí-nu  kɔ-wa duka nɛ́ Sorea, Ɛstaɔl, Ir-Sɛmɛs, ","Ma hɛɗi nyi kaŋa nci ne, Sora, Ɛshetawol, Ir-Shɛmɛsh, ","Äi leege maga wo äil tway äaaran wo diñ Soreya, Estawol wo de Ir-Semes. "
JOS.19.42," Sélébin, Ajalon, Jéthéla, ","And Shaalabbin, and Aijalon, and Jethlah,","Salabin, Ayalon, Yitla; ","Salabin, Ayalôn, Yitla; ","Saˀalabiŋ, Ayaloŋ, Itla, ",e Sa'alabbin e Ayyalon e Yitila ,e Sa'alabbin e Ayyalon e Yitila ,"Salabin, Ayalɔŋ, Yitla, ","Salabin, Ayalɔŋ, Yitla, ","Sha'alabin, Ayalon, Itla, ","Saalabin, Ayalon wo de Yitla, "
JOS.19.43," Elon, Themna, Acron, ","And Elon, and Timnah, and Ekron,","Helon, Timnata, Ekron; ","Elôn, Timnata, Ekroñ; ","Eloŋ, Timna, Ekroŋ, ",e Elon e Timna e Ekuruun ,e Elon e Timna e Ekuruun ,"Elɔŋ, Timnata, Ekrɔŋ, ","Elɔŋ, Timnata, Ekrɔŋ, ","Ɛlon, Timna, Ɛkron, ","Elon, Timnata wo de Ekroñ, "
JOS.19.44," Elthécé, Gebbéthon, Balaath, ","And Eltekeh, and Gibbethon, and Baalath,","Elteke, Gibbeton, Baalat; ","Eltéké, Gibeton, Baalat; ","Elteke, Gibetoŋ, Baˀalat, ",e Elteke e Gibbeton e Ba'alat ,e Elteke e Gibbeton e Ba'alat ,"Ɛlteke, Gibetɔŋ, Balat, ","Ɛlteke, Gibetɔŋ, Balat, ","Ɛltekɛ, Gibeton, Ba'alat, ","Elteke, Gibetnñ wo de Baalad, "
JOS.19.45," Jud, Bené-Barach, Geth-Remmon; ","And Jehud, and Bene–berak, and Gath–rimmon,","Yehu, Bene-Berak, Gad-Rimmon; ","Yeyud, Bené-Berak, Gat-Rimôn; ","Yehut, Bene-Berak, Gat-Rimoŋ, ",e Yehud e Bene-Barak e Gat-Rimmon ,e Yehud e Bene-Barak e Gat-Rimmon ,"Yehud, Bene-Berak, Gat-Rimɔŋ, ","Yehud, Bene-Berak, Gat-Rimɔŋ, ","Yehəwd, Benɛ-Berak, Gat-Rimon ","Yehud, Bene-Berag wo de Gat-Rimon. "
JOS.19.46," Mé-Jarcon et Arécon, avec le territoire vis-à-vis de Joppé. ","And Me–jarkon, and Rakkon, with the border before Japho.","Goloŋŋa vi Yarkon hiɗi Rakon, hiɗi nagata ta ka ɗiger vok Yaffa.","Mendim me Yarkôn a Rakôn, a si é ne bebé a Yafa. ","mi yam Yarkoŋ, Rakoŋ, ati li mugun gun a ciki Zafa. ",e ndiyamji Yarkon e Rakkon bee lesdi haa wakeere Yafo. ,e ndiyamji Yarkon e Rakkon bee lesdi haa wakeere Yafo. ,"o foka-yì Yarkɔŋ, Rakɔŋ ká bá nɛ̀ nù nɛ duk mgbák ti Jope. ","o foka-yì Yarkɔŋ, Rakɔŋ ká bá nɛ̀ nù nɛ duk mgbák ti Jope. ","Hələa Yarkon, Rakon, ŋkwa nya dzeyi yitea Jafa. ",Äi leege Yarkon wo de Rakon de sir ma ti jeñ Jafa no.
