livre.chapitre.verset,Francais,Anglais,BIBALDA_TA_PELDETTA,Bulu,Guiziga,Fulfulde_Adamaoua,Fulfulde_DC,KALATA_KO_SC_Gbaya,KALATA_KO_DC_Gbaya,Kapsiki_DC,Tupurri
NEH.11.12," et leurs frères qui faisaient le travail dans la maison : huit cent vingt-deux ; Adaïas, fils de Jéroham, fils de Phéléias, fils d'Amsi, fils de Zacharie, ","And their brethren that did the work of the house were eight hundred twenty and two: and Adaiah the son of Jeroham, the son of Pelaliah, the son of Amzi, the son of Zechariah, the son of Pashur, the son of Malchijah,","hiɗi ɓosiyosina sa ka li lopna vi ziyda, nisi kis-glafandi kalam dok-ma' yam ma'; goora vi Yeroham, goora vi Pelatiya, goora vi Amsi, goora vi Zakariya, goora vi Paskur, goora vi Malkiya, ","a bobenyañe bap, be nga yeme a bisaé ya nda; bese bôte mintete muam mewôm mebaé a bebaé. Adaya mone Yérôam, mone Pelatia, mone Amsi, mone Zakari, mone Pasur, mone Malkiya, ","waɗ muy taŋhay magam slra ar hay ngi Buymisemuŋ, taŋ mizli skat skat dangafaɗ ti kukur cuw nga cuw, i ti: Adaya, dideˀ ngi Malkiya, angi tizer ngi Pasehur, Zakari, Amsi, Pelaliya ati Yeroˀam, ","e deerɗiraaɓe muuɗum'en huuwooɓe kuugal nder haykaliiru, worɓe teemeɗɗe njoweetato e noogas e ɗiɗo (822). Non boo Adaya ɓii Yeroham ɓii Pelaliya ɓii Amci ɓii Zekariya ɓii Pashuuru ɓii Malkiya ","e deerɗiraaɓe muuɗum'en huuwooɓe kuugal nder haykaliiru, worɓe teemeɗɗe njoweetato e noogas e ɗiɗo (822). Non boo Adaya ɓii Yeroham ɓii Pelaliya ɓii Amci ɓii Zekariya ɓii Pashuuru ɓii Malkiya ","sɛka o nya-wa nɛ de tom kɔ̧ Tua ko Sɔ̧ lɛŋ. Wa lɛŋ nɛ́ 822. Mbe bíí woyo nɛ́ Adaya bem ko Yeroam, bem ko Pɛlalia, bem ko Amsi, bem ko Zakarii, bem ko Pasɛhur, bem ko Malkia, ","sɛka o nya-wa nɛ de tom kɔ̧ Tua ko Sɔ̧ lɛŋ. Wa lɛŋ nɛ́ 822. Mbe bíí woyo nɛ́ Adaya bem ko Yeroam, bem ko Pɛlalia, bem ko Amsi, bem ko Zakarii, bem ko Pasɛhur, bem ko Malkia, ","tsagha mbeli gwəmsə deghese ba'a bakemsə bakeghəmbe nyi kwa yita ta nci, nyi nza slene va hɛ mbe ghɛa Shala. Adaya, hwelefe ta Malkiya laka Pashehəwr, Zakari, Amsi, Pelaliya ba'a Yerowam, ","diñ heçeçre äaara maga hay wo de haç see äaara jag joñre ma äil tiñn mono saara äuy kiskis nenma' de jar do äog ti äoge. Yoo äaara pa diñ Adaya je ni Yeroham, je ni Pelatiya, je ni Amsi, je ni Sakari, je ni Pashur, je ni Malkiya, "
NEH.11.13," fils de Phashur, fils de Melchias, et ses frères, chefs de famille : deux cent quarante-deux; et Amassaï, fils d'Azréel, fils d'Ahazi, fils de Mosollamoth, fils d'Emmer, ","And his brethren, chief of the fathers, two hundred forty and two: and Amashai the son of Azareel, the son of Ahasai, the son of Meshillemoth, the son of Immer,","hiɗi ɓosiyomna, sa ŋulona vi jafna, kis-ma' kalam dok-fiɗi yam ma'; hiɗi Amaksay, goora vi Azreel, goora vi Ahzay, goora vi Mesillemot, goora vi Immer, ","a bobenyañe bé, bivete ya menda me bôt; bese bôte mintete mibaé mewôm menyin a bebaé; a Amaksayi mon Azaril, mon Azayi, mone Mesilemôt, mone Imer, ","ati sukum naŋhay, buy ngi hayay, taŋ mizli skat skat cuw ti kukur mufaɗ nga cuw, i ti: Amasesay, dideˀ ngi Imer, angi tizer ngi Mesilemot, Azay waɗ Azarel, ","e deerɗiraaɓe muuɗum'en, baaba-ci'e'en  teemeɗɗe ɗiɗo e cappanɗe nayo e ɗiɗo (242). Non boo Amassay ɓii Azareyel ɓii Ahajay ɓii Mesillemot ɓii Immer ","e deerɗiraaɓe muuɗum'en, baaba-ci'e'en  teemeɗɗe ɗiɗo e cappanɗe nayo e ɗiɗo (242). Non boo Amassay ɓii Azareyel ɓii Ahajay ɓii Mesillemot ɓii Immer ","gú nɛ̀ o nya-a̧ nɛ duk nɛ́ o gasawi nutua. Wa lɛŋ nɛ́ 242. Ŋma bíí woyo nɛ́ Amasesai, bem ko Azarɛl, bem ko Azai, bem ko Mɛsilɛmɔt, bem ko Imɛr, ","gú nɛ̀ o nya-a̧ nɛ duk nɛ́ o gasawi nutua. Wa lɛŋ nɛ́ 242. Ŋma bíí woyo nɛ́ Amasesai, bem ko Azarɛl, bem ko Azai, bem ko Mɛsilɛmɔt, bem ko Imɛr, ","zlaɓe zhilia ghɛ gwəmsə bake ba'a wəfaɗemsə bakeghəmbe nyi kwa yita ta ŋkɛ. Amashesay, hwelefe ta Imɛr laka Meshilɛmot, Azay ba'a Azarɛl, ","wo de heçeçre äe wañre ma ti feelen wo, saara äuy kiskis äog de jar do naa ti äogge, diñ Amasay je ni Asareel, je ni Ahsay, je ni Mesilemod, je ni Imern "
NEH.11.14," et leurs frères, hommes vaillants : cent vingt-huit. Zabdiel, fils de Hagdolim, était leur chef. ","And their brethren, mighty men of valour, an hundred twenty and eight: and their overseer was Zabdiel, the son of one of the great men.","hiɗi ɓosiyosina, sum sa nagayna, kis kalam dok-ma' yam glafandi. Zabdiyel goora vi Gedolim, mi ma ɗuwsi hay lopna.","a bobenyañe bap, benya bôtô; bese bôte ntet mewôm mebaé a muam, Zabdiél mone Gedôlim a mbe évete jap.","ati sukum taŋhay, mizli mupuɗaw puɗaway skat ti kukur cuw nga dangafaɗ. Buy ngi jum ngi mizli hanayna i Zaɓdiyel, mangal ngi Hagedolim.",e deerɗiraaɓe muuɗum'en honooɓe suusɓe teemerre e noogas e njoweetato (128). Zabdiyel ɓii Hagedolim woni kaliifaajo maɓɓe.,e deerɗiraaɓe muuɗum'en honooɓe suusɓe teemerre e noogas e njoweetato (128). Zabdiyel ɓii Hagedolim woni kaliifaajo maɓɓe.,gú nɛ̀ o nya-a̧ 128 nɛ yaa nɛ́ o ŋgaŋa-wi. Wi nɛ duka so wan zu wa nɛ́ Zabdiɛl bem ko Ha-Gɛdɔlim.,gú nɛ̀ o nya-a̧ 128 nɛ yaa nɛ́ o ŋgaŋa-wi. Wi nɛ duka so wan zu wa nɛ́ Zabdiɛl bem ko Ha-Gɛdɔlim.,"zlaɓe le ka katsala kɛfia ka sewajɛ gwəmsə ba'a bakemsə degheseghəmbe nyi kwa yita ta ŋkɛ. Ma wəndə nya te ghəa wəvəsə shɛ ne, Zabdiyɛl, wəzege ta Hagedolim.","wo de heçeçre äaara, jar ma tinoo n wo äuy kis ti äe do äog ti nenma'aç. Sabdiyel, je ni Gedolimn hay diñ je waçaç ree äaara."
NEH.11.15," Des lévites : Séméïas, fils de Hasub, fils d'Azaricam, fils de Hasabias, fils de Boni; ","Also of the Levites: Shemaiah the son of Hasshub, the son of Azrikam, the son of Hashabiah, the son of Bunni;","Sa Levitna: Semayeya, goora vi Hasub, goora vi Azrikam, goora vi Hasabiya, goora vi Bunni, ","Bevoʼo ya Belévit: Semaéya mon Asub mon Azrikam, mon Akabia, mone Buni. ","A wuzla Leviheye i ti: Semaya, mangal ngi Buni, angi tizer ngi Hasabiya, Asrikam ati Hasup, ",Nder Lewi'en kamɓe ngoni: Sema'ya ɓii Hassuba ɓii Ajirikam ɓii Hasbiya ɓii Bunni ,Nder Lewi'en kamɓe ngoni: Sema'ya ɓii Hassuba ɓii Ajirikam ɓii Hasbiya ɓii Bunni ,"Mgbara o bezaŋ Levii nɛ́ Sɛmaya bem ko Hasub, bem ko Azrikam, bem ko Hasabia, bem ko Buni;","Mgbara o bezaŋ Levii nɛ́ Sɛmaya bem ko Hasub, bem ko Azrikam, bem ko Hasabia, bem ko Buni;","Hwa ka Lɛvi ne, yɛ: Shemaya, hwelefe ta Bəwni laka Hashabiya, Azrikam le Hashəwb, ","Yoo jar Lefid wo mono diñ Semaeya je ni Hasub, je ni Asrikam, je ni Hasabiya je ni Buni no, "
NEH.11.16," Sabathaï et Jozabed, chargés des affaires extérieures de la maison de Dieu, du nombre des chefs des lévites ; ","And Shabbethai and Jozabad, of the chief of the Levites, had the oversight of the outward business of the house of God.","Sabbetay hiɗi Yozabad, sa sum sa Levitna vulsi lop ma goy jiy Tempella vi Ma-Vatɗina hay ɓisiya; ","Kabétayi a Yôzabad, mbe be nga bili ésaé ja fombô mame ya atane nda Zambe e Belévit be ne bivet été; ","waɗ buy ngi si Levihey vuna i ti Sabetay ati Yosabat, magam slra ar hay ngi Buymisemuŋ ti vra naŋ. ","e Sabbetay e Yozabat, ɓe ardiiɓe Lewi'en huuwooɓe yaasi haykaliiru Allah. ","e Sabbetay e Yozabat, ɓe ardiiɓe Lewi'en huuwooɓe yaasi haykaliiru Allah. ",sɛka Sabetai in Yɔzabad mgbara o gasawi zu o be Levii nɛ zɔk tom ko Sɔ̧ nɛ zan;,sɛka Sabetai in Yɔzabad mgbara o gasawi zu o be Levii nɛ zɔk tom ko Sɔ̧ nɛ zan;,"tsagha yɛ Shabetay le Yozabad hwa mbeli nyi te ghəa ka Lɛvi, nyi nza slene nyi pelɛke te ŋwela ta ghɛa Shala te dzeve va hɛ. ",diñ Sabetay wo de Yosabad jar ma yoo wañre jar Lefid maga waçaç wo ree feçeçre ma nen siigi ga wo de mañge se tiñ Baan mono 
NEH.11.17," Mathanias, fils de Micha, fils de Zébédéi, fils d'Asaph, le chef qui entonnait le chant de louange à la prière ; Becbécias, le second parmi ses frères, et Abda, fils de Samua, fils de Galal, fils d'Idithun. ","And Mattaniah the son of Mica, the son of Zabdi, the son of Asaph, was the principal to begin the thanksgiving in prayer: and Bakbukiah the second among his brethren, and Abda the son of Shammua, the son of Galal, the son of Jeduthun.","Mattaniya, goora vi Mikka, goora vi Zabdi, goora vi Asaf, namu mi ma ŋolla ma sli nulla kay suburta hay liyna vi siɗawta, hiɗi Bakbukiya, ma ma'na jar ɓosiyomna, hiɗi Abda, goora vi Sammuwa, goora vi Galal, goora vi Yedutun. ","Matania mone Mika, mone Zabdi, mon Asaf, évet é nga boʼo é vaʼa tyiñe jia éyoñe meyeʼelan, a Bakbukia, môta baa ézezañe bobenyañ, a Abda mone Kamua, mone Galad, mone Yedutun. ","Mataniya, dideˀ ngi Asaf, angi tizer ngi Zaɓdi ati Mika. Ti pas ngi diradibiɗ na, a vulaka Matatiya i slra ngi bo ti ˀay ngi dimis ngi hunuma Bumbulvuŋ. Basukiya, mijinga ngi Matatiya a wuzla sukum naŋhaya i mucuw naŋ ngi bo ti ˀay ngi dimise, yo Abda, dideˀ ngi Yedutuŋ, angi tizer ngi Galal ati Samiwa.","Non boo Mattaniya ɓii Mika ɓii Zabdi ɓii Asaf, kaliifaajo maŋgtoore saa'i do'aare e Bakbukiya, ɗiɗaɓo caka deerɗiraaɓe maako nder kuugal man e Abda ɓii Sammu'a ɓii Galal ɓii Yedutuun. ","Non boo Mattaniya ɓii Mika ɓii Zabdi ɓii Asaf, kaliifaajo maŋgtoore saa'i do'aare e Bakbukiya, ɗiɗaɓo caka deerɗiraaɓe maako nder kuugal man e Abda ɓii Sammu'a ɓii Galal ɓii Yedutuun. ","in Matania, bem ko Mika, bem ko Zabdi, bem ko Asaf; a̧ nɛ́ wi nɛ ku̧ so naŋ gima-gasi-sɔ̧ tɛ ŋgimbi kɔfa-sɔ̧; sɛka Bakbukia, nya-a̧ nɛ duk ɗoŋ-aa tɛ tom'i in Abda bem ko Samua, bem ko Galal, bem ko Yedutun.","in Matania, bem ko Mika, bem ko Zabdi, bem ko Asaf; a̧ nɛ́ wi nɛ ku̧ so naŋ gima-gasi-sɔ̧ tɛ ŋgimbi kɔfa-sɔ̧; sɛka Bakbukia, nya-a̧ nɛ duk ɗoŋ-aa tɛ tom'i in Abda bem ko Samua, bem ko Galal, bem ko Yedutun.","Mataniya, hwelefe ta Asaf laka yɛ Zabdi le Mika, nya kegha kagha cimə ketsahe Shala te vəa səkwə ghə. Bakbəwkiya, kwete hwa ka menəhɛnyɛa Mataniya, ya kasləwəfəa ŋkɛ. Abda, hwelefe ta Yedəwtəwn laka yɛ Galal le Shaməwa. ","diñ Mataniya je ni Mise, je ni Sabdi, je ni Asaf, wañ maga far siñ togoëgen ti wur tosgen mono, diñ Bakbukiya je kluu ma de äog yoo heçeçre äen wo mono, diñ Abda je ni Samuwa, je ni Galal, je ni Yedutun no. "
NEH.11.18, Total des lévites dans la ville sainte: deux cent quatre-vingt-quatre. ,All the Levites in the holy city were two hundred fourscore and four.,Tapta vi sa Levitna hay hoyok-ziy ma peldetna noŋ pet kis-ma' kalam dok-glafandi yam fiɗi.,Belévit bese be mbe Yérusalém be mbe mintete mibaé mewôme muam a benyin.,"Levihey misi ar walahay ngi Bumbulvuŋ, taŋ jom gar taŋ, mizli skat skat cuw ti kukur dangafaɗ nga mufaɗa.",Limgal Lewi'en nder berniwol ceniiŋgol fuu waɗi teemeɗɗe ɗiɗo e cappanɗe njoweetato e nayo (284).,Limgal Lewi'en nder berniwol ceniiŋgol fuu waɗi teemeɗɗe ɗiɗo e cappanɗe njoweetato e nayo (284).,O be Levii lɛŋ nɛ yaa so Jerusalɛm nɛ́ 284.,O be Levii lɛŋ nɛ yaa so Jerusalɛm nɛ́ 284.,"Jikə pɛtɛ, gwəmsə bake ba'a deghesemsə wəfaɗeghəmbe ɓelate ka Lɛvi mbeli mbe meleme nya keveyi geva tekeleke.",Jar Lefid ma äi leege ma bay ëagn wo äuy kiskis äog de jar do nenma' ti naa.
NEH.11.19," Et les portiers : Accub, Telmon et leurs frères, gardiens des portes : cent soixante-douze. ","Moreover the porters, Akkub, Talmon, and their brethren that kept the gates, were an hundred seventy and two.","Hiɗi sa ŋom vun-galana: Akkub, Talmon, hiɗi ɓosiyosina, sa ŋom vun-galana, tapay kis kalam dok-siɗiya yam ma'.","A bebaʼale mimbé: Akub, Talmon a bobenyañe bap, bebaʼale mimbé: bôte ntet mewôme zamgbwal a bebaé. ","Mijigina mizlingreheye i ti: Akup ati Talmoŋ, waɗ muy taŋhaya, mizli skat ti kukur tarnaˀ nga cuw, ngi jigina mizlingre.","Aynooɓe dammuɗe ngoni: Akkubu e Talmon e deerɗiraaɓe muuɗum'en aynooɓe dammuɗe, worɓe teemerre e cappanɗe njoweeɗiɗo e ɗiɗo (172).","Aynooɓe dammuɗe ngoni: Akkubu e Talmon e deerɗiraaɓe muuɗum'en aynooɓe dammuɗe, worɓe teemerre e cappanɗe njoweeɗiɗo e ɗiɗo (172).",Mgbara o wi-pɛm-nú-tua nɛ́ Akub in Talmɔŋ ká bá nɛ̀ o nya-wa lɛŋ nɛ a̧a̧ so tɛ tom'i in wa; wa nɛ́ 172.,Mgbara o wi-pɛm-nú-tua nɛ́ Akub in Talmɔŋ ká bá nɛ̀ o nya-wa lɛŋ nɛ a̧a̧ so tɛ tom'i in wa; wa nɛ́ 172.,"Ma yɛ Akəwb le Talmon nyi kaka ya degha ne, zlaɓe hɛ le ka menəhɛ nci kaya yɛ mɛ degha. Pɛtɛa nci ne, 172.","Jar gor jag tiñn wo diñ Akub, Talmon wo de heçeçre äaara jar gor jag tiñn wo, saara äuy kis de jar do renam ti äoge."
NEH.11.20," Le reste d'Israël, les prêtres, les lévites, étaient dans toutes les autres villes de Juda, chacun dans sa propriété. ","And the residue of Israel, of the priests, and the Levites, were in all the cities of Judah, every one in his inheritance.","Caw sa Israyella ma hinina, muliyan-sa-ɗifinna, sa Levitna, nisi ka lakay hay hoyok-ziyna vi Yuda noŋ kafe, gigekaw hay vocota valamu valamu.","Bôte bevoʼo yʼIsraél: betuni, Belévit, be nga tabe e bitisone bise ya Yuda, môt ase éliʼi jé été.","Israyel mekelemey ati masayay, waɗ Leviheye, taŋ suweˀ angi walahay ngi si ruwuy Zudahaya, mbur gar, a cifi angi li naŋ, angi li naŋ. ","Isra'iila'en luttuɓe e liman'en e Lewi'en njooɗi nder berniiji Yahuuda fuu, koo moy nder maral muuɗum. ","Isra'iila'en luttuɓe e liman'en e Lewi'en njooɗi nder berniiji Yahuuda fuu, koo moy nder maral muuɗum. ","Oi o be  Israɛl  lɛŋ, o wi-ɗafi-sɔ̧ in o be Levii dama tɛ gasa ye Juda lɛŋ; kóó o ndé sɛn tɛ̀ kɔ‘i. ","Oi o be  Israɛl  lɛŋ, o wi-ɗafi-sɔ̧ in o be Levii dama tɛ gasa ye Juda lɛŋ; kóó o ndé sɛn tɛ̀ kɔ‘i. ","Ma kweci ka Israyɛl, jikə le ka dzeghe Shala ba'a ka Lɛvi ne, mbe meleme ta Zhəwda nyi jama jama nzanji hɛ, yayata wəndə te wəvea ŋkɛ. ","Te jar Israyel ma lan wo, jar sië jag wo, jar Lefidn wo mono, sen hay wo de tiñ äi leege ma ti sir Judan wo, wosela äuy ti tway äe."
NEH.11.21," Les Nathinéens, s'établirent dans le quartier d'Ophel ; Siha et Gaspha étaient préposés aux Nathinéens. ",But the Nethinims dwelt in Ophel: and Ziha and Gispa were over the Nethinims.,Sa Netiniyena ka lakay hay Ofel; Siha hiɗi Gikpa ay si sa ŋulona vi sa Netiniyena. ,"Benétinieñ be nga tabe Oféle yôp: si ya Gispa be mbe minlô ya Benétinieñ, ","Gawla migi slra ngir hay ngi Bumbulvuŋhoyo a cifam a Zeruzalem, a slala Ofel. Miwaka taŋ i ti Siha ati Gisepa. ",Huuwooɓe kuuɗe pamare nder haykaliiru njooɗi haa towndiire Ofel. Ciiha e Gispa ngoni ardiiɓe maɓɓe. ,Huuwooɓe kuuɗe pamare nder haykaliiru njooɗi haa towndiire Ofel. Ciiha e Gispa ngoni ardiiɓe maɓɓe. ,O wi-de-tom kɔ̧ Tua ko Sɔ̧ ɔ so kɔ‘i sɛn ŋma fara Jerusalɛm nɛ‘i sa Ofɛl; ɓɛɛ gasawi kɔ-wa nɛ́ Siha in Gispa.,O wi-de-tom kɔ̧ Tua ko Sɔ̧ ɔ so kɔ‘i sɛn ŋma fara Jerusalɛm nɛ‘i sa Ofɛl; ɓɛɛ gasawi kɔ-wa nɛ́ Siha in Gispa.,"Ma mbeli nyi kemene slene mbe ghɛa Shala ne, mbe Ofɛl, ghedəkwəa Zhɛrəzalɛm nzanji hɛ. Yɛ Siha le Gishepa ya te ghəa nci.","Jar Netiniyeçeç hay wo de laage ti Ofel no, Siha wo de Gispa hay wo diñ wañre jar Netiniyeçeç wo. "
NEH.11.22," Le chef des lévites à Jérusalem était Azzi, fils de Bani, fils de Hasabias, fils de Mathanias, fils de Micha, d'entre les fils d'Asaph, les chantres chargés du service de la maison de Dieu. ","The overseer also of the Levites at Jerusalem was Uzzi the son of Bani, the son of Hashabiah, the son of Mattaniah, the son of Mica. Of the sons of Asaph, the singers were over the business of the house of God.","Sa ma ɗuw sa Levitna hay Yerusalem ay mi Uzzi goora vi Bani, goora vi Hasabiya, goora vi Mataniya, goora vi Mikka, jar gurona vi Asaf, sa gi nulla, sa li lopna hay ziyna vi Lawna; ","Evete Belévit, e Yérusalém, é mbe Uzi, mone Bani, mon Akabia, mone Matania, mone Mika ya bone bʼAsaf, beyia bia be nga bili bisaé e nda Zambe. ","Buy ɓi ngi si Levihey a Zeruzaleme i Uzi, dideˀ ngi Mika, angi tizer ngi Mataniya, Hasabiya ati Bani. Uzi i muy ngi dideˀ ngi Asafay. Muy ngi Asafay i mizli dimisey mazlaka ar hay ngi Buymisemuŋ. ","Uzzi ɓii Baani ɓii Hasabiya ɓii Mattaniya ɓii Mika woni kaliifaajo Lewi'en haa Urusaliima. O goɗɗo danygol Asaf, yimooɓe nder huuwooɓe haa haykaliiru Allah. ","Uzzi ɓii Baani ɓii Hasabiya ɓii Mattaniya ɓii Mika woni kaliifaajo Lewi'en haa Urusaliima. O goɗɗo danygol Asaf, yimooɓe nder huuwooɓe haa haykaliiru Allah. ","Gasawi ko o be Levii sɛn Jerusalɛm so nɛ́ Uzi bem ko Bani, bem ko Hasabia, bem ko Matania, bem ko Mika tɛ nú-gara ko Asaf; wa nɛ́ o wi-bii-gima sɛn kɔ̧ Tua ko Sɔ̧. ","Gasawi ko o be Levii sɛn Jerusalɛm so nɛ́ Uzi bem ko Bani, bem ko Hasabia, bem ko Matania, bem ko Mika tɛ nú-gara ko Asaf; wa nɛ́ o wi-bii-gima sɛn kɔ̧ Tua ko Sɔ̧. ","Ma wəndə kwelea ka Lɛvi nyi mbe Zhɛrəzalɛm ne, Əwzi, wəzege ta Mika, ta Mataniya, ta Hashabiya ba'a wəzege ta Bani. Wəndə nya kwa yita ta Asaf ŋkɛ, yita nya nza wəshi ketsa mbe ghɛa Shala te dzeve ta ŋkɛ. ","Je waçaç ree jar Lefid ma Jerusalem wo diñ Usi je ni Bani, je ni Hasabiya, je ni Mataniya, je ni Mise yoo jar ni Asaf wo, jar maga joñre siñ ma äil tiñ Baan de haçge ne hara do mono. "
NEH.11.23," Car il y avait une ordonnance du roi à leur sujet, et un salaire déterminé était accordé aux chantres pour chaque jour. ","For it was the king's commandment concerning them, that a certain portion should be for the singers, due for every day.","kay mulla col lawta kisiya, nam col va'a kaw kay sa gi nulla hay buurta kafna. ","Amu abendé njô bôt é mbe mfaʼa wop, a ngume ntiñetan mfaʼa beyia bia, asu môs ôse. ","Mizli dimiseye, slra taŋ magaka vur hin gar na, sey a cinam tivi ɓi buy miɓa le ɗaˀ le ati jiviɗ naŋ mupula taŋ di le, vur hine vur hine. ",Woodino umroore laamiiɗo e anniya timmuka dow kuuɗe yimooɓe nyalaade fuu. ,Woodino umroore laamiiɗo e anniya timmuka dow kuuɗe yimooɓe nyalaade fuu. ,Ŋma heembea ko wannu a̧a̧ so sɛnɛ zu o wi-bii-gima nɛ usi so yuwar tom kɔ-wa wese kpɔk kpɔk.,Ŋma heembea ko wannu a̧a̧ so sɛnɛ zu o wi-bii-gima nɛ usi so yuwar tom kɔ-wa wese kpɔk kpɔk.,Nahe meghe kegezeyi ghena te ghəa nci ba'a te wəshi nyi hi ka tsa wəshi kamene keveci keveci.,"Wañ hay we de yer jag liñgi ti äaara, hay go de ngaä joñre äaara maga jar 'wad siñn wo nen joñge äe nen naw tum go ta' ta'a. "
NEH.11.24," Phathahias, fils de Mésézébel, d'entre les fils de Zara, fils de Juda, était commissaire du roi pour toutes les affaires du peuple. ","And Pethahiah the son of Meshezabeel, of the children of Zerah the son of Judah, was at the king's hand in all matters concerning the people.","Petaya goora vi Mekezabeel, jar gurona vi Zerak goora vi Yuda namu mi ma sunda vi mulla kay lopna vi sumun noŋ kaf.","Peta ya mone Mésezabil, bevoʼo ya bone be Zéra mone Yuda, a mbe nkee minlômane njô bôt asu mejô mese ma fombô ngum ayoñ.","Petahiya, mangal ngi Mesezabel, angi muy ngi Zera, mangal ngi Zuda, gwat mica mizli le a mamay buy Peres gar na, mideŋ i naŋ.",Petahiya ɓii Mesejabeyel mo danygol Zeraha ɓii Yahuuda woni dawranoowo laamiiɗo ngam haala ummaatoore fuu.,Petahiya ɓii Mesejabeyel mo danygol Zeraha ɓii Yahuuda woni dawranoowo laamiiɗo ngam haala ummaatoore fuu.,"Pɛtahia bem ko Mɛsezabɛl tɛ nú-gara ko Zɛra, bem ko Juda, duka so katɛ wannu wen wee ɗoŋ mɔ ko dukbíí ha̧ a̧ oi nú wa.","Pɛtahia bem ko Mɛsezabɛl tɛ nú-gara ko Zɛra, bem ko Juda, duka so katɛ wannu wen wee ɗoŋ mɔ ko dukbíí ha̧ a̧ oi nú wa.","Petahiya, wəzege ta Meshɛzabɛl nya kwa yita ta Zɛra, wəzege ta Zhəwda ya yitea meghe kezha wəshi nyi te pɛtɛa ka Israyɛl.",Petahiya je ni Mesesabeeln yoo jar ni Sera je ni Judan hay diñ ajiya  wañ ti ree feçeçre maga sen de mañge see jar ma ti prog Judan mo äuy no.
NEH.11.25," Quant aux villages et à leurs territoires, des fils de Juda s'établirent : à Cariath-Arbé et dans les villes de sa dépendance, à Dibon et dans les villes de sa dépendance, à Cabséel et dans ses villages, ","And for the villages, with their fields, some of the children of Judah dwelt at Kirjath–arba, and in the villages thereof, and at Dibon, and in the villages thereof, and at Jekabzeel, and in the villages thereof,","Hay ziy ma goy fulla hiɗi sinena, gurona vi Yuda lak hay Kiryat-Arba hiɗi naga ma kuɗa'na, hay Dibon hiɗi naga ma kuɗa'na, hay Yekabseel hiɗi naga ma kuɗa'na, ","E minlam a e mefane map, bone be Yuda be nga tabe e Kiryat-Arba a mevôm me tii a nye, e Yekabsil a e minlame mié, ","Mizli mekelemey angi sukwi ngi Zuda, a cifam ar dulumoy ani: A Kiryat-Arba ati prok naŋhay, Diboŋ ati prok naŋhay, Yekapseyel ati li ngi cikeˀehey, ","Yahuudu'en woɗɓe njooɗi nder gure caka gese muuɗum'en, haa berniwol Kiriyat-Arba e gure maagol, haa Dibon e gure maagol, haa Yekabceyel e kawyeeji maagol, ","Yahuudu'en woɗɓe njooɗi nder gure caka gese muuɗum'en, haa berniwol Kiriyat-Arba e gure maagol, haa Dibon e gure maagol, haa Yekabceyel e kawyeeji maagol, ","Nɛ̀ ɗoŋ o ye si zaŋbɛɛ, o bezaŋ Juda ɔɔ sɛn Kiriat-Arba, gú nɛ̀ o be ye mɛ ká̧ a̧; sɛn Dibɔŋ, gú nɛ̀ o be ye mɛ ká̧ a̧; sɛn Yɛkabseɛl gú nɛ̀ o be ye mɛ ká̧ a̧; ","Nɛ̀ ɗoŋ o ye si zaŋbɛɛ, o bezaŋ Juda ɔɔ sɛn Kiriat-Arba, gú nɛ̀ o be ye mɛ ká̧ a̧; sɛn Dibɔŋ, gú nɛ̀ o be ye mɛ ká̧ a̧; sɛn Yɛkabseɛl gú nɛ̀ o be ye mɛ ká̧ a̧; ","Ketaze taze mbe meleme hwa gamba nzanji kweci mbeli mbe hwelefe ta Zhəwda, mbe: yɛ Kiriyat-Arba le kweci meleme nyi dzeyi yite, yɛ Dibon le meleme nyi dzeyi yite, yɛ Yekabsɛyɛl le meleme nyi dzeyi yite, ","Go äi leegen wo de tiñ ma ti äaaran wo mono, weere Juda laa wo tiñ go Kiryat-Arba de sir ma ti äen wo, go Dibon wo de sir ma ti äen wo, go Yekabseel de äi leege ma ti äen wo, "
NEH.11.26," à Jésué, à Molada, à Beth-Phalet, ","And at Jeshua, and at Moladah, and at Beth–pelet,","hay Yesuwa, hay Molada, hay Bet-Palet; ","e Yékua, e Môlada, e Bét-Palét; ","Yesuwa, Molada, Bet-Pelet, ","haa Yeesu'a e Molada e Bayti-Polet, ","haa Yeesu'a e Molada e Bayti-Polet, ","sɛn Yesua, Mɔlada, Bɛt-Pɛlɛt; ","sɛn Yesua, Mɔlada, Bɛt-Pɛlɛt; ","Yɛshəwa, Molada, Bɛt-Pɛlɛt, ","go Yesuwa, go Molada, go Bet-Paled, "
NEH.11.27," à Hasersual, à Bersabée et dans les villes de sa dépendance, ","And at Hazar–shual, and at Beer–sheba, and in the villages thereof,","hay Hatsar-Suwal, hay Beer-Seba hiɗi naga ma kuɗa'na, ","e Asar-Kual, ","Hasar-Suwal, Berseba ati prok naŋhay, ","haa Hacar-Su'al, haa Biirsaba e gure maagol, ","haa Hacar-Su'al, haa Biirsaba e gure maagol, ","Hasar-Sual, sɛn Bɛrseba gú nɛ̀ o be ye mɛ ká̧ a̧; ","Hasar-Sual, sɛn Bɛrseba gú nɛ̀ o be ye mɛ ká̧ a̧; ","Hasar-Shəwal, yɛ Bɛrshɛba le meleme nyi dzeyi yite, ","go Hatsar-Suwal, go Beer-Seba de sir ma ti äen wo, "
NEH.11.28," à Siceleg, à Mochona, et dans les villes de sa dépendance, ","And at Ziklag, and at Mekonah, and in the villages thereof,","hay Siklag, hay Mekona, hiɗi naga ma kuɗa'na, ","e Tiklag, e Mekôna a mevôm me tii a nye, ","Siklak, Mekona ati prok naŋhay, ","haa Cikilak, haa Mekona e gure maagol, ","haa Cikilak, haa Mekona e gure maagol, ","sɛn Siklag, sɛn Mɛkɔna gú nɛ̀ o be ye mɛ ká̧ a̧; ","sɛn Siklag, sɛn Mɛkɔna gú nɛ̀ o be ye mɛ ká̧ a̧; ","Siklag, Mekona le meleme nyi dzeyi yite, ","go Siglage, go Mekona de sir ma ti äen wo, "
NEH.11.29," à En-Remmon, à Saraa, à Jérimuth, ","And at En–rimmon, and at Zorah, and at Jarmuth,","hay Eyin-Rimmon, hay Soreya, hay Yarmut, ","e En-Rimôn, e Tôréa, e Yarmut. ","En-Rimoŋ, Sora, Yarmut, ","haa En-Rimmon e Car'a e Yarmut, ","haa En-Rimmon e Car'a e Yarmut, ","sɛn Ɛn-Rimɔŋ, Sɔra, Yarmut; ","sɛn Ɛn-Rimɔŋ, Sɔra, Yarmut; ","Ɛn-Rimon, Sora, Yarməwt, ","go En-Rimoñ, go Soreya, go Yarmud, "
NEH.11.30," à Zanoé, à Odollam et dans leurs villages, à Lachis et dans son territoire, à Azéca et dans les villes de sa dépendance. Ils s'établirent depuis Bersabée jusqu'à la vallée d'Ennom. ","Zanoah, Adullam, and in their villages, at Lachish, and the fields thereof, at Azekah, and in the villages thereof. And they dwelt from Beer–sheba unto the valley of Hinnom.","hay Zanowa, hay Adullam, hiɗi naga gurayna va'a, hay Lakis hiɗi sinena va'a, hay Azeka hiɗi naga ma kuɗa'na. Nisi lakay ɗawni, tun caw hay Beer-Seba pa ta-ta tam lokŋa vi Hinnom. ","E Zanôa, Adulam a minlame miap, Lakis a mefane mé, Azéka a mevôm me tii a nye. Be nga tabe ataté Birséba a kui mbiʼili Inom. ","Zanoa, Adulam ati prok naŋhay, Lakis ati prok naŋhay, Azeka ati prok naŋhay. A pam zle a Ber-Seba, hã sesẽŋ a ciki hurjijiŋ ngi Hinom.","haa Zanoha e Adullam e kawyeeji maaji, haa Lakis e gese maagol, haa Azeka e gure maagol. Ɓe njooɗi diga Biirsaba haa yotti Waadiwol Hinnom.","haa Zanoha e Adullam e kawyeeji maaji, haa Lakis e gese maagol, haa Azeka e gure maagol. Ɓe njooɗi diga Biirsaba haa yotti Waadiwol Hinnom.","Zanɔa, sɛn Adulam gú nɛ̀ o be ye mɛ katɛ wa; sɛn Lakis in katɛ a̧ lɛŋ; in sɛn Azɛka gú nɛ̀ o be ye mɛ ká̧ a̧. Wa ɔɔ sɛn Bɛrseba hɔ nɛnɛ kɔ̧ ɗɔŋgɔ Hinɔm.","Zanɔa, sɛn Adulam gú nɛ̀ o be ye mɛ katɛ wa; sɛn Lakis in katɛ a̧ lɛŋ; in sɛn Azɛka gú nɛ̀ o be ye mɛ ká̧ a̧. Wa ɔɔ sɛn Bɛrseba hɔ nɛnɛ kɔ̧ ɗɔŋgɔ Hinɔm.","Zanowa, yɛ Adəwlam le meleme nyi dzeyi yite, yɛ Lakish le meleme nyi dzeyi yite, yɛ Azɛka le meleme nyi dzeyi yite. Pa hɛ nzanji kwelɛ yɛ Bɛrshɛba nya laka bela kwa zeme le zlərəa Hinom nya laka bela kwa gwela.","go Sanowa, go Adulam wo de äi leege ma ti äaaran wo go Lakis de prog äe no, go Aseka de sir ma ti äen wo. Saara lag tiñ le Beer-Seba haçaç a go ti log Hinom. "
