livre.chapitre.verset,Francais,Anglais,BIBALDA_TA_PELDETTA,Bulu,Guiziga,Fulfulde_Adamaoua,Fulfulde_DC,KALATA_KO_SC_Gbaya,KALATA_KO_DC_Gbaya,Kapsiki_DC,Tupurri
NEH.8.7," Et Josué, Bani, Sérébias, Jamin, Accub, Sépthai, Odias, Maasias, Célita, Azarias, Jozabed, Hanan, Phalaïas et les lévites instruisaient le peuple de la loi, et chacun restait à sa place. ","Also Jeshua, and Bani, and Sherebiah, Jamin, Akkub, Shabbethai, Hodijah, Maaseiah, Kelita, Azariah, Jozabad, Hanan, Pelaiah, and the Levites, caused the people to understand the law: and the people stood in their place.","Yosuwa, Bani, Serebiya, Yanim, Akkub, Sabbetay, Hodiya, Maaseya, Kelita, Azariya, Yozabad, Hanan, Pelaya hiɗi sa Levitna sa ka di caw gatta goy tam sumuna, sumun ka lakay kulo'o may. ","Yasua, Bani, Kérébia, Yamin, Akub, Kabetayi, Odiya, Maséya, Kélita, Azaria, Yôzabad, Anañ, Pelaya a Belévit, be nga bo ésaé ya kôñelane be metiñe na be tuʼa me wôk a bôte bese be nga tele betetele. ","Akẽh na, mizli levihey: Yesuwa, Bani, Serebiya, Yamin, Akup, Sabetay, Hodiya, Maˀaseya, Kelita, Azariya, Yosabat, Hanan waɗ Pelaya, mizli tayna a zlaka a dubunaka taŋ Ɓimujuwa tuwa. ","Yeesu'a e Baani e Serebiya e Yamin e Akkubu e Sabbetay e Hodiyya e Ma'aseya e Kelita e Azariya e Yozabat e Hanan e Pelaya, Lewi'en, paamtini tawreeta haa ummaatoore dariinde haa nokkuure maare. ","Yeesu'a e Baani e Serebiya e Yamin e Akkubu e Sabbetay e Hodiyya e Ma'aseya e Kelita e Azariya e Yozabat e Hanan e Pelaya, Lewi'en, paamtini tawreeta haa ummaatoore dariinde haa nokkuure maare. ","Wa kura yor ŋgɔn woyo, ɓɛɛ Yesua, Bani, Sɛrɛbia, Yamin, Akub, Sabetai, Hɔdia, Masɛya, Kɛlita, Azaria, Yɔzabad, Hanaŋ in Pɛlaya nɛ yaa so nɛ́ o be Levii we ɗoŋ Heembea ha̧ wa. ","Wa kura yor ŋgɔn woyo, ɓɛɛ Yesua, Bani, Sɛrɛbia, Yamin, Akub, Sabetai, Hɔdia, Masɛya, Kɛlita, Azaria, Yɔzabad, Hanaŋ in Pɛlaya nɛ yaa so nɛ́ o be Levii we ɗoŋ Heembea ha̧ wa. ","Pa hɛ zhɛne kasatenji meslete, ntake yɛ Yɛshəwa, Bani, Shɛrɛbiya, Yamin, Akəwb, Shabetay, Hodiya, Masɛya, Kelita, Azariya, Yozabad, Hanan le Pelaya nyi kaka Lɛvi kateke nda wəsə mahalegə ke mbeli. ","Josuwe, Bani, Serebiya, Yamin, Akub, Sabetay, Hodiya, Maaseya, Kelita, Asariya, Yosabad, Hanan, Pelaya wo de jar Lefidn hay wo go naa wer jag liñgin go ne jarn wo maga aà mo laa wo wer äe, day jarn raw wo lagge go deele. "
NEH.8.8," Ils lisaient distinctement dans le livre, dans la loi de Dieu, et ils en donnaient le sens, et l'on comprenait ce qui était lu. ","So they read in the book in the law of God distinctly, and gave the sense, and caused them to understand the reading.","Nisi ka jaŋ ɗerwella vi gatta vi Lawna goy haraŋ ŋaa'a ŋolo, nisi ka dum cawam goyo kay nisi ma hum caw sle ma jaŋamna.","Be mbe be lañek ne sañesañ e kalate metiñe me Zambʼété, a kate atinan ya vôm ba te lañ, ane bôt be ne tuʼa wôk jôm ba te lañ.","Joˀ a slufa ɗerewol Ɓimujuwa ngi Buymisemuŋ tuwa, ti jiviɗ naŋ macin kwaŋ kwaŋ, a ɓa taŋ mbiɗeˀvra naŋ, ɓa a slaka wala ngi ɓi taŋ maslufaka taŋ di vuna. ","Ɓe njaŋngi nder deftere tawreeta Allah bee laaɓɗum, ɓe passitiri nde haa yimɓe paama ko jaŋnga.","Ɓe njaŋngi nder deftere tawreeta Allah bee laaɓɗum, ɓe passitiri nde haa yimɓe paama ko jaŋnga.","Wa tɔr so nɛ́ mɔ zaŋ kalata Heembea ko Sɔ̧ nɛ sa̧a̧‘a̧, we nɛ ɗoŋ-aa ha̧ o bíí mɛ zii gba̧a̧-a̧.","Wa tɔr so nɛ́ mɔ zaŋ kalata Heembea ko Sɔ̧ nɛ sa̧a̧‘a̧, we nɛ ɗoŋ-aa ha̧ o bíí mɛ zii gba̧a̧-a̧.","Ntake hɛ kajaŋga palepa ta wəsə mahalegəa Shala same same ba'a kancɛ nda ghena nya mbe ke mbeli, yitea fate wəsə nya kejaŋgate geva yayata wəndə. ",AÀ hay wo kee kefder jag liñgi mani Baan go crage day saara hay go naa wer äe maga jar mo laa wo wer fen maga saara hay kee ne hara mono.
NEH.8.9," Et Néhémie, le gouverneur, Esdras, le prêtre et le scribe, et les lévites qui instruisaient le peuple, dirent à tout le peuple : ""Ce jour est saint pour Yahweh, votre Dieu ; ne soyez pas dans le deuil et dans les larmes."" Car tout le peuple pleurait en entendant les paroles de la loi. ","And Nehemiah, which is the Tirshatha, and Ezra the priest the scribe, and the Levites that taught the people, said unto all the people, This day is holy unto the  Lord  your God; mourn not, nor weep. For all the people wept, when they heard the words of the law.","Nehemiya ma guvernera, Esdras mul-ma-ɗifinna ma wi ɗota hiɗi sa Levitna sa hat sumuna di tam sumun kaf ala: Buurta vaydit zawni vuli goy tam Ma-Vatɗina Lawna vigiya; lakgi hay yorta hiɗi tiynɗi. Kay sumun kaf ka tiya hay li ma nisi hum yoboyna vi gatta. ","Néhémie ngovina, Esdras ntuni a ñyeme bekalate, nalé fe belevite, be nga bo ésaé ya yeʼele bôt. Be nga jô bôte bese na: Môse wu ô ne ntelan ngumba asu Nti, e Zambe wônan. Te taban ôlun été nge e miliʼi été! Amu bôte bese be nga yôn éyoñ be nga wôʼô mejô ya kalate metiñ. ","Akẽh na, Nehemi, mbur miwi li ati Masay Esdras misina toho gwata waɗ Levihey maɓaka pulaˀvra ngi Ɓimujuwa da mizli gar na, a ɓaka taŋ: «Hin misenna i hin ngi Bumbulvuŋ, Buymisemuŋ kum. Anja ki likam ta, yo ki tuwam ta!» Asi mike na, mizli gar macinaka mingiɓi ngir Ɓimujuwa tuwa na, a roko tuwam zleˀe. ","Nehemiya, ngomna e moodibbo Esira, limanjo e Lewi'en faamtinɓe ummaatoore nde mbi'i ɓe fuu: “Hannde woni nyalaade senaande ngam Allah Jawmiraawo mooɗon. Taa cune, taa mboye.” Ngam ummaatoore fuu ɗon woya, saa'i ɓe ɗon nana bolle tawreeta. ","Nehemiya, ngomna e moodibbo Esira, limanjo e Lewi'en faamtinɓe ummaatoore nde mbi'i ɓe fuu: “Hannde woni nyalaade senaande ngam Allah Jawmiraawo mooɗon. Taa cune, taa mboye.” Ngam ummaatoore fuu ɗon woya, saa'i ɓe ɗon nana bolle tawreeta. ","Nɛ mɔ'ɔ nɛ Nehemii, wi-duk-zu nù in Ɛsdras wi-ɗafi-sɔ̧ nɛ duka nɛ́ wi-yɔr-mɔ ká bá nɛ̀ o be Levii nɛ usi mɔ ha̧ dukbíí tɔ̧ɔ̧ ha̧ wa: «Wese’ɛ nɛ́ ko GASA WAN Sɔ̧ k’ɛɛ. K’ɛ́nɛ́ zim mɔ na, in k’ɛ́nɛ́ hi̧i̧ kɔ̧a̧ na mbɛt!» Dukbíí nɛ oi-aa lɛŋ hi̧i̧ so nɛ́ kɔ̧a̧, ŋgimbi nɛ wa zii nɛ o gba̧a̧ Heembea'i. Nɛ mɔ'ɔ nɛ Ɛsdras tɔ̧ɔ̧ ha̧ wa woyo: ","Nɛ mɔ'ɔ nɛ Nehemii, wi-duk-zu nù in Ɛsdras wi-ɗafi-sɔ̧ nɛ duka nɛ́ wi-yɔr-mɔ ká bá nɛ̀ o be Levii nɛ usi mɔ ha̧ dukbíí tɔ̧ɔ̧ ha̧ wa: «Wese’ɛ nɛ́ ko GASA WAN Sɔ̧ k’ɛɛ. K’ɛ́nɛ́ zim mɔ na, in k’ɛ́nɛ́ hi̧i̧ kɔ̧a̧ na mbɛt!» Dukbíí nɛ oi-aa lɛŋ hi̧i̧ so nɛ́ kɔ̧a̧, ŋgimbi nɛ wa zii nɛ o gba̧a̧ Heembea'i. Nɛ mɔ'ɔ nɛ Ɛsdras tɔ̧ɔ̧ ha̧ wa woyo: ","Pɛtɛ tsene ta mbeli kanehwene kwa fate jaŋga shɛ hɛ. Vatse nda se yɛ Nɛhɛmi nya kaŋgwamna, Ɛsdras, nde dzeghe Shala nya kande rafe wəshi mahalegə le ka Lɛvi nyi kencɛ nda ghena nyi mbe ke mbeli kageze: «Veci nya keveyi geva tekeleke kaŋa Shala Mahwətə ta ŋayɛ veci nya! Veci keheɗe kema ba'a kenehwene ŋkɛ we.» ","Nehemi je waçaç ree prog no, Esdras je sië jag ma naa wer waçaçre Baan wo de jar Lefid maga hay wo had jarn kal wo riñ jarn wo äuy gano: Wur se ka'n wara diñ wur maga go sagsag ma Manwuri, Baa äay no. Law wee wa, ra wee wa lay! Sen na werga jarn wo äuy hay ra wo de maga saara laa waçaçre jag liñgin wo mono. "
NEH.8.10," Et Néhémie leur dit : ""Allez, mangez des viandes grasses et buvez des liqueurs douces, et envoyez des portions à celui qui n'a rien de préparé, car ce jour est saint pour notre Seigneur; ne vous affligez pas, car la joie en Yahweh est votre force."" ","Then he said unto them, Go your way, eat the fat, and drink the sweet, and send portions unto them for whom nothing is prepared: for this day is holy unto our Lord: neither be ye sorry; for the joy of the  Lord  is your strength.","Esdras di tisiya: Tuɗgiya, tigi tin ma hiɗi mula, cigi dolay ma sleɗna, jokgi gal hena tam sum sa fisin mayɗina, kay fatta vaydit zawni vuli goy tam Bum-sumuna vaya; nigi ma to sutaygiɗi, kay firita hay Ma-Vatɗina kayn ti donota vigiya. ","Esdras a nga jô be na: Kelan a di betit be ne avoñ, a nyu biôm bi nʼévôvoé, a lôme mengap e be ba be nji bi jôm: amu môse wu ô ne ntelan asu Nti wongan; te wôʼan ôlun amu avaʼa Nti nde é ne ngule jenan. ","Esdras a ɓa t'ani ava ma: «A ram ngi hay kumoy, zumam gwat mezleŋ, yo sam gwat mundumoy. Mizli manja gwatay na, saka taŋ ti mi nga taŋ, vur hin misenna i muvula le da Bumbulvuŋ ndra. Anja ki likam ta, asi mumul maso ti vu Bumbulvuŋ na, mavulukum gidaŋ i nah.» ","Esira wi'i ɓe: “Njehe jonta, nyaame payɗum, njare mbelɗam, nelde boo geɗe nyaamdu haa mo taaskitinaay nyaamdu. Ngam hannde woni nyalaade senaande ngam Jawmiraawo men. Taa cune, ngam seyo iwŋgo diga Jawmiraawo woni semmbe mon.” ","Esira wi'i ɓe: “Njehe jonta, nyaame payɗum, njare mbelɗam, nelde boo geɗe nyaamdu haa mo taaskitinaay nyaamdu. Ngam hannde woni nyalaade senaande ngam Jawmiraawo men. Taa cune, ngam seyo iwŋgo diga Jawmiraawo woni semmbe mon.” ","«Ɛ̀nɛ̀ sí ɗoŋ, ɛ̀nɛ̀ nyɔ́ŋ nɛ́ de nyɔŋmɔ, ɛ̀nɛ̀ nɔ́ o de mɔ in ɛ̀nɛ̀ tóm ŋma nɛnɛ ha̧ o bíí nɛ bo nɛnɛ na, wen sɔsɔɔ'ɛ nɛ́ wese ko GASA WAN k’ɛɛ; ká see'nɛ́ ɗaŋ na, wen desee ko GASA WAN nɛ́ ŋgai k’ɛ́nɛ́.» ","«Ɛ̀nɛ̀ sí ɗoŋ, ɛ̀nɛ̀ nyɔ́ŋ nɛ́ de nyɔŋmɔ, ɛ̀nɛ̀ nɔ́ o de mɔ in ɛ̀nɛ̀ tóm ŋma nɛnɛ ha̧ o bíí nɛ bo nɛnɛ na, wen sɔsɔɔ'ɛ nɛ́ wese ko GASA WAN k’ɛɛ; ká see'nɛ́ ɗaŋ na, wen desee ko GASA WAN nɛ́ ŋgai k’ɛ́nɛ́.» ","Ma ke Ɛsdras mtsehete: «Kwiɗi mə sha ghɛa ŋayɛ, zeme mə wəshi ganji, sa mə wəshi ganji, ɗave nda mə ke mbeli nyi keɗema ketakɛ, kwa nza ŋkɛ nahe veci nya keveyi geva tekeleke kaŋa Mahwətə ta ɓəmə. Nzama yɛ le kema teheɗe ma! Zlama ta Mahwətə ya kaberete ta ŋayɛ.» ","Esdras hay riñ ra gano: See wee, wo wee ree naèy ma de noo wo, joo wee feçeçre ma bay jiigi wo day haç wee te äaara ne jar maga ma äaara bay wo go de 'wuçygi wa ëa mono. Gahaçyla, wur sen diñ wur maga go sagsag ma Wañkluu naa no, law wee wa werga fruygi mani Manwurn diñ eegre äay no. "
NEH.8.11," Les lévites calmaient tout le peuple, en disant : ""Taisez-vous ; car ce jour est saint ; ne vous affligez pas."" ","So the Levites stilled all the people, saying, Hold your peace, for the day is holy; neither be ye grieved.","Sum sa Levitna kaw ka sleɗ dik sumun kaf hiɗi dita ta ala: Zangiya, kay buurta ta vaydit zawni na' peldete, togi sutaygiɗi. ","Belévit be jeʼe bôte bese minlem be jôʼô na: Tabaʼane bivôl, amu môse wu ô nʼétyi, te wôʼan ôlun! ","Levihey a taˀaka mi da mizli, a ɓaka taŋ: «Cifam teˀ teˀ takwa, asi hin misenna i muvula le da Bumbulvuŋ. Anja ki likam ta.»","Lewi'en boo nde'itini yimɓe, mbi'i ɓe: “Nde'ite, ngam nyalaade nde'e nde senaande, taa cune.” ","Lewi'en boo nde'itini yimɓe, mbi'i ɓe: “Nde'ite, ngam nyalaade nde'e nde senaande, taa cune.” ","O be Levii gaia dukbíí nɛ oi-aa lɛŋ tɔ̧ nɛnɛ‘e: «Ɛ̀nɛ̀ kàɗì, wen wese’ɛ ɔ sa̧a̧, ká see'nɛ́ ɗaŋ na.»","O be Levii gaia dukbíí nɛ oi-aa lɛŋ tɔ̧ nɛnɛ‘e: «Ɛ̀nɛ̀ kàɗì, wen wese’ɛ ɔ sa̧a̧, ká see'nɛ́ ɗaŋ na.»","Pa ka Lɛvi gweɗakwete mbeli perə kwa geze hɛ: «Gweɗakwe pe yɛ! Kwa nza ŋkɛ, nahe veci nya keveyi geva tekeleke kaŋa Shala. Mba yɛ kenza le kema teheɗe!»",Jar Lefidn hay wo teñ nen jarn wo äuy gano: Hem wee mbay werga wur sen diñ wur ma sara. Law wee wa so! 
NEH.8.12," Et tout le peuple s'en alla pour manger et boire, envoyer des portions et se livrer à de grandes réjouissances. Car ils avaient compris les paroles qu'on leur avait fait connaître. ","And all the people went their way to eat, and to drink, and to send portions, and to make great mirth, because they had understood the words that were declared unto them.","Sumun kaf kali kay ti'e kay ci'e kaw, kay vul galla (mi segena) kay li firita ta ŋolda. Kay nisi humi yoboyna ma cawam ka ɗekay goyna.",Ane bôte bese be nga ke be nga tuʼa wôʼô mejô be nga kate be.,"Akẽh na, mizli gar a ram ngi hay taŋhay, ɓa a zumam gwat, ɓa a sam gwata. Yo mizli mujuwam vu tahay na, ɓa a saka taŋ ti mi nga taŋ, waɗ ɓa a bigaka mumul taŋ mihaɗa na, asi mingiɓi mudubunaka taŋ di na, a cinaka pulaˀavra naŋ le kuy kuy.","Nden yimɓe fuu ndilli nyaamoygo e yaroygo, ɓe neldi geɗe nyaamdu boo. Ɓe ceyi bee seyo maŋngo ngam ɓe paami bolle ɗe ɓe anndini ɓe.","Nden yimɓe fuu ndilli nyaamoygo e yaroygo, ɓe neldi geɗe nyaamdu boo. Ɓe ceyi bee seyo maŋngo ngam ɓe paami bolle ɗe ɓe anndini ɓe.","Nɛ mɔ'ɔ nɛ dukbíí nɛ oi-aa lɛŋ yaka mɛ nyɔŋ mɔ in mɛ nɔ mɔ, in ha̧ wa mɛ tom mɔ ha̧ o ŋmaa, de nɛ gasa gbaŋa wen wa zia wen nɛ wa tɔ̧a̧ ha̧ wa.","Nɛ mɔ'ɔ nɛ dukbíí nɛ oi-aa lɛŋ yaka mɛ nyɔŋ mɔ in mɛ nɔ mɔ, in ha̧ wa mɛ tom mɔ ha̧ o ŋmaa, de nɛ gasa gbaŋa wen wa zia wen nɛ wa tɔ̧a̧ ha̧ wa.","Tsagha, pɛtɛ mbeli kalə kazeme wəshi ba'a kasa wəshi. Pa hɛ ɗave wəshi kezeme ke mbeli nyi keɗema ketakɛ, ntake hɛ kamene gəsəkə nya wəba le zlama, kwa nza ŋkɛ nahe hɛ kefate ghena nyi gezave nda mbeli ke hɛ.","Jarn wo äuy kal wo rawge reege lay, jooge lay maga saara mo haç te äe ne jar lay, saara mo joñ fruygi ma kluu lay. Gahaçyla, aà hay laa wo wer waçaçre maga aè hay naa wer äaara ne hara mono."
NEH.8.13," Le second jour, les chefs de famille de tout le peuple, les prêtres et les lévites s'assemblèrent auprès d'Esdras le scribe, afin de s'instruire plus complètement des paroles de la loi. ","And on the second day were gathered together the chief of the fathers of all the people, the priests, and the Levites, unto Ezra the scribe, even to understand the words of the law.","Hay buurta ma'ta, sa ŋulona vi jafna vi sumun kaf, muliyan-sa-ɗifinna hiɗi sa Levitna tok tuwsi kat Esdras, sa ma wi ɗota, kay tun ŋalda visiya kay yoboyna vi gatta. ","E môse baa, minlô menda me bôte ya ngum ayoñ betuni a Belévit, be nga sulan e be Esdras ñyeme bekalate na be vôʼôlô mejô ya metiñ. ","Angi hin mucuw naŋ na, buy ngi hayay ngi wuzla mizli gar, masayay ati leviheye, a kusom kos kos a ciki Esdras, mbur misina toho gwat tuwa, ɓa a slaka wala ngi ɓi ngir Ɓimujuwa na kuy kuy. ",Jaŋngo man baaba-ci'e'en nder ummaatoore fuu e liman'en e Lewi'en mooɓti haa moodibbo Esira ngam ɓe keɗito bolle tawreeta. ,Jaŋngo man baaba-ci'e'en nder ummaatoore fuu e liman'en e Lewi'en mooɓti haa moodibbo Esira ngam ɓe keɗito bolle tawreeta. ,"Tɛ yiitoo ɔɔ-zɛ, o gasawi nutua ko dukbíí, o wi-ɗafi-sɔ̧ in o be Levii mɔi̧a ŋmaa sɛn katɛ Ɛsdras wi-yɔr-mɔ, ha̧ wa mɛ kii mɔ tɛ Heembea wen zia gba̧a̧-a̧, ","Tɛ yiitoo ɔɔ-zɛ, o gasawi nutua ko dukbíí, o wi-ɗafi-sɔ̧ in o be Levii mɔi̧a ŋmaa sɛn katɛ Ɛsdras wi-yɔr-mɔ, ha̧ wa mɛ kii mɔ tɛ Heembea wen zia gba̧a̧-a̧, ","Ma mbe kwa bake ta hɛ, pa mbelia jama nyi mbe pɛtɛa hwelefefi, ka dzeghe Shala le ka Lɛvi tsenete geva yitea Ɛsdras, nde rafe wəshi mahalegə, kezha fave zeweve ta ghena nyi mbe wəshi mahalegə megela. ","Ti naw ma de äogn mono, wañre ma ti feele ma yoo jarn wo äuy, jar sië jagn wo de jar Lefid raw wo tayge le see Esdras je had waçaçre Baan ma lagge seëem co' sug waçaçre jag liñgi no. "
NEH.8.14," Et ils trouvèrent écrit dans la loi que Yahweh avait prescrite par l'organe de Moïse, que les enfants d'Israël devaient habiter sous des tentes pendant la fête du septième mois, ","And they found written in the law which the  Lord  had commanded by Moses, that the children of Israel should dwell in booths in the feast of the seventh month:","Nisi fum ɗoy hay gatta ta Ma-Vatɗina ɗo'a, vula' hay ɓam Mususta ala, sum sa Israyella ma lak hay guɗukŋa hay yuldeta vi til ma siɗiyana. ",Be nga koone ntilan e metiñ été na Nti a nga kobô a anyu Môze na: Bone bʼIsraél ba yiane tabe bibeme si éyoñ abôʼô ya ngone zamgbwale da boban. ,"A lumam a tohoko ar Ɓimujuwa misenna, gwat Bumbulvuŋ miɓa ɗaˀ le da Israyeley ti balam Moyis na: ti hin ngi muguzlum ngi kiya mitarnaˀ naŋ na, sey Israyeley a hinam ar mazlaɓay. ","Ɓe tawi nder maaka ko Jawmiraawo umri bee hunnduko Muusa: “Saa'i juulde nder lewru joweeɗiɗaɓru, Isra'iila'en fuu njooɗo nder bukkaaji.” ","Ɓe tawi nder maaka ko Jawmiraawo umri bee hunnduko Muusa: “Saa'i juulde nder lewru joweeɗiɗaɓru, Isra'iila'en fuu njooɗo nder bukkaaji.” ","ɓɛɛ wa kpa zaŋ kalata Heembea nɛ Sɔ̧ ha̧a̧ so ha̧ Moisɛ‘e: «O be  Israɛl  a̧ ɔ́ nɛ́ kɔ̧ tua-ŋgui wese gbaŋa mɔɔrɔ-ɗoŋ-yiitoo fio-zɛ,  ","ɓɛɛ wa kpa zaŋ kalata Heembea nɛ Sɔ̧ ha̧a̧ so ha̧ Moisɛ‘e: «O be  Israɛl  a̧ ɔ́ nɛ́ kɔ̧ tua-ŋgui wese gbaŋa mɔɔrɔ-ɗoŋ-yiitoo fio-zɛ,  ","Ma mbe wəsə mahalegə nya gezeke nda Shala ke hɛ laka Moyize ne, pa ntsate ŋkwa nya kegeze nda ke ka Israyɛl kezha nza hɛ mbe ghwəli hwa “gəsəkəa ghwəli” te tere kwa mberefaŋe: ","Saara wo da'ge de yerge äil jag liñgi maga Manwur hay yern nen do Moyis ga jar Israyel wo nen nage äil mburyug ti wur joñge few ma nen few ma de renam no, "
NEH.8.15," et qu'ils devaient faire entendre et publier une proclamation dans toutes leurs villes et à Jérusalem, en disant : ""Allez à la montagne et rapportez des rameaux d'olivier, des rameaux d'olivier sauvage, des rameaux de myrte, des rameaux de palmier et des rameaux d'arbres touffus pour faire des tentes, selon qu'il est écrit."" ","And that they should publish and proclaim in all their cities, and in Jerusalem, saying, Go forth unto the mount, and fetch olive branches, and pine branches, and myrtle branches, and palm branches, and branches of thick trees, to make booths, as it is written.","A nisi ma di labar goyo, siwel goy hay hoyok-ziyna visi kaf, hay Yerusalem kaw ala: Cukgiyay goy kay hiɗiyn pa, margi hum-gun olive, hiɗi hum-gu olive ma fulla, hum gu-warana, hum gomona hiɗi gu goɗayna, kay kot guɗukŋa, ki nam ka ɗoy nala.  ","Nalé fe na ba yiane mialane foé e bitisone biab a e Yérusaleme na: Kelane nkôl a nyoñ mebui mʼôlivié, mebui mʼôlivié yʼafan, mebui me mirte, mebui melen a mebui bilé bise bi bili abui mekaé, mi lôñe bibem, avale ntilan ô né. ","Yo anja sey a ɓaka ɓi ngi muguzlum misenna, a tilam di mi ar walahay taŋhay gar waɗ a Zeruzalem, a ɓaka mizli: «Bam, a ram nga muwã, nguwoko mihaŋ ngi tutumbur mihirva ti hirvihey ati ngi ɓuhoy, kalaf ngi mirte,   mihaŋ ngi Babazlahay, waɗ mihaŋ ngi widis mutukuf tukufoy, soko taŋ ɓa ngi ɗiya mazlaɓ, kaɓa mutohoko ɓi nah.» ","Nde ɓe nani ɗum, ɓe ngooyni nder Urusaliima e gure maɓɓe fuu: “Njehe kooseeje, ngadde lice diga jaytunje gese e jaytunje ladde e asuraaje e dibinooje e leɗɗe cukkuɗe, mbaare bukkaaji, bana ko winnda .” ","Nde ɓe nani ɗum, ɓe ngooyni nder Urusaliima e gure maɓɓe fuu: “Njehe kooseeje, ngadde lice diga jaytunje gese e jaytunje ladde e asuraaje e dibinooje e leɗɗe cukkuɗe, mbaare bukkaaji, bana ko winnda .” ","in wa a̧ tɔ̧́ wen-aa ha̧ bíí lɛŋ sɛn saaye kɔ-wa in sɛn Jerusalɛm hee mɔ'ɔ ga: ‹Ɛ̀nɛ̀ dáŋ zu kaya, ɛ̀nɛ̀ kíí o wa̧a̧-te-nɔ̧́ nɛ‘i guna in o wan nɛ hɔ nɛ ta-tɛ, wa̧a̧ be-te nɛ pɛr-aa ɔ dee,  wa̧a̧ ndɛŋgɛ in o ŋma da̧a̧ wa̧a̧-te wen dea-a nɛ o tua-ŋgui  hee mɔ'ɔ nɛ Sɔ̧ tɔ̧ɔ̧ so ga.› » ","in wa a̧ tɔ̧́ wen-aa ha̧ bíí lɛŋ sɛn saaye kɔ-wa in sɛn Jerusalɛm hee mɔ'ɔ ga: ‹Ɛ̀nɛ̀ dáŋ zu kaya, ɛ̀nɛ̀ kíí o wa̧a̧-te-nɔ̧́ nɛ‘i guna in o wan nɛ hɔ nɛ ta-tɛ, wa̧a̧ be-te nɛ pɛr-aa ɔ dee,  wa̧a̧ ndɛŋgɛ in o ŋma da̧a̧ wa̧a̧-te wen dea-a nɛ o tua-ŋgui  hee mɔ'ɔ nɛ Sɔ̧ tɔ̧ɔ̧ so ga.› » ","nahe hɛ kehi kaɗepete ba'a kazlapete ghena ta gəsəkəa shɛ mbe yɛ meleme ta nci ba'a mbe Zhɛrəzalɛm kala nya: «Kwiɗi mə kadzeme yɛ ghweme katsasle dzeve ta yɛ bekele kwa wəza wəza ba'a nyi hwa gamba, ŋa yɛ sewahe, ŋa yɛ peha ba'a yɛ wəfe nyi zhiɓə kezha mene ghwəli, kala nya kerafete geva.»","ga aà wo nen 'wad äay go äi leege äaaran wo äuy lay, go Jerusalem lay gano: Laa wee wo go yoo huuli wo, hrag wee sug koo Olifiye le, sug koo Olifiye ma mbasga, sug koo mirte, sug hare wo de sug koore ma kliäkliä wo ma bag mburyug wo do maga aà de yerge nono. "
NEH.8.16," Alors le peuple y alla, et ils rapportèrent des rameaux, et ils se firent des tentes chacun sur son toit, dans leurs cours, dans les parvis de la maison de Dieu, sur la place de la porte de l'Eau et sur la place de la porte d'Ephraïm. ","So the people went forth, and brought them, and made themselves booths, every one upon the roof of his house, and in their courts, and in the courts of the house of God, and in the street of the water gate, and in the street of the gate of Ephraim.","Nala sumun cuki goyo, nisi maramu. Nisi kot guɗukŋa, gigekaw kulo'o hay wur-daŋŋa vi ziyda vi Lawna, hay liyna vi vun-galana vi niyna, hiɗi vun-galana vi Efrayim. ","Nde bôte be nga ke a nyoñe mebui bilé mete. Be nga lôñe bebiene bibem, môt ase éfuse si ya nda jé, e minseñe miap, e minseñe ya nda Zambe, e vôme ya mbé mendim, a e vôme ya mbé Efrayim. ","Ar nah na, mizli a bam, a nguwoko kalaf ngi ɗiya mazlaɓaya. Mbur gar na, a ɗiyi a hirnga viŋ naŋ midika ti dike, malla a mamay taŋhay, a mamay ngi hay ngi Buymisemuŋ malla ar li misi a mizlingre ngi Yam, waɗ ar li misi a mizlingre Efrayim.","Ummaatoore wurti, waddi ɗe. Nden ɓe mbaɗi bukkaaji, koo moy dow soorowol mum, koo haa daldal saare mum. Non boo haa daldal haykaliiru Allah, haa babal yeeso Dammugal Ndiyam e babal yeeso Dammugal Efrayim. ","Ummaatoore wurti, waddi ɗe. Nden ɓe mbaɗi bukkaaji, koo moy dow soorowol mum, koo haa daldal saare mum. Non boo haa daldal haykaliiru Allah, haa babal yeeso Dammugal Ndiyam e babal yeeso Dammugal Efrayim. ","Dukbíí lɛŋ nɛ̀ɛ́ mɛ kii o mɔɔ-de-tua, ɓɛɛ wa de o tua-ŋgui kɔ-wa, o ŋma sɛn zu tua kɔ‘i, o ŋma sɛn bee-gara kɔ‘i, o ŋma sɛn bee-gara Tua ko Sɔ̧, o ŋma sɛn bee-gara nɛ duk Nú Garo Yì in o ŋma sɛn bee-gara Nú Garo ko Efraim.","Dukbíí lɛŋ nɛ̀ɛ́ mɛ kii o mɔɔ-de-tua, ɓɛɛ wa de o tua-ŋgui kɔ-wa, o ŋma sɛn zu tua kɔ‘i, o ŋma sɛn bee-gara kɔ‘i, o ŋma sɛn bee-gara Tua ko Sɔ̧, o ŋma sɛn bee-gara nɛ duk Nú Garo Yì in o ŋma sɛn bee-gara Nú Garo ko Efraim.","Pa ka Israyɛl lə kazeleke dzeve ta wəfe kezha mene yɛ ghwəli, ma kweci mbeli ne, pelɛ dɛɓere nya kənəa cɛa nci ŋa nci, kwa zlave ta nci ŋa kweci, dzeyi te ŋwela nya yitea ghɛa Shala ŋa kweci, dzeyi te ŋwela ta mɛ degha ta Yɛmə ŋa kweci ba'a mɛa mɛ degha ta Ɛfrayim ŋa kweci. ","Mo so no jarn raw wo laage go, kal wo hragge äe le. Saara raw wo bag mburyug wo, wosela äuy ciñ ti tiñ äe ma de lawge, jar po wo feele äaara wo, äil feele tiñ mani Baa no, ti ngeel ma jag faage Biin wo, ti ngeel ma jag tiñ mani Efrayim no. "
NEH.8.17," Toute l'assemblée de ceux qui étaient revenus de la captivité fit des tentes et habita sous les tentes. Depuis les jours de Josué, fils de Nun, jusqu'à ce jour, les enfants d'Israël n'avaient rien fait de pareil. Et il y eut de très grandes réjouissances. ","And all the congregation of them that were come again out of the captivity made booths, and sat under the booths: for since the days of Jeshua the son of Nun unto that day had not the children of Israel done so. And there was very great gladness.","Tokŋa vi nisi sa hotay hay gorvot pana kot guɗukŋa; nisi lak hay guɗuk namna. Tam caw tam liyna vi Yosuwa goora vi Nun pa ta-ta tam buur namna, sum sa Israyella bay li va ki kayn nala tuwa, firita li ŋolo.","Ekôane bôt ése ya ba be nga so minkôm é nga lôñe bibem a tabe bie si. Ataté melu Yasua mone Nun a kui môse wu, bone bʼIsraél be nji tame bo jame nalé: beta mevak me nga boban.","Mizli mukusom kos kos tuwa gar taŋ, ati mizli mumoko tir beke tuwa, a ɗiyam mazlaɓaya, a hinam angi taŋ. Dambalaka na, zle ti hin ngi Zozuwe, mangal ngi Nun, hã a ndilo hin nah na, Israyeley a gam gwat misi kanah ɗaˀ ta wãˀ. A gi avu taŋ tapasa i hin ngi mumul madiɗa. ","Yimɓe jama'aare wartuɓe diga daheeki fuu mbaɗi bukkaaji, njooɗi nder maaji. Diga wakkati Yosuwa ɓii Nuuna haa wargo nyalaade man, Isra'iila'en meetaay waɗugo irin ɗu'um. Ɓe ceyi bee seyo maŋngo. ","Yimɓe jama'aare wartuɓe diga daheeki fuu mbaɗi bukkaaji, njooɗi nder maaji. Diga wakkati Yosuwa ɓii Nuuna haa wargo nyalaade man, Isra'iila'en meetaay waɗugo irin ɗu'um. Ɓe ceyi bee seyo maŋngo. ","Giiwi lɛŋ nɛ mɔi̧a, o wi nɛ pia nɛ tɛ bara dee tua-ŋgui, ɓɛɛ wa ɔ sɛnɛ. Tɛ ŋgimbi ko Josue bem ko Nun hɔ sɔsɔɔ, o be  Israɛl  de mɔ hegɔ na. Duka nɛ́ mɔɔ gasa desee nyɛmna. ","Giiwi lɛŋ nɛ mɔi̧a, o wi nɛ pia nɛ tɛ bara dee tua-ŋgui, ɓɛɛ wa ɔ sɛnɛ. Tɛ ŋgimbi ko Josue bem ko Nun hɔ sɔsɔɔ, o be  Israɛl  de mɔ hegɔ na. Duka nɛ́ mɔɔ gasa desee nyɛmna. ","Pɛtɛa mbeli nyi ketsenete geva tagha, nyi kezhɛneke geva nyi menete yɛ ghwəli kantishɛnji mbe. Kavəa zlama nya wəba se vəa shɛ, kwa nza ŋkɛ kegha ka Israyɛl kamenete gəsəkəa shɛ se mɛa vəa Zhozəwɛ, wəzege ta Nəwn we. ","Ngaäa jar maga hay wo le ti dañgay day fer wo le mo äuy raw wo bag mburyug wo, saara lag go äil mburyug wo. Tï¡ï¡ le ti kal mani Josuwe je ni Nun haçaç a go ti wur sen mono, jar Israyel joñ wo te mo ma dosen no kay gaa, fruygi joñ debañ debañ ti wur sen ni."
