livre.chapitre.verset,Bafia,Dii,Ejagham,Ghomala,Vute,Limbum,MKPAMAN_AMVOE_Ewondo,Mofa,Mofu_Gudur,Ngiemboon,Doyayo,Guidar,Peere_Nt&Psalms,Samba_Leko,Du_na_sdik_na_wiini_Alaw,Francais,Anglais,BIBALDA_TA_PELDETTA,Bulu,Guiziga,Fulfulde_Adamaoua,Fulfulde_DC,KALATA_KO_SC_Gbaya,KALATA_KO_DC_Gbaya,Kapsiki_DC,Tupurri
PHP.2.21,"Lɛ ɓum ɓɛ̀cèm ɓɛɛ̀ kaakaa lɔŋ kirɔɔ kaa ki ɓɔmiɗ, ɓɛ̀ kɛɛ̀ kaa ki Yeesus Kiris. ","A̧máa nán tóó vu̵ ká̧ŋ́ voo fó̧ó̧ voo nɔ, vu̵ taan hȩn Yesu Krístu woo né. ","Ane mba tat á kéra áno a ri mma ábho achot, á ká fon ebhú na etûm í Jisos Krayis. ","Guŋ pyə shɑ pɔ awɛ wə sɔlam pɑ́ nə yap nwə̀, wap tə̌ wə sɔlam nə yə́ Yeso Kristo pɑ̀. ","Nùb meré lâs lə́əmháce bɨ́ síí ŋgáb nɨ̀mibi, ŋgáb bɨ lə́ə̀mnɨ ndɨ̀ŋnɨ nɨ́m Yésù Krístù ɗúré ɗàà. ","Beèe wááwá a ku ce kwaè'shi ba aèmboè wap btu, a ke' ce kwaè'shi aèmboè yuu ce Jisoès ce roèo ka'. ","Amu bod bësë badzëṅ hë mfi waban, së ki e hi Yesus Kristus. ","Aman ta tèlèba ta woy skwi ta, skwi Yèsu Kristi ka ɓai.","tabiyaha kwa way way na, a dzeley 'ar na ka tek ata ma satar ana hay zləna, na ma Yezu Kriste kakay. ",ee chaꞌtso ntꞌomcheⁿ nnꞌaⁿ macanda̱ mꞌaaⁿꞌ nꞌomna cantyja ꞌnaaⁿ na cwilaꞌjndaaꞌndye nquieena nchii chiuu waa na lꞌue tsꞌom Jesucristo. ,"Dood sɛw hi wook hinyɔ kpoos ya̧nɛ ha̧a̧hi giya, hi wōō Yeesu Kristu woos ɔnɛ gɛ.","Vi ɗii pak takəŋ wəgayaŋ aka wəza na gəba ziti kaaka'ə, məza aka ana Zezu Krestu ɓa. ","Bòobtò də́ə gá və yá̧a̧ vìrgəŋ pu yúl vəní vɛ, və yá̧a̧n pu Yeesu Kiristu pai. ","Kàandə, nɛ́b bəd kóólé, bə̀ sèl tə́ in boò yílə́ bə̀ bəd ní, bə̀ sèl Krístù bòórú bə̀ kɔ̀ sé. ","Buri ɓa na zamai paŋ ɗa e piyi ɗa a pɗem na wiiɗi, a na wiini Yesu Kristu ɗa kai. ","tous, en effet, ont en vue leurs propres intérêts, et non ceux de Jésus-Christ.","For all seek their own, not the things which are Jesus Christ's.","kay nisi kaf garam mi slen ma lisi ŋaana, may ma vi Kristu Yesunɗi. ","Bese be lôô foʼo ve mfi wobe bebien, saa ñhe wu Yésus Krist. ","Mizli mekelemey gar na, a puram i li lum taŋ tewle, anta ngi pula gir da Yesu Kristu ta. ","Luttuɓe fuu ɗon cuklani ko nafata ko'e muuɗum'en, naa ko nafata Yeesu Almasiihu. ","Luttuɓe fuu ɗon cuklani ko nafata ko'e muuɗum'en, naa ko nafata Yeesu Almasiihu. ","Oi bíí lɛŋ kíí nɛ́ mɔ wen tɛ-wa nɛ̀ tɛ-wa, nɛ̀ bó nɛ́ wen zu Jesu Krist na. ","Oi bíí lɛŋ kíí nɛ́ mɔ wen tɛ-wa nɛ̀ tɛ-wa, nɛ̀ bó nɛ́ wen zu Jesu Krist na. ","Ma kweci mbeli ne, deke ŋa nci ghə yazəzə hɛ, kaɗema kazəzə ŋa Yɛsə Kriste. ","Werga jar lan wo äuy ëig wo äaaran diñ ti da'ge äaara, bay wo ëiggi ti joñre mani Yeso Krisn wa. "
PHP.2.22,Ɓì yii lɛ Timote à mɛ fa ɓirèmzɛnà ɓi ɓi resii lɛ à rì mum à ǹtyweeyi; ɓì yi girig lèg ànɛ à falɛ̀ngà ɓi kìsay ki Syeesyee à Ɓɔlɛ ǹɗaŋ ri mɛ̀ lɔŋ yɛ̀ɛ man ànɛ à rì seŋi a mɛ̀kòò. ,"Ví gaa Timɔtée máa, mbaalı̵́ woo, kan ta ya̧g buu sá woo á̧ḿmɔ́. Maan ba'ad kɔ́lı̵́ kɔ́ ı̵́ waa ka kɔ́ ba'ad kan ba' woo wɔgɔ yúú moo to̧o̧ 'maŋŋı̵́. ","Kən ên áfoné, ó məŋe ên ekpak nji Timoti a tóŋe se yê a bhîk ka etûm Obhasi. Ó məŋe ên ekpak nji mme na yê e yimî etûm ka obhô otîp ogyebhá-ḿbə́ŋé mbi ó kpée na Jisos Krayis, noŋ ńsé na mmon. ","Da' gɑ sɔ' m̀ nə yʉ́ Timotio bɑ pǒ tsə zhyə dəŋ mfa' myə́: dəŋdəŋ pa' mú bəŋ tap e a, e tamtə nə m̀ nə fa' nə Cùŋ pɑpúŋ. ","Ɨ́dù kɨ́ Tìmòtéè, nyí nɨ̀miib nyí ɗəəŋtɨ́ hȩ ŋgə́ ya túmnɨ jɨ̧ nóò, hȩ ŋgə́ ya kpɔ́k mɨ ə́r ɓéhèé Kìn Nyɔ̧né hȩ mwin kpɔ́k tá ni ə́ré. ","AÈ ka' ba aèmboè Timotïì, weèe ku riñ yïì ndeèe. Weèe rïìñ ená e faè' weèr ye aèmboè muu e ke faè' a yïì ta naè, aè rgeèe ená Nsuñ Mboèñmboñ du kuèntombïì. ","Miayëm wò-esye woe, amu angasye ai ma fufulu asu mbëmbë foe anë mòn asye ai esya. ","Aman kin sun Timothée, nenga'a njkudo ma, a n'nza a sam ga, a ntakahayè a géƋ ma mbela'a, ara kra man a takaha bab na. ","Ama ŋga na, kuray ana ka səradama, ka ɓada ba ŋga ɗa ka vaw ŋga: kalkal andza bəzey ka tsakay ma baba ŋga na, ŋga me dzəmey a dey ɗaw, ma da key mesələrey ma Mey Wayna. ","Sa̱a̱ ꞌo nquiuꞌyaꞌyoꞌ chiuu wjaamꞌaaⁿ Timoteo ndoꞌ chiuu waa na tyondiꞌntjoom nꞌeⁿndyo̱, teijneiⁿ ja chaꞌcwijom machꞌee jnda tsꞌaⁿ ñequio tsotye. ","Hɔnɛ nɛ mɛɛ Timɔte dɔglɔ be. Woo Dɔgl Rɔb woos hi mii an waa yɔ gi ɗaasig baatɔ woosɛ. Yɔ anbɔ, zuun a gin mɔkil rɔbo. ","Kəsənənka va an Timote agəɗə, aɗɗak va wiyən adaɗɗa wəza sən affəni, vaski agəɗ su wəza vi Wən Neneke. ",Timote gá və́ gàaro kə̧sàŋ dúur əní. Bə́ŋ tò̧ dùg muur púur tonóm yò kə̧ mú yír vəŋ túnú. ,"Aí kɔ̀ íí gàb yàá kə̀ yíl aí bìá, nɛɛ̀n aa Timote də́' ɛ̀g yíl oò kə̀ vɛ́nà oò roó, bít nɛɛ̀n aa mà' tù' kə̀ máá tá, kìínmbə̀ wàà aa tə́ kə̀ báá oò tə́ rə kíin,  * Nwɔŋ Puu Sɔ̀ɔ̀nkè tùsú. ","Amma ni a siŋkumu edi ɓa, a na maiɗi nagai ɵa kai, a za sda gaya maini ahi n’aŋ gaini epini nɵa, maini bege nɵa war ɓikini labar na pɗem. ","Vous savez qu'il est d'une vertu éprouvée, qu'il s'est dévoué avec moi, comme un enfant avec son père, au service de l'Evangile.","But ye know the proof of him, that, as a son with the father, he hath served with me in the gospel.","Nigi kaw wi ala nam ɗek tuwam goyo, ki goora ma ka goboy tam bulum heb' nala, nam vul tuwamawa goyo hiɗi nanu hay sunda vi labara ma firina. ","Ve nye, mia yeme na, a nga liti mboone wé: Aval ane mon a too e fefel ésaa, a nga fubu ésaé Mbamba Foé bia nye. ","Amma ki sinaka le, Timote a biga le, naŋ teŋteŋ: Ya ati naŋ na, i gam slra ngi Ɓimezle le jom kaɓa mangal ati cine. ","Onon on anndi no hoolaare maako waŋgiri. Bana ɓiɗɗo kommbi baaba mum, non o huuwdi bee am ngam Linjiila. ","Onon on anndi no hoolaare maako waŋgiri. Bana ɓiɗɗo kommbi baaba mum, non o huuwdi bee am ngam Linjiila. ","Ɓɛɛ ko Timotee, ɛ́nɛ́ iŋa hee mɔ'ɔ n'aa dee nɛ̀ tom usa De Mbe Wen in am, hee mɔ'ɔ nɛ bem de nɛ̀ tom in dáà'ɛ ga. ","Ɓɛɛ ko Timotee, ɛ́nɛ́ iŋa hee mɔ'ɔ n'aa dee nɛ̀ tom usa De Mbe Wen in am, hee mɔ'ɔ nɛ bem de nɛ̀ tom in dáà'ɛ ga. ","Ama nahe yɛ keɗepe gheyɛ le ghəa ŋayɛ tsema tsema se Timotɛ kamene yitea slene, nahe yɛ keɗepe slene nya menete 'ya le, kala yɛ wəzege le yitenyɛ menete slene 'ya le kezha Ghena kwatenca nya ganyɛ. ","Nday yañ go de koge ga Timote hay naa nen joñre äen go, day se hay haç see äe go sagsag ti joñre siigi Waçaçre ma de Coçoçren go ne jar kay ndi doga weel kay pan äe nono. "
PHP.2.23,"Nyi nnɛ nfèfeg lɛ nɗom̀ yì mìni, di m̀manɛɛ kì yiì rìsyɔn ɗi kiɓan kɛm̀ lɛ syeesyee. ","Mí taa, a̧n gaa mbaalı̵́ míí yɛ tée, míń há̧á̧ ba""u̵ la víílí dɨlı̵́. ","Ka obhô mbí, tîk n tûm yê mbâ eyəné ebhú nji m məŋê ekpak nji tîk é jóe na mme. ",A yʉ́ tə́ gɑ wə sɛ nə təm e bi po nə cwə yə gɑ gɔ zhyə kwa' pa' pu gɔ ghə nə m̀ a. ,Mɨ á lə́ə̀mnɨ tómsònànɨ nyí ŋgə́ ɓwâ mɨ ɓa óknyààŋnɨ àm mo sóò. ,"A mbuèu ce m ce ke' máná a ka' teni mnsa' m riñ aèmboè buu yu, m ka' tuu ye tá e vú yá weèe. ",Ṅnyè hm mafidi na mayi lom ṅnyie anë mayi yëm etye mëtëlë. ,"l zhèrè te ndav, te deɓa'a man i tsena skwi man ta da gi a sam ga a ma ma, i war i zlinda kinè Timothée. ","I dzeley akwa ma da sləraɓa na ŋga, kendzey andza guma ma tek a ɗaw a neney ka weley ba na. ","Joꞌ chii tyuaaꞌti na nljeiya chiuu nntseijndaaꞌñenaꞌ ñꞌoom na maleiñꞌoom ja, quia joꞌ njño̱o̱ⁿya jom na mꞌaⁿꞌyoꞌ, ",Ya̧a̧nɛ mi mɔkig an mi see hinyɔ gɔ gi tursim kete ɓɔr mi ɔsin Timɔte yaak nɔɔko. ,"Nəɗumək naw slənən go'u, an nəsənək gabba zuwa. ","Ŋdí ní muur míní vəəro ní, ŋdàŋ pə́və́ fúu tó̧nárì Timote bee.","Kə̀ aakíin də, mə́ zíg tɛ́m má oò tumàá, dáà mə́ gàb nɛɛ̀n aa má kuùm dú reì nyɛdkè gə́ roó. ","Nɵa mu hiina ɓa aga mu ɵinaŋɗi siki, na ɓa seŋŋa ɗa a ɵa li edi ara gaglai su ɗa. ",J'espère donc vous l'envoyer dès que j'apercevrai l'issue de ma situation;,"Him therefore I hope to send presently, so soon as I shall see how it will go with me.","Namu, nan ka var kay gumis tigiya, hay li ma nan wi caw liyn ma nan ka haynawa goy wina; ","Nye ñhe ma buni na ma ye lôme mia, ataté éyoñe ma ye tuʼa yem été ja yange ma, ","Da ɓi ɗu a sa bun le ndar na, i wa na, i sa slinukum di i naŋ. ","Ngam man, mi tammi nelugo mo haa mooɗon law, to mi faami bee laaɓɗum ko laatanto yam. ","Ngam man, mi tammi nelugo mo haa mooɗon law, to mi faami bee laaɓɗum ko laatanto yam. ","Kà‘m nɛ́ iŋa mɔ nɛ̀ tɛ́ hɔ zu'm nɛ̀ sa̧a̧-a̧ kaɗi, ɓɛɛ nɛ́ a̧ a̧‘m ta mɛ́ tom nɛnɛ h’ɛ́nɛ́. ","Kà‘m nɛ́ iŋa mɔ nɛ̀ tɛ́ hɔ zu'm nɛ̀ sa̧a̧-a̧ kaɗi, ɓɛɛ nɛ́ a̧ a̧‘m ta mɛ́ tom nɛnɛ h’ɛ́nɛ́. ",Gheŋkɛ yateghwene ŋayɛ 'ya kahe kahe vəa ŋkwa shɛ keneweve nza ta ɗa 'ya. ,Ndi de kañ ëiggi äi ta' ga ndi äo'n yañ wo see äay ge la mbañ de maga aà cag waçaçre äi we go mono. 
PHP.2.24,Fɔɔnnɛ ǹɗì rì ǹtyweeyi ri Kan lɛ cààmɛ̀n lesàg mɛ̀ɛmiɗ. Nkpaŋ lɔŋ foo.,"Mí gaa ı̵́ 'yɛ́lı̵́ woolı̵́ máa, míń dɨ laalı̵́ víílí dɨlı̵́ há̧ná á̧ḿ.",Ń kam ka etʉri na Ńtâ Jisos bəre kpe mme ḿfoné tîk m bák mbâ eyəné ka mkpât ebhú.,"Ba kwa' myə wə́ shəŋtə jyə́, shyə́ m̀ nə́ Cyəpɔ gɑ̀ kwa' myə gɑ̌ wə gɔ sɔ' wuŋ sɔ' wə po.","Ɨ́dù mɨ ɗəəŋtɨ́ Kéké ɓa kpɔ́knɨ á, hò̧ mvin ti ŋgób mɨ nɨ̀mɨ́r mɨ a gɨ̀sòɓà nyí pénɨ.",M rïìñ máná nfeè' múcaèr tá Tata ma'shi tá má máè vú yá weèe.,Mëbëlë afidi abë Nti na mamen mayi fë vol sòṅ we. ,"Aman i fì gèƌ a vna, te Bi Yesu, aman iyè a ri ga, a di i dè a sam kinè ndul ndul.","Akwa yah ana na, i sərada ha da mezəley ma Bay’ərlam na, yah ana tiyatsa na, mazlambar aha i da daɓa. ",sa̱a̱ mati quitꞌmaⁿ tsꞌo̱o̱ⁿ Nquii na matsa̱ꞌntjom ja na tyuaaꞌ nncjo̱ cando̱o̱ꞌa ꞌo.,"Yɛrɛ mi gbaak kpoos mi a Waar Yeesu ge a mii hi zul mi hɛw, mi zaak kuudu kaasi a nɛɛge.","Amma əntatə ɗumo də Ɗəfdaya, abe suɗike na, wanəmbat ulukum in sən kiwa.","Ŋgàaro Gɛ̀nbògə̀r yòobà gá, mí pɛ́m ŋdàŋnəvə́ ɛ́m tə́lérì nə́n li ló. ","Bít mə́ gàb yàá vɛ́nà, kə̀ láŋke Báátììkpɛ̀ŋ bìá, kə̀ yíl máá bə̀ kɔ̀, má dáàn aí səǹ záàn zɔ̀gɔ̀ yóo.","War Epiɗ-ɗai, mu yima ɓa, ta dama aga mu halaɗi siki gobi. ",et j'espère également du Seigneur que moi-même aussi je pourrai venir bientôt.,But I trust in the Lord that I also myself shall come shortly.,"lo tap-wida van ka hay Bum-Sumun ala, la musawa neeɗa, nan kay tuwan ma coys tigiya.",me too ndi e be Nti na ma fe ma ye zu anaʼana.,"Na zle, ar ya mujom ati Bumbulvuŋ na, i si na le gisiŋ, neˀ ngrˀa mbuŋ aka, ya vuna, i sa ra purukum aya. ","Mi ɗon hooli Jawmiraawo boo, mi ɓadake wargo haa mooɗon min bee hoore am.","Mi ɗon hooli Jawmiraawo boo, mi ɓadake wargo haa mooɗon min bee hoore am.","Mi e ta nɛ̀ Gasa Wan'e, mi nɛ̀ tɛ‘m tɛ́ hɔ tɛ‘nɛ́ mbɛt.","Mi e ta nɛ̀ Gasa Wan'e, mi nɛ̀ tɛ‘m tɛ́ hɔ tɛ‘nɛ́ mbɛt.","Ama kagezleŋe ghə 'ya va Shala we, katelə 'ya le ghəa ɗa kanewe ŋayɛ temə ɓɛhwɛ.",Ndi go de koge cwaçy de kañ ëiggi äi ti Wañkluu ga ndi wo yañ wo ni äay la mbañ de see äi lay.
PHP.2.25,"Mɛ̀ɛ nghɛɛ kìrɔɔ lɛ mpɛɛziì mìni kì romìì Epafirodit à geni wɛ̀m ànɛ ti kiki kisay ri nyi, tì ɗùùɗùù ǹɗaŋ ri nyi; rì nyi innɛ ɓìi nɗomiì mɛ̀ nghɛɓsɛn ɓisuu ɓyom ɓi ɓi nkaakààrɛ̀n mɛ̀. ","Da ba ví kirtȩ́n Epafodíd, dan ba'ad kíí ba""u̵ ya, ka pa̧n ya hȩn káń hí̧í̧ pee máa, vɔ́ sú̵g kɔ́ ba'ad néélȩ́ na'a wu̵lı̵́ á̧ḿ, ma mí taa, maa ba mín ba""u̵ vȩ' laan víílí. ",Kən ń kere bəre tîk é nôp n tûm ntem-mmon-i-nnyen owəré Epafrodayitus a chəbhé njəm ágo mbâ eyəné. Epafrodayitus a yim etûm í Jisos Krayis na mme. A chə̂m na mme ka enok achot Obhasi mma é dáŋa sê á jí ochî. A yîm etûm ejê noŋ ḿgbán nnyo o túmi ên a bhá kak ə̂m obhô. ,"Da' gɑ̌ yɔ gɑ́ ǎ puŋ gɑ́ nthəm fɑ́ a Epafrodito bi po, yʉ́ yə e bɑ só fa' a biŋ bɑ so shù a, yʉ́ yə po lə təm e bəm gɑ e pɑ̀ ŋkwitə a nə cwə yə a lə bɑwə shəŋ po' a. ","Mwin yàá nɨ́mè Èpàfɨ̀ròdît, nò nɨ́me ŋgə́ tɨ lɨɨŋɓáhe ə́r Kìn Mèèín, nyí tɨ tómwo gèwònà mɨ nɨ́m du mɨ ɗúnàniì rɨ, mɨ péé á nyɔ̧ɔ̧́ mɨ tómcùsònà nyí ŋgə́. ","Máè yá máná yi yu boèñboñ ená m tuu nfúr yïìseèe ce ÁÈpafroèditoès tá e kúti vúè yá weèe. E yu ñwáè ce weèr ye ce faè' aèbee, a ce maè' bïìr Nyúè aèbee. E yu foñ ñwáè ntuu ce weèe aè m tuu ená e vú ja' máè. ","Mëyen fë na anë ai mfi na mëlom mina Epafroditus , madzaṅ a bia nyè bibòòg esye fufulu, bitoa fë a nkan bita fufulu, nyè angasò a nloman waan, avòli fë ma a mëyaṅan mama, ","Aman i huro amba aman i zlinda kinè Epaphrodite ba, kramam nga. Nenga'a ndo mizlinè ga, ndo man nga gi var a vna, ndo sak kinè, ndo ntakaha kinè te di man a ga. ","Ama i ma dzala ŋgama i slərəkuraɓa Epafrodit, malam a ɗaw, mandala ɗaw da ma kəɗada vaw da meslərey, na kuray ma sləradəmərawa ka tsakay ɗaw, ka da kaya meslərey, da har ana tek a hətsaya ha na. ","Sa̱a̱ maqua̱ⁿ cwenta na macaⁿnaꞌ na catseicwano̱ⁿlcwa̱ꞌa tiꞌnnꞌaaⁿya Epafrodito, jom na matseijomñê tsꞌiaaⁿ na matsꞌaa ndoꞌ tseimaaⁿ sondaro cwentaaꞌ Ta Jesús, jom na jñomꞌyoꞌ na mꞌaaⁿya na cwiteijndeiꞌyoꞌ ja ꞌnaⁿ na macaⁿnaꞌ ja. ","Mi see gi an mi yaa Epafortitus, yɛ̧ɛ̧ wɛ yɔ gi fɔk Yeesu gbɔnɔ, yɔ gi wooswook hi miya, gi ɗaak nɔk hi mii ɔksi, gi wɛɛwɛ. Nɛ yààzig nɛ miige an tɔmsya nɛ an gi ɗaasim a hinyɔ ha̧a̧m gedu sɛw. ","Nulak na, aslək nəmil gənə gən Epafroditus azokum, dəni mədaɗɗa wəza ndəni dədaw gay də in tamə, ndəni məs kəslənaŋ, dəki su zəga məs kəbaah suwəni atər suwək wəray nawa. ","Ŋyaa ŋtə̀ ní sáan ní ŋtìibtirà pə́və́bà dàawa Ipafodii, yír ya bə́ŋ tò̧ŋ ní, wəi gò̧ zaaŋ pə́ŋ gò̧n nì. Ba və́ tò̧i pə́ŋ wəi kə à̧a̧i pə́mmà̧ ɛn ya u̧u̧nə́ŋ ní. ","Mə́ sèl lə, tə́ sɔ̀ònkèá, aí bə̀ ɔ̀dkudvɛɛ̀l bə́n Epafrodite tuùm bí'ǹnà bə̀ aí sunú, ɔ̀d mə́ nə́ŋ̀ tùsú bìá, bít ɔ̀d mə́ nə́ŋ̀ bùmú bìá. Oòrə, nɛ́ŋə̀ aa íí tùmə̀ máá səǹ, oò àà mə́ láŋke in aa mə́ ɔ̀d də bə̀ roó. ","A tala ara pɗem lai buri mu wiyikiɗi Epafrodit, na tawala, na maya zi sda, maya na war hatam lai, apostel na tiki ki ɵiniŋsi sa buri a zina pa war hajaŋa paŋ. ","En attendant j'ai cru nécessaire de vous envoyer Epaphrodite mon frère, le compagnon de mes travaux et de mes combats, qui était venu de votre part pour subvenir à mes besoins.","Yet I supposed it necessary to send to you Epaphroditus, my brother, and companion in labour, and fellowsoldier, but your messenger, and he that ministered to my wants.","Wulini nan ɗuw ŋaa'a kay gi Epafroditus ays tigiya, namu mi ɓasunna, niranna ma hay lopna, ma hay duura kaw, ma nigi sunumay tanu, nam ma nigi vulan slen ma ŋom ŋil tuwanna ay kalamu; ","Akôsa bo nalé, me nga yen e too mfi na me lôme mia Epafrôdite, mojañe wom, ébe mbo ésaé a nyô bia nye bia wosan, nyô mi nga lôme na a zu saane ma e minkômbane miam été ","Amma i pura na, a zlir le ɓa i slinukum sukum ndra Epafrodit a muŋ. I gam slra le jom, yo i cikam vu le cuwa. I mbur kum mislinoko di ɓa ngi jiniy, dambalaka yi ro ti may naŋ vuna zleˀe. ","Mi laari ɗum kaanduɗum mi lornana on deerɗiraawo am Epafrodit, kuuwdiɗɗiraawo am, balluɗo yam nder haɓre, nelaaɗo mo on nelno haa am ngam humtugo haaje am. ","Mi laari ɗum kaanduɗum mi lornana on deerɗiraawo am Epafrodit, kuuwdiɗɗiraawo am, balluɗo yam nder haɓre, nelaaɗo mo on nelno haa am ngam humtugo haaje am. ",Ɓɛɛ mi taa ɔ dee ha̧‘m mɛ́ tom Epafrodit siɗoŋ tɛ‘nɛ́. A̧ nɛ́ nya'm nɛ̀ duk nɛ́ gbama wi-de-tom in gbama wi-biro in am. Nɛ́ ɛ́nɛ́'ɛ toma so a̧ tɛnɛ mɛ́ gbak am tɛ́ tom wen mi kíí so nɛ́ ŋma bíí nɛ̀ tɛ́ gbak am. ,Ɓɛɛ mi taa ɔ dee ha̧‘m mɛ́ tom Epafrodit siɗoŋ tɛ‘nɛ́. A̧ nɛ́ nya'm nɛ̀ duk nɛ́ gbama wi-de-tom in gbama wi-biro in am. Nɛ́ ɛ́nɛ́'ɛ toma so a̧ tɛnɛ mɛ́ gbak am tɛ́ tom wen mi kíí so nɛ́ ŋma bíí nɛ̀ tɛ́ gbak am. ,"Ma zəzə 'ya ne, megela keghweneghe ŋayɛ Ɛpafrodite 'ya kaba, wəza meyɛ ɓəmə, wəndə nya kebeghe ɗa mbe slene ba'a mbe mpa nya mpa 'ya, gheŋkɛ yaghweneke ɗa yɛ le wəshi nyi kemanakɛ ɗa yɛ le hɛ, kwa nza titikwəa ŋkɛ te 'ya. ","AÀ coo jag äi debañ ga ndi mo äo' hen naa Epafrodid je maga wuur de ma joñ joñre de kaçaçra, de durgi de kaçaçra wo ne nday. AÀ diñ je maga nday hay äo'n le see äi ma kay mege de feçeçre maga ndi hay de saçy äaara ti mono. "
PHP.2.26,"Àa ǹɗì rì coo zày ìnɛ lɛ di àa ghɛɛ̀daagh mìni ɓɛ̀sɛ̀ɛ̀ ɓɛ̀cèm, wɔ̀lɛ kìɓan ki ki ǹ-yeesii nyi lɛɛ̀gweey, ki ǹɗì kiɓan ki ɓɔlɛ à fìroɓ fii anɛ ɓìi nteri foo. ","Hí̧í̧ bi la ho̧ ví 'waapád á̧ḿ. Zó̧ó̧ tó̧""o̧, moo ká ví ki hȩn ba ho̧o̧wo̧ ó̧. ",N kí tum yê ka a kôt ka biji ibhê se yê a yén ên. É rî a ri ejûm okíma-aya mbâ eyəné nji o yúghi ên sê yê a fôn emaŋé. ,"Nə pa' nə pìŋ jɔ wɔ lə bɑwə nthəŋ e te', nə pa' a lə paknyə e nə zhyə gɑ pǒ zhyə gɑ ě gho. ","Ŋgə́ á ɗúɓànɨ ɓàìncùnɨ ɓe nyí lâs, ɓetí á ŋgə́ yínɨ só àm nyí tɨ ók ɨnayâna ŋgə́ á yábnɨ na rè. ","Cuèu yi ce luèu ye aè ryá weèe, mluè mi ce koo ye njobeè' e rïìñ ená weèe aè yu' yi yañ. ","mbol angabë ayi mina bësë du, nnëm otoa nyè a mëlunga, mbol mingawog na angabë akònò. ","Mpataka kinè tèlèba a keƌa'a, a ndav nenga'a m'mbeƌa, a géƌ man kin tsena'a, ara man nenga'a mbelakaɓai. ","A sar aha nduk nduk ma nəkadakwar tabiyaha, ŋga ka zlewerey ba, hərway kuray ka sərafama ba vaw a tsafa seŋgey. ",Jeeⁿ lꞌue tsꞌoom na nntyꞌiaaꞌnnaaⁿꞌaⁿ chaꞌtsondyoꞌ ꞌo ee matseiꞌndaaꞌnaꞌ ntyjeeⁿ na jnda̱ jndyeꞌyoꞌ na ñeteiweeⁿꞌeⁿ. ,"Yɛrɛ kol gig kaŋk a nɛɛge sɛw. Wɛɛ, yɔ lag a nɛ kɛm gumsɔ yɔ wa̧a̧g dɔglɔ, kpoosɔ ɗɔ̄ɔ̄t zaa ma gɛ, gig ha̧a̧sig an gi rek a nɛɛge gi ɓaas muul nɛ. ","Vi aŋgələk ulukum pakə, arəkək sawɓa va kəpprəmənən na gbəgba' armaka. ","Ipafoditu bee gàaro və́ kìilèro u̧u̧sáŋ ən yò, símá̧a̧r əní pɛ́m ví̧i̧ró, yá̧a̧nəvə́ tə́ kúntírì pɛ́m. ","Íí kìì mad nwɔŋ oò yérə, í' taà aí bə̀ bé'ǹmbə̀ gbàákù, bít sèl taà in gbàákù. ","A firya ɓa a tiliki gai hlaiki paŋ, n’a fiɗini sini a suwa paŋ buri ki ɵini ɓa a nafu veglek. ","Car il désirait vous revoir tous, et il était fort en peine de ce que vous aviez appris sa maladie.","For he longed after you all, and was full of heaviness, because that ye had heard that he had been sick.","nam gar hiɗi dikam kaf kay wigi kafe, kay dikam may tun suk noŋɗi kay humda ma nigi hum kay moyna valamu. ","amu a nga bili beta nkômbane ya beta yene mia bese, a a nga bili njuk e nlem amu foé mi nga nyoñ ajô ôkone vié. ","Naŋ, a ro ti may haɗi nga purukum gar kumo, yo a ro welele asi kum micinaka ɓi ngi jiji naŋ na. ","Ammaa o ɗon yenwa on masin, o ɓillake jamum ngam on nani o nyawɗono. ","Ammaa o ɗon yenwa on masin, o ɓillake jamum ngam on nani o nyawɗono. ",A̧ kɔ̧ɔ̧ nyɛmna mɛ́ nɛ̀ɛ́ zɔk'nɛ́ lɛŋ woyo; ɓɛɛ zia nyɛrɛ ɔɔ-zɛɛ kɔ̧-a̧ n’ɛ̀nɛ̀ zia ha̧a̧ dita-see ha̧ a̧ batɛ. ,A̧ kɔ̧ɔ̧ nyɛmna mɛ́ nɛ̀ɛ́ zɔk'nɛ́ lɛŋ woyo; ɓɛɛ zia nyɛrɛ ɔɔ-zɛɛ kɔ̧-a̧ n’ɛ̀nɛ̀ zia ha̧a̧ dita-see ha̧ a̧ batɛ. ,"Kaɗe ŋkɛ kalə kanewe ŋayɛ, kwele kwele beze mehele ta ŋkɛ kwa fate shewə se ŋkɛ. ","Werga aà de saçy maga se mo wo ko nen äay äuy ti, day jiili äe hay car go debañ ti maga nday laa ree ceege äen mono. "
PHP.2.27,"Ki ri lɔŋ fɔlɔɔ lɛ, àa nɗoɓi yɛ̀ɛ mɛ̀nɔ̀ɓɔ̀, à ɓosɛ̀n rìwu, kìɓan kifog Bɛ̀ll àa nwoogh nyi nyìighnyìg, nni àa nyi cɛ̀ncii innɛ Bɛ̀ll àa nwoogh nyìighnyìg, àa nwoogh girig mɛ̀ nyìighnyìg, lɛ kɛ̀ɛ mɓa lɛ, mɛ̀ ɓi ǹɗemi-kɛŋɛn abɛ̀y, wudɛŋ, wu yu tì kì ɓɔɓtɛɛ ɓi wiǹ. ","Ho̧o̧ woo zaa kan nɔɔ ó̧. A̧máa Tayɨɨ wu̵ kɔ́ddu̵ zó̧ó̧ nán. Kɔ́n wu̵ yu̵ dágá né, kɔ́n á̧ḿ, moo a̧n nuŋ zó̧ó̧ ví̧i̧ní ha'an sá. ","A fôn emaŋé ka etʉri, ta a kə̂t kpít na ekpóóm, kən Obhasi a fôn nsôn na yê. Á ka fon nsôn na yê átíŋ, a fôn na mme eróŋ a yíghi ə̂m ka ekpatə́m nsae nnyi kə́n m fonê ebhú sê yê a kpóe. ","A nə pɑ̌ po'o bɑ e lə ghǒ tɑ́ bvɔk vʉ́, da' gɑ Si cɔmmtso myə, tə da' myə́ pɑ́, ba mə̌, po' gɑ́ ŋ khɑ́ tə̌m nə go'o, ŋkho nə go'o. ","Ŋgə́ tɨ yábmeɓatɨ́, tènɨ ŋgób ŋgə́ kúnɨ; ɨ́dù Mèín ɨ́ ô ŋgə́ mwàm. Mwàm kɨ́ Mèín ókɓwée mɨ á, àm yəré tɨ̀ bɨndóŋ mɨ tíí tíí. ","Yi yu mini ená e m yañ, a ku táá yïû ñkwe, Nyúè aè ke' byemïì ka'. Nyúè aè ka' kani wa'a, a koosi ba mnse neè ye, a koosi neè máè foñ, njobeè' e m ba kwe kwe, yaè ñgá' aè ba báèr. ","Amu angakòn fò, awu ai enyiṅ ntye mbòg; Dzam da ndò Zamba angayen nyè ngòl, së ki hë nyè, tò fë mamen, asu yë na të mintye miabag ma a nyòl hë mbagan. ","A patsakai skwa a ndza na man a vèvèd a vava. Aman a nsau Bi Zhiklè te va, nenga'a genè ka ɓai, aman iyè ba, a woy a mbedamay ndav pèc pècèk azɓai.","Vaw na, ka tsafa ba dərka, a zarawa ketekuɗey na, a mətsey, amana, ŋga ka kar ba da vaw a Bay ma Bəla, ma kar da vaw na, ŋga dada tsa kakay, amana ta yah adzay tiyatsa, ma viya ɗaw ka da səkey adiya adiya zlay. ","Ee ñꞌoom na mayuuꞌ naljoꞌ tjoom hasta mawaa xjeⁿ na ntseicueeꞌnaꞌ jom sa̱a̱ tyꞌoom Tyꞌo̱o̱tsꞌom na wiꞌ tsꞌom jom, ndoꞌ nchii macanda̱ jom, mati ja, titseicwaljooꞌtinaꞌ na chjooꞌ tsꞌo̱o̱ⁿ. ","Da gums nɛ ha̧a̧ltɔnɔ, wagdi kaasi an gi wɔrɔ, yɛrɛ Bɛt mɛɛsigya̧a̧r baasig zelɛ. Bɛt mɛ̄ɛ̄s gii ya̧a̧r kpɔd gɛ, mɛɛs mii hɛw an bɔ kpoos mi gi waa miŋki.","Vaski gesiŋ gbəgba' armak sawɓa ha kayəmta, amma Maŋgəlva awələk saha akani, akani awəl saha kaka ɓa, amma də in pakə. Vi wəɗum naw adawsan diiɗa ɓa. ","Uu̧sáŋ gá u̧u̧ro há̧a̧ tiitii vool yag di. Ə ní Vannáb gàa pu gím, gàa pu mí bə̀ri, yaa záa kó zɛ, símá̧a̧r míní kə ví̧i̧ tálti pai. ","Kə̀ aakíin də, ləə mad yàá, nyɛ́d zɔ̀gɔ̀ní gɔ̀ŋsə́ oò dákíìn bɛ́ràá. Zá Vɛnɛ́b ɛ̀g bé'ù búúd yàá. Bít ɛ̀g bé' kə̀ oò ní gá, zá ɛ̀g bé' máá kɔ̀, bɔ̀b bíd máà bɔ̀b tɛ́m nwuukè ɔ̀d sɔ̀ŋ sí. ","Veglek a yimaŋ jre, jre ɵa, a nafu gobi gaini mri, amma Alaw a hiina haw burini, burini ni kiini kai, amma buriya ta lai, kapai girŋa a riya amai a suwa kai. ","Il a été, en effet, malade à mourir; mais Dieu a eu pitié de lui et non pas seulement de lui, mais aussi de moi, afin que je n'eusse pas tristesse sur tristesse.","For indeed he was sick nigh unto death: but God had mercy on him; and not on him only, but on me also, lest I should have sorrow upon sorrow.","Gasi, nam ay moyo, goboy tam mitta kaw; may Lawna li slugota kalamu, may kalam nam kepɗi, may kan nan kaw, kay nan ma fi yorta mara' mara'aɗi. ","E ne foʼo na, a nga kon bebé ya wu, ve Zambe a nga ko nye éngôngo, a saa ve nye étam, nalé fe ma, me za bo ve ôlun ôlun. ","Naŋ guta zleˀe gisiŋ gwaɗ naŋ, gweˀ ngi mucu. Amma Buymisemuŋ a puraŋ ˀircece le, da naŋ tewle ta, amma da ya ya, ɓa i ndir ar li ndurɓo hiri ta. ","Fakat o nyawino haa o ɓadake maayugo. Ammaa Allah enɗi mo, naa kaŋko tan, ammaa min boo, ngam taa suno ɗuuɗanammi. ","Fakat o nyawino haa o ɓadake maayugo. Ammaa Allah enɗi mo, naa kaŋko tan, ammaa min boo, ngam taa suno ɗuuɗanammi. ","Nɛ̀ mbetɛ, a̧ ɔɔ zɛɛ nyɛmna, oi-aa ŋgɛlɛk a̧ tɛ̀ɛ́ fe; nɛ́ mɔ'ɔ nɛ̀ Sɔ̧ dee ko ha̧ a̧, bó nɛ́ ha̧ a̧ ɓɛɛ na, ɓɛɛ ha̧‘m mbɛt wen ká‘m tɛ̀ɛ́ kpa mbe dita-see woyo. ","Nɛ̀ mbetɛ, a̧ ɔɔ zɛɛ nyɛmna, oi-aa ŋgɛlɛk a̧ tɛ̀ɛ́ fe; nɛ́ mɔ'ɔ nɛ̀ Sɔ̧ dee ko ha̧ a̧, bó nɛ́ ha̧ a̧ ɓɛɛ na, ɓɛɛ ha̧‘m mbɛt wen ká‘m tɛ̀ɛ́ kpa mbe dita-see woyo. ","Kaganda ne, shewə se ŋkɛ, takwa takwa ŋkɛ kamte, ama nahe Shala kezhɛakɛ heli yite, yite nahe we, ama yitea 'ya perə, yagha wənəa ɗa kazhɛne kazhɛ ɗa za ma ke nya kaghate. ","Ceege hay joñn mbe we cwaçy. AÀ hay kos huli go mbañ day Baa raw ko decoo äe. AÀ ko diñ decoo äe tawa gaa, aà ko decoo äi lay maga nenceere äi mo dañ go debañ debañ wa. "
