livre.chapitre.verset,Bafia,Dii,Ejagham,Ghomala,Vute,Limbum,MKPAMAN_AMVOE_Ewondo,Mofa,Mofu_Gudur,Ngiemboon,Doyayo,Guidar,Peere_Nt&Psalms,Samba_Leko,Du_na_sdik_na_wiini_Alaw,Francais,Anglais,BIBALDA_TA_PELDETTA,Bulu,Guiziga,Fulfulde_Adamaoua,Fulfulde_DC,KALATA_KO_SC_Gbaya,KALATA_KO_DC_Gbaya,Kapsiki_DC,Tupurri
PHP.3.14,"Fɔɔnnɛ nghɛghɛŋi lɛ nkɛǹ kìkpaŋzɛɛ, di nteɗ mɛ̀lèɓ mɛ ɓi ǹɗeèghreŋi wu wu ɓaghày mɛ̀ aɗyòò yɛ̀ɛ Bɛ̀ll, ɓi Yeesus Kiris.","kɛ ɗug líí la tə́g, bi la nuŋ hȩn Tayɨɨ ka been, a̧n la nuŋ biilí, kan yɛ́g Yesu Krístu woo yȩ pȩ́ń.","Nâ ńjə́ne n di ágo n noghá na ikom-ikom bəre ń yen echî, ḿ fôn orʉrí mbi ó rî nâ ekpin ótúm-ótúm nji Obhasi a bhiŋî ə̂m ka mbiŋ i Jisos Krayis.",gɑ̌ ŋkhaktʉɔ nə ghɔ dzə̀ nə kwi mcwɔ'fa' myə a bɑ nə nə́ ke mo kɛbəŋ yə Si nə ŋkhe wɔk pɑ shyə́ m̀ nə Yeso Kristo a. ,"Nɨ́m kɨ́ á mɨ du lùhánɨ, àm mɨ a kwà ɓə́r Mèín du nɨ́m ɓénànɨ còóm ku ɓe ɨ́r Yésù Krístùù rè.",M ce faè' ce duè kuèntombïì máná m bo duè koni blaè' embe buèu ce Nyúè aè ká' máè ená e bo fa máè njo' yuu ce Jisos Kraâis aè m geèe. ,"matoṅ fò a mëmana, e maan ya mënë na Zamba angaloe ma a yob abë Yesus Kristus. ","a i hi a sam skwi man a zhè a ma, a sam n'ndikèma, a sam skwi ntulè, a sam man Zhiklè a baba nga a pa te Yèsu Kristi.","I hway 'ar ka mey ka tek ana, ma vəday ma masa na ma dzəmaya ka vaw ta me zəley ana, na Bay ma Bəla ma zəladandakwar da 'ərlam, da Yezu Kriste ana. ",cha nncua̱caño̱o̱ⁿya yuu na jnda̱ tꞌmo̱ⁿ Tyꞌo̱o̱tsꞌom no̱o̱ⁿ ndoꞌ na nntoꞌño̱o̱ⁿya naya na nñequiaa nqueⁿ na maꞌmaaⁿ jaa cantyja ꞌnaaⁿꞌ Cristo Jesús.,Mi nɔɔko an mi tuur a nɔɔkil da̧a̧klɛlɛ mi dag ɗɛɛt mi dɔɔrɔɔsyɔ Bɛt elinmi wɛɛha a ɔksig mi bɔ gedu hi Yeesu Kristu.,"Yaŋ ndəni kan nədanzaw kla təki nawrah zəga nani, vi nərəhə gən zəga nani məs Maŋgəlva ayəm akan daga sə disiŋ də Zezu Krestu, ndəni wəkoho.",Ŋwà̧a̧ ɛ̀m dùggəŋ kə ŋzìibà ɛn ya Vannáb ká̧ pə́ŋnəbə́ gógsan ni vəŋ Yeesu Kiristu əni yò. ,"Kə̀ aakíin də, nùù mə́ tə́ ɛɛ̀m in aa mə́ zíg númú rə ba, bɔ̀b dáàn bɔbm̀bə̀ dùm aa Vɛnɛ́b pii bə́nnà lɛgə́ paà kə̀ Yéésù Krístù roó.","Mu lawa na ɗa sin wala n’a! gai kiti wuzani ara ta ɗa, kapai mu nava vrak na wiini yiki n’amai par, na wiini Alaw war Yesu Kristu. ","je cours droit au but, pour remporter le prix auquel Dieu m'a appelé d'en haut en Jésus-Christ.",I press toward the mark for the prize of the high calling of God in Christ Jesus.,nan jaŋ tam dabta kay fi wurakŋa vi yita ma may kulo pana vi Lawna hay Kristu Yesu.,"me tôñesan e jame ma sôñ, asu maʼan me tii a e nloone ya yôp, ñwô Zambe a loone bia e be Yésus Krist. ","Naŋ kanah, i ra kiɗ vu ngi ndila pi mi, ɓa i ra lum migir, Buymisemuŋ mazila ndra tisi Yesu Kristu nga tiɓi naŋ ar li ngi muŋ na. ","mi ɗon haɓda yottaago keerol daɗa-daɗa, haa mi heɓa keɓal ewnaandu ndu Allah ewnori yam nder Yeesu Almasiihu.","mi ɗon haɓda yottaago keerol daɗa-daɗa, haa mi heɓa keɓal ewnaandu ndu Allah ewnori yam nder Yeesu Almasiihu.",Mi ma nɛ́ yì nɛ̀ ŋgaya-a mɛ́ hɔ sɔŋkur-aa wen ha̧‘m mɛ́ ba mɔ nɛ̀ Sɔ̧ sa ɛ́ɛ́ nɛ̀ ŋgɔn mɛ̀ wen-aa nɛ̀ ɗoŋ Jesu Krist.,Mi ma nɛ́ yì nɛ̀ ŋgaya-a mɛ́ hɔ sɔŋkur-aa wen ha̧‘m mɛ́ ba mɔ nɛ̀ Sɔ̧ sa ɛ́ɛ́ nɛ̀ ŋgɔn mɛ̀ wen-aa nɛ̀ ɗoŋ Jesu Krist.,Kantsə geva 'ya tsape kahwɛ yitea kemave wəsə nya heka ɓəmə Shala laka Yɛsə Kriste kakele pelɛ ghweme.,"Ndi de durgi ga ndi mo wo go dayge ti ngeel ma bag jag ëee no, maga ndi mo da' poëge ëee äi maga Baa ëe naa wo ti äe ciñ nen do Yeso Kris mono."
PHP.3.15,"Ɓìsi ɓɛ̀sɛ̀ɛ̀ ɓɛ̀cèm ɓɛ tì ti ɓɛ̀sɛ̀ɛ̀mɛn ɓi cɛɓ ki ɓi nghay, tì ghɛ̀ɛ̀sɛɛ kìɓaà rì fèg ànɛn; nni i ki kpaŋi lɛ ɓì wooghrɛɛ ɓi jɛ̀ɛ̀ ɓi kìɓan kidɛŋ Bɛ̀ll à rì mìni ɓiì lomi kitɛɛtɛn ɓi kìɓan kiǹ. ","Ɨ́ baa ví, kaa mbaa ví kɔ́ ı̵́ Tayɨɨ ka hí̧í̧ wɔgɔ yɛ, ba taa ví hȩn dágá yȩ nɔ. Tow i taa moo ı̵́ víí dɨ kə́dda tée, Tayɨɨ wú̵ń tú'ud ví hȩn woo á̧ḿ. ","Êt fép mba é kui ka achot Obhasi, deê é fôn ntʉ́ghi ekpin njí. Kən ájoé etʉ̂ ejə́né o ri mba o fonê ên ekpin egyê, Obhasi tîk a tóŋe ên mbá. ","Guŋ yɔk pɑ awɛ, wɔk pɑ pɔ dɔlɔ̌, pɑ vɔk pa' pɔ dɔlɔ̌ a; tə́ bi a po pɑ́ tə pɑ́ ŋkwishwə nə mu' nwə, bɑ Si gɔ kyɛ̀' wɔ nə nwə bɔ. ","Nɨ́m nùb dunácɨ gbɔ̧́ɔ̧ ɓe ə́ə́m ndè, nɨ́m dùná ɓe kúúŋ mɨ̀lə́m kíì, nùb kù kpáín nyínè noò ɨ́ dùcè bɨ́ lə́ə̀mndóŋnɨ jɨ̀r ji, Mèín ɓa nyí túùmnànɨ á. ",Yi boèñ ená seèe ce seèe yu bleebeèe aè buu Nyúè seèe túr njáèá mkwaè'shïì ca. Yuu mo' yi ka' ba aègho ce weèe ce kwaè'shi jáá baná Nyúè be naèshi yuu anaè neè weèe. ,"E bia ya biwon ya, eyë ntsogan nala. Ndò fë ngë miatsog mbol mfë, Zamba ayi fë mina dò kulan. ","Tèlèba te ndev kinè, man ta gra ma, sèi ngohurokoy arsa. Aman a sam ngiƋè kin hér skwi tsaƋ, a di Zhiklè a ngreda kinè. ","Lakwa neney tabiya ha me dzeley ’ar a lakwa haya hiya na hay na, tek a lakwa ma wuɗey ana na ŋga asləta. Haɗaw sa ma ndaw hay a dzalam gəle na, Bay ma Bəla ana aza a da ɓakwar vaw kava. ","Chaꞌtsondyo̱ jaa na laxmaaⁿya na canda̱a̱ꞌ cwilaꞌyuꞌya nꞌo̱o̱ⁿya matsonaꞌ na laaꞌtiꞌ cꞌoomꞌ nꞌo̱o̱ⁿya. Ndoꞌ xeⁿ waa cwiicheⁿ nnom na mꞌaaⁿꞌ nꞌomꞌyoꞌ cantyja ꞌnaaⁿꞌ ñꞌoomwaaꞌ, nntseijndo̱ꞌ Tyꞌo̱o̱tsꞌom nꞌomꞌyoꞌ cantyja ꞌnaaⁿꞌnaꞌ. ","Wɛ́ɛ́ yɔ wɛ ram a Kristu dɔgl du sɛw, yɛwɛ dag mɔkil wɛ gbun anbɔ. Yɛrɛ nɛ gin mɔkil za dɔɔm a hinza ha, Bɛt gi zunsin hinɔ gii hɛw. ","Mənam məs madaram adəv wənnəŋka, va ɗii gugiriɗ mənani, məsam səm də wəɗum nan məstaka vaska. Ko an ɗəf tay səmbokum məs dəsən wənan də tive temme, Maŋgəlva warban sukum wənnani. ","Yíbtò ya bəŋ nìilénənno Vannáb bàanu ri yò, sábsàŋ bənəní kə̧mà̧ tívɛ́. Yír də́ə sábtiro góŋ ní, Vannáb dàŋ pə́və́ mág vírdì. ","Bə́n kóólé, nɛ́b aa bə́n doòn Vɛnɛ́b Nwulú roó, báà kuùm kə̀ inselké luùm nə́ŋ̀ní. Zá dáà nɛ́b kam aí tə́ŋú, bə̀ sèl tə́ gɔ̀ŋ gə́, Vɛnɛ́b bàà dá ii nwɔŋ aarə kíìn nyɛ́'nàá. ","Nɵa ɗa, n ɓa mu ɗumu ɗai na gaini vi amai ta, aga mu ɗiyumu sini hiini hanɗa, na ɓa war wazagai zamai zamai ɗa, hiiniki a na kiini ɗa, Alaw aga a siŋkiki burini hanɗa. ","Que ce soient là nos sentiments, à nous tous qui sommes arrivés à l'âge d'homme; et si, sur quelque point, vous avez des pensées différentes, Dieu vous éclairera aussi là-dessus.","Let us therefore, as many as be perfect, be thus minded: and if in any thing ye be otherwise minded, God shall reveal even this unto you.","Kay na'ta nay sa pasiyakŋa, nay ma vara'a kay kayni, la varta vigi kay va mara'a ɓurawaya, Lawna ma ɗekgi caw van kayni goy ala nam ka nala. ","Bia bese, e ba be ne nya mvoʼé , e ntabaʼane ñhe nalé. A nge mfaʼa éziñ mia wulu aval afe wôna, e mfaʼa ôte fe, Zambe a ye faé mia éfufup. ","Ndra minaham le ar jiviɗ ngi Kristu gar na, sey ndurukum ti wuluk misi kahana. Yo da ar gwat mekelemeye, ki ra wulkam pal na, Buymisemuŋ a sa bunukum hiri naŋ ma. ","Sey en numa bana non to en limi ko'e men nder timmuɓe. Koo to woodi ko paamroton bee laawol feere, Allah laɓɓinanan on ɗum. ","Sey en numa bana non to en limi ko'e men nder timmuɓe. Koo to woodi ko paamroton bee laawol feere, Allah laɓɓinanan on ɗum. ","Ɛ́ɛ́ lɛŋ nɛ̀ mgbita tɛ mɔ ko Jesu Krist kaɗi, deemɔ k’ɛ́ɛ́ a̧ dúk kànà hegɔ. Ɓɛɛ k’ɛ̀nɛ̀ nɛ́ a̧ra̧ tɛ́ ŋma mɔ, Sɔ̧ tɛ́ usi mgbara mɔ‘i nɛ̀ sa̧a̧-a̧ h’ɛ́nɛ́. ","Ɛ́ɛ́ lɛŋ nɛ̀ mgbita tɛ mɔ ko Jesu Krist kaɗi, deemɔ k’ɛ́ɛ́ a̧ dúk kànà hegɔ. Ɓɛɛ k’ɛ̀nɛ̀ nɛ́ a̧ra̧ tɛ́ ŋma mɔ, Sɔ̧ tɛ́ usi mgbara mɔ‘i nɛ̀ sa̧a̧-a̧ h’ɛ́nɛ́. ","Ma gheɓəmə ka Kriste nyi kentsə ntsə ne, zəzə ɓəmə ghena nya kanya kwetɛŋe. Ma kenza kwete wəndə kazəzə tekeleke hwa gheyɛ ne, Shala nde tencɛ ŋayɛ zəzə ta ŋkɛ. ","Naa jar maga naa kol go diñ jar ma de ruggi ti faage Baa mo ti' no, naa mo hay de ëiggi sen mokay äil naa äuy. Hayga ëiggi äay joñ we sar sar ti fen po laybla' no, Baa naa ge nen äe mbe yañ go ne nday do maga aà nono. "
PHP.3.16,"Wɔ̀lɛ ɓì nɗɛli wu tì ti wu miì, tì ghɛ̀ɛ̀sɛɛ lɛ tì kɛ̀nkɛ̀n lɔŋ asu ǹɗaŋ.",A̧máa ba duu ví baa hi̧naa dágá yɛ nɔ kɔ́ ı̵́ kaa kɔ́ ví tíŋ́ yɛ wɔgɔ.,"Kən kpe ekpak-ekpak é rî, deê êt é jî ochî na ńgyímí nnyi e róghe etóbhóm ta é si égyé.","Da' gɑ́ pɑ nə pyap, a kwa' tsʉ' yə pɑ giŋ tə ŋkhəm nə a pɑ giŋ dé pɑ nə ta' məjyə́.",Nɨ́m mwi̧ nɨ́m gɨ̀sénáhácɨ̀ péín nɨ́m du gɨ̀sénɨ rè.,Yi ba ená seèe ku ce jár seè'ni ba njep mkuèu ce seèe ce jáèshi njo na. ,"E hom osë bikë ya kui, nkaṅan ai nala osu.","Te skwi man nga ngots ma, ngogsokoy va a vna! ","Ekəɗey kasl ka slam a neney, lakwa ma husakwama kasl kava ta fəɗa ha na na, nakwa na, 'ar a slam ana asləta. ","Sa̱a̱ ñꞌoom na mayuuꞌcheⁿ, macaⁿnaꞌ na tjoomꞌ cꞌo̱o̱ⁿya cantyja ꞌnaaⁿ ñꞌoom na jnda̱ toꞌño̱o̱ⁿya.","An ginɛ ri, yɛwɛ fɔ gbɔnɔ yɔ wɛ fɔk nɛ gi tuur nɛɛk lɛlgbunu. ",Say məsok səm zəmə də wəsban tive an məs məsban laŋka ha gap dəpaŋka.,"Mú ya kə̧ ní gá pɛ́m, bəŋ dùu dùgnəmà̧ bàanu ya bəŋ dùunəŋ ní yò.","Kóó leè, báà diìn ɛɛ̀m dáànmbə̀ númú, kə̀ bagǹmbə̀ zɔ̀ŋ aa bə́n də́'ǹ gbə̀' bə, yaà wə́ə́ bə́ŋyée zé roó.","A suwa paŋ ɓa, hlai na mu cumusi woni na ta ɗa, aga mu hulumu warɗi futi na ɗa ɵa bas.","Seulement, du point où nous sommes arrivés, marchons comme nous l'avons déjà fait jusqu'ici.","Nevertheless, whereto we have already attained, let us walk by the same rule, let us mind the same thing.","May va kep kayn ala, liyn ma nay coy hayn lakŋi, nay ma tuɗ vokay kuɗ tuway kep.","E nté bia yange vôme bi kuiya nyô, e ñwulaʼane zene jia. ","Wurenna na, akum tir jiviɗ misi purla si, jiviɗ ndra misi anga hã dana na. ","Bee non fuu, nde nii en njottake darnde nde'e, njahden fodde darnde man hawtaade.","Bee non fuu, nde nii en njottake darnde nde'e, njahden fodde darnde man hawtaade.","Fara n’ɛ̀ɛ̀ hɔɔ sɛnɛ‘i, ɛ̀ɛ̀ bá kana nɛ́ kpɔk war'i nɛnɛ.","Fara n’ɛ̀ɛ̀ hɔɔ sɛnɛ‘i, ɛ̀ɛ̀ bá kana nɛ́ kpɔk war'i nɛnɛ.","Ya tsema tsemanyɛ ŋkɛ ne, ntsə ɓəmə geva kajive mbe kema kazele hweŋkwa nya zelete gheɓəmə pa tsetsenya.","Ane, ti ngeel maga naa day go ni ga jag naa le' go ti sen mono, naa hoo wee äaale naa boñ ma seege."
PHP.3.17,"Ɓɔɔsoŋ̀, nɔ̀ɔ̀tiina mɛ̀kòò mɛm̀, ɓì seesèè ɓɛ̀roɓɛ ɓɛɛ̀ nɔ̀ɔnɔɔ̀tì kìfèèghrɛnà kis. ","Dan kirtȩ́n vu̵, i duu hȩn kɔ́lı̵́ Yesu woo kɔ́ ı̵́ káń duu yɛ wɔgɔ á̧ḿ. I 'yɛ́ nɔ́ɔ́ víí nán ku̵u̵ duu hȩn kɔ́lı̵́ vóó yɛ voolı̵́. ","Atem-abhon-í-nnyen, deê o gyebhá ên ekpin ejámé noŋ ane etat. É toŋe ên noŋ egaé ekpak erû nji o kí top ên. Kî ên mân amə̂t o gyebhá ên ane mba á yíma noŋ e tóŋe ên.  ","Guŋ yɔ awɛ mfɑmfɑ́, po fo' a, po pɑ nthʉ́ mnyə mɔ pɑ nə pɔ pyə́ wap giŋ pɑ́ nə fo' yə pǒ jɔ bi pyə a. ","Mwin yàá bɨ ə́mní, tunáam guur gùrí moò. Nɨ́m natɨ́ túúm, góomnáam nùb du ndɨ̀ŋnɨ u̧nèé, nyí a ndɨ̀ŋɓwê u̧. ","Bfúr waê, weèe wááwá ce be'ni ba yuu ce m ce geèe. Weèr aè duèñshi ndeâe mboèñmboñ. Weèe be'ni yuu ce beèe ce a beè'ni yeèr ndeèe anaè, a ce geèe. ","Vuan ma, a babëdzaṅ, mifòmbògò fë e ba ya banyiṅ anë mingayen mvulna abë bia. ","Vagu lèmèlèmè ara ga, dalahimam ga, vapu di a tenga'a man ta gi arsa! Valèmda va kinè a nga! ","Tobiya kwar aha na, tsam dey ka yah malam a ɗaw hay, pam dey na ka ndaw andza ma kam tek, andza na kuray ma ndzafəmaɓa ka la na hay. ","ꞌO nnꞌaⁿya na cwilaꞌyuꞌyoꞌ, calaꞌljeiiꞌndyoꞌ chaꞌxjeⁿ na matsꞌaa. Ndoꞌ mati queⁿꞌyoꞌ cwenta cwaaⁿ ncꞌiaaꞌyoꞌ na cwilaꞌljeiiꞌndye chaꞌxjeⁿ na cwilꞌaayâ, caluiiꞌndyoꞌ joona. ","Gokin woos mi, yɛ̧ɛ̧dɛ mi wɛ, wɛɛ sɔ̧ɔ̧n dood wɔ hi waak an mii yɔ mi waak mi gisin gbɔnɔ dorko. ","Milmiŋgiɗwa, məsbawa, mula wədaw nam azokum va zəga narban sukum wənna, məzi horokum azet ɗii məzu dawaŋ vaska. ","Dàavɛ, və́ mág dùubà míi, və́ tə̀ də́g dùubà yíbtò ya kə̧ dùuŋ kə̧sàŋ bə́ní ní. ","Ɔ̀dkudvɛɛ̀l mə́ í'sɛ̀lbə̀ bərá, íí kóólé, ìì kùm kìínmbə̀ nɛɛ̀n aa mə́ kùm dú rə kíin, bít ìì ɛ̀g núù, nɛ́b aa bə̀ tə́ kuùm kə̀ obə́ kíin də ba. ","Tawalakai, ki tiki aza, ki mili arki siɗi nagai na payaiɗi a na maini na ki tiliŋ siyi tiyi par nɵa ɗa. ","Vous aussi, frères, soyez mes imitateurs, et ayez les yeux sur ceux qui marchent suivant le modèle que vous avez en nous.","Brethren, be followers together of me, and mark them which walk so as ye have us for an example.","Ɓosiyonna, sligi kuɗanu; cukgi irgi kay sa poy ki numa ɗekgi hay poyta vuma nala. ","Mia bese, nsamba wua, a bobejañ, vuane ma a fombaʼane ba ba wulu ane éveʼela mi bili mfaʼa wongan é né. ","Sukum ɗuwoy, kum jom gar kumo, sipaka sar ɗu. I bugukum gwat ngi gi le. Na so na, ɗuvaka hiri kumo taˀ ar mizli masipaka sar ndra na. ","Mbaɗe ko mi waɗata, onon deerɗam'en, cute tokkiiɓe misaaluwol ngol keɓɗon haa amin . ","Mbaɗe ko mi waɗata, onon deerɗam'en, cute tokkiiɓe misaaluwol ngol keɓɗon haa amin . ","O nya'm, ɛ́nɛ́ lɛŋ, ɛ̀nɛ̀ zɔ́k ɗoŋ deemɔ kɔ‘m, ɓɛɛ ɛ̀nɛ̀ zɔ́k ɗoŋ deemɔ ko o bíí nɛ̀ de mɔ nyɛm nɛ ɗoŋ deemɔ k’ɛ́ɛ́ mbɛt.  ","O nya'm, ɛ́nɛ́ lɛŋ, ɛ̀nɛ̀ zɔ́k ɗoŋ deemɔ kɔ‘m, ɓɛɛ ɛ̀nɛ̀ zɔ́k ɗoŋ deemɔ ko o bíí nɛ̀ de mɔ nyɛm nɛ ɗoŋ deemɔ k’ɛ́ɛ́ mbɛt.  ","Ka kesaka ma, mene mə kala nya mene 'ya. Nahe n'yɛ kencɛte ŋayɛ wəsə keyipə pa. Tagha gɛ, vate mə ntsə ta ŋayɛ te mbeli nyi kedzeghwa kala wəsə keyipə pa shɛ. ","Nday heçeçre äi no, joñ wee see äay do ndi nono, ko wee see jar maga see wo doga nday kon see wuur no mono. "
PHP.3.18,"Maà kakàlì mìni lɛ kìgwey ki ɓum ki ri wɔɔ ki ɓìsyɔ̀ɔ̀ ɓyaa ɓyɛɛ̀ rèrèsi lɛ ɓɛri ɓumɓɛ ɓɛ ɓeèzɛɛ kɔrɔs à Kiris, m̀ɓììtii mìni kìkalii ɓiɓan ɓiǹ ɓigomìnɛ rì mìsì ɓi mɛ̀tam. ","Mí baa o̧d ví, mí duu faa o̧d ví, kan ká̧ń ya̧gá̧ yɔ. Nán tóó vu̵ ɓu̵u̵lı̵́ na'a, vu̵ máń nɔm Yesu woo la' vbagadı̵́ yȩ ó̧. ","Echî aŋ? Ń səre ên ofú ábhi ntə̂m etî-etî, kən n kí kpo səre ên mfá-mfá, amə̂t ayép-ayép. Ane á rî etî-etî mba á bhó yubhi Jisos Krayis na ekʉ̂ nji a kpóe ka ego. ","Ŋ də bɑ sǐŋ wɔ biŋ ŋkwi' bɑwə dɑ́ shyətsə siŋ wɔ, bo'gwyə pɔ giŋ pɑ́ pa' mghɛ bo bɛnyəpɛnyə Kristo a. ","Mɨ ya tanacií nyí, á mɨ du nyí ɓààcùnànɨ ɓe yînɨ́m sumí rè, nùb kù ví̧i̧ á bɨ́ pə́wààmkɨ́nɨ cwá Yésùù ya kú bɨ̧̀ɨ̧́. ","Máè suñ weèe nfeè' aèñgoo, a ker ce suñ weèe seè'ni neè mñgoommir-ñwáè máná beèe magoèr a yu a weâe mú ce yaèp ndeèe ce duèñshi ená woweèe a baèa rkwe ce Jisos Kraâis aè m kwe mbe kïìntaa naè. ","Amu abui bod banyiṅ hala -mazuzu ya makad mina adzo daban, etoa dzi makad mina dò mëyono- bënë minziziṅ mi klos Kristus, ",Aman ta kumba ta ga a mayamhi wof ngézlèl Kristi. AgéƋ tenga'a i gaƌa kinè sak kumba ma; aman anai i gaƋa kinè a kuƋa a dai.,"Akwa na, ndaw hay haɗadzidzay ɓa i ka tsakwar ba zarra, i madakwar sa, ekəɗey na, ta ma tuway aha, da mendzey ta na, dugwan ahiya ta tuwaw ma gazləla na ma Kriste. ","Jndye ndiiꞌ jnda̱ ñetsjo̱o̱ya nda̱a̱ꞌyoꞌ, ndoꞌ ñequio na matꞌio̱o̱ya matsjo̱o̱nndaꞌa, jndye nnꞌaⁿ mꞌaⁿ na jndoo ñꞌoom cantyja ꞌnaaⁿꞌ na tueꞌ Cristo nacjooꞌ tsꞌoomꞌnaaⁿ, ","Dood kittɔnɔ hi ɛmbik an Kristu dɔ̧ɔ̧rɔ lɔlhɛ̧ɛ̧nikyaadɛyɔ. Mi raasin dɔglya̧ dɔɔ kittɔnɔ, yɛrɛ ɓɔryɔ mi gisin dɔglya̧ gii raak ɓɛ hi mɛɛk lɔl du: oon zul nɛ hi hiya.","Nənah sukumək wənnet səkay təl diiɗa. Ndəni nədawnah sukum əmpa kakaŋka də sin arawa, net wənnet pak va maseŋgiɗ wəmta na Krestu wəŋ aka məzliwrihe. ","Ɛntò ai ŋdòn tallè pə́və́ró, ŋdòntiŋ pə́və́ sáŋ vəŋ nórmom: Və́ gàaro yír gùurɛ̀, və kə̧ŋ kə̧sàŋ vəní mú Kiristu fanɛ̀, yír ya vò lab tágdì ríi. ","Màìgə́ mə́ bàà ii kúnú, bít mə́ tə́ ii bídǹ baàn sɔ̀ŋ kə̀ kpə̀ə́ǹá' nɛ́b bəd zùúm, bə̀ í' Krístù val aa kò'ù téélɛŋké bərə, nwɔŋ oò bə̀ kiìnmbə̀ sé. ","Buri viya e ɗa piyi maiɗi gawni dagrani Kristu nɵa, mu miɗiki hanɗa azi viya, amma mu muɗa hanɗa tiyana na ɗa gaini tuwi, ","Car il en est plusieurs qui marchent en ennemis de la croix du Christ: je vous en ai souvent parlé, et j'en parle maintenant encore avec larmes.","(For many walk, of whom I have told you often, and now tell you even weeping, that they are the enemies of the cross of Christ:","Sum sara ŋolo sa poy hay gawta tam gu-ma-grakŋa vi Kristu; nan digi kisi jewe, wulin lo nan digi hiɗi zimiyna: ","E ne été na, bôt abui, ane me mbe me jôʼô mia de biyoñ biyoñ, a ma beta baʼalane mia de éyoñe ji a miliʼi mise na, ba wulu dulu besiñe Krôa Krist. ","Asi mike na, mizli ada haɗa magam gwat kaɓa taŋ i mesene ngi dum mizlira ngi Kristu. Yi ɓukum di le is mbeˀbeˀ, yo wurenna, i ra mahiri naŋ ava ti tuwuy kolkol. ","Ko mbi'mi on nde ɗuuɗɗum, jonta mbi'anmi ɗum bee gonɗi: Ɗuuɗɓe laatake konne'en gaafaaŋgal Almasiihu, yahdu maɓɓe ɗon hona ngal. ","Ko mbi'mi on nde ɗuuɗɗum, jonta mbi'anmi ɗum bee gonɗi: Ɗuuɗɓe laatake konne'en gaafaaŋgal Almasiihu, yahdu maɓɓe ɗon hona ngal. ","Wen dɔ̧ɔ̧-dɔ̧ɔ̧ mi tɔ̧ɔ̧ so h’ɛ́nɛ́‘e deemɔ ko o dɔka bíí usi'e wa nɛ́ o wi-sɛn-te-diŋa ko Krist, ɓɛɛ kinii mi tɔ̧ wen'i h’ɛ́nɛ́ woyo nɛ̀ mi̧i̧kɔ̧a̧ yí‘m mbɛt. ","Wen dɔ̧ɔ̧-dɔ̧ɔ̧ mi tɔ̧ɔ̧ so h’ɛ́nɛ́‘e deemɔ ko o dɔka bíí usi'e wa nɛ́ o wi-sɛn-te-diŋa ko Krist, ɓɛɛ kinii mi tɔ̧ wen'i h’ɛ́nɛ́ woyo nɛ̀ mi̧i̧kɔ̧a̧ yí‘m mbɛt. ","Nahe 'ya kegezete ŋayɛ kaghate, gheŋkɛa shɛ yageze ŋayɛ 'ya tsetsenya le nehwene kwa ntsə: ma nza ta kweci mbeli kwele kwele ne, kaka ghema ta sheghwə kwa slekwa ta Kriste hɛ. ","Jar yañ wo debañ joñre baara de caa hee de waçaçre huli maga Kris hu go ti koo ma äal jarn mono. Ndi hay sii ree jar se kay wo we go wee äaale pur debañ, patala ndi de siigi äe wo wee de mberbe nen kliw kliw so. "
PHP.3.19,"Rìsyɔn ɗyaa ɗi ri lɛ, ɓɛ ri ɓiì ɗyaŋì; ɗùm ɗyaa ɗyɛɛ rì ɓɔ bɛ̀ll yàà, com ki kɛɛ̀ sòosoòtì ɓɔ kɛɛ̀ki ɓɛ foŋi rìkem ɗyaa miì; lɔŋ ɓìɓan ɓi ɓi ziinɛ ɓyɛɛ̀ɓi ɓɔɔ̀ fèfèg. ","Tayɨɨ wú̵ń tud vu̵, moo vu̵ taa voo də́ń hȩn lálı̵́ voo yȩ nɔ. Hȩn fó̧ó̧ dəmné voo wu̵ hȩn sȩ́ḿ vu̵ yu̵. Vu̵ taa voo də́ń hȩn hágá yɛ vu̵ yu̵. ","Ane ntʉ́ghi mbá, emana-nchot ábho a ri Obhasi nâ a kí bhibhi ábho. Nji ábho á yubhi á chîŋ ochíŋ a ri efaŋ í ngun. Á kí ko ejûm ísonê á yimá nkat. Á ká fon íkíkéré á kpê na ejûm etat é chíŋí iyîm í ngun. ",Wap gɔ sɔ' miŋ m nə pi; si yap bɑ vam tsap; ba yap ghu'tə pɑ kuso yap; nə pa' wap sɛ yap nwə a pɑ́ pɑ́ nwə dəmcǎ' a. ,"Ŋgáb gain bɨ lɨ́lɔ̧́ á, ɓetí mèín ŋgábè du nɨ ɓwɨi ŋgábè á, ŋgáb á óknɨ mɨ̀tù ɓe nɨ́m tɨ du ɗúnɨ nà ŋgáb sə̀réé, ŋgáb lə́əmháce bɨ́ nɨ́ɨ́b ɗɔ̀bɨ́nné. ","Woweèe a be kwe, bú njobeè' woweèe a koèñ buu ce aè nyoèr a caa Nyúè. A loèr yuu ce rïìtu yi ba koo woweèe aètu mo a beesi aè yuu naèatu, a lá yap ntee wááwá ba njep buu embe tunshe. ","a mëmana, bayi dzaṅ, Zamba waban anë abum daban, bëbëlë duma a osama waban, mbò batsog hë mam më si. ","Ndikèma tenga'a, sam ngéƌèsh ta. Zhiklè tenga'a, hwaƋ ta. N'njèl tenga'a, hori ta, ta hér skwi herkeda. ","Ma da ndəvey ta na na, mezəɗey, 'ərlam ata na na, hwaɗ ata na, me wezley dey ta na ma pa ha na, da hwaray ta na, taya ma ta da mevel ata na, tek ma dala ɗey hay. ","sa̱a̱ na macanda̱ maxjeⁿ nntsuundyena. Ñequiiꞌcheⁿ cwilaꞌtꞌmaaⁿꞌndyena juu na lꞌue nꞌom seiina. Matsonaꞌ na cꞌomna na jnaaⁿna cantyja ꞌnaaⁿꞌnaꞌ sa̱a̱ juu na matsonaꞌ na cꞌomna na jnaaⁿna, cwitjeiiꞌsꞌandyena cantyja ꞌnaaⁿꞌnaꞌ. ","Lɔɔsumya̧ lɛl gɛ laa bɔ. Buuya̧ gii gi bɛtya̧. Seemya̧ giigi gbɔlumsya̧, hi mɔkig hinwɔ waal du gii kpɔd. ","Wəgrak na wənnet pak say də wəzzan ziti, gədəfti maŋgəlva neti zəga na willi azet ka gakdak neti. Wəɗum net say aka zəga nanziya egge kaaka'ə. ","Və ní gá sóo làro ní, və dàŋ dórì vee ri, bə́l vəní kə̧ pə́vərì Vannábò, və kóŋ sɛ́g ɛntò, ammá̧ və ləgənənì, və sáb dùggəŋ ɛntò ya kúsà̧a̧r di lói vɛ. ","Nùù bə̀ tə́ ɛɛ̀m zɔ̀ŋ aa bə̀ dá gɔ̀ŋsə́ boò bɔ̀'ǹ bə laarú rə ba. Kàandə, in aa tɛ́m vaksə́ boò í' rə, kùmsə̀n vɛnɛ́b boò ra. Bə̀ tə́ tɛ́m yádǹ in aa dáà dá bə̀ sə́ə́mnúù daàn də ba, bít tɛ́m boò ləə tə́ in zɔ̀ŋə yɛ́b bə bə̀ ba. ","dibi na wiiɗi ɗa a bi n’edi, alaw na wiiɗi ɗa a warɗi, kol na wiiɗi ɗa aŋ war wala n’a tikiɗi siyer na wiiɗi, e hiini ɗa sai midini wazagai na warɗi yai. ","Leur fin, c'est la perdition, eux qui font leur Dieu de leur ventre, et mettent leur gloire dans ce qui fait leur honte, n'ayant de goût que pour les choses de la terre.","Whose end is destruction, whose god is their belly, and whose glory is in their shame, who mind earthly things.)","Dabaŋgu'ta visiya ti ba-goyta; lawayna visiya kayni mi haysiya, nisi vul suburta mi va ma mar zulo kisiya; nisi varam mi slena vi nagata. ","Asuʼulane dap e ne njañan. E zambe wop a ne mebume map, a ba futi duma dap ôsone viap été, mbe bete minleme miap mi luu ve mame ya si nyô. ","Kiɗa mi nga taŋ, i zizi. Asi bumbulvuŋ nga taŋ, i kwacay taŋ. A jijaham nga taŋ asi gwat ngi pi mesem. A wulkam a mevel taŋ, i gwat ngi ruwuy aka tewle. ",Ragare maɓɓe ɗum halkere. Deeɗi maɓɓe laati ɗowanteeɗo maɓɓe. Ɓe ɗon mantoro kuuɗe maɓɓe cemtiniiɗe. Ɓe ɗon cuklano kuuje duniyaaru tan. ,Ragare maɓɓe ɗum halkere. Deeɗi maɓɓe laati ɗowanteeɗo maɓɓe. Ɓe ɗon mantoro kuuɗe maɓɓe cemtiniiɗe. Ɓe ɗon cuklano kuuje duniyaaru tan. ,"Sɔŋkur mɔ kɔ-wa nɛ́ yɔa-a; sɔ̧ kɔ-wa nɛ́ zaŋ-wa, ɓɛɛ mɔ nɛ̀ tɛ̀ɛ́ pi̧ so foe zu wa'i a̧ wa zɔn tɛ-wa sɛnɛ, e nɛ̀ see-wa tɛ́ mɔɔ-nù ɓɛɛ. ","Sɔŋkur mɔ kɔ-wa nɛ́ yɔa-a; sɔ̧ kɔ-wa nɛ́ zaŋ-wa, ɓɛɛ mɔ nɛ̀ tɛ̀ɛ́ pi̧ so foe zu wa'i a̧ wa zɔn tɛ-wa sɛnɛ, e nɛ̀ see-wa tɛ́ mɔɔ-nù ɓɛɛ. ","Ma kwa keɗaŋe ta slene ta mbeli nyi kala nyighɛ ne, zamte ghəa nci yatekemave hɛ. Kwa nza ŋkɛ hwəa nci ya kashala ta nci, kahawe hɛ va mene wəsə nya kepəli nda hawe ke hɛ we, fare fare ghəa nci yitea mene wəshi nyi teke te hɛɗi. ","Tawge ti äaara diñ ga aà bas ge wo go. Baa äaaran go diñ äil äaara tu. AÀ kee wo see äaara ti feçeçre maga a wo de soçoçre ne hara ti mono, day saara de kañ ëiggi äaara diñ ti feçeçre ma ti tamsir wo la. "
