livre.chapitre.verset,Bafia,Dii,Ejagham,Ghomala,Vute,Limbum,MKPAMAN_AMVOE_Ewondo,Mofa,Mofu_Gudur,Ngiemboon,Doyayo,Guidar,Peere_Nt&Psalms,Samba_Leko,Du_na_sdik_na_wiini_Alaw,Francais,Anglais,BIBALDA_TA_PELDETTA,Bulu,Guiziga,Fulfulde_Adamaoua,Fulfulde_DC,KALATA_KO_SC_Gbaya,KALATA_KO_DC_Gbaya,Kapsiki_DC,Tupurri
PHP.1.1,"Ɓìsi ɓɛ̀kìì-ɓìsay ɓɛ Yeesus Kiris lɛ rì Pol, rì Timote, tì kàni ɓum ɓɛ Bɛ̀ll ɓɛ̀ ɓi Yeesus Kiris ɓɛ̀cèm ɓɛ ɓi bàn ì Filiɓ, rì ɓɛ̀kɛ̀ɛ̀sì ɓaa rì ɓɛ̀dyaakìrɛ̀. ","Vɔ́ yu̵, Pól kan Timɔtée, nán ba'ad Yesu Krístu woo vu̵ yu̵. Vóo ba'ad nán Tayɨɨ woo ví kíí dɨ kaa Filíbbí, kíí duu Yesu Krístu yȩ víw ɗerwəl yɛ nɔ, kan  ı̵́  nii sú̵ggı̵́ vu̵, kan  diyáakərə  vu̵ á̧ḿ. ","Nwet nnyí a dʉ mbâ êt, Pol na Timoti, ane-etûm í Jisos Krayis. E séŋe e tûm mbâ chénchén ane Obhasi ka Firipi mba o chəmê ên na Jisos Krayis. E séŋe e tûm fə́ne ane-echî echəme atóbhá Jisos na ane mba á nyáŋa ábho.  ","Myə Polo pyə Timotio, mkwɔ Yeso Kristo, bi guŋ pɔ dɔlɔ̌ awɛ nə Yeso Kristo pyə wap Filipo a, bi pɑ lé wap pu a mghɛ fa' pap: ","Mɨ Pôl, nɨ́me Tìmòtê, nɨ́m nùb du nɨ̀kɨ̧́ɨ̧ Yésù Krístùù. Nɨ́m tɨnna nùb Mèèín du dùnɨ Fìlíìb á, ŋgáb nùb du ɓaín ɓe Yésù Krístùù. Nɨ́m tɨnna nùb ge mɨ̀kwìn nùb ə́mní Fìlíìb kwe á, ɓe nùb ə́ré dúú Mèèín ɓwê. ","Ñwaè' ca ce sañ máâ Pol weèr Timotïì ce weèr yu ñgaâa mfaè' neè Jisos Kraêis. Weèr ce sañ neè weèe ce weèe yu beèe Nyúè aè rla' Fileèpaêi, ce weèe aè tarshi weèe Jisos Kraâis weèe, a ker ce sañ neè wee btu embe coêr, ker ba bdikïìn. ","Paulus ai Timoteus, bësye bë Kristus Yesus, biatil mimfufub misë minë abë Kristus a Filipi, ai bëtëbë bë osu ai bëbò bë esye, ","Paul a Timothée, ɓèlèlihi Kristi Yèsu, a sam ndohi Zhiklè tèlèba man ta kezla a nzlembaƌ Kristi Yèsu tèlèba, te kokwar Philippes; a sam ndohi mɓer mizlinè Zhiklè a ndohi ntakaha ta ba. ","La, Pol ta Timotey, gawla ma Yezu Kriste hay, la windəmatar a ndaw kokwaɗ ana hay tabiyaha da Yezu Kriste, a bay ’ar ata na ma kəlatar ke mey ana ta diyakre ta hay, na taya tabiyaha da Filipi ana. ","Maja Pablo ñequio Timoteo cwiluiindyô̱ nnꞌaⁿ na cwindyeꞌntjomtyeⁿ nnom Jesucristo, cwilaljeiiyâ cartawaañe, cwilacwano̱o̱ⁿyâ juunaꞌ na mꞌaⁿꞌ ꞌo na cwilaꞌyuꞌyoꞌ tsjoom Filipos na cwilaꞌjomndyoꞌ ñꞌeⁿ Cristo Jesús, ñequiondyoꞌ ꞌo na cwijndoꞌyoꞌ tsꞌiaaⁿ ꞌnaaⁿꞌ Tyꞌo̱o̱tsꞌom ñequio ꞌo na cwindyeꞌntjomꞌyoꞌ nda̱a̱ tmaaⁿꞌ nnꞌaⁿ na macwjiꞌ Tyꞌo̱o̱tsꞌom cwentaaⁿꞌaⁿ. ","Mii Pol , hi Timɔte, wii bi̧i̧ ɗɛɛrwol yɛrɛ. Wi gi Yeesu Kristu woosyaadɛ ɔ̧ɔ̧nɛ. Wii gi yaasig Bɛt doodɔ, Yeesu Kristu ɗɔbsigya wɔ hi gi a Filipi sɛw, hi Bɛt wooszulyaya̧ hi woosɗaakyaya̧ wɔ. ","Letərəŋka, səza Pol də Timote ade, belemɗe na Zezu Krestu, azet ɗii na Maŋgəlva a Filipi mes de tafnen Zezu Krestu pakə, dit mezuteɗeŋɗe dit ɗii gugiriɗ net kretiyenɗe.","Pol vəŋ Timotei, Yeesu Kiristu tonóm yírtò, bə́ dì̧i̧nà pú Vannáb yírtò ya Filipi ríi, yíb ya kə̧ŋ Yeesu Kiristu na̧a̧ ríi. Bə́ mùubvə́ro vəŋ yír yúlnábtò, vəŋ yíbtò ya tò̧ŋ pu Vannáb yírtò ní pɛ́m. ","Núúboòraa vúgà Pol naú, kə̀ Timote naú, nɛ́b Yéésù Krístù tù' bə̀ ma'ǹ bərá. Núúboòd aarə, bád bə́ pii Vɛnɛ́b nɛ́b  * gìdń bəraa bə̀ kùm Filipiya bìlə́ rə gə́ kóólé, aa bəraa bə̀ tə́ Yéésù Krístù bagǹ doó, nɛ́b yíl bə̀ bəraa  * Eklisiya bəd tə́ŋə́ roó, bít kə̀ diakre bəd tá. ","Paulus gaini Timotewus, ɗai zi sda na wiini Kristu Yesu, siɗi nagai n’e ɗa sɗik war Kristu Yesu war Filipi, siɗi abakaiɗi gaiɗi zi zinai na wiiɗi lai. ","Paul et Timothée, serviteurs du Christ Jésus, à tous les saints dans le Christ Jésus qui sont à Philippes, aux évêques et aux diacres:","Paul and Timothy, the servants of Jesus Christ, to all the saints in Christ Jesus which are at Philippi, with the bishops and deacons:","Paulus hiɗi Timotewus, sa sunda vi Kristu Yesu, tam sa peldetna kaf sa hay Kristu Yesu, sa ka hay Filipi, tam sa ŋomda hiɗi sa sunda: ","Ma Paul a Timôté bi too, ma tili mimfufube mise mi ne be Krist mi too e Filip, ô laté a betebʼôsu a bediakone bap. ","I ya Pol ati Timote, gawla ngi Yesu Kristuhoy matohoko ɗerewol hana, da kum mizli ngi Buymisemuŋhoy gar, misi a hurwuy Filip, ar kum mujom ati Yesu Kristu, da mizli madiɗa ngi Cikil ngi misikrisktuhoy waɗ da mijini mitiɓihey.","Min Pol e Timote, maccuɓe Yeesu Almasiihu, min ɗon mbinndana on, onon senaaɓe Yeesu Almasiihu wonɓe haa Filippi fuu e ardiiɓe e wallooɓe jama'aare nuɗɗinɓe :","Min Pol e Timote, maccuɓe Yeesu Almasiihu, min ɗon mbinndana on, onon senaaɓe Yeesu Almasiihu wonɓe haa Filippi fuu e ardiiɓe e wallooɓe jama'aare nuɗɗinɓe :","Nɛ́ mi Paul in Timotee, o wi-de-tom ko Jesu Krist a̧ tom kalata’ɛ ha̧ o sa̧a̧-bíí lɛŋ nɛ̀ ɗoŋ Jesu Krist, ha̧ o gasa wi-duk-zu zuduk bíí ko Krist in o wi-gbak-wi nɛ̀ ya sɛn Filipii.  ","Nɛ́ mi Paul in Timotee, o wi-de-tom ko Jesu Krist a̧ tom kalata’ɛ ha̧ o sa̧a̧-bíí lɛŋ nɛ̀ ɗoŋ Jesu Krist, ha̧ o gasa wi-duk-zu zuduk bíí ko Krist in o wi-gbak-wi nɛ̀ ya sɛn Filipii.  ","Se va yɛ Pol le Timotɛ, ka mene slene ta Yɛsə Kriste. Ke pɛtɛa mbelia Shala nyi mbe Filipe, gheyɛ nyi jikə mbe Yɛsə Kriste, mbeli nyi te ghəa Jikə ta ka Kriste ba'a ke ka kemane ŋkwa. ","Ndi Pole, wuur dege Timote, wuur weere joçoçre Yeso Krisi, wuur wo de yer waçaçre sen wo mokay ne jar ma ti jag Baa maga wo de haç äil äaara ne Yeso Kris wo äi leege Filip mono, ne jar kluuri ma gor ti äaaran wo de diyakren wo äuy. "
PHP.1.2,"Bɛ̀ll à Seŋi wìs rì Kan Yeesus Kiris ɓɛɛ fa mìni lɛ rì geesɛ̀n, rì fyòoog.","Ba' baa ví Tayɨɨ kan ı̵́ 'yɛ́lı̵́ Yesu Krístu u̵u̵ kɔ́d ví zó̧ó̧ nán, u̵u̵ 'yɛ́ ví i mbaa ká̧'a̧dɨ.","Deê Obhasi Ńsé owəré na Ńtâ Jisos Krayis á tóŋé ên onobhá-eji, á káre ên fə́ne enare.",A gho' ba hwitə̀ pɑ bi po shyə m̀ nə Si Tá yɔk pɑ̀ ba m̀ nə Cyəpɔ Yeso Kristo.,"Nɨ́m yóóŋ Tá nɨ́mè Mèín ɓe Yésù Krístù nò du Kéké nɨ́mè, ŋgáb nà nyí faám, ŋgáb a nà nyí ju ɗóóŋ.","Weèr ce loo werná Nyúè ce e yu yïìseèe Ta ker ba Tata Jisos Kraêis, túr weèe aè ntee boèñboñ, ker fa weèe cumúnyañ.",maa ai mvoè a biasò abë Zamba esya ai Nti Yesus Kristus bibòò ai mina.,"Pombai a gumai da zhè a nda kinè, te Zhiklè, Bab nga, te Bai Yèsu Kristi!","Hayna hahaya ta zozoy ma Bay ma Bəla Baba lakwa, ta Bay’ərlam Yezu Kriste ka ndzey ta kuray.",Nquii Tsotya̱a̱ya Tyꞌo̱o̱tsꞌom ñequio Ta Jesucristo quiana na canda̱a̱ꞌya nntoꞌñoomꞌyoꞌ naya na laꞌxmaⁿna ñequio juu na tjaa ñomtiuu cꞌoom tsꞌaⁿ jo nda̱a̱na.,An Baa wɛ Bɛto hi Waar wɛ Yeesu Kristu hi gaanɛ gɛmsili hi boolumi!,"Maŋgəlva Affəmə də Zezu Krestu Ɗəfdaya namə: dəpsukum mbəlembəle nani, de zam.","Vannáb Bàa bənəní vəŋ Gɛ̀nbògə̀r Yeesu Kiristu úr pə́və́bà puur vəní, və à̧a̧ pə́və́bà kà̧a̧bò.","Mə́ nyɛ̀m Báá bə́n Vɛnɛ́b bít kə̀ Báátììkpɛ̀ŋ Yéésù Krístù tá, boò mà' ii pə̀dkèá, bít boò pii ii tɛbàá.",Alaw apumu gaini Epiɗ-ɗaimu Yesu Kristu e siki yim gaini ɵeɗ.,grâce et paix de la part de Dieu notre Père et du Seigneur Jésus-Christ!,"Grace be unto you, and peace, from God our Father, and from the Lord Jesus Christ.",Lawna buya hiɗi bum Bum-Sumuna Yesu Kristu vulgi slugota hiɗi toyta tage.,"Mvam a mvoʼé bi boʼo e be mia, bi soʼo e be Zambe Esaa wongan a e be Nti Yésus Krist.","Anja Cine ndra Buymisemuŋ ati Buy ndra Yesu Kristu a gukum mezle, a vulukum zuy.","Allah, Baabiraawo men e Jawmiraawo Yeesu Almasiihu ndokka on mo'ere e salaaman.","Allah, Baabiraawo men e Jawmiraawo Yeesu Almasiihu ndokka on mo'ere e salaaman.",Deemɔ nɛ̀ ta-tɛ in ga̧a̧mɔ ko Sɔ̧ Dáà k’ɛ́ɛ́ in ko Gasa Wan Jesu Krist à̧ dúk in'nɛ̀ɛ́.,Deemɔ nɛ̀ ta-tɛ in ga̧a̧mɔ ko Sɔ̧ Dáà k’ɛ́ɛ́ in ko Gasa Wan Jesu Krist à̧ dúk in'nɛ̀ɛ́.,Pa Shala Yita ba'a Nde sleke ŋkwa Yɛsə Kriste ndeke ŋayɛ zlaɓa ta ŋkɛ ba'a kwelɛŋea ŋkɛ.,"Daga Baa Pan naan wo de Yeso Kris Wañkluu mo woo wo wee, mo haç wo jam wee lay."
PHP.1.3,"Cààmɛ̀n kìcèm ki ǹ-yitii mìni, ǹti falàg Bɛ̀ll wɛ̀m ɓìtògsɛ̀n. ","Bá' 'waapád káń baa taa ví tée, mí dȩn Tayɨɨ míí nag yúú víílí. ","Kpe bhaghé ebhú nji ń tirá ên, n kí karé Obhasi ekûp. ","Guŋ mcwə awɛ myə gɑ̌ ŋkhamtə́ wɔ a, gɑ̌ hɑ pa'lə́ bi Si a; ","Ɓwâ lâs mɨ du nyí lə́ə̀mniì, mɨ á sáktɨ̀nɨ Mèín ɓe ɨ́r nyínè. ",Máâ ke yoèñshi yaè Nyúè aè nfeè' wááwá ce m ce kwaè'shi aèmboè weèe. ,"Makaṅ Zamba wama eyòṅ matsog mina, ","l shid gèƋ a Bi Zhiklè pèc pècèk, aman i hér kine, ","Ka pas a ɗaw andza i dzeley aha 'ar ka kuray na, i madara sise a Bay ma Bəla ɗaw. ","Cwii cwii ndiiꞌ na macjaañjoomꞌ tsꞌo̱o̱ⁿya ꞌo, nnom Tyꞌo̱o̱tsꞌomya, mañequiaya na quianlꞌuaaⁿꞌaⁿ cantyja ꞌnaⁿꞌyoꞌ. ","An bili mi gin mɔkugo, mi gi baanik Bɛt mi a nɛ zulɛ. ","Pay pak əntatə ɗum akokum, əntatə kaman Maŋgəlva naw vikum. ","Sóo ya ŋsáb zìivə́ró gá pɛ́m, ŋfu̧ŋ pu Vannáb na̧a̧. ","Sɛŋ aa sèl mə́ zá' nwɔŋ aí bə̀ rə gə́ kóólé, mə́ mɔ̀' Vɛnɛ́b aí yílú. ","Hlai paŋ na mada a kɵa li gaiki ɗa, mu sa tese sin Alaw na wiya, ","Je rends grâces à mon Dieu toutes les fois que je me souviens de vous, et dans toutes mes prières pour vous tous,","I thank my God upon every remembrance of you,",Nan gi deɓ mi Lawna van dok-dok hay liyn kaf ma human ka gan kigiya; ,Ma ve Zambe wom akéva éyoñ ése ma simesane mia. ,"Ti ya muwulka ɓi kumo le gar na, i ra ga sise da Buymisemuŋ ɗu aseˀeŋ. ","Koo ndeye mi siftori on, mi ɗon yetta Allah am ngam mooɗon, ","Koo ndeye mi siftori on, mi ɗon yetta Allah am ngam mooɗon, ",Mi de osoko ha̧ Sɔ̧ kɔ‘m ɓɔnsɛnɛ ŋgimbi n'am ta mɔ wen'nɛ́. ,Mi de osoko ha̧ Sɔ̧ kɔ‘m ɓɔnsɛnɛ ŋgimbi n'am ta mɔ wen'nɛ́. ,Ŋ'wese 'ya sha Shala keveci keveci kezəzə ŋayɛ 'ya. ,"Ti äi ëig we ti äay no, ndi joñ suse' ne Baa wer äay tum tum. "
PHP.1.4,"Ɓi bɔ̀ŋzɛ̀n yìcèm yi nkìki ɓisu win ɓɛsɛ̀ɛ̀ ɓɛ̀cèm, ǹti m̀ɓɔ̀ŋzàg rì kìnyàà, ","Sey káń baa ɓá'ad ví Tayɨɨ ya víí 'waapád tée, mí ɓá""u̵ kan zó̧ó̧ dȩ""ȩ́ȩ, ","Chénchén ebhú nji ń gorá Obhasi mbâ eyəré chénchén, ń gorá na ekpatə́m ogyebhá-ḿbə́ŋé. ","nə pa' nə guŋ nə cwyɛ'nyə yə gɑ̌ shwyɛ'nyə nə po awɛ a, gɑ dɑ pɑ́ ŋwɛnyə̀ shwyɛ'nyə́. ","Ɓwâ lâs mɨ du yóŋnɨ Mèín ɓe ɨ́r nyínè, mɨ á yóŋnɨ ɓe mɨ̀tù cúk. ","Máâ ke loo neè weèe, ce loo neè rlu'shïì-ñwáè. ","e ngogëlan makogëlan asu daan kòm esë, mëbòò dò ai mintag, ","a i gi arsa pèc pècèk te ntsi ri ga tèlèba a géƋ kinè, a i tsi rai a mwuffè, ","Ka pas ka pas da ma ɗuley mey ka kuray tabiyaha na, i ɗuley mey na ta wuiya ha. ","Quia na matseina̱ⁿya nnoom, ñequio na neiⁿya macaⁿꞌa na cateijneiⁿ ꞌo na chaꞌtsondyoꞌ. ","Nɛɛ sɛw, mi gisin waak Bɛt zɔ̧ki hi hato a mi zɔ̧k du sɛw, ","Pay nədawzuli vikum pakə, əntat zuli de weneken zuwa, ","Ŋlú pə́və́ró Vannáb tə́mnì ní, ŋtə̀m dùggənəŋ símá̧a̧r púurì, ","Sɛŋ aa mə́ tə́ Vɛnɛ́b nyɛɛ̀m aí yílə́ rə gə́ kóólé, mə́ nyɛ̀m kə̀ tɛ́m làmkèá, ","War siiwiŋa na buriki paŋ, kureɗ, mu siiwa gaini firiyi; ","c'est avec joie que je lui adresse ma prière,","Always in every prayer of mine for you all making request with joy,","hay siɗawta van kaf ma kigiya, yan may jok kay siɗaw hiɗi firitaɗi, ","Eyoñ ése, ma yeʼelan ajô denane mia bese. Ma yeʼelane fe me vaʼak, ","Da ya mira dir dibiɗ ndrehhe vur kum gar na, i dira ti mumul, ","tum mi ɗon do'ano on fuu bee seyo nder do'aaje am fuu, ","tum mi ɗon do'ano on fuu bee seyo nder do'aaje am fuu, ","Ɓɔnsɛnɛ sɛn tɛ kɔfa-sɔ̧ kɔ‘m wen'nɛ́ lɛŋ, mi kɔfi Sɔ̧ nɛ̀ desee, ","Ɓɔnsɛnɛ sɛn tɛ kɔfa-sɔ̧ kɔ‘m wen'nɛ́ lɛŋ, mi kɔfi Sɔ̧ nɛ̀ desee, ","Yayata və nya səkwə Shala 'ya kwa kezha gheyɛ ne, le farefa səkwə 'ya. ","Tum de maga ndi le' tos Baa we ti äay mo äuy, äil äi joñ go feh ma tosge äe, "
PHP.1.5,"ɓisuu gàɓ ìnɛ ɓì mɛ teɗ ɓi rìsààtì ɗi Syeesyee à Ɓɔlɛ, à tumɛ̀n ŋwos a ǹtonto, à kpaŋ ɓigomìnɛ. ",moo kíí maan moo to̧o̧ 'maŋ palı̵́ ya dəné woolı̵́ há̧á̧ ka ya ya̧ 'ya̧'a̧ yɛ nɔ. ,"Echî aŋ? É róghé ka ofú mbi n sə́re ên otîp ogyebhá-ḿbə́ŋé Obhasi ta é si égyé, ó chəm ên na mme ó nyaŋe ə̂m ka esə́rə́m otîp mbí. ","Gɑ̌ dɑ ŋwɛnyə shwyɛ'nyə́ po'o, a cyə m̀ nə́ dəŋ pa' po lə nə fa' yɔ́ nə Cuŋ pɑpúŋ tə fɑ́ nə́ dəŋdzə́ tyɛ'dzʉ́ gɔ ŋkhəm cwəlɔ a. ","Ɓetí, yànɨ ɓwâ nɨ́me náb ya ɓainyayeré, há̧á̧ mwáín, nyí kpɔ́ktɨ́ mɨ ə́r àhèé Kìn Nyɔ̧né. ","Máâ loo wa'a ce yoèñshi Nyúè njobeè' m ce kuushi aèmboè weèe aè koni máè aè rfaè' Nsuñ Mboèñmboñ, ká' embe nfeè' ce weèe aè m byemi neè Nyúè vú gháá seè'ni na. ","a enyiṅ fufulu dzaan asu mbëmbë foe, atarigi amos osu, azaag kui etoa dzi, ","te man kin humda te ma mbela'a, te pats nshèlèkura'a, ba patsna. ","Hərway ma lakwa ma dzəmakwa dzaya ka Mey Wayna, zla ta pas tsəfəmey aha na, kasl ekəɗey. ","Ee cantyjati xuee najndyee hasta xjeⁿ jeꞌcheⁿ, ñecwii cwilaꞌjomndyô̱ naquiiꞌ tsꞌiaaⁿ na cwiñequiaayâ ñꞌoom naya ꞌnaaⁿꞌ Tyꞌo̱o̱tsꞌom. ","anyɔ nɛ ta̧a̧ Dɔgl Rɔb bɔ woosɔ, nɛ ɗaasim dɔglɔ dɔko a ɔ̧tyɔ baar gedu gi tuur nɛɛko. ","vi wəbaah mes kəbaahaŋ suwən de wəbalan Wən Neneke, daga wətəŋ nani, ha kakaŋka. ","vəŋ ya bəŋ yà̧m zaanəŋ pə́ŋ Kiristu muur Púur ni yò, gù̧u̧ yó̧ŋ ya və́ fíl ní ri, há̧a̧ yakai pɛ́m. ","nɛɛ̀n aa íí láŋ mə́ kə̀ gbaŋə̀ íí bəd, bɔ̀b  * Nwɔŋ Puu Sɔ̀ɔ̀nkè baànmbə̀ rə bòórú, sɛŋ aa sɔ̀d dú roó, yaà wə́ə́ bə́ŋyée zé. ",buri diŋgi na ki diŋgi gaya war sdani labar na pɗem sin mefeŋ n’avut ɗa par haa tiyana. ,"à cause de votre concours unanime pour  le progrès de  l'Evangile, depuis le premier jours jusqu'à présent;",For your fellowship in the gospel from the first day until now;,kuɗ tapta vigiya hay labara ma firina ma tun caw hay buur ma jewna pa ta-ta wulini. ,"amu ngap mia nyoñ a bia ajô Mbamba Foé, ataté e môs ôsu a kui den. ","asi kum mijinikiy ngi njaha Ɓimezle, zle angi hin mudumbuŋ naŋ, hã wurenna na. ",ngam on mballi yam anndingo Linjiila diga nyannde aartunde haa wargo hannde. ,ngam on mballi yam anndingo Linjiila diga nyannde aartunde haa wargo hannde. ,wen gbaka'm n’ɛ̀nɛ̀ gbaka tɛ tɔ̧ɔ̧ De Mbe Wen nɛ̀ ku̧u̧naŋ-a mɛ  hɔ nɛnɛ kinii. ,wen gbaka'm n’ɛ̀nɛ̀ gbaka tɛ tɔ̧ɔ̧ De Mbe Wen nɛ̀ ku̧u̧naŋ-a mɛ  hɔ nɛnɛ kinii. ,Va nya kemanakɛ ɗa yɛ yitea nehe nda ghena ta Shala ke mbeli se te kwa ghate ta hɛ pa ɓeshi. ,"werga nday yaçaç Waçaçre ma de Coçoçren mokay tu, nday raw kay mege ti siëgi waçaçre sen go tu tu haçaç wara mono. "
PHP.1.6,"Ǹ-yii syeesyee à rìyi lɛ roànɛ à tumɛ̀ngà syeesyee à kìsay anɛ̀n ɓi mìni, à rì ɓiì kɛ̀ɛ ri kɔ asu à kpaŋ yɛ̀ɛ à ri wɔmɓɛn kɔ ɓi ŋwos a Yeesus Kiris. ","Mí gaa Tayɨɨ ka dəŋ ba'ad du̵u̵ kɔ́lı̵́ víílí yȩ, wú̵ń kɔ́ si̧' la gbug há̧á̧ wú̵ń ya̧ zá̧ga̧ fíiní Yesu Krístu woolı̵́. ","Ḿ məŋe bəre Obhasi nnyo a róghe énoê etûm njí ka ḿbə́ŋé eyəné, tîk a yîm ńjə́ne é jak ochî tata é sî ntə̂m ka ofú mbi Ńtâ Jisos Krayis a kə́ bha.",Gɑ̌ cəŋtə́ jyə́ gɑ: Mo yə e lə to' fa' pɑpúŋ nə po a gɔ lɑ nə ghɔ dzə̀ tə la' myəŋ nə tyɛ'dzʉ́ Yeso Kristo. ,"Mɨ á ɓe gíí ɨnayâna Mèín nò ndɨŋ nyí yàré ə́r du nyɔ̧né, ɓa ndɨ̀ŋnɨ nyí gɨ̀ tíí ɓe ə́r kɨ́ há̧á̧ cáŋhɨ̀rí ye Yésù Krístù ɓa cùwòniì á. ","M rïìñ boèñboñ máná Nyúè ce e m káè' a gee li rfaè' ce rboèñboñ ca njep weâe mntee be kuè duè kuèntombïì neè rfaè' anaè, caar duè baè' aè nfeè' ce li be keè mïì aè noèñ ce Jisoès be vúè naè. ",mëyëmë fò mbëṅ na e mod angatari abëṅ esye di abë mina ayi dzò dzala akui a amos Kristus Yesus. ,"A i fi gèƋ a vna: nenga'a man a hüno mizlinè mbela'a te ndav kinè, a dè a ma ma a nrufa'a, ba pats Yèsu Kristi. ","Me dzeley 'ar a ɗaw na, andza neney: Ndaw ana ma zələrawa me key mber mambay mambay aha da vaw kwar ana na, a da husada, a da ndaslada ba kasl ka pas ma Yezu Kriste. ","Ee ntyjiiyaya na juu tsꞌiaaⁿ nayawaañe na to̱ꞌ Tyꞌo̱o̱tsꞌom naquiiꞌ nꞌomꞌyoꞌ, ñeꞌcwii tco nntsꞌaaⁿ na nncjaacanda̱a̱ꞌñꞌeⁿnaꞌ hasta xjeⁿ na nncwjeeꞌnndaꞌ Jesucristo. ",Mi mɛɛ rɔbtɔnɔ a Bɛt yɔ yɛɛl woos rɔb bɔrɔ a nɛ kpoos du gi gbor wooki gi tuur gi da̧a̧ a Yeesu Kristu wɛɛzigɔ bɔ gedu.,"Nəsənək fəkat Maŋgəlva dətəŋ wəza mogon amakrokum, wadaw dəndən ha gap wəgrakən də pay məs Zezu Krestu adazzani. ","Ŋgàaro pɛ́m, Vannáb ya tò̧ bìi ɛn dúur kəvə́ símá̧a̧r di yò, dàŋnəŋ tó̧ ɛ́m dúgdì, há̧a̧ kə tò̧ kùn Yeesu Kiristu yó̧ŋ ni. ","Mə́ gàb nwɔŋ aa yée yàá vɛ́nà' Vɛnɛ́b aa sɔ̀d tùsaa ma'ǹmbə̀ aí tə́ŋə́ rə, mà' dá dáàn kə̀ númú, yaà dá bɛ́dǹ sɛŋ aa Yéésù Krístù dáà bídǹnà bərə zé. ","Mu yima fakat ɓa ni n’a tika pini sda hanɗa warki, aga a hala gaini haa a ɵaŋ edi, haa sin mefeŋ na wiini Kristu Yesu. ","et j'ai confiance que celui qui a commencé en vous une œuvre excellente, en poursuivra l'achèvement jusqu'au jour du Christ.","Being confident of this very thing, that he which hath begun a good work in you will perform it until the day of Jesus Christ:","Kay nan wi goy haraŋ ala, nam ma tun caw haygi hiɗi lop ma ŋaana, nam ma dabam yalam kulo'o ta-ta hay buura vi Yesu Kristu. ",E ndi nleme jam e nje le. Nyô a nga taté mbamba ésaé e be mia a ye ke ôsu a sondô je a kui e môse Yésus Krist wo ye kpwaan. ,"Yi tiɓa le gisiŋ gisiŋ: Buymisemuŋ mizla virzi ngi slra mezle hana a hur kum na, a sa ru di caˀa kine, gbaˀ avu kiɗa mi naŋ, hã tapas Yesu Kristu masa mawa. ","Mi anndi fakat, Allah puɗɗuɗo kuugal booɗŋgal nder mooɗon timminan ngal boo haa nyalaade nde Yeesu Almasiihu loroyto. ","Mi anndi fakat, Allah puɗɗuɗo kuugal booɗŋgal nder mooɗon timminan ngal boo haa nyalaade nde Yeesu Almasiihu loroyto. ",Mi iŋa nɛ̀ mbetɛ: wi nɛ̀ ku̧u̧ naŋ dee de tom mgbara'nɛ́ tɛ́ yor ɗoŋ-aa hɔ wese nɛ̀ Jesu Krist tɛ́ pii ɗoŋ. ,Mi iŋa nɛ̀ mbetɛ: wi nɛ̀ ku̧u̧ naŋ dee de tom mgbara'nɛ́ tɛ́ yor ɗoŋ-aa hɔ wese nɛ̀ Jesu Krist tɛ́ pii ɗoŋ. ,"Nahe 'ya keɗepe fate fate: ma Shala nya keghate slene ganyɛke mbe gheyɛ ne, katejive mbe kema le kiɗi ta slenea shɛ hwa'a te vəa Yɛsə Kriste. ",Ndi go de koge cwaçy ga Baa maga tï¡ï¡ wer joñre äe se de woren de äay mokay ëaw wee yañ joñge äe de wore tum haçaç go ti wur maga Yeso Kris wo le ferge mono. 
