livre.chapitre.verset,Bafia,Dii,Ejagham,Ghomala,Vute,Limbum,MKPAMAN_AMVOE_Ewondo,Mofa,Mofu_Gudur,Ngiemboon,Doyayo,Guidar,Peere_Nt&Psalms,Samba_Leko,Du_na_sdik_na_wiini_Alaw,Francais,Anglais,BIBALDA_TA_PELDETTA,Bulu,Guiziga,Fulfulde_Adamaoua,Fulfulde_DC,KALATA_KO_SC_Gbaya,KALATA_KO_DC_Gbaya,Kapsiki_DC,Tupurri
PHP.1.26,"Rìsugtìì ɗi mɓiì sugtii yi a lɔ̀ŋkin, ɗi ri mìni ɓiì faà coo nyɔɔnyɔn à kìɓan anɛ ɓi rì lɛ ɓì sànsàm miì ɓi Kiris ɓi ɗùm, lɛ mɛ̀.","A̧n duu laa víílí tée, víń dəm fó̧ó̧ víí moo míílí̧, yúú mbaalı̵́ víí Yesu Krístu woolı̵́ yȩ nɔ.","É kó mân sê ebhú ḿ kpo joé na ên, ogyebhá-ḿbə́ŋé mbi o fonê ên ka ekpin ejə́né na Jisos Krayis, tîk ó súi ó fûk ka obhô obhámé.","Po'o gɑ a cyə m nə m̀ cwə yə gɑ̌ pɑnyə bə́ŋ po a, yɔ nə ghu'tə Yeso Kristo ghɔ dzə̀.","Ɓe ɨ́r moò, nyí ɓa dɨ̀ɨ̀mnɨ Yésù Krístù á, nyí ɓa ókɓànɨ mɨ̀tù ɓwâ mɨ ɓa gɨ̀sònɨ yɨ́ nyínè á.","máâ keèr vúè yá weèe, tá weèe bo yoèñshi Jisos Kraâis njo' máè.",asu yë na enguṅ dzan efuguzan abë Kristus Yesus abë ma eyòṅ mayi dugan sòṅ a bë mina. ,"a kin da jégèr va kumba te Yèsu Kristi a géƋ ga, a pats man i dè a sam kinè za'a.","ma aza kuse ma ma da maɓa ɗaw ka tsakay kwar na, maram a kwar ma ndzafam da Kriste na, ka gəley adiya.","Joꞌ chii na nncꞌo̱o̱ⁿnndaꞌa quiiꞌntaaⁿꞌyoꞌ cha juu na neiⁿꞌyoꞌ na cwiluiindyoꞌ cwentaaꞌ Jesucristo, nleitꞌmaⁿtinaꞌ.","Yɔ anbɔ gɔ mi wɛɛ mi wɛɛz a nɛɛge, nɛ dagn gbɔnɔ an nɛ gɔns zul nɛ gbɔlums hi rɔb a mi dɔŋgo a ɔksil nɛ bɔ gedu hi Yeesu Kristu.","An namilyaw azokum empa, kənekenən gən zukum vi wənnawa, də gakdak məs kədawrəhaŋ də Zezu Krestu.","Mú ya və́ kə̧ŋnəŋ Yeesu Kiristu ní yò, sóo ya ŋɛ̀mtiràro kəvə́ tuŋ ní, símá̧a̧r və́ní dàŋ púurì kəŋ yúl li. ","Kə̀ aakíin də, sɛŋ aa bíd yaà máá wə́ə̀n aí səǹ sɔ̀ŋ də, íí dá kuùm kə̀ tɛ́m yádke gbà'á máá bòórú, nɛɛ̀n aa íí kùm kə̀ gɔ̀ŋsə́ Yéésù Krístù rú ní roó.","Kapai won hlai na mu wayaɗi li arbaki ɗa, firiyi na wiiki na burini Yesu Kristu ɗa a riya amai abai buriya ta.","afin que, par mon retour auprès de vous, vous ayez en moi un abondant sujet de vous glorifier en Jésus-Christ.",That your rejoicing may be more abundant in Jesus Christ for me by my coming to you again.,"Kay kuɗ hotta ma nan ma hotis tigina, suburta vigi ma li ŋolo hay Kristu Yesu kuɗan nanu.","Nde étôtoʼo mi bili e be Krist ja ye nen amu ma, amu mbulane wom e be mia.","Yo ɓa ya misa mi le ng'avu kum na, dudok kum mulumam asi kum mujom ati Yesu Kristu na, aru nga mbuŋ nga mbuŋ mbele ya. ","Nden kam, to mi wari haa mooɗon fahin, seyo mooɗon nder kawtal bee Yeesu Almasiihu ɓesdan ngam daliila am.","Nden kam, to mi wari haa mooɗon fahin, seyo mooɗon nder kawtal bee Yeesu Almasiihu ɓesdan ngam daliila am.",wen ha̧ gasamɔ n’ɛ̀nɛ̀ a̧a̧ nɛnɛ tɛ Krist mɛ́ gasi wen zu'm tɛ pia-ɗoŋ kɔ‘m mgbara'nɛ́.,wen ha̧ gasamɔ n’ɛ̀nɛ̀ a̧a̧ nɛnɛ tɛ Krist mɛ́ gasi wen zu'm tɛ pia-ɗoŋ kɔ‘m mgbara'nɛ́.,"Ma kezhɛne 'ya kelə sha gheyɛ, katemene fege yɛ le 'ya fate fate laka nza ta mpia ŋayɛ mbe Yɛsə Kriste.","Diñ wersen, wur maga ndi fer wo wo see äay tigriñ pa no, nday kee see äay yañ wer äi wer tayge äay de Yeso Kris no. "
PHP.1.27,"Kìɓan kifog, ghɛɓina rìkuu ɗi cɛɓ ɗi ɗi ghɛɛ̀sɛɛ rì Syeesyee a Ɓɔlɛ à Kiris ɓi lèg ànɛ lɛ nsoò màa yùu mìni kì ghɛɛ̀, nsoò lɛ màa rì mìni fìràɓ, ǹghɛ̀ɛ̀sɛɛ kì woògh lɛ ɓum ɓɛɛ̀ kpaakpaa lɛ: Ɓì rì lɔŋ ɓɛsììrɛn, ɓì ɓa ɓɛ̀fèg ɓɛ̀fog, ɓi ki ɗùùɗuu nɗem wùfog ɓisuu ǹtyweeyi wu wu ri ɓi Syeesyee à Ɓɔlɛ. ","A̧máa hȩn dágá máa, i mbaa kɔ́ ı̵́ moo to̧o̧ 'maŋ Krístu woo ka o̧ wɔgɔ. Kóó a̧n laa víílí, kóó a̧n laa né si̧', tée míń ki la ba vín nda doo néélȩ́ na'a kan zó̧ó̧ dágá, ba vín sú̵g kɔ́ ba'ad kan zó̧ó̧ 'yɛ́lı̵́ dágá yúú moo to̧o̧ 'maŋŋı̵́ yȩ á̧ḿ. ","Kpe bhaghé ejûm é fábhe, deê ekpin ejə́né é jóe ka ekpak esə́re Jisos Krayis é kpíi ên. Kpe ń jóe ágo na ên, kpe ń ka joé, tîk n yúghá sê o ri ên ḿbə́ŋé eyəné yə́t, sê o ri ágo o noghá ên fə́ne noŋ nne yót sê otîp ogyebhá-ḿbə́ŋé Obhasi ó jî ochî. ","Da' gɑ́ po vɔk nthi vɔk yə a ku'nyə nə Cuŋ pɑpúŋ Kristo a, po'o gɑ ŋ dá sɔ́' pɑ́ nə yɔ wɔ́ kɑ nthak tak lə, nwə yə pɑ́ ju' pu ghɔm nə po a, a pɑ́ pɑ́ gɑ́ pǒ wə nthɔm a tʉɔ nthʉm ta' zhwenyə yɑmu', bɑwə bəmtə́ dɑ ta' tʉ̌m tsɑmu' do' kwa' pa' ǎ pùŋ nə piŋnthʉm nə Cuŋ pɑpúŋ a; ","Nɨ́m mwi̧ dunáam ɓe ɗɨ́m juu du ɗóhîn ɓe Kìn Nyɔ̧ɔ̧́ du ɓe ɨ́r Krístùù. U̧nè á, mɨ gɨ̀sògɨ̀ nyí pénɨ, mɨ dùgɨ̀ gɨ̀sòwá, mɨ ók ɨnayâna nyí á ə́ə̀ŋɓànɨ kpéín, nyí á ɓaín ɓe kɨ̀cáàb mwi̧, nyí á cè lɨ̀ɨ̀ŋnɨ ŋgárɨ̀b ŋgárɨ̀b sum mwi̧ ɓe ɨ́r ə́ə́m Kìn Nyɔ̧ɔ̧́ du nàniì. ","Yuu mo'sir yi yu ená yeè ndeèe ba le rcu li ku ba yáánïì aèmboè Nsuñ Mboèñmboñ Jisoès ce roèo ená li ba, ka' máè ka' vú yá weèe, káè máè vúè ka' áè, m bo kuè yu' máná weèe táá tatap, a túr rkwaè'shïû rmo'sir, a ker ce reè neè ntee mo'sir tá Nsuñ Mboèñmboñ ce weèe aè byemi aègho bo duè kuèntombïì. ","Nyiṅan hë mbol wayean ai mbëmbë foe Kristus asu yë na tò mësò, mëyënë mina, tò masëki we, mëwodan minlaṅ mian, na mitëlë a kpiim ai nsisim mbòg, nnëm mbòg, mikëan a ṅyëbë mbëmbë foe, ","Vanza a maya te nshèffè kinè, aman kin nzala ma mbela'a te Kristi! Ko i dè a i rka kinè, ko i az a sam kinè ɓai, i da tsena ma kinè, kin nzi tara'a te Mèzhèɓ nstaƌ, a kin gi var a nda nga a ndav staƌ, a gèƌ ncè ma mbela'a a ndav. ","Haya dzadzak na, ndzam andza na ma Mey Wayna ma Kriste, haɗaw i da daɓa ma da nəkurawa na, kwa kendzey i dakay na, i tsənada a tsam aha ka kuray, ma ɓadəmaya kuray mandzaya mambay aha da mesəfrey ana asləta, ka kəɗam aha vaw ka masləta ha, ta mevel asləta, andza ma me pey 'ar ma Mey Wayna. ","Luaa queⁿꞌyoꞌ cwenta: juu cantyja na cwitsamꞌaⁿꞌyoꞌ, cjooꞌ nꞌomꞌyoꞌ na matseijomnaꞌ juunaꞌ ñequio ñꞌoom naya cantyja ꞌnaaⁿꞌ Cristo, quia joꞌ meiiⁿ na nncjo̱ nntyꞌia ꞌo oo meiiⁿ na aa tiꞌcjo̱, nnda̱a̱ nndiiya ñꞌoom na cwiljooꞌndyoꞌtyeⁿꞌyoꞌ na ñeꞌcwii nꞌomꞌyoꞌ na cwilaꞌjnda̱ꞌyoꞌ na chaꞌtsondyoꞌ cantyja ꞌnaaⁿꞌ ñꞌoom na cwilaꞌyuuꞌa na laꞌxmaaⁿya ncꞌe juu ñꞌoom na macwjiꞌnꞌmaaⁿñe Tyꞌo̱o̱tsꞌom nnꞌaⁿ, ","Hin gbunu: ɛmbil nɛ yɛgi bɛr gi riitin hi Kristu Dɔglɔ Rɔb bɔ. Zaabe an mi dag gbɔnɔ mi zaa mi seenɛ, zaabe mi dāg zaak a nɛɛge gɛ, mi kɛm ɔnɛ a hi dɔgl nɛ booko a nɛ waak hi kɔmbil nɛ gbunu hi mɔkil nɛ gbunu, nɛ kɛɛsig Dɔgl Rɔb bɔ ɗɔbsugɔ hi tɛŋko hi kpoos gbunu nɛ gig ka̧dugo. ","Say wəsuwa nokum dəslə də Wən Nenek na Krestu, vi an nədeke, wanulukum ko nəde ɓa, wanəpprəm labara nokum, vi munokum tat də sembe də Əmpəs taka, munokum tatə gayaŋ də makrokum taka də wətaf Wən Neneke. ","Ammá̧ və́ kə̧mà̧ kə̧sàŋ ya Kiristu muur púur yá̧a̧ ní. Mú wəi, kə ŋɛ̀mnà kəvə́ tuŋ kɛ, vəŋ ŋɛ̀mnə̀ bai pɛ́m, ŋdà kíirì və́ sà̧ dii dùggənì, və́ kə̧ŋ yag də́əvɛ, və́ gò̧ dùggəŋ símá̧a̧r də́əvɛ muur púur kə ɛ̀mmà̧ nə́n ni. ","Bə́ŋyée mə́ tə́ ii baàn sɔ̀ŋ, ìì kò' yíl íí kə̀ nɛɛ̀n aa kùm íí dá saŋ̀ kə̀  * Nwɔŋ Puu Sɔ̀ɔ̀nkè Krístù bə̀ roó, bɔ̀b dá máà bé' ii kúnú, kóó sínkɔ̀ mə́ dáá sín má, máá kíìn báàn gabm̀bìá, íí kùm tə́ və̀'kèá, inselké íí wál tə́ nə́ŋ̀ní. Bít íí nə́' nə́gə̀d tə́ kə̀ tɛ́m nə́ŋ̀ní, tɛ́mbagké aa Nwɔŋ Puu Sɔ̀ɔ̀nkè tə́ piìn də bìá. ","Amma a pɗem ɓa ki piyi payai na pɗem n’a kata pini labar na pɗem na wiini Yesu Kristu, kapai na ɓa koo mu halaɗi aŋ tiliki, koo mu halaɗi kai tekeɗeɗi ɗa, mu ɵina ɗa ɓa tiki ki ɗa gdaŋai war seze ktai, ki hitimi na ɗa miki ktai burini yimi na wiini labar na pɗem. ","Seulement, conduisez-vous d'une manière digne de l'Evangile du Christ, afin que, soit que je vienne et que je vous voie, soit que je demeure absent, j'entende dire de vous que vous tenez ferme dans un seul et même esprit, combattant d'un même cœur pour la foi de l'Evangile,","Only let your conversation be as it becometh the gospel of Christ: that whether I come and see you, or else be absent, I may hear of your affairs, that ye stand fast in one spirit, with one mind striving together for the faith of the gospel;","May va kep kayni, poygi ki nagay kay labara ma firina vi Kristu nala, a la nan coys kay ɗuwgiya, lebo coys manɗi kaw, nan ma hum kigi kayn ala nigi ka lakay dono'o hay ŋusta kepe, kay hiɗi ciwta kep nigi ka dur kay vida vi labara ma firina. ","Ve jame da, nyiñan ényiñ ja yiane Mbamba Foé Krist, nde, nge ma zu yene mia, nge na, me too momo, ma wôʼô be kobôʼô ajô denan, me wôʼô na mi yeme ngu e nsisime wua été. Mi yitaʼane bese nleme wua aval ane mbunane Mbamba Foé ô né. ","Amma sey da gwat ngi gi kumo, a ndila le kaɓa Ɓimezle ngi Kristu mawuɗo. Naŋ kine, da ko i ru le nga purukum, malla i ru ta kwana, i sa cine ɓi kumo, ki roko cicam zlak kuy kuy ar wuluk misi purla. Ki roko cikam vu jom arleˀe ti mevel purla, ka tiɓi Ɓimezle mawuɗo. ","Tan nii ngeeɗe fodde ko haandani Linjiila Almasiihu. Koo mi heɓan wargo haa mooɗon, mi yi'a on, koo mi heɓataa boo, sey mi tawa, on ɗon tabiti dow hakkiilo wooto, on ɗon kaɓda hawtaade ngam gooŋga Linjiila bee ɓernde woore. ","Tan nii ngeeɗe fodde ko haandani Linjiila Almasiihu. Koo mi heɓan wargo haa mooɗon, mi yi'a on, koo mi heɓataa boo, sey mi tawa, on ɗon tabiti dow hakkiilo wooto, on ɗon kaɓda hawtaade ngam gooŋga Linjiila bee ɓernde woore. ","Mɔ kpɔk, duka-a k’ɛ́nɛ́ a̧ nyɛ́m nɛ̀ ɗoŋ De Mbe Wen ko Krist, wen kà‘m nɛ́ nɛ̀ɛ́ mɛ́ zɔk'nɛ́, kóó kà‘m nɛ́ nɛ̀ɛ́ na, ha̧‘m mɛ́ zii'e ɛ́nɛ́ yor nɛ̀ nɔa-a tɛ taamɔ kpɔk, h’ɛ́nɛ́ mɛ́ bi biro nɛ̀ see kpɔk nɛ̀ kɔ̧ɔ̧ɗɔɔwen ko De Mbe Wen. ","Mɔ kpɔk, duka-a k’ɛ́nɛ́ a̧ nyɛ́m nɛ̀ ɗoŋ De Mbe Wen ko Krist, wen kà‘m nɛ́ nɛ̀ɛ́ mɛ́ zɔk'nɛ́, kóó kà‘m nɛ́ nɛ̀ɛ́ na, ha̧‘m mɛ́ zii'e ɛ́nɛ́ yor nɛ̀ nɔa-a tɛ taamɔ kpɔk, h’ɛ́nɛ́ mɛ́ bi biro nɛ̀ see kpɔk nɛ̀ kɔ̧ɔ̧ɗɔɔwen ko De Mbe Wen. ","Deke nza mə kala nya ncɛte ŋayɛ Ghena kwatenca nya ganyɛ ta Yɛsə Kriste. Ya 'ya lə sha gheyɛ, ya 'ya ləma ne, kaɗe 'ya kafate nza ta ŋayɛ tiɗiɗi, jikə mbe mehele kwetɛŋe, nda mpa yɛ le wənə kwetɛŋe kezha yɛ nya yɛte Ghena kwatenca nya ganyɛ yɛ. ","Ane seele äay mo hay de tabge de Waçaçre ma de Coçoçre mani Kris no. Ndi mo da' ba nen ma woge ko weege go de nen äi noga ndi mo hay ba yoo äay gaa, daga ndi mo laa waçaçre äay ga nday de lagge kiñ de tay ëiggi boñ, ga nday go de haç maysee äay äuy boñ durgi ti haçge äil ne Waçaçre ma de Coçoçren no. "
PHP.1.28,"Kɛ̀ ɓi càrɛn lɛ ɓɛ̀bènàbena ɓɛɛ niŋzi mìni nyoo nsoò lɛsàg; kìɓan kiǹ ki ri kìrèmzɛnà ki lɛ, ɓɛ ri ɓi rìɗyaŋ; wɔ̀lɛ ɓi san wìn, ki ɓa kìrèmzɛnà ki cɛɓ. ","Dú̵ú̵ a kɔ́ ví kan ı̵́ maag víí vu̵ sá sá̧ḿ. Tée vú̵ń ho̧ gaa ba bin ti ú. Ɨ́ víí máa, víń gaa ba bíń sə́d sú̵'ú̵ á̧ḿ, moo hȩn yȩ Tayɨɨ wu̵ kɔ́. ","Tîk n yúghá sê efup é bhó yim ên na ane mba sê á bhan ên. Ńji tîk é tóŋe ábho sê erûm a ri ejə́né, éká a ri nji ábho. Ka érûm njí, a ri Obhasi nâ a karê. ","po lə piŋ gɑ mghɛ bo hɛ wɔ nə sɔmywə, a pɑ́ bi pu bɑ mtiŋ gɑ wap gɔ simnyə, biŋ bɑ bi po bɑ mtiŋ ywə vɔk yɔ́: a fɑ m bi Si ","Nyí nɨ fûb fûb dùr nùb nyínè ɓi̧ní tíí, ɓa dùnà nɨ ŋgáb túúm ɨnayâna ŋgáb lɔ̧́ɔ̧́ bɨ́ na á, kɨ́ nyínè a dùcè túúm ɨnayâna Mèín á nyí ɓátɨ̀nɨ. ","Weèe ka' tá ce wáp ye ñgaâa bbaèa ka', ca yi be ba ncoâo nrara neè woweèe ená woweèe a be kwe, bú, keèr duèñshi ená Nyúè be geèe tá weèe luêñ. ","mina të mbara tò nziziṅ waan a dzam ziṅ, nala wayi bò lëdë amala daban, olëdë mina akode daan. Dzom te yatye abë Zamba. ","A kin gi aman ndohi mayamhi kinè ta slaha ta pra kinè zlau a va azɓai, ko te skwi staƌ. A skwi ar haha a ngreda ta, ta za; aman a sam kinè a ngreda kinè, kinè mbela, skwi haha a shkè te Bi Zhiklè.","Mandzara kuray ka mbəkadəmatara vaw a ndaw dugwan hay, ka wuɗadəmakwar mey zlay, a da tərey ka taya na, zeheɗ ma ma zəɗey ta, ta me buwey kwar, arka tek aŋga na a da sawa na da Bay ma Bəla. ","na meiⁿcwii tintseicatyꞌuenaꞌ ꞌo ljoꞌ na nlꞌa nnꞌaⁿ na jndoona ꞌo. Na nlꞌaꞌyoꞌ na ljoꞌ, nntseixmaⁿnaꞌ cwii ꞌnaaⁿ nda̱a̱ joona na nntsuundyena, sa̱a̱ cantyja ꞌnaⁿꞌyoꞌ tseixmaⁿnaꞌ cwii ꞌnaaⁿ na nñequiaa Tyꞌo̱o̱tsꞌom na nluiꞌnꞌmaaⁿndyoꞌ. ","Bɔnɛ ɔɔ lɔlhɛ̧ɛ̧niknɛya wɔ hi ha̧a̧sin hoob fɛŋ mɔɔti. Ya̧a̧nɛ hin bɔ lab Bɛt gii gihi zuunik a hi doo wagsigyaadɛyɔ, wɛɛ nɛɛbe nɛ dak za̧a̧tigyɔ.","Kədaw geslneŋ'eŋ sit məzu zel kumən ko suɗike ɓa. Vi akpaŋgək azet va saydawa na zəga an dəgil va ndən nawzeti, amma azokum na, agilik va nawkoh gukum, as bo səza Maŋgəlvayi. ","Və́ wà̧a̧ fan və́ntò pai! Kə̧ nì wəi və dà tə́rì mú ya və gi lee ní, ammá̧ və́ ní və́ sóró. Vannáb mag pə́və́rì. ","Ìì dàà ɔ̀dmáàn íí bəd boò káá ii də́dǹ kə̀ in nə́ŋ̀má sí. Aarə boò gə́, dá bə̀ i'ǹ gə́, bə̀ tə́ ɛɛ̀m bɔ̀bke rú. Bít aí kɔ̀ dá kuùm in i'ǹmbə̀ aa dá ii aàn súúke kpaŋə́ roó, bít aarə vúgà Vɛnɛ́b naú. ","Ki hiniɗi gawki e miliki hunai piki war wala ktai kai zaŋ, buriɗi nagai ɗa, a wala n’a siŋka midini bi n’edi, amma buriki tiki ɗa a wala n’a siŋka midini kûri n’a na sini Alaw par, ","sans vous laisser aucunement intimider par les adversaires: c'est là pour eux un signe de ruine, mais pour vous, de salut, et par la volonté de Dieu.","And in nothing terrified by your adversaries: which is to them an evident token of perdition, but to you of salvation, and that of God.","Muɗgi nar kay sa gawt kigina hay va ne' noŋɗi, kay kayni mi wakka kisiya kay ba-goyta, may kigi nigiya nam mi su'da, ","Te ko besiñe woñ a jam éziñ; jame te e ne ndeme ja yené ya nkuane wop, a nyô ya nyiane wônan. A jame te da so e be Zambe. ","Ko ki pulaka mizli mazliram ti kum ta na, a gucukum mi ar gwat ko neˀta. Avi taŋ na, i gwat mabiga taŋ di njah, taŋ maram na, nga zizi, yo ngi kumo, kum ar jiviɗ ngi lih, yo hana, a so tivu Buymisemuŋ. ","Taa acce konne'en kulna on koo seɗɗa. Ngam maɓɓe kam, ɗum ɗon holla halkere maɓɓe, ammaa ngam mooɗon ɗum ɗon holla kisndam mon. Ɗum iwi diga Allah. ","Taa acce konne'en kulna on koo seɗɗa. Ngam maɓɓe kam, ɗum ɗon holla halkere maɓɓe, ammaa ngam mooɗon ɗum ɗon holla kisndam mon. Ɗum iwi diga Allah. ","K’ɛ́nɛ́ dé kíì o bíí nɛ̀ kur zu'nɛ́ na, wen mɔ‘i tɛ́ usi nɛ́ tika-a kɔ-wa ha̧ wa, ɓɛɛ k’ɛ́nɛ́, nɛ́ yuwar-kpasa-a; ɓɛɛ mɔ‘i tɛ́ nɛ̀ tɛ́ Sɔ̧. ","K’ɛ́nɛ́ dé kíì o bíí nɛ̀ kur zu'nɛ́ na, wen mɔ‘i tɛ́ usi nɛ́ tika-a kɔ-wa ha̧ wa, ɓɛɛ k’ɛ́nɛ́, nɛ́ yuwar-kpasa-a; ɓɛɛ mɔ‘i tɛ́ nɛ̀ tɛ́ Sɔ̧. ","Mba yɛ keghazlənə va ka jaga ta ŋayɛ. Ghazlənə nya ɗema yɛ kaghazlənə nde ncɛ nda ke hɛ kaka za za hɛ, ma gheyɛ ne, kwa hweŋkwa ta mbele yɛ, va Shala se ŋkɛ. ","Ndi mo laa ga nday bay go caa heçeçne do jar hee äay wo me' dra' wa. Sen diñ fen ma kañ nen äaara ga aà wo go de basge, day nday ma äayn nday wo ge da' peçeçge. "
PHP.1.29,"Kìɓan kiǹ ki riì yɛ̀ɛ Bɛ̀ll, ɓisuulɛ àa mààgh ànɛ lɛ ɓi gherɛn Kiris nnɛ Bɛ̀ll à faghà mìni nyi rì nyi, ànɛ lɛ ɓi wog girig mɛ̀tɔɓ ɓisu wii, à rì girig miì. ","Tayɨɨ wu̵ kɔ́d ví zó̧ó̧ nán yȩ yúú Krístu woolı̵́, moo i 'yɛ́ zó̧ó̧ víí Krístu woolı̵́ dágá sá, a̧máa i nuŋ hȩn ndɔ́gɔné moo woo á̧ḿ. ","Ka nan? Obhasi a kâm se é jóe ên ágbán í Jisos Krayis, cháŋ sê ka ḿbə́ŋé ekíím átíŋ, é rî fə́ne ka oseŋe eyéném ka obhô Jisos Krayis. ","nə pa' a bɑ Si ghə gho' nə po shyə m nə Kristo tə da' gɑ pǒ piŋ é pɑ, ba m gɑ́ po yɔgo' nə e. ","Ɓetí Mèín ə́əmtɨ́ ɨnayâna nyí ə́nnà Krístù, ə́r kɨ́ nɨ tàɗóòwá àm nyí du ə́ə̀mnɨ Krístùù, duɓwée nɨ àm nyí du pénɨ jábɨ́r ɓe àm noò rè á. ","Nyúè aè fa weèe njïì ená weèe fa kuè byemi neè Jisos Kraâis byemi ka', e fa ená weèe yá ñgá' a yeâ tuè foñ. ","Amu bëngavë mina na, asu Kristus, mibi ngul ya ayëbë nyè, së hm ki hë nala, ngul yë na mibi mintye asu die, ","Aman kin ngots pomɓai te Kristi, a kin cè nenga'a a ndav, a kin si matakwan a géƌ Kristi ba. ","Hərway ka kakwar hahaya ba kavəday ma Kriste, ama da me pey'ar ka ŋga dada tsa kakay, ama satsa na, da me key tsetseh hərway ŋga, ","Ee nchii ñequiiꞌcheⁿ cwicandaꞌyoꞌ na cwilaꞌyuꞌyoꞌ ñꞌeⁿ Cristo, sa̱a̱ mati na lcoꞌwiꞌnaꞌ ꞌo cantyja ꞌnaaⁿꞌaⁿ. ","Bɛt yɔ gaan gɛmsil an nɛ ɗɔbs Kristu, ɗɔbsig nɛ bɔ gii kpɔd gɛ, gaan gbɔnɔ an nɛ yɔ̧ya̧a̧r a gi dɔŋg be. ","Maŋgəlva apsəmək wəŋgla naɗɗa weza sən Krestu, vi wətafəni kaka ɓa, amma də wəzəm saha vi wənnani. ","Vannáb fàŋ pə́və́ró pèeli, və́ pə́ dòrdo fú̧u̧ Yeesu na̧a̧ ri. Pə́və́ró pèel də́ə sáŋ kə və́ tə̀bà gím koo yúl li bə̀ri. ","Kàandə, Vɛnɛ́b mà' ii pə̀dkè, bɔ̀b ìì mà' Krístù tù' kə̀ oò bə̀ bagǹmbə̀ ní gá, zá kə̀ búúd í'ǹmbə̀ oò bòórú kɔ̀. ","buri ɓa, burini Kristu ɗa, tiki ki nivi yim, buri ki yimi war ni ktai kai, amma pra buri ki siɗi gir burini lai. ","Car c'est une grâce qu'il vous a faite, à vous, à l'égard du Christ, non seulement de croire en lui, mais encore de souffrir pour lui,","For unto you it is given in the behalf of Christ, not only to believe on him, but also to suffer for his sake;","Kayni may vi Lawni pa; kay nam li slugotawa tigiya kay nigi vi hay Kristu tutaɗi, may kay fi lasta kalamu kaw, ","Amu a nga mvamane mia mfaʼa Krist, Saa ve na mi buni nye, ve na, mi wôʼô mintaé amu nye, ","Asi Buymisemuŋ a gukum mezle le, ɓa ki gam gwat da Kristu. Anta ki tiɓakaŋ ti tiɓi tew ta, amma sey kisam bonoy aseˀe ma, ","Allah mo'ani on ngam daliila Almasiihu, naa ngam haa on nuɗɗina mo tan, ammaa ngam haa on njara bone ngam maako boo. ","Allah mo'ani on ngam daliila Almasiihu, naa ngam haa on nuɗɗina mo tan, ammaa ngam haa on njara bone ngam maako boo. ","Wen a̧ dee mɔ nɛ̀ ta-tɛ h’ɛ́nɛ́ wen zu Krist, bó nɛ́ h’ɛ́nɛ́ mɛ́ kɔ̧ ɗɔaa ha̧ Krist ɓɛɛ na, mɛ̀ nɛ́ wen h’ɛ́nɛ́ mɛ́ zɔk bɔnɛ wen zu a̧ mbɛt. ","Wen a̧ dee mɔ nɛ̀ ta-tɛ h’ɛ́nɛ́ wen zu Krist, bó nɛ́ h’ɛ́nɛ́ mɛ́ kɔ̧ ɗɔaa ha̧ Krist ɓɛɛ na, mɛ̀ nɛ́ wen h’ɛ́nɛ́ mɛ́ zɔk bɔnɛ wen zu a̧ mbɛt. ","Kwa nza ŋkɛ nahe Shala kezlaɓa le gheyɛ laka Kriste, kenza deke yɛ nya yɛte ghena ta ŋkɛ yɛ we, ama kezha sa yaka tewəmbəreke gheŋkɛ. ","Ree sen a le jag Baa: Baa joñ äil de el ti äay bay maga nday mo haç äil äay ne Kris tawa koë wa, ama maga nday mo joñ bon wer Kris lay, "
PHP.1.30,"Kɛɛ̀ki ɓi ɗùùɗuu zàà ìnɛ ɓì ghɛngà mɛ̀ di nɗùùɗùù, ìnɛ ɓì ki yii lɛ ǹkaka ǹɗùùɗùù à kpaŋ ɓigomìnɛ.","Ví gaa, ká ba mín kɔ́ ba'ad Yesu woo néélȩ́ na'a. 'Ya̧'a̧ yɛ ví ki ba mín kɔ́ laa tíŋ́, ma ví sú̵g kɔ́ ba'ad dágá yȩ kɔ́ ı̵́ mí wɔgɔ á̧ḿ.",Mfá-mfá ó chəm ên na mme ka enok otîp Obhasi etíbhím. A ri enok í nchane jə́t nji o yéne ên ə̂m n noghá ebhú áji. Ńjə́ne fə́ne nâ ó yugha ên áno sê n nyə́ne n noghá ngá.,Bɑ do' pɑ nthi shù yə po jɔ́ ŋ bɑwə do'; bɑ pǒ nəŋ jyə gɑ́ gɑ ŋ gɔ tə kwi' lo' a.,"Ɗàrò nyí á lɨ̀ɨ̀ŋɓáànɨ ɓe mɨ. Lɨɨŋ kɨ́ du kɨ́ mwi̧ nyí ya pə́ mɨ lɨ̀ŋnɨ ɓwâ kù, mɨ duce lɨ̀ɨ̀ŋháyènɨ rè á, hȩ nyí ɗəŋhȩ ɗàrɨ́ u̧.","E geèe ená wee weèe niñ njep múè bkoèr ce weèe aè m yá máè ce reè, a ker ce yu' seè'ni ená m ku bii reè na.","miluman e bita mingayen na binë bita biama, mbiè fë miawog minlaṅ abë ma bili .","Kin gi var lèmèlèmè ara man kin rka a sam ga, a kin tsena antanta te ma ga.","ta me kəɗey vaw andza na ŋga ɗaw, kuray ma nəkadəmaya i me key andza ha na na, kuray ana ka səradama ha, re i kəɗey aha vaw sa təŋga.",ꞌO ndoꞌ mati ja mañeꞌcwii waa na cwilaꞌjnda̱a̱ꞌya. ꞌO jnda̱ ntyꞌiaꞌnda̱a̱ꞌyoꞌ chiuu waa na seijndo̱ya ndoꞌ jeꞌ macwindyeꞌyoꞌ na ndicwaⁿ matseijndo̱.,"Ya̧a̧nɛ, yɛrɛ ɓɔryɔ nɛ gi ɔksig hi mii a gabs du. Gabs gbuna bɔ gii anyɔ nɛ da nɛ gbɛnim ɛmbiko, yɛrɛ nɛ kɛŋk dɔglɔ gii ma a mi waak ɛmbik gedu te.","Məsok zukum ama wəgay də ina, wəgay nan va məs kulaŋ azawa, va məs keppremaŋ azaw kakaŋka.","Yakai və́ gò̧ŋ gòn ya ŋgò̧ŋ ní. Gò̧n ya bal və́ tə̀ŋ gá ŋgò̧ŋ ní bee, yakai pɛ́m ŋgò̧ dùggənì, və́ gàaŋ bə̀ri.","Bə́ŋyée íí nə́' bùm luùm nə́ŋ̀ní aa mə́ tə́ nə́'ǹ də tə́ kɔ̀. Bùm aarə, kùmsə̀n bùm luùm nə́ŋ̀ní aa íí bé' mə́ nə́' nyàam doó, bít mə́ tə́ nə́'ǹ sɔ̀ŋ, kìínmbə̀ nɛɛ̀n aa íí gàb də kíin.","aŋ tipi gaya war hatam hanɗa, na ki tiliŋa warni, na tiyana ki ɵini labarni ɓa mu na hitimaŋ na ɗa ɵa.","en soutenant le même combat que vous m'avez vu soutenir, et que, vous le savez, je soutiens encore aujourd'hui.","Having the same conflict which ye saw in me, and now hear to be in me.","kay tap dur duur namna ma nigi wan durumu, ma nigi humumna kaw, ma ta-ta vaydi nan ka durumu.","éyoñe mia wosan avale mewosan ebien mi nga yene me wosaʼan, a, ane mia yem, me ngenane me wosaʼan.","ti cika vu misi purla, kum mipraka avu ya na, yo ki sinaka le, i ra cik vu aruŋ.",On ɗon kawti bee am nder haɓre woore. Naane on ngi'no haɓre am nde'e. On nani koo jonta boo mi ɗon nder maare .,On ɗon kawti bee am nder haɓre woore. Naane on ngi'no haɓre am nde'e. On nani koo jonta boo mi ɗon nder maare .,"Ɛ́nɛ́ bí nɛ́ kpɔk biro n’ɛ̀nɛ̀ zɔka so'm fara bia-a; ɓɛɛ ɛ́nɛ́ iŋa'e, mi ɓɔna kànà tɛ bia-a nɛnɛ.","Ɛ́nɛ́ bí nɛ́ kpɔk biro n’ɛ̀nɛ̀ zɔka so'm fara bia-a; ɓɛɛ ɛ́nɛ́ iŋa'e, mi ɓɔna kànà tɛ bia-a nɛnɛ.","Tsetsenya gɛ ne, mbe mpa shɛ yɛ kala 'ya. Gheŋkɛ mpa nya nakɛ ɗa yɛ kampa vecagha, mba 'ya kampa tsetsenya kala nya fa yɛ.",nday mo dur jaw maga nday hay ko me durgi äe day nday de laage patala ga ndi mbi jag äe durgi ëa pa mono.
